"comment_id","user","time","message","parent_id"
"lpt53oi","Elulah","2024-10-01 13:29:02 UTC","It depends on a few things.  Why I didn’t like a book is one of them… for example, I read the watchers by am shine, which was decent, so then I read the creeper.  It was so, so woefully dreadful in just about every sense, and I don’t criticise so forcefully lightly.  I don’t think I’ll ever go near him ever again because I’ve lost all faith in an author willing to put out something like that… my feeling was after selling movie rights to the watchers he was cynically trying to bang out another to bag another movie deal.  It screamed that to me, and the quality was absolutely awful, like comically so.  

Paul tremblay is another one.  I read the cabin at the end of the world first and thought it was utter, schlocky dross.  But then I saw high of praise for head full of ghosts by people who had also not enjoyed the cabin at the end of the world, so I read that and really enjoyed it.  Following that success I read disappearance at devils rock, and while at first I found it compelling, it descended into something I really didn’t like.  I do find his premises enticing and I have really enjoyed one, so I may try another… but if that doesn’t work for me, I’ll call it a day.  

I guess it depends on where the potential lies, ie what I personally value most.  The creeper was just so ridiculous I can’t make a serious investment in this authors work again, and it makes me feel I’ve seen behind the curtain with his intentions so to speak.  The book was indeed terrible but what I feel is the motivation behind it is worse.  It’s possible I’ve got the wrong impression, but once you become aware of the author to that degree it’s game over.",""
"lptjosx","HippityHoppityBoo","2024-10-01 14:54:13 UTC","Depends on if I've read and loved them before. 


New to me author? They get one book. If I don't like the first thing I've read by them I won't pick up anything else. 


Author I've lived in the past? Maybe 2 or 3 books. There's one romance novelist I've really enjoyed and she made a major style change. I gave it 2 books after that but I don't read her new stuff anymore because that style doesn't work for me. ",""
"lptnoyo","FunctionAsUare4","2024-10-01 15:16:13 UTC","That Karen McManus series.  Read 'One of Us is Lying' in primary school and it was great. Read another in high school—it was good. Read another straight after I read the previous one—it was good. Read the next one, again, straight after—it was good, but it was trash too.

And really, there's a reason why I am saying it's trash. This reason, in fact, is why I think the other books, including the ones above that I said were good, are trash(One of Us is Lying not Included).

This is because, despite being a crime book, not one book of the 3 I read in High school had a person that was at least quarter-important to the story die.
Every single one of them they ended up in the hospital, but low and behold, no one suffers, no one dies, and it's all good at the end. All 3 of those books  almost had the same conclusions.

So, the last of McManus that I read, was only the last spark needed to kindle fire, I was already unhappy with the emotionless conclusions prior to the 3rd book.
This is why, when I saw 'The Cousins' book in the library, I decided not to read it, because I knew I'd be disappointed. I regret ever reading the McManus series.",""
"lpu7lj2","StrangeNanny","2024-10-01 17:03:28 UTC","Jodi Picoult she has to always have an added surprise twist . She kills the rest of the story to just get that shocking twist off",""
"lpu93wj","manlybrian","2024-10-01 17:11:25 UTC","I loved Ender's Game. I liked Ender's Shadow despite some hard eye-rolling moments.


The next 2-3 books I read by Card were incredibly boring. Super duper boring. I decided I was done with him.",""
"lpua9a6","kiminyme","2024-10-01 17:17:26 UTC","When I don't enjoy the books anymore.

I read Kate Atkinson's Life after Life last year. The writing style was quirky, but so were the characters and the plot, and I thought everything worked well together. I then read the sequel (A God in Ruins). Writing was still quirky, but there was a lot of overlap with characters in the first book, so it was okay.

I then picked up Case Histories, which has a completely different storyline, and the same ""quirky"" writing style drove me bats. I DNFd after a chapter or two. I very much enjoyed the series on Peacock, though.

I'm not likely to try another. My TBR list is long enough to last me the rest of my life, and I won't waste time on a book I won't enjoy.",""
"lpufkfx","johjo_has_opinions","2024-10-01 17:44:53 UTC","For me it depends. If it’s someone I have enjoyed for a long time and I like their voice, I’ll still read even after I think the quality has gone down (Mary Higgins Clark). If it’s an author newer to me, I’m much less patient—ex I loved Red, White, & Royal Blue, but I didn’t like the author’s second book nearly as much, so that was kind of it for me.",""
"lpuvbqx","Ambitious_Jelly3473","2024-10-01 19:06:53 UTC","Usually when co-authors start getting added. Looking at you Clive Cussler, Lee Child, Wilbur Smith et al.

In the case of all 3 it has now become a cynical cash grab, with hugely inferior writers attempting to carry the torch. 

In absolutely 0 cases have they ever improved on the original.",""
"lpv3yil","ihavenoidea6668","2024-10-01 19:51:16 UTC","I gave up on Chuck Palahniuk. Feels like his only good book is Fight Club and the others just trying hard to do the same thing again.",""
"lpvmslx","A_Powerful_Moss","2024-10-01 21:29:11 UTC","After reading ‘The Wind-Up Bird Chronicle’",""
"lpvq6vt","conehead4evr","2024-10-01 21:47:55 UTC","when they start using the fact that their characters are queer as the main plot. example- been here all along by sandy hall. the writing was horrible, most of the characters had little depth and were just there. also the fact that kyle and gideon are a queer coulpe is for some reason one of the biggest things in the story. the plot also makes almost no sense yet it is very predictable. that's js one example of throwing queer characters in doesn't make a good book! it infuriates me, as an actual sapphic person.",""
"lpvsw1x","dear_little_water","2024-10-01 22:03:12 UTC","It’s been different things throughout time. 
For Stephen King, I read Misery and decided that I didn’t need anything like that in my head. So I never picked up another SK book. 

For Chuck Palahniuk, I read the first 4 books back to back and realized they all had the same ‘formula’. 

Just two examples.",""
"lpw4x41","Late-Ad2922","2024-10-01 23:15:12 UTC","I had the same Jenny Colgan experience. I started with The Christmas Bookshop and loved it. The next ones I read were such a letdown!",""
"lpx5y75","TTurt","2024-10-02 03:05:35 UTC","I used to read Dean Koontz in spite of his shitty political takes because I really enjoyed his fucked up monster designs, the man has a mind for the twisted. But I finally just couldn't deal anymore after I read 77 Shadow Street and The Taking.

77 Shadow Street >!is about 3 chapters of actual story, and 20 something odd chapters of the author literally just expositing to you which political view each character and villain is supposed to be making fun of - can't risk you forming your own opinions about things and coming to a different perspective than the author intended, after all! - and why you're supposed to think they're good or bad.!<  It wasn't even so bad it's good, it was just *boring,* like listening to the first three chapters of a Stephen King book and then getting interrupted with a three hour long Ben Shapiro podcast.

The Taking >!was super dark and creepy and fucked up, we actually don't know who the monsters are or what they represent for once, and they're actually mysterious and terrifying....and then like 60% of the way into the book when things seem like things are getting to a climax, all the aliens suddenly disappear. Turns out it was just Satan, testing humanity. Oh but don't worry, all The Libs™️ he killed in fucked up and torturous ways for not having faith in Jesus are still dead, so the world's a better place now! 🙄 So pointlessly cruel and mean spiritedly political, it felt like such a petty twist to what had been a really fascinating story about a threat that was beyond the scope of our petty politics.!<",""
"lpxbr3t","CaptainMayNemo7849","2024-10-02 03:47:50 UTC","James Patterson. When I was little I loved his young adult books. Then as I grew I realized that the Maximum Ride books had the same plot over and over and there was no ending in sight. Now as an adult I realized that Patterson barely rights his own books. So it's just a money printer for him.",""
"lpytj8l","PharmaceuticalBitch","2024-10-02 12:37:22 UTC","IYKYK.. Laurell K. Hamilton  The entire Anita Blake series just went to shit. Not went down in a way as a fan I didn’t like, but went to utter shit. Is there even a plot anymore? Everything became really badly written. Straight up Penthouse Forum was written better if you just want sex fantasies. I’m not against the author deciding to change her subject matter, but it’s just written so boring now I couldn’t care.",""
"lpzo765","GhostbusterEllie","2024-10-02 15:37:36 UTC","If I hate 2 books in a row by any author, I avoid them. If I don't like a book about two hours in i'm done, sometimes earlier if i'm actively getting angry or upset lol.",""
"lq0qtiy","unique-unicorns","2024-10-02 19:00:57 UTC","After reading the 5th Koontz book that talks about: aliens, the Rapture, and/or Golden Retrievers.",""
"lq19biq","Dame-Bodacious","2024-10-02 20:38:48 UTC","I generally ditch an author when I don't like their books anymore. Like, I loved Dresden Files as a 20-something but as I got older and the misogyny and homophobia became exhausting. I hung on for a bit but then Butcher did some really awful things to female characters and I was out. He's dead to me. 

If I buy a book and it just *sits there,* on the kindle or on the shelf, and I always look at it and think ""nah, I'm not in the mood"", I consider myself done but they're not dead to me. I might just not be in the mood for that for several years.",""
"lq5w4r7","AgentDaleStrong","2024-10-03 16:54:59 UTC","Harry Potter is a great creation, but I’m through with JK Rowling. It’s the hate mongering against trans people. Of all the things this rich and privileged person could have done to make the world a better place, she chose this as the focus of her activism. Paranoid, hateful and shortsighted. Bye JK.",""
"lq6w0lc","CrunchyGremlin","2024-10-03 20:03:54 UTC","It depends. If I read one book and it's awesome and the next book is crap I give up on buying because of the author.   
I don't think I have ever been disappointed by Kurt vonnegut but then again they are not ultra great books. I just liked them.   Consistency is the key.",""
"lq77p42","Lady-Cortado","2024-10-03 21:04:39 UTC","Whenever I encounter descriptions of unnecessary cruelty towards animals.",""
"lqce64l","SuitableEpitaph","2024-10-04 18:55:50 UTC","When you keep DNFing their books. That's a clear sign.",""
"lqfluo2","OnePieceMangaFangirl","2024-10-05 09:45:29 UTC","When they start preaching.",""
"lqih9u7","tokkireads","2024-10-05 20:36:37 UTC","If I read 2 or 3 books by them and they're bad then that's when I won't bother to read more from them. That's how I feel with Frieda McFadden, Donna Tartt, and Alex Michaelides.",""
"lprsnkd","emoduke101","2024-10-01 05:43:48 UTC","When they end up putting too much filler in their stories and start giving me anticlimatic endings. Eg: I loved 'The Weight of our Sky' and 'The Girl & The Ghost' by Hanna Alkaf, but in her newer works, her conclusions are just too abrupt and underwhelming. I know most of her characters are teens, but her newer MCs keep diverting and waffling from the plot. One of her stories even includes a back and forth about a weretiger needing to use the loo.

>!I can sniff out the culprit of Alkaf's murder mystery long before the end of it. How did her young victim actually die? Nothing dramatic; just a heart attack with zero explanation! !<

Jodi Picoult was great during her prime in the 2000s. I appreciate her tackling difficult themes, but A Spark of Light was written backwards (!). which confused me initially. The Book of Two Ways also took the multiverse approach, which frankly, we're all tired of, thanks to MCU. I didn't bother with Mad Honey and *By Any Other Name.*",""
"lps50bl","Book_Dragon_24","2024-10-01 08:01:27 UTC","I decided about ten chapters into Good Omens 🙃",""
"lpsorr4","Frescanation","2024-10-01 11:32:23 UTC","I loved The Name of the Wind by Patrick Rothfuss.

I hated the sequel WIse Man;s Fear.

He’s kept me waiting 14 years for the third book and I long since stopped caring.  If it came out tomorrow I have no interest in reading it.",""
"lpsu4wo","cabridges","2024-10-01 12:14:34 UTC","It’s hard for me to stop, even when the quality is suffering. 

Since I was a kid in the 80s, if I read something I liked I tracked down everything the author ever wrote. I enjoyed the hunt (WAY pre internet), I like completing collections, and it was almost like, cool, don’t have to choose new authors for a while, I can just buy these on sight. Nothing makes me happier than reading a book by a new-to-me author, loving it, and realizing I’ve got lots more ahead of me. Unfortunately I also read a lot of mid books that way. 

(Also means no matter how many great books you’ve written, if the one I pick up doesn’t grab me I’ll prolly never get around to trying others.)

I’ll hang on to a favorite author for a long time even if the quality slips, but if obnoxious political views start taking over (Orson Scott Card), the books just get creepy (Piers Anthony), or the author themselves is revealed to be obnoxious or unsavory (Rowling, Gaiman) I’m done.",""
"lpt1el3","WiggleSparks","2024-10-01 13:05:22 UTC","When there’s no subtext.",""
"lprpcah","SalltyJuicy","2024-10-01 05:11:24 UTC","I'm not really prone to reading things based purely on the author. Not really been any one author where I've picked up the book just based on the name power. If I stick with an author it's usually cause they wrote a series that I like. As a result I don't really have any authors I've decided to be ""done with"".

Only real exception is J K Rowling. Even if her politics weren't so vile and obnoxious, her writing is not great. Those were some of the first books I read as a kid and I liked them then. But even for kids books there were a lot of others I liked way more. Why grown adults STILL obsess this much over Harry Potter is beyond me.",""
"lpr7y7m","Taste_the__Rainbow","2024-10-01 02:53:59 UTC","Pretty much never. A lot of my favorite books were originally DNFs. And some of my favorite books are from authors whose other works just didn’t hit for me. If I’d read the bad ones(for me) first and stopped then I would have skipped the things I love.",""
"lpsgbng","Maiden_Sunshine","2024-10-01 10:12:25 UTC","When they annoy me, which is unpredictable unfortunately. I can read books I hate, books that are boring, etc. But once I am annoyed it is like hearing someone smacking gum in my ear and screeching chalkboard.


Riley Sager is one this year that I tried two of his books, and I just don't like them. Easy reads, but he infuriates me. 


There was also another writer who the first book kinda irked me with him having the characters constantly yawning. But I was still able to read the second book. I was in agony the whole time. They yawned so much! At one point, a mother and son started a chain yawn reaction and this went on a whole paragraph! And several times in that scene! I felt like I was going mad, plus the sequel was terrible!


So those are two authors on my Do Not Ever Read Again list. They got 2 tries. I couldn't make it to 3.


My other one is specifically when they reference Black characters simply as ""tall black"". Irks my soul. Fully immersed in the story, everyone and their dog, familar, butterfly, etc gets an extremely detailed description and the one random Black character is described as ""tall black.""


I actually give 3 tries for that if I otherwise like their stories. I also will keep reading an author if Black portrayal improves over the course of their writing career. I'm generous and gracious with a LOT of portrayals and can roll with many things. But writers I like get 3 ""annoyed me"" strikes. And if an active writer, that is applied to past decade. I make mental adjustments for their older books.",""
"lpt63e3","seitansbabygoat","2024-10-01 13:35:14 UTC","With Murakami it took me around maybe the First 100 pages of Kafka on the Shore. The handjob scene. Could have thrown the book ofd a bridge after that. Not giving this pervert another chance, that's for sure (although i'm sure i would enjoy heavily censored versions of his books, probably)",""
"lpsuqhv","Extension_Physics873","2024-10-01 12:19:04 UTC","This. I loved Nelson DeMille thrillers for years, and would wait anxiously for his next release. But then he just kept sticking with the one character, and this character's ability to keep saving-the-day against all odds was just too much. I still haven't found his equal though to move onto.","lpr5hnf"
"lprfc24","ChocolateLover207","2024-10-01 03:45:42 UTC","It's 50/50 for me when I go to their backlog of books sometimes I love even the early work other times it's usually the 4/5th book they published onwards I like","lprc3fv"
"lq6zqsg","queenjaneapprox","2024-10-03 20:23:16 UTC","Usually I'll give an author 2-3 books before giving up, but I read *The Only One Left* earlier this year, and it was terrible. Probably the worst book I have read so far this year, and for sure one of the worst I've read in the last 2-3 years.","lprhs5u"
"lpvxtov","ChocolateLover207","2024-10-01 22:32:22 UTC","I honestly think she's so overrated and hyped as an author","lprlzpl"
"lq9ttlt","hey-miele","2024-10-04 08:51:09 UTC","I’m not even mentioning the controversy around her, but I think she’s just not a good author. Her writing contradicts itself and she is overly repetitive in what often seems to be an accidental way. I read It Ends With Us, It Starts With Us, and Confessions.","lprlzpl"
"lpwlrrh","conehead4evr","2024-10-02 01:00:02 UTC","colleen hoover is SO overhyped. ive read better stories on ao3.","lprlzpl"
"lprf345","ChocolateLover207","2024-10-01 03:43:50 UTC","I've felt that with authors too in series before where I loved the first one then the next one is supposed to be about a different character but it's basically the first book repeated thru out the series","lprbp9s"
"lpt5cyu","Elulah","2024-10-01 13:30:37 UTC","That’s interesting re Sally Rooney… I also really disliked Normal People but I may give the other one you mentioned a go based on this.","lprbp9s"
"lprtyxu","emoduke101","2024-10-01 05:57:03 UTC","I know we should give new authors a chance but I've wasted enough money and time on poorly written thrillers whose writers likely self-published. Sometimes it is safer to stick with big names.","lprbp9s"
"lprikil","Not_Cleaver","2024-10-01 04:11:38 UTC","You’ve read 11/22/1963, right?","lpr8cvj"
"lpr8ren","ChocolateLover207","2024-10-01 02:59:22 UTC","Never got into Stephen King even though I always heard such good things","lpr8cvj"
"lprgvlj","Altruistic_Yellow387","2024-10-01 03:57:47 UTC","His writing was a lot better when he was on drugs","lpr8cvj"
"lprqi6s","DarkMishra","2024-10-01 05:22:31 UTC","As a King fan for probably 25 years now, I do have to agree with this. His writing style has definitely changed over the past decade or so. What’s worse is his releases are far too often and too expensive to keep up with - especially considering nearly all of them are getting movie/show deals even before they’ve been published! Barely any of his novels are even “horror” anymore.","lpr8cvj"
"lptddnz","ashoka_akira","2024-10-01 14:18:37 UTC","King is always hit or miss for me. I generally find his novels unnecessarily long winded too and its not that I am opposed to big books but after 1000 pages I lose steam if the plot isn’t advancing quickly enough.","lpr8cvj"
"lprt8c7","emoduke101","2024-10-01 05:49:35 UTC","Yeah I prefer his horror era over his mysteries","lpr8cvj"
"lpsoyt2","boarshead72","2024-10-01 11:34:01 UTC","I read so much of him from late elementary to early university until one day I realized I had grown out of his writing style.  I didn’t touch another for thirty years when I read 2/4 of Different Seasons.  Writing in this one is definitely dated (Apt Pupil read like Hardy Boys meets Clockwork Orange, fucking wild).  A couple years later I read his JFK one and it was really good.  I’ll have to read some of the ones I missed now (but not all, man he writes a lot).","lpr8cvj"
"lprlx35","FluffMonsters","2024-10-01 04:40:27 UTC","SAME. Loved The Stand, Misery, Gerald’s Game, The Long Walk, Pet Cemetery, etc… but I simply cannot read any more of his masturbatory self-praise.","lpr8cvj"
"lps3hdy","koinu-chan_love","2024-10-01 07:43:04 UTC","I always get downvoted for this but I felt the same way about Eragon. I thought it was so derivative and that it was obvious the author’s parents didn’t make him work with an editor, so to me it seemed a lot like a self-published book too.","lpr5g4z"
"lpr815p","ChocolateLover207","2024-10-01 02:54:32 UTC","Yeah I give the benefit of the doubt whether it's a learning curve or if they've been writing a long time that they could be burned out","lpr5g4z"
"lprywx2","CatterMater","2024-10-01 06:50:14 UTC","I've come to the conclusion that booktok and I simply don't see eye to eye.","lprpzkc"
"lpw0og7","ChocolateLover207","2024-10-01 22:49:42 UTC","ACOTAR I did get curious because I saw so much of it but then I read the description and was like eh not my jam but it wasn't till I saw a video a girl posted of her bf's texts messages as he was reading the 1st book of the series that I was like yup 100 percent not reading it now","lprpzkc"
"lprz846","Stefanie1983","2024-10-01 06:53:43 UTC","Agree with the Stephen King comment. Read some of his newer stuff 5-10 years ago and some was okay, some was really boring, but none of it was as good as the old books.","lprx8sc"
"lpw0ygo","ChocolateLover207","2024-10-01 22:51:22 UTC","The lots of detail has to have a purpose for me and not just for filling up the pages","lprromr"
"lpsr4rk","Hopeful-Ant-3509","2024-10-01 11:51:24 UTC","I read/listen purely for the twists lol she has a specific writing style and I think we all know it and her pattern, so  it’s not anything interesting or groundbreaking but the twists make up for it for me lol like I didn’t really enjoy The Teacher and I didn’t care for it but I got to the end and thought I figured it out no biggie but then she pops in the real twist and I’m like oh! Okay lol I liked that 

She just slightly scratches that itch sometimes haha","lps4w1c"
"lq03ud4","egotistical_egg","2024-10-02 16:59:21 UTC","Yikes! And I really liked a couple books he wrote too 😭","lpslmg0"
"lpv1kvy","Deleted","2024-10-01 19:39:15 UTC","[deleted]","lptysoc"
"lpsp1zy","HelloDesdemona","2024-10-01 11:34:45 UTC","He was also battling Alzheimer’s during those last books, so I consider it an amazing those later books exist at all. You can tell by reading them he was in a decline, which breaks my heart, but he left a good legacy behind.","lprzq1b"
"lpsaj44","Plenty_for_everyone","2024-10-01 09:05:49 UTC","I didn't know about the ghost writing, it explains much. ","lprcump"
"lpw1nxy","ChocolateLover207","2024-10-01 22:55:39 UTC","It was like she could only write about one topic","lptml92"
"lql83ot","Deleted","2024-10-06 08:36:41 UTC","Second this. I even stop when too much objectification on sexual intercourses","lqjsp4c"
"lpr8rxc","fforde","2024-10-01 02:59:27 UTC","The thing about Stephen King is that he cranks out books at a ridiculous pace and he seemingly publishes *everything* that he writes. There are **definitely** some stinkers. But the ones that hit, hit hard. 

If you do decide to give him another try, I'd suggest 11/22/63. It's fantastic and in my opinion, one of his best books. It is one of those books that kind of takes up residency in my head after reading.","lpr7m9r"
"lptzk0w","KnowledgeIsDangerous","2024-10-01 16:21:00 UTC","I decided to quit before the book where they just travel, and Matt isn’t in it. I was already getting bored with it and decided if they weren’t going to include my favorite character then I was done","lprzddi"
"lpu9uqt","manlybrian","2024-10-01 17:15:20 UTC","Yeah, I've found the quality of Sanderson's books to be all over the place. I loved Warbreaker. I even found the banter to be funny. Fast-forward to The Way of Kings, the comic relief character Wit is absolutely insufferable. Every time he tries to be funny, I die inside.","lpszkmc"
"lprfir5","ChocolateLover207","2024-10-01 03:47:10 UTC","That stinks reminds me of an author that promoted their book sounded and looked good only for it to not have anything they promoted in it","lprdhna"
"lprfrvb","ChocolateLover207","2024-10-01 03:49:08 UTC","That's how I am with authors that I've been reading for years.","lprf6q6"
"lpw88v5","ChocolateLover207","2024-10-01 23:35:43 UTC","Least now I know I'm not crazy. Which other ones did you read?","lpw4x41"
"lq0r9am","unique-unicorns","2024-10-02 19:03:18 UTC","You didn't like 77 Shadow Street?!

It's 700 pages of silliness that could have been condensed into easily less than 50 pages.

And the Taking?!

Just another scary Rapture novel. There's millions of them out there.","lpx5y75"
