"comment_id","user","time","message","parent_id"
"lpsrei0","Hopeful-Ant-3509","2024-10-01 11:53:30 UTC","Yikes, me on like 3rd round of getting through the series and plan on buying physical copies 🤣","lprpcah"
"lpr8kg9","ChocolateLover207","2024-10-01 02:58:07 UTC","That's sort of how I am and feel about authors that I discover with a book of theirs that's getting alot of attention read it and love their writing. I then go to their backlog and read those books. It's usually the first 2-3 books that they published that I'm not a fan of and that if i read those first I wouldn't have read the other ones of them","lpr7y7m"
"lpu0wb1","gnostic_heaven","2024-10-01 16:28:12 UTC","Yeah, I'd be curious if you liked it, not that you will remember or return to this thread when/if you read it hahah. I read the first couple of chapters and did actually like it so far. I'm curious whether I will still like it by the end or whether it will fall flat - but I haven't had time to dig into it. Also, my friend read Beautiful World first, whereas I will be coming to it after having read Normal People and I wonder if that will influence how I see it (though maybe that won't be a bad thing). I feel like I can see in the first couple chapters of Beautiful World, a more refined version of the workings of Normal People, but I kinda like it. Hmm maybe I should just sit down one evening and read it so I can stop speculating what I'll think of it lol.","lpt5cyu"
"lptyla9","gnostic_heaven","2024-10-01 16:15:33 UTC","Oh that's interesting - I don't feel obligated to give unknown authors a chance. Maybe it's because I'm not interested in publishing my own work, and so don't feel a karmic need to read others who are trying to make it through the ordeal of getting their work out there. I do try and read books published by indie presses, but only if they seem really good... Mostly I read traditionally published books by names that are at least known, vetted, reviewed, if not ""big"". And even so, there are clunkers and misses!","lprtyxu"
"lprxds6","boywithapplesauce","2024-10-01 06:33:15 UTC","People always talk about his novels but his short stories may be his strongest work. I recommend checking out the wonderful collection Skeleton Crew, and his first collection Night Shift.

Edit: Skeleton Crew is the proper title.","lpr8ren"
"lprgq6k","viking_with_a_hobble","2024-10-01 03:56:35 UTC","Favorite author, hes rather annoying tbh though. If you took any book of his and took out every word being used to describe how something appeals to the senses you have a third of the book. Now this is great for painting pictures, but what ends up happening is the book drags on because you’re still having the entryway to the MCs apartment described to you on page 22

And he also can’t do endings to save his fucking life. The only reason I made it through the dark tower series is because the books feed right into each other so he never had to really wrap things up.","lpr8ren"
"lprmcto","99thLuftballon","2024-10-01 04:44:16 UTC","I read a bunch of his books when I was a teenager and I never really became a fan. The interesting thing with him is that he's a good writer, in the technical sense. He has that ""great American novel"" style like, say, John Irving. It just makes for a weird clash between his genteel writing style and the graphic sex and violence in his stories. But then, I'm a bit wussie and I don't like violence, so maybe I'm not the target audience.","lpr8ren"
"lprpx9q","raevnos","2024-10-01 05:16:56 UTC","I just stick to his short stories and avoid his longer books. I think he's better in that realm.","lpr8ren"
"lprp22f","poof1030","2024-10-01 05:08:46 UTC","🤣","lprgvlj"
"lpt6vsx","arbor597","2024-10-01 13:40:09 UTC","Take an upvote today 👍🏽","lps3hdy"
"lprk8j4","arbor597","2024-10-01 04:25:43 UTC","Absolutely.","lpr815p"
"lpssdu0","cabridges","2024-10-01 12:01:12 UTC","I like new booktokkers who are passionate about old favorites and the ones that talk about older books, or “if you like this you’ll like…” 

So many established booktokkers often seem to be talking about whatever’s getting a heavy promotion this week.","lprywx2"
"lpthj70","alainel0309","2024-10-01 14:42:19 UTC","I found booktok to be 85% about romance novels. So I dial it in by specifying genre and its still a bit hit and miss.","lprywx2"
"lqh4tpk","LathropWolf","2024-10-05 16:17:28 UTC","Same here, but I don't mind it within reason. Also tend to prefer some ""alternative"" details authors don't think about commonly for any number of reasons.

If it's going to be 5 pages though of a character turning a door knob, yeah no...","lpw0ygo"
"lpzwgoj","Unlv1983","2024-10-02 16:20:29 UTC","A reader after my own heart.  I loathe present tense narration.  And the characters!  I really liked her niece in the early books.  I’m always glad to have a good LGBTQ character in a book, but she went off the deep end with the constant brooding depression and the James-Bondish computer tech devices she came up with.  I read somewhere that Cornwell is not writing any more Scarpetta novels, which is a relief.","lpv1kvy"
"lpzwhix","Unlv1983","2024-10-02 16:20:36 UTC","A reader after my own heart.  I loathe present tense narration.  And the characters!  I really liked her niece in the early books.  I’m always glad to have a good LGBTQ character in a book, but she went off the deep end with the constant brooding depression and the James-Bondish computer tech devices she came up with.  I read somewhere that Cornwell is not writing any more Scarpetta novels, which is a relief.","lpv1kvy"
"lprffwc","couchwarmer","2024-10-01 03:46:33 UTC","I watched the mini series and enjoyed it. Same with most movie adaptations of his novels.","lpr8rxc"
"lprg5t4","JustaBasicGemini","2024-10-01 03:52:10 UTC","Yeah, all authors have bad days, not all books they write are gonna be masterpieces. Although it does depend on if the characters/plot is bad, or if the writing style itself is bad. Cause to be fair I'm not one to read stories with super long descriptions, like one book I read that had page long descriptions of something. Couldn't read it lol, I need a little bit of a break from paragraph pages.","lprfrvb"
"lq0tcxy","TTurt","2024-10-02 19:14:33 UTC","I was legit ready to argue with you when I read that first line out of context 😂🤣

The nefarious thing about the Taking is that it's not immediately obvious that it's just Left Behind written by HP Lovecraft, but that's exactly what it is","lq0r9am"
"lpucb07","Elulah","2024-10-01 17:28:00 UTC","Yeah.  Normal people is very much out of my comfort zone anyway (book club pick), but I particularly disliked it.  I am trying to expand my repertoire but books outside my usual remit are already up against it so to speak, so then when I cant get away with the author’s style on top of that, or if the plot falls flat (both of those things happened for me with normal people), it’s nail in the coffin time.","lpu0wb1"
"lpry4z5","chamrockblarneystone","2024-10-01 06:41:35 UTC","I would disagree and say Salem’s Lot is horror literature.","lprxds6"
"lprm3d0","FluffMonsters","2024-10-01 04:41:58 UTC","My husband was really into that series and was beyond disappointed when the writing changed post-accident. :/","lprgq6k"
"lpt7r4l","koinu-chan_love","2024-10-01 13:45:34 UTC","Thanks, friend!","lpt6vsx"
"lq2x2j3","unique-unicorns","2024-10-03 02:50:48 UTC","It would have been scary if it was authored by Lovecraft. I rolled my eyes once I immediately read what she translated from the audio of the space mission. 

I was like ""I hate this, but I'll hate it even more if I don't finish it.""","lq0tcxy"
"lq31tte","TTurt","2024-10-03 03:25:30 UTC","I didn't know anything about it so I was actually ok with it at first, I remember thinking ""ok the main couple are evangelicals so there's gonna be that stuff, but at least the villain isn't just John the Liberal Academic for once, and the monster designs are creepy and somewhat unique. I know he usually has conservative aesops for his endings so I was expecting somewhat of a trash ending (having read Sole Survivor, Eyes of Darkness and that one where the cult is trying to kill the main lead's kid because they think he's the devil, whose name escapes me at the moment), but what I for some reason hadn't learned to expect yet was ""ok we have hit the contractually obligated minimum word count to publish, time to wrap up. Uhhh all the demons were sufficiently convinced of her evangelical faith so they went home and put back all the good Christian folk, but all the bad liberals who didn't vote for the right politicians stayed dead and the world was a better place. Also it was Satan. The end.""","lq2x2j3"
