"comment_id","user","time","message","parent_id"
"lpr5hnf","Live_Island_6755","2024-10-01 02:37:54 UTC","after about three or four misses in a row, I usually take it as a sign to move on",""
"lprc3fv","SongOfS8","2024-10-01 03:22:01 UTC","When I realize I read their best work(s) already. It’s hard for me to get invested in their personal lives and early works that were less successful. I only look at their best performances usually",""
"lprgcat","Merle8888","2024-10-01 03:53:34 UTC","Well, I look at it slightly differently. There are so many thousands of books out there clamoring for attention, thousands more published every year, and I read at most 100 a year. So, I aim to read the books I think I’m most likely to appreciate. Past experiences with an author (good or bad) are certainly data points in making those decisions, as are blurbs, reviews, and the quality of the opening pages of the book. 

So the answer is really that it depends. If I read a book, or just a few pages, from an author and conclude they are a poor writer full of cliches, I’m not likely to look at any of their other books (but then, I might if they seriously level up as an author and also have future books that sound up my alley). If I get tired of an author for overusing the same characters and tropes, same. But it’s more that there will always be more promising things to read than returning to that dry well, as opposed to making an affirmative decision to read nothing more by an author. We’re not in a relationship, we don’t need to break up. ",""
"lprhs5u","Deleted","2024-10-01 04:05:05 UTC","As a big fan of the Thriller genre, I'm totally done with Riley Sagers.

I just couldn't get the hype behind his work. His writing style is totally not for me.

I tried reading 2-3 books from this author and ended up DNF all the books.",""
"lps6dkg","Sauerteig","2024-10-01 08:15:06 UTC","I'm pretty forgiving for most authors, but many years ago I dumped/ignored anything with the name James Patterson on the cover. Liked the early books, then came an interesting experience.

I love the book ""Dust"" by Charles Pellegrino (1998) So much that I actually bought a copy (library person here). An acquaintance and I often exchanged books. She gave me one by Patterson around 2010. I was shocked by how startlingly similar it was to ""Dust"". Our next exchange I gave her ""Dust"". When the next exchange happened she explained her shock at how it was basically the same book with different names and a few other minor changes, verifying that I was not overreacting.

Lost all respect for the Patterson book factory ever since.",""
"lprlzpl","Lonely_String8097","2024-10-01 04:41:05 UTC","Honestly, for me, it usually only takes one book or even just a few chapters to decide if an author is for me or not. I can be quite critical and picky when it comes to writing styles and storytelling. That’s how I lost interest in Colleen Hoover. After reading *It Ends with Us*, I couldn’t bring myself to explore her other work. As for authors whose earlier works I’ve enjoyed but can’t connect with their newer ones anymore, I’ve learned to just let go.",""
"lprbp9s","gnostic_heaven","2024-10-01 03:19:20 UTC","If I don't like the first 50 pages of a book, I don't feel like I have to finish it, let alone try all the other books by that author. 

If I do make it through a whole book that I dislike (usually end up hate reading the last third of it) I almost certainly won't try another book by the same author. Will never ever read anything by Richard Powers after absolutely hating The Overstory. 

However - I really really disliked Normal People by Sally Rooney, but I do have Beautiful World Where Are You on my TBR stack on the recommendation of a good friend (who also didn't like Normal People). Sooo it's not a hard and fast rule, but in general I won't continue to try to read an author I didn't like previously - life is too short. 

However, if it's the other way around, where I love one or two books by an author and then nothing else lands, I will give up for good after about two books. Isabel Allende was like this for me - I loved House of the Spirits, but then it was like everything else she wrote was basically a different version of the House of the Spirits - I felt like she had one story in her and I'd read the best version first and didn't feel like I had to keep trying.",""
"lpr8cvj","S2ndOrderTheta","2024-10-01 02:56:42 UTC","I hate to say this but I've grown out of Stephen King. Love the classics- the stand, the shining, misery etc but any time I try to get into a more recently dated novel  -- I. Just. Can't. 
the purple prose monster comes alive and my will to read on just dies lol",""
"lpr5g4z","arbor597","2024-10-01 02:37:38 UTC","People have been absolutely raving about Ryan Cahill’s “The Bound and the Broken” series. I read the first book and thought, “okay, this was his first try and he’s self-published.” and tried to ignore the incredibly poor writing, using his inspirations directly (more on this in a sec), and basically just rewriting “Eragon” in his own new way. 

His inspirations are crystal clearly John Gwynn’s “The Faithful and the Fallen” series, “Eragon” by Paolini, and surprisingly Bethesda’s “Skyrim”. He uses the same names, plot lines, and even notable places (Whiterun? Cmon man.) in his books. 

I found the first book incredibly weak, but a solid attempt. The second book was unbearable. I found it to be dull, near-plagiarism, and it was quite evident he was self-published. 

To answer your question: I give it two books before I call it quits. The first book might just be a learning curve as the author finds his/her rhythm, so I always give them a second chance with the second book. Unfortunately, I found the second book in this series to be weaker than the first. Very, very disappointing. 

To each their own, but I honestly cannot fathom how people think these are good books.",""
"lprkcbm","BigJobsBigJobs","2024-10-01 04:26:36 UTC","""I'm getting more and more frustrated""

Right about then.",""
"lpre7gb","Direct-Bread","2024-10-01 03:37:09 UTC","Two, maybe three. I know everybody's crazy about Freida McFadden but I'm pretty much over her.",""
"lprpzkc","alainel0309","2024-10-01 05:17:33 UTC","I would say I give authors at least 2 books before I decide they aren't working for me. I read the 1st ACOTAR book and went, ""meh"". But people were raving about Throne of Glass so I gave that a try. Could not even finish it, it was so outlandish. I have definitely crossed Sarah J. Maas off my list.",""
"lpr59g4","metalsmith503","2024-10-01 02:36:28 UTC","I fire them from my library.",""
"lprl2nz","lazylittlelady","2024-10-01 04:33:00 UTC","One strike policy here-way too many other books with potential",""
"lprx8sc","Zempirsorc","2024-10-01 06:31:45 UTC","Pretty quickly. If the book doesn't grab me in the first 100 pages, will probably set it aside. And go to the next book. I also am not impressed by if a book is popular, or not.  I generally won't give an author much more of my attention. Like with The Wheel of Time series, for example. The very first book was good, I enjoyed it. The second book was very boring to me, and dragged on and on (my perspective only, of course, others can have different opinions)-- 

Anyway, so as a result, I stopped there. For good. (I know he has a ton of other books in the series - I don't care)

Additionally, if I hate a book and its super popular, or I hate a book and its super obscure, I feel the same way.  For example, I was forced to read ""A Tale of Two Cities"",  when I was in school - one of the so-called classics. I hated that book so much, and never read it, beyond the first 30 pages or so, for my class, even though it was required reading in school. Same for another book called the ""Red Badge of Courage"". On the other hand I loved a book called ""The Good Earth"" which was also considered ""classic"" literature. So it can be hit or miss. 

Random comment about Stephen King, I don't read any of his new stuff. I feel its bad. I agree with others that his best stuff was earlier. Pet Sematery, Cujo, and his early short stories were amazing. His modern stuff can go to hell, as far as I'm concerned, lol",""
"lpsibqw","areyounotembarazzedd","2024-10-01 10:33:24 UTC","When I've given maybe 2/3 books a try, that's why I'm not buying the new Salley rooney ",""
"lprromr","LathropWolf","2024-10-01 05:34:05 UTC","When they drag on and on. Steven King (From a Buick 8) and Tom Clancy (Pick anyone)

I don't mind lots of detail, frankly the more the merrier. But good heavens figured out why so many say these are ""by the pound"" authors",""
"lprv00a","valiumandcherrywine","2024-10-01 06:07:42 UTC","when i stop enjoying their work.",""
"lprwaw2","celestinchild","2024-10-01 06:21:29 UTC","The best example I can think of for this personally is John Varley. I loved his Eight Worlds series back in high school, and Steel Beach in particular had so many fascinating concepts that really expanded my idea of what the future could be like. But then his Thunder and Lightning series took a decidedly conservative/libertarian direction that, because of modern politics, was much harder to ignore than the same thing in Heinlein's later writings. I just couldn't engage with the books the same way and gave up on him as an author.

That said, Becky Chambers captured the spot in my heart that he had left behind, so I'm sure that if any other living author disappoints me similarly in the future, I will find a new fave swiftly enough.",""
"lps4w1c","RachyC1999","2024-10-01 08:00:02 UTC","That’s me with Freida McFadden- I loved the maid series (can’t remember the name), but I’ve read like 8 other books of hers since and none were rated above a 3 but for reasons I can’t understand, I still keep reading her books, in hopes I’ll find another one I liked like the maid ones",""
"lpslmg0","EnvironmentalSoft401","2024-10-01 11:05:04 UTC","Christopher Buehlman, when he made one of the major characters in The Necromancer's House a ""sympathetic"" child molester . That book is one of my extremely few DNFs",""
"lptysoc","Unlv1983","2024-10-01 16:16:43 UTC","Patricia Cornwell wore me down.  Her early books are phenomenal, but I gave up about 10 years in because she turned most of her major characters into caricatures (eg Pete Marino into a rapist) and dwelt on Scarpetta’s relationship with Benton Wesley rather than on plot.  Postmortem was one of the best mysteries/thrillers I have ever read.  I hated to give up on her, but I couldn’t stand the comparison with her early books.",""
"lpv6mg0","General_Cow_3341","2024-10-01 20:04:48 UTC","When I read the child orgy in Stephen King's IT.",""
"lprzq1b","Hatpar","2024-10-01 06:59:13 UTC","Have to say the same about Terry Pratchett towards the end it felt very 'here's a pop culture reference but on Ankh-Morpork! And here's a funny little footnote again.'


Loved the books I did read, but I do get tired of artists staying in a stylistic groove. ",""
"lps0qg8","PizzaSweats1790","2024-10-01 07:10:40 UTC","Sounds juvenile in a way but Sarah J Maas and her substandard under edited over priced nonsense the ‘Maasverse’ was a one way ticket to the charity pile for me. The characters she creates always somehow end up becoming insufferable - it’s quite a gift. For me the straw was the novella ‘a court of frost and starlight’ I paid £8 to read 400ish pages of pure drivel.",""
"lprcump","DoubleNaught_Spy","2024-10-01 03:27:12 UTC","I read a couple of James Patterson's novels, but haven't read another one because I thought they were very amateurishly written. It wasn't until later that I heard that his novels are ghost-written.",""
"lprmp8g","Commercial_One_4594","2024-10-01 04:47:23 UTC","Lee child has a brother, and I tried to read one of his books. I didn’t last 2 chapters ! Horrible !

Then it was announced that he will be joining Lee child to write future Jack Reacher, and the first was great. 

Then… I think the next Lee child wasn’t involved at all because the style and the treatment of the character was shit. 

So anything that guy writes is a no no for me and I’m done with Reacher. 

Thank god the tv show is perfect",""
"lprqyj7","spooniemoonlight","2024-10-01 05:26:58 UTC","I’d say I’ll stop trying if most of them are bad. There are authors I’ve loved reading one book from and then the second I’ve read was not very good, and usually I take a break from their writing and try again for a third book later on and if that third book still doesn’t really please my taste I just give up and move on to someone else. Maybe harsh but an author that makes me waste some time once is ok but twice yeah life is too short and there are too many good books waiting to be read for that",""
"lprr5p0","DarkMishra","2024-10-01 05:28:57 UTC","I’m not usually a diehard fan of authors to the point I’ll read everything they release. I’m more of a fan of specific novels and series. Actors have their movies people will or won’t like, and authors who write a ton of books will generally be the same way to most readers. Sometimes authors let their popularity get to their head, so they continue writing more, but without that spark that made them interesting in the first place.",""
"lps66ix","blockandroll","2024-10-01 08:12:45 UTC","I've got an author I'm currently trying to decide on - Sally Thorne. Picked up her first book (The Hating Game) at random - just expected it to pass the time but loved it, have re-read. Was excited for her second book (99% mine) - HATED it. Had to force myself to finish it. Still tried her third book - it was okay. So now I'm debating - do I try more? Or just give up and keep The Hating Game for when I need an easy read?

Her fourth book is a bit different, too, and sounds interesting but that second book has scarred me.",""
"lps789r","annoyinghuman03","2024-10-01 08:25:29 UTC","when it's just terribly written and some ideas in it are... off. I don't know how to articulate it, but I read an author this year and there was a lot of misogyny and some racism as well. sometimes that comes along in classics, but this was published in 2021 and was just a bit gross to read.",""
"lpsbnls","sapphireblueyez","2024-10-01 09:19:18 UTC","There are some authors that I definitely can’t get into because their writing style is not my thing like Steven King, so I just don’t read them because I know I won’t enjoy them. There are other authors that I’ve outgrown or just dislike because my reading preferences have changed but their writing hasn’t or  they recycle the same plotlines just different characters and locations. I give it 2-3 books before I move on to a new author. There’s so many books and authors out there that you could miss a really amazing story if you stick with someone that just isn’t giving you what you want out of a book. I also find that using apps like Goodreads and Fable to keep track of what I’m reading and how I rate an author is helping me enjoy books a lot more.",""
"lpsgtk5","pracharat","2024-10-01 10:17:39 UTC","When he start his own cult.",""
"lpstxbo","BicycleConsortium","2024-10-01 12:12:59 UTC","I give up on an author when I'm just not excited about them anymore. Recently, I was reading a romantic fantasy from an author I general like and found my attention kept wandering to whether I should be doing chores instead. If I'm more interested in vacuuming than the romance, that's a good sign the book just isn't working for me.",""
"lptdvds","MrPanchole","2024-10-01 14:21:27 UTC","There are a few writers I can think of--Tom Robbins, Christopher Moore, Chuck Palahniuk--who I just had enough of. Like I had enough of hair metal in the 80s; it seemed to peak early creatively and just got more and more formulaic, codified and hidebound. Robbins' interrupting narrators, Palahniuk's attempts to outdo himself in grossness, all three writers' styles...enough already. That doesn't mean I can't dig a repetitive style--hell, I read 25 PG Wodehouse books in row two winters ago. I have tried so hard to find something in John Irving's 21st century output to like (Last Night in Twisted River wins), but after Avenue of Mysteries I will not read The Last Chairlift. I'm finally done with John Irving.",""
"lptml92","Plenty-Bank5904","2024-10-01 15:10:11 UTC","It sounds like you really tried that author! I believe it's perfectly fine to move on after 5 books if the writing no longer speaks to you. It's okay to move on to new authors who make you want to read again when an old one loses your interest.",""
"lpu8ljm","manlybrian","2024-10-01 17:08:44 UTC","When the evil overlord got a hard-on while eating a young boy's testicles, I decided I was forever done with Terry Goodkind. 🙃🙃🙃🙃🙃",""
"lpz298j","Icy_Ad_124","2024-10-02 13:34:17 UTC","In my case it was the Anita Blake series by Laurell K. Hamilton...excellent series that turned into 500+ pages of sex scenes (well written, but still). The characters were loosely based on people in her life and after she divorced the character based on her husband disappeared and she lost the plot, literally. The last book I read I actually counted and of the 580 pages only 13 didn't contain sex.",""
"lq70oq6","Icy_Lengthiness_6151","2024-10-03 20:28:05 UTC","I gave Otessa Moshfegh a try with both Lapvona and Death in Her Hnads but think I have to quit after the latter",""
"lqjsp4c","doonkune","2024-10-06 01:15:49 UTC","Sexual violence. Rape. If it's a central theme I just can't do it. Cancels the author in my mind. Stephen Donaldson and Jacqueline Carey come to mind.",""
"lpr7m9r","couchwarmer","2024-10-01 02:51:44 UTC","I stop reading them.

One that sticks out is Stephen King. I don't even remember what the novels were. What I do remember were three poorly written, overly abrupt endings in a row. That was enough. I have never read another Stephen King novel since.

One exception... When The Dome was released 20-some years later I decided to give the audio book a try. I was pleasantly surprised that King managed an ending. But that one success hasn't been enough to bring me back to his other novels.",""
"lprgsao","gutfounderedgal","2024-10-01 03:57:03 UTC","There are a few authors like that for me. I simply don't read any more of their work. Many I know I won't read again from the first book, if I ever make it to the end, such as anything by Dan Brown. Others, I read more when I was younger and less aware of literature. Stephen King is one for me. These days I can't tolerate the dumbed down picture aspect to the writing anymore in the way I can't tolerate daytime soap operas. So much ""stuff"" really makes me question the small parts of a couple things I thought were good in his writing, but even mediocre but popular writers can have a good day of decent writing. Literary writers too can lose their touch it seems, some seem to give up whatever made them once something special. Well, as we know, writing is a cruel mistress.",""
"lprzddi","Tweedishgirl","2024-10-01 06:55:18 UTC","The wheel of time book 11ish. Was a million pages long, advanced the plot 2 weeks. 

Literally 2 weeks. I was so exhausted by the end, I swore: no more.",""
"lpszkmc","Artistic_Regard","2024-10-01 12:53:12 UTC","I gave up on Brandon Sanderson after Defiant. I loved Skyward, it is one of my favorite books. The two sequels after that were just okay, but they weren't horrible. 

The last book, Defiant, is literally the worst book I've ever read in my entire life. It was so bad, I don't understand what he was smoking. 

So many times, I cringed so hard, it took me 6 months to finish it because it was so painful to read. Some scenes logically made no sense, and the traumatizing cringy massage scene, and also it was also cliche af. He actually used the line, ""If you pick a fight with one of us, you'll have to get through all of us."" How much more cliche can you get than that?!

I consider Skyward to be one of the bests YA books I've ever read and Defiant to be the worst. The drop in quality was baffling to me.

I haven't read any of his more recent works, but judging from his output pace, I feel like at this point he must be going for quantity over quality. I also wouldn't be surprised if it came to light that Janci Patterson wrote Defiant and not him because it really seems like her style. But yeah, I've given up on him for now. I might read the new Stormlight book when it comes out out of curiosity, but I don't have high hopes for it anymore.",""
"lps6ysk","jaklacroix","2024-10-01 08:22:16 UTC","I tried reading Purity by Franzen and realized I was just done with him. So lame and disconnected.",""
"lprdhna","poopsinpies","2024-10-01 03:31:49 UTC","I've recently placed Stuart James on this list after inadvertently picking up a book of his and not remembering that he had written one of my one-star books from just a month ago.
 
The plot description sounds intriguing, like ""ok, well how in the world did they end up in *that* situation?"" but the story follows every stupid horror movie trope: people deciding to grab a flashlight and investigate rather than just run, people who are scared enough to wet their pants one second and then calmly answering the phone with ""oh hi mom"" the next, implausible situations, women who default to the nurturing and caregiving role while their husband/father gets to be superhero. 
 
Just so tired and stupid. I was kicking myself after the latest one for not remembering to avoid this author at all costs.",""
"lprf6q6","JustaBasicGemini","2024-10-01 03:44:36 UTC","I stick to two books usually, typically because one bad book is all I can take and I stop half way through the second one. I read Article 5 and the sequel to it and they're objectively bad, but I thought the first one was decent and bad in a funny way, the second one I actually thought the plot was good but the characters still kinda sucked but at least interesting things happened. I quit the third one cause I couldn't even finish it, it was kinda boring and didn't have many redeeming qualities.

But truthfully I usually don't care if a book by an author is bad, it doesn't really affect the way I read their other works because all authors have hits and misses, mostly. So if one work by an author is bad, unless it's so bad it leaves a long lasting impression, it usually won't deter me from trying their other books.",""
"lprzyi2","Paradox_being99","2024-10-01 07:01:50 UTC","I usually decide after reading one book. I read Remember Me by Sofie Kinsella and I knew I wouldn't enjoy her other books. The same goes for Mario Puzo. It's an unpopular opinion but I read The Godfather and there's no way I am reading another one of his books.",""
"lps0yya","ConstantReader666","2024-10-01 07:13:23 UTC","I move on easily. I've lost interest in an author over one bad book, or one written in present tense.",""
"lpsbjz3","Due-Cook-3702","2024-10-01 09:18:07 UTC","I read 'Master of the game' by  Sidney Sheldon. It's the worst book ive ever read. That one book was all I needed to decide I was done with the author.",""
"lpsi5tq","QuestionableIdeas","2024-10-01 10:31:41 UTC","When they stop telling you the story. Jason Anspach and Nick Cole had a really compelling universe set up. A few books in a grand space opera and in the middle of a pitched space battle they get characters to angrily rant to themselves about the ""deep state"" and liberals. They were very obvious about their politics from the get-go but the further time moved on past 2016 the more egregious it got =|",""
"lpsmwdh","Ecstatic-Yam1970","2024-10-01 11:16:22 UTC","If an author is really nailing it for a while, then falls off, I tend to skip around in their bibliography. Maybe they're in a rough patch, or trying something new that isn't working for me. Then I go from buying their work to checking it out at the library. Maybe they'll get it together and produce stuff I like. I'm an optimist that way. But I no longer keep track of when they're releasing new work and it may be years before I look into what they're up to. ",""
"lpsua5d","Ineffable7980x","2024-10-01 12:15:41 UTC","I can usually tell after 2 books.  If I don't like one book, I will often give that author another chance.  After two books however, I can definitely tell that we don't get along.",""
"lpt46yv","Raff57","2024-10-01 13:23:19 UTC","If you like them? When you read everything they've written.  Some great, some good, some just okay.  Time to move on.

If its a DNF? I usually try to give it 40-50% to improve.  After that it's unlikely I'll ever read them again.",""
