"comment_id","user","time","message","parent_id"
"lptt317","SJWTumblrinaMonster","2024-10-01 15:45:38 UTC","I collect vintage Science Fiction books, especially mass market paperbacks, and will occasionally pick up a duplicate in better shape or in an earlier edition. In those instances, I'll often put the older or more well-loved book in our local free library box. I don't think anyone on our street cares about these New Wave Sci-Fi gems, but I always hope to one day infect one of my neighbors or their kids when they casually scoop up a copy of, for example, Joanna Russ' *The Female Man* to flip through.",""
"lptq8xy","Existenz_1229","2024-10-01 15:30:07 UTC","Dude, all the time. I found a terrific copy of the first volume of the 1982 Vintage edition of Proust, and I ended up reading all of *In Search of Lost Time*.",""
"lpty8ez","FrankReynoldsToupee","2024-10-01 16:13:34 UTC","I self published a book many years ago and very nearly approved a print run but had second thoughts. I did print a few trial copies for review but backed out. One of those I put in my little free library around the corner from my house in Cali thinking it might be cool for my neighbors to check out my work. Several months later I found it for sale on ebay in Canada. Several years later, and only a couple months ago, I found it for sale by a user in Alabama. I bought it and now it's back at its home. I don't think anyone even opened it.",""
"lptquqd","cogogal","2024-10-01 15:33:27 UTC","Nothing rare or valuable (yet), but I have found recently-released books from my TBR list that I nab immediately. Most recent one was Tom Lake by Anne Patchett.

I also have a fun side challenge where I’m trying to solely rely on little free libraries to work my way through two different series (Tony Hillerman and Nevada Barr). So far I’ve found two from each series. That way I can use my library holds for more recent/popular books.",""
"lpu4sz6","RedneckChEf88","2024-10-01 16:48:56 UTC","Found a first edition the hobbit in one down the road from my house.",""
"lpuhw1d","djinnisequoia","2024-10-01 17:57:01 UTC","I know this isn't really what you had in mind, but once in a free box I found somebody's dissertation (what is that for? A Master's degree? Idk) on Sikhism and it was fascinating.",""
"lpvb80v","Bea_virago","2024-10-01 20:28:28 UTC","I found a signed Mort by Terry Pratchett.",""
"lptxp30","mofoxo","2024-10-01 16:10:39 UTC","I love when I add something to my tbr and then it shows up in the little free library soon after. It feels like a sign from the universe that I was meant to read it!",""
"lptty9b","Bright_Broccoli1844","2024-10-01 15:50:15 UTC","What a lucky find! I kind of wish I still had my Norton Anthologies from college.",""
"lpuxw2r","DaisyDuckens","2024-10-01 19:20:08 UTC","A hardcover complete poetry of Robert frost and a hard cover edition of the complete short stories of Ray Bradbury",""
"lptwe8z","genericthrowaway021","2024-10-01 16:03:24 UTC","Almost half a full collection of bram stoker incrementally from the same little library!",""
"lpttdkq","original12345678910","2024-10-01 15:47:10 UTC","Yeah I've found some cool stuff. 


I think it's not objectively fantastic but something that started me reading was picking up *Stonehenge* by Bernard Cornwall from a converted telephone box library thing. 13 year old me read that cover to cover in about 2 days. I also found Malevil by Robert Merle and Earth Abides by George Stewart on community bookshelves and to this day they're still two of my favourite sci fi books.",""
"lptyw0q","HotAndShrimpy","2024-10-01 16:17:15 UTC","Oh man i have some great stuff from free boxes! Maybe not valuable, but definitely things I’d have never found otherwise. 
My favorite is a 1940s cookbook called “Jewish cookery” by Florence Greenwood that is so hilariously dated. Some good recipes but also a lot of boiling green beans to death! I adore it!",""
"lpugd72","marcorr","2024-10-01 17:49:02 UTC","One time, I found a vintage edition of 1984 that had this beautiful cover art—it felt like it had a history.",""
"lptvyfc","Anaevya","2024-10-01 16:01:00 UTC","I found a german edition of Daphne de Maurier's The Parasites and it was as good as new. The cover on the design led me to believe that the edition was from the 90s or early 2000s (there was no date in the book), yet the hard cover seemed really sturdy and clean and none of the pages had yellowed, which means the paper must be very good quality. I've seen books that were less old with incredibly yellowed pages (which I really hate). It's rare to find an old book that's in such a good condition, everytime I look at those shelves I think in horror about all the paper waste that books that no one cares about anymore generate. I really enjoyed the book too, it was my first time reading Daphne de Maurier and I love her writing style. I'm really glad I found it and very thankful to the previous owner for keeping it in such a good condition. I know that none of my books would be in such good condition,  since I often read while eating or drinking coffee. I recently got some soy sauce splatter on a book signed by the author, which made me a bit more careful.",""
"lpu189d","keerin","2024-10-01 16:29:59 UTC","I found 2x Take Off In German boxes, including 4x CDs and full coursebook at a donation for book stand. I took both and gave one to my brother who wants to learn German.

When I reviewed the series afterwards I realised how lucky I was - it seems like a really comprehensive beginners learning experience.",""
"lpue1cd","142Ironmanagain","2024-10-01 17:36:58 UTC","I found an amazing book on my local library’s 25 cent sale shelf years ago!!

It was Hawaii by James Michener. Literally a historical fiction account of the islands of Hawaii, from its inception to the present (at the time it was written, went up to 1970s).

Such a great engrossing book! Not only great characters but a history lesson at the same time. It was my first Michener, and still might be my favorite. I went on to read many more of his novels as well (Texas, Caribbean The Novel & Poland are other favorites) Highly recommend!

1000 pages at 25 cents too!",""
"lpul4oa","ALandWarInAsia","2024-10-01 18:14:05 UTC","Pre-release copies. There was a rack near the home of someone who reviewed media copies / pre-release copies. They would leave them in there, which is probably a huge no-no especially since some of the books had not come to market yet.",""
"lpus4kf","vexillifer","2024-10-01 18:50:26 UTC","All the time, my neighbourhood is full of them. I’ve found fun random inspirations and I’ve found at least a dozen books that were already on my TBR list. Anything I’ve taken from one I have returned to a different one in the neighbourhood and I have added lots of my own books to them too. Seems to be pretty thriving around me",""
"lpux44p","mintbrownie","2024-10-01 19:16:05 UTC","I think I put really good books *into* my local LFL. But sometimes there’s a treasure trove waiting for me. I’m not a book keeper kind of person. I *try* not to take books out while dropping books off, but 3 Pulitzer Prize winners!!?? Ghost Wars (non-fiction), Angle of Repose and The Mambo Kings Play Songs of Love. I didn’t walk away from these.",""
"lpv5zxi","tolkienfan2759","2024-10-01 20:01:38 UTC","I've found quite a few good ones on free shelves.  The Hamlet, by Faulkner; The Moviegoer, by Walker Percy; Thucydides' History of the Peloponnesian War; Dreadnought, by Robert K. Massie;  Factotum, by Bukowski; people get rid of some amazing stuff.",""
"lpvlu51","chubchubchaser","2024-10-01 21:24:00 UTC","I once found Piranesi by Susanna Clarke in a thrift store, just days after discovering its existence and adding it to my TBR.",""
"lpueux7","0xcedbeef","2024-10-01 17:41:14 UTC","I found a LOTR trilogy book for $2. The cover was from the 70s",""
"lpuirtw","jphistory","2024-10-01 18:01:40 UTC","I used to love library book sales, used book stores and various rummage sales for this, but the really cool stuff is usually scooped up by people wanting to make a buck and sell it online. If you're lucky, your rare gem is not worth much money, which is always what I hope to find. I collect vintage Tanith Lee for the joy of it.",""
"lpukg8s","Weakera","2024-10-01 18:10:33 UTC","Yes.

I love those free book boxes that are spread around my city.  I once found the best short story anthology I have ever encountered (I'm always checking out contemporary short story collections for teaching purposes) and also some books by top drawer writers.

SO much has deteriorated in recent decades--including the loss of so many independent bookstores--this is one of the few improvements!

  
One other thing I love about them:  you can usually tell what kind of people live in a neighbourhood from the kind of books you find in the free book boxes.",""
"lpuwrx4","sillyoryx","2024-10-01 19:14:20 UTC","I found a second edition of To Kill a Mockingbird at a share shed in rural Alberta many years ago. Still my best find to date",""
"lpvau1h","CDNChaoZ","2024-10-01 20:26:28 UTC","Found a copy of Stephen King's short stories compilation as Richard Bachman, which included the out-of-print story, Rage. Apparently it's somewhat sought for now? It was a Book Club Edition, not a true first, so only worth $50-100 or so and not $500.",""
"lpvi2n6","shehadagoat","2024-10-01 21:03:43 UTC","Not free, but for cents at a library book sale I found a signed copy of Good Bones and Simple Murders by Margaret Atwood",""
"lpw11px","darkest_irish_lass","2024-10-01 22:51:54 UTC","Not a great find, but a funny story. My husband has a hobby of collecting copies of Fahrenheit 451 if he sees them being discarded. I had three to donate so I took one to a little free library, but I found a copy already there. Came home and there was another on the stack by the front door. 

He saw me adding my book to the stack and said ""Wait ...we can't _both_ do this.""",""
"lpxfud5","BluC2022","2024-10-02 04:20:55 UTC","I found Sylvia Plath’s The Bell Jar in a book pile in a resort in Boracay island, Philippines. I now have her unabridged journals and collected poems.",""
"lq11irf","librariantothefluffs","2024-10-02 19:57:51 UTC","I'm a librarian who gets review copies mailed to me. I can't add them to the collection, so I like to drop read-once brand new releases in the Little Free Libraries throughout my town. It makes me feel cooler than I probably am.",""
"lptycfu","rmnc-5","2024-10-01 16:14:10 UTC","I find books all the time but nothing really special. The ones I found recently and liked were “Broken Ground” by Val McDermid and “All My Friends are Superheroes” by Andrew Kaufman.",""
"lpu3y5m","Raineythereader","2024-10-01 16:44:26 UTC","I've gotten quite a few good ones from the ""retired"" shelf at my county library.  (""Close Range,"" ""The White Tiger,"" ""The Bluest Eye,"" etc.)  The biggest surprise was Alinsky's ""Rules for Radicals,"" in a community exchange in a small town in Montana which will remain nameless XD",""
"lpusbce","ApparentlyIronic","2024-10-01 18:51:25 UTC","Maybe it's just the area I live, but I've never found a book worth taking in a little library. All the books are either religious, cookbooks, or for children",""
"lpuyh2c","AptCasaNova","2024-10-01 19:23:08 UTC","Nope, usually it’s harlequin romance novels and kids books.",""
"lpuz2np","TheGoldenGooch","2024-10-01 19:26:18 UTC","Absolutely, so often. I found a 1950’s collection of Steinbeck short novels. Also just so many wonderful books both on and off my reading list.",""
"lpx3129","Scuttling-Claws","2024-10-02 02:45:50 UTC","I had an English teacher leave eight grocery bags of books at my little free library. There were some gems for sure, a ton of great poetry, some modern science fiction I've been meaning to read and some wild philosophy.",""
"lpx5f7r","Deleted","2024-10-02 03:01:53 UTC","The other day, I thought about a chapter book series I read when I was a kid. The very next day, I was looking through a free library and a copy of the first book in the series actually literally fell into my hands. 

I took it and gave it to a friend who has kids old enough for chapter books.",""
"lpu3blh","ExoticPumpkin237","2024-10-01 16:41:07 UTC","Tons. Some of the coolest were a vintage edition of Elvis biography (the one written by his psychic) and included my favorite thing to find in old books, a little personalized memento, it was a postcard of Elvis grave in Nashville, the book has to be at least from the 70s, really great condition. I love finding little treasures like that... 


I've found editions of Thomas Pynchons V right when I needed it, almost like it was also trying to find me. I've found old rare editions of Allen W Eckert books around here. All kinds of cool shit. Between that and my junk store quests I've amassed a pretty incredible amount of weird old stuff ",""
"lpu3vav","The68Guns","2024-10-01 16:44:01 UTC","I found one called DysFUNtional, which was this guy that thought he was taking a one-off job at this local function hall and ended up running the place,",""
"lpu7rwb","NiddleJiddle","2024-10-01 17:04:24 UTC","Once I found a signed copy of Nature Girl by Carl Hiaasen. Huge fan so that was neat.",""
"lpucgot","chumluk","2024-10-01 17:28:49 UTC","Found ""The Death Ship"" (1926), possibly my new all-time favorite, in a neighborhood free library. Telling everyone about it. Love those things!",""
"lpuuk9h","HorseWestern62","2024-10-01 19:02:58 UTC","Wow, that’s incredible! I once found a slightly used pizza flyer in one of those free shelves. Almost as exciting as your find but… you got the Norton Anthology? That’s like finding buried treasure! They don’t mention this kind of stuff on cruise brochures.",""
"lpuzh6z","somastars","2024-10-01 19:28:22 UTC","A River Runs Through It. Grabbed on a whim. One of my favorite books ever now.",""
"lpvcezl","The_Sky_Swimmer","2024-10-01 20:34:38 UTC","No, but I've heard stories of others who have. I feel like I'm missing out on all the good freebies! \\*sad face\\*",""
"lpvhyz3","jaklacroix","2024-10-01 21:03:10 UTC","All the time! Great to keep an eye on them",""
"lpvmlka","thinkingboutbread","2024-10-01 21:28:07 UTC","gave away my Norton Anthology to the little free library lol, but have found lots of first edition harry potter books in the meantime",""
"lpvn98m","Kristy_Gardner","2024-10-01 21:31:41 UTC","Every time I find a Fear Street book, I take it as the book gods smiling down on me.",""
"lpwid5p","amber_purple","2024-10-02 00:38:46 UTC","Not a free library, but the 25c used bookstore of my public library 

I collect vintage paperback romances (like those bodice rippers grandma used to read), and one time I found a rare, out of print one. Like, stuff that can sell up to $100 on eBay. A holy grail for the fans. I almost screamed at the library.",""
"lpwqnrt","Lost_Total2534","2024-10-02 01:30:45 UTC","Found currently popular reads for free in absolutely brand spankin' new condition at the public library.",""
"lpxem7w","Deleted","2024-10-02 04:10:43 UTC","I got a signed copy of Mort by Terry Pratchett.  Unfortunately it was signed by someone other than Terry Pratchett, but I still felt like it was a good find.",""
"lpxex4c","Rabidleopard","2024-10-02 04:13:14 UTC","never, but I've put a few in. at my last job at the public library we had one that we stocked with books that weren't being checked out any more.",""
"lpy496u","thebeardedcats","2024-10-02 08:37:09 UTC","I went to Boston for a wedding this summer and found a copy of Jonathan Swift's writings printed in 1890 at the little free library next to the Irish Migrants memorial",""
"lpz5awi","AKA_Arivea","2024-10-02 13:52:49 UTC","My city is particularly bad with the little libraries, one near me is at a church, they check and filter it to their likings and always have the Bible in it, others are often filled with self help, cooking, and trashy romance novels. 

My city's library did install book vending machines, you can have books delivered to them, or you can pick from what is available, and they got rid of late fees, so less stress about returns.  Books can be returned to the machines too.",""
"lq04qpm","Angry-Dragon-1331","2024-10-02 17:04:07 UTC","Not a free book shelf but a thrift store without any real focus on books. An 1880 edition of Cicero’s speeches.",""
"lq1fgfj","Soggy-Blood9603","2024-10-02 21:10:24 UTC","Not me personally, but a local National Trust property has a small area for second hand book donations / sales. 
Turns out one of the donations was a first edition of Animal Farm which they auctioned to pay for renovations. (Dyffryn Gardens, Wales, UK, if you want to look it up).",""
"lpufz67","Bent_notbroken","2024-10-01 17:47:00 UTC","My joy is taking all the religious pamphlets and then trashing them. There is nothing better!",""
"lptqhwm","sexydiscoballs","2024-10-01 15:31:28 UTC","All the time",""
"lpu0c5o","AdmirablePrint8551","2024-10-01 16:25:11 UTC","Yes every blue moon John Ibrahims book king of the cross was a great find found it very hard to put down.",""
"lpu8vnv","Flashy_Bill7246","2024-10-01 17:10:13 UTC","I have found a number of them. I discovered \\*The Everlasting\\* (by the late Leonard Bishop), which I consider the finest novel involving reincarnation. \\*A Voyage to Arcturus\\* (sci-fi by David Lindsay) was another find from the ""free books"" bin. I also grabbed volumes of collected works by Robert Frost and T. S. Eliot.",""
"lpuib1w","dsmyxe","2024-10-01 17:59:13 UTC","I found a book that I had given away two years earlier (assuming that I would need to buy a new copy). It was the hardcover of the last book in a trilogy.",""
"lpunwq2","SomeKindoflove27","2024-10-01 18:28:33 UTC","Found an early copy of killers of the flower moon when it first came out.",""
"lpuum06","voivoivoi183","2024-10-01 19:03:13 UTC","I found a copy of Klaus Kinski’s bananas autobiography on a charity bookstall after wanting to read it for years. It did not disappoint.",""
"lpvyoj1","AggressiveTea7898","2024-10-01 22:37:33 UTC","I found A Brief History of Seven Killings, in perfect condition, at a Little Free Library in my neighborhood.",""
"lpwk5fn","Sauerteig","2024-10-02 00:49:56 UTC","Not in a public free book place, but a neighbors garage sale. ""Winter's Tale"". Really just wanted to support her financially but love books. I wasn't sure to make of it upon the first few chapters since I'm not a fairy/fantasy tale type reader, seemed weird to me. But got more involved in the strange story. Upon finishing I read it again with far more appreciation. Long book, but worth it since I spent 50 cents. Many times over.

Every time I see a movie or think of a white horse I mentally call him ""Athansor""..",""
"lpxc0cq","Rookiebee_","2024-10-02 03:49:50 UTC","I’ve been unsuccessful with my local Free Little Libraries, but our used book store has almost any book on my TBR. I’ve found books that just came out that month already in there.",""
"lpxcsys","martymarquis","2024-10-02 03:56:04 UTC","Found all of A Song of Ice and Fire except for Game of Thrones in a free box right before going on tour (= hours of reading time every day) one time. I didn't miss the first book but had it for a re-read a few years later and saw how it would've been a great hook",""
"lpxkyl0","imhereforthemeta","2024-10-02 05:06:08 UTC","Savage legion, which ended up being my favorite book I’ve read this year. Extremely unexpected- I just snagged it because it was a chance to try a fantasy I’ve never heard of",""
"lpxlutl","Vanhacked","2024-10-02 05:14:30 UTC","It's where I stumbled onto The Curious incident of the Dog in the Night Time",""
"lpxt9gg","Gorf_the_Magnificent","2024-10-02 06:29:51 UTC","Best I’ve come up with was “The Art of Acting” by Stella Adler, who was Marlon Brando’s acting coach.",""
"lpxupi5","DeterminedQuokka","2024-10-02 06:45:38 UTC","I mean nothing super rare but tons of books I wanted to read. Most recently something by Tom holt. Also someone is finding what I’m leaving there which is usually new scifi novels or romance. So that’s also good.",""
"lpyfzqm","todddobleu","2024-10-02 10:48:19 UTC","I found a pretty recent copy of Jane’s Fighting Ships in one. If you know you know. Huge score.",""
"lpyr6s5","Poetic-Jellyfish","2024-10-02 12:20:38 UTC","There are so many! I roam these bookshelves everywhere I go. Of the top of of my head, I once found brand new Anna Karenina, the 1st part. It was still in a foil...the edition used to come with a newspaper subscription quite some time ago, and nobody even bothered with unwrapping it for so many year. Thing is, it then took me years to find the second part in the same edition. 

In Germany, in a small town, I also found Brave New World and Lord of the flies in English. I really wanted Brave New World. In that same bookshelf, I also once found the fourth Harry Potter book. I put it in my head that I want every book in a different edition, since I landed on the first 2 in different editions. And voilà, it was there. Only took me about 2 years to collect all of them 😂",""
"lpyzrsc","Confident_Yellow584","2024-10-02 13:18:40 UTC","I found a signed copy of Klara and the Sun by Kazuo Ishiguro in a little free library! ",""
"lq17r91","perpetualpastries","2024-10-02 20:30:38 UTC","The memoir of Gypsy Rose Lee, which GYPSY is based on, SO GOOD 

A histomap in a library sale for 25c, had it framed and now it lives on my wall",""
"lq38ict","2occupantsandababy","2024-10-03 04:19:27 UTC","I picked up The Sparrow at one and went into it totally blind. That was an experience.",""
"lq3tk44","Dreaming_Void1923","2024-10-03 08:02:19 UTC","The book from a lending library that I got the most out of was Black Boy.

I've found some books on my to-read list like The Neverending Story, 20000 Leagues Under the Sea, and The Curious Incident of the Dog in the Night-Time.",""
"lq6kb7v","quackerzdb","2024-10-03 19:01:51 UTC","I got a combo Call of the Wild with White Fang.",""
"lq8pzwz","gonegonegoneaway211","2024-10-04 02:36:14 UTC","*Diable, Dieu, et autres contes de menterie* for free in a college library. Dude, that was a trippy series of short stories, weird enough to keep the attention of even a french-as-second-language reader like me.",""
"lq8xg14","house-hermit","2024-10-04 03:27:40 UTC","I found The Red Tent out by a dumpster.",""
"lqcdej5","SuitableEpitaph","2024-10-04 18:51:45 UTC","Wish I had. I've bought some books like that, and they were in the garbage an hour later.",""
"lqcs41h","opalopica","2024-10-04 20:11:35 UTC","I don't think I've ever found anything good. I definitely can't even remember any of the books I've gotten from one.",""
"lqm7h74","Recognition_Waste","2024-10-06 14:00:27 UTC","I found some of my now favourite books in public bookcases. My last find was a leather bound copy of Anna Karenina with gold edges",""
"lqq9ns2","Tasty_Block4196","2024-10-07 04:12:45 UTC","I found a 1974 or 75 printing of Travels With Charley by John Steinbeck, it's not particularly rare or collectible but I had been thinking for the past week or two I wanted to read it and was just about to put it on hold at the library, when I found the copy. Best timing I've had with a book find.",""
"lqumo77","Alert-Management9177","2024-10-07 22:28:27 UTC","Not exactly in a book box, but I found the most beautiful copy of Jane Eyre once in a trash can. It is a red hardcover with golden letters, printed in 1952. I don't believe anyone ever actually read it, it looks as if it was bought yesterday,so perfectly preserved. There were many other great classics, from the same collection I would say, in the container, too, but unfortunately all of them ruined by rain. Is this how are everyone's bookshelves going to end up one day?",""
"lqwmmk8","WarThunderFDO","2024-10-08 07:19:28 UTC","I found a first edition of ""A Walk In The Sun"" with a war bond add clipping inside the jacket on a free book shelf at an airfield in Iraq.",""
"ltq96q3","Sad_Performance_5921","2024-10-25 18:55:12 UTC","I found a random anthology of contemporary Japanese short stories printed 25 years ago, it was a treasure! I’ve never read anything similar and unique as these stories ",""
"lpv27sh","emsiemilia","2024-10-01 19:42:28 UTC","It's nice to see so many people found great books. As someone who is a great advocate for literacy, both personally and through my work, I always had mixed feelings about ""little free libraries"". Or specifically that they could really do anything to improve literacy rates-- book availability alone is not enough to solve the literacy crisis. 

I also feel like people have so many crappy books to get rid of, and the LFLs just let them feel less guilty than throwing them away. One literacy-focused non-profit I worked at  got boxes upon boxes of crappy (as far as I could tell) books dropped off on a weekly basis (we didn't ask for donations), and they ended up in the recycling while the donors had no idea, and thought they were helping with literacy in some way. 

Sorry to be negative-- just needed to vent, I guess. Maybe this is the wrong place to vent about free books.  What I'm seeing from this thread is that for us book nerds, free libraries can be great, so yay for that.",""
"lpvzcud","darkest_irish_lass","2024-10-01 22:41:36 UTC","The art on those early sci-fi books is amazing.","lptt317"
"lpu6o08","mushinnoshit","2024-10-01 16:58:36 UTC","Looking for the SF Masterworks series in free libraries and charity shops is my weird little hobby. Proper little dopamine hit when I find one I don't have. I've got about 40 of them so far and never paid more than about £4 for one. 

I have the Female Man btw! I'll bump that up my list if you recommend it","lptt317"
"lpx7gzv","dangolyomann","2024-10-02 03:16:13 UTC","I nabbed an old Isaac Asimov paperback the other week!","lptt317"
