"comment_id","user","time","message","parent_id"
"lpubkyd","bashothebanana","2024-10-01 17:24:15 UTC","What's your book called?","lpty8ez"
"lqe1wpc","qread","2024-10-05 00:57:19 UTC","I always find recently released hardcovers at library book sales. I think a lot of people who donate books to libraries don’t know that they won’t end up on the shelves.","lptquqd"
"lpz4quy","dumpling-lover1","2024-10-02 13:49:30 UTC","That’s so fun!","lptquqd"
"lpuhxv3","Deleted","2024-10-01 17:57:18 UTC","Woahhh what was its condition?!?","lpu4sz6"
"lpz5nrm","coolestdudette","2024-10-02 13:54:54 UTC","haha that's an unusual one! a dissertation is usually for a phd/doctor's degree, at least in my country","lpuhw1d"
"lq3gmup","unspun66","2024-10-03 05:35:35 UTC","What a treasure!","lpvb80v"
"lpx522d","Deleted","2024-10-02 02:59:23 UTC","[deleted]","lptxp30"
"lptvmw9","ImLittleNana","2024-10-01 15:59:17 UTC","I saved mine for years because I would read from it frequently. It’s gone missing and I suspect someone threw it away because it was ‘just an old textbook’. I miss it! I could always find something in it.","lptty9b"
"lpukphy","Weakera","2024-10-01 18:11:54 UTC","Long live the Norton Anthologies!  That's how i got turned on to poetry.","lptty9b"
"lq3vi8x","Kayakchica","2024-10-03 08:25:49 UTC","I still have my Norton Anthology from college (which was in the 80s by the way). I keep thinking I should just get rid of them but there’s so much great stuff in there.","lptty9b"
"lpvw3l5","EngineerSandi","2024-10-01 22:22:00 UTC","Hawaii by Michener was what my parents tested 6 year old u/engrsandi’s reading skills. Fortunately, not comprehension, but I read the heck out of that random page!","lpue1cd"
"lpz6efi","coolestdudette","2024-10-02 13:59:12 UTC","okay that sounds like an interesting author! when you say historical fiction, how accurate is he in his writing to the actual history of the area he writes about?","lpue1cd"
"lq13evn","maple_dreams","2024-10-02 20:07:58 UTC","I haven’t had any spectacular LFL finds but I also think I put good books into the one down the street from me. The ones I’ve put in seem to go quickly!","lpux44p"
"lq19kcy","kaerahis","2024-10-02 20:40:03 UTC","Interesting. There's a comic with Joe Hill's name on it titled Rage. I wonder if it's similar to his father's story.","lpvau1h"
"lpz6vy7","coolestdudette","2024-10-02 14:02:01 UTC","yes to finding little mementos! my copy of Les Mis had the ticket to a soccer game from the 70s or 80s when the Euro wasn't introduced yet and it was paid for in German Mark","lpu3blh"
"lq3ulpq","LonelyBruce1955","2024-10-03 08:14:55 UTC","Slightly off topic, but your comment reminded me of a wonderful random store I discovered during my active duty Navy days while in a liberty port (Fort Lauderdale FL). They were selling the original paintings of many Sci-fi pulp novels as well as Star Trek and Star Wars books. They were signed by the artist and came with authenticity documents from the publishers. Some were priced in the thousands.","lpvzcud"
"lpui4me","RedneckChEf88","2024-10-01 17:58:17 UTC","Honestly not that great lots of creased pages and the spines starting to come apart. Im still keeping it though lol.","lpuhxv3"
"lq12wlj","maple_dreams","2024-10-02 20:05:15 UTC","Enjoy The Overstory, it’s a beautiful book! It shot to my top 5 before I’d even finished it.","lpx522d"
"lpza4kl","142Ironmanagain","2024-10-02 14:20:46 UTC","Michener has been gone for a while now, but his books are thoroughly & extensively researched and include real events, many times maps are included, usually peppered with fictitious and real characters. In the introductions and addendums to his books, many times he cites what’s real, and what’s not. Sometimes even names of towns are fictitious but based on real towns. But if you check his output, he’s written more than 40 books (!), both fiction and non-fiction!!","lpz6efi"
"lq1bbnw","CDNChaoZ","2024-10-02 20:49:02 UTC","I just searched it, it's titled *[Road Rage](https://joehill.nl/TheCollection/comics/comic-roadrage/)*, no?","lq19kcy"
"lq4gsqi","coolestdudette","2024-10-03 12:02:40 UTC","wow that's crazy, thank you so much!!","lpza4kl"
"lq24533","kaerahis","2024-10-02 23:44:40 UTC","Ah maybe, thanks. I just remember the cover saying Rage really big on it.","lq1bbnw"
