"comment_id","user","time","message","parent_id"
"lq81o7j","joymarie21","2024-10-04 00:03:39 UTC","I would just say I have a huge pile of books i want to read first and thanks so much for the suggestion.  I wouldn't lie.",""
"lq823zv","marktwainbrain","2024-10-04 00:06:20 UTC","Only to teachers, when I was much younger. If you’re doing this to friends as an adult, you need better friends.",""
"lq80ue7","helvetin","2024-10-03 23:58:34 UTC","not at all - if i didn't do something, then i didn't do something and i will go on the record as not having done it. others can feel what they want about the situation; they're allowed. don't understand what's so hard about telling the truth...",""
"lq85cql","kiwibreakfast","2024-10-04 00:26:27 UTC","I remember going into my English Lit prof's office and his copy of Infinite Jest had the first 30% absolutely filled with tabs then none at all thereafter, and I asked him ""have you not finished it?"" and he just looked very tired and said ""nobody has.""",""
"lq85beh","DialecticalEcologist","2024-10-04 00:26:14 UTC","i wouldn’t lie about having read something. but i also wouldn’t continue probing somebody on a book if it was clear they hadn’t really read it or had forgotten a chunk of it. that’s just rude and awkward.",""
"lq8199z","mainebingo","2024-10-04 00:01:05 UTC","I never finished Ulysses. Phew, OMG, I’m so glad that lie’s over.",""
"lq83ffj","Cangal39","2024-10-04 00:14:34 UTC","If someone is really insistent on a book rec, I'll usually say something like ""I tried it, couldn't get into it.""",""
"lq83i2o","yawnfactory","2024-10-04 00:15:01 UTC","Does writing a book report based on a Wishbone episode, just to prove I could, count? 


Edit: It was the Black Arrow by RL Stevenson",""
"lq84u31","floridianreader","2024-10-04 00:23:14 UTC","I'm an English major who actually did do all of the reading for the degree, apparently.  

To answer OP's question, I never lied about reading something. I don't think I've ever lied about that, not even in high school. 

When I was in 10th grade, we had to get a book from the school library, read it, and do a book report in like a week.  I chose Gone With the Wind (about 1000 pages).  My teacher was just so convinced that I was just going to watch the movie that she made me stand up and do my book report while she asked me a bunch of questions to try to trip me up. I did read the book. I didn't get around to watching the movie until a couple years later. I got an A on the book report.",""
"lq81qef","nrith","2024-10-04 00:04:02 UTC","Does lying to your professor count, if you still passed the test for the book?",""
"lq867bw","WriterJWA","2024-10-04 00:31:44 UTC","I think a subset of people gauge their worth based on how smart or current they appear to others regarding a trend, similar to diehard music snobs or even foodies or beer snobs. I've had people look down on me because I'm not up on some arcane or esotoric music currently in vogue (or just popular with them at that moment). Really, though, it's just their own insecurities shining through. Read what you want, read what makes you happy, and branch out into the unknown with it at your leisure.",""
"lq875o6","ilikebooksbetter","2024-10-04 00:37:35 UTC","Years ago I felt like everyone had read the classics and quoted them and were snobby about it. I never outright lied, but I found myself smiling and nodding during some of those book discussions despite not having a clue who or what they were referencing. They actually kinda shamed me to the point I've spent the last few years catching up on all those classics. 🫣

Now that I'm older, I don't ever take it personally and don't do the smile and nod thing. I do what I want and read for my own pleasure, enjoyment, and knowledge. If someone is that pushy or judgy about it, I've mostly moved on from them.",""
"lq86fuh","WhichSpirit","2024-10-04 00:33:13 UTC","People generally believe me when I say ""I think I read that years ago but honestly couldn't tell you anything about it.""",""
"lq859gc","firefoxjinxie","2024-10-04 00:25:54 UTC","Haha, only in high school. For example, I couldn't get past about 75% of Anna Karenina and I just looked up the plot summary and wrote my report on stuff that I read after confirming nothing at the end would contradict. 

But since I have been reading for fun, no lies about books read. After all, it's reading for fun.

But I'm like you, my memory can't hold the hundreds of books read. Sometimes I even forget which books I've read, even the titles. I'm in my 40s and started writing down books read in 2013, and I'm at over 600. I couldn't even list all the titles if I tried unless I could reference my tracking apps.",""
"lq819cu","Antilia-","2024-10-04 00:01:06 UTC","This girl back in elementary school who hated me for some reason insisted I hadn't read one of the Campfire Weenies books. ""What's the third story in it, then?"" she asked, smugly. Me: ""Uhh...something about a girl creating a monster to take to prom?"" I was correct. She shut up. Just so odd that she would accuse me of making that up for attention. Oh well.",""
"lq85dl3","ForAGoodTimeCall911","2024-10-04 00:26:37 UTC","No. Never. Shameful behavior.

...but nodding and saying ""oh for sure"" when someone is talking about a book and then letting them continue the conversation under the false impression that I have read it? That's a gray area.",""
"lq839li","monday_thru_thursday","2024-10-04 00:13:33 UTC","Just as you mention sitcoms, *some* people can be very weird (and not understanding in the slightest) when it comes to different people's attachment to media.

For some, if you ""like"" something, how could you NOT remember every single important line? Every single funny exchange!? Like, hello, what is even the POINT of watching something with dialogue as good as (let's say) Community, if you can't recognize the context of \\[insert literally random line here\\]!!!?!?!?!?

Books aren't immune to that, either. Despite being a reader, some people are not quite capable of seeing that others are, at their core, different than them: that they read things at different times and paces, that they consider different things important, and that something important to one person may not be permanently memorable to another.

~~In my snarkiest moment, I'd just tell them to literally grow up, as you most clearly see the same behavior in children or others with little life experience. But everyone wants to be a spoiled gifted child nowadays, so what can you do?~~

Less snarkily, these are, in fact, *not* religious texts. You're expected to carry the knowledge of a religious text with you, always. But a random pretty good novel? Even a masterpiece? Eh. The broad strokes; the major themes, sure; but maybe give a person a refresher if you want to talk smaller details.",""
"lq90n8x","shin_malphur13","2024-10-04 03:51:00 UTC","Lied about finishing Steve Jobs' biography. In reality I read half of it before realizing he's a fucking asshole",""
"lq82t7t","Aggressive_Dog","2024-10-04 00:10:43 UTC","Go to an asoiaf subreddit and disagree with someone on any minor, banal aspect of GRRM's writing that you can think of. People will flock to you solely to accuse you of having never read the books.",""
"lq83ujz","eaglesong3","2024-10-04 00:17:08 UTC","I've never lied about reading a book.  I doubt I ever would.  If a book doesn't interest me there's no shame in not reading it.  I'm also open about my DNF list.  I'll tell you the books I never finished and why I didn't finish them.  On a positive note, I looked up a list of top 20 books (or series) that people lie about having read and I have read 9 from the list (10 if reading the PLAY ""Oliver Twist"" counts for that title.)  So I guess I'm reading a good number of ""coveted"" books.   The list was from 2016 though.  I wonder if people have started lying about reading The Wheel Of Time since Amazon started producing their limited series.",""
"lq83yaf","Br0methius2140","2024-10-04 00:17:48 UTC","Yeah I have.
Running late writing a summary about ""Heart of Darkness"" for a GenEd course. Got maybe 10 pages in and realized that this seemed really familiar. Wrote 3 pages of material about ""Apocalypse Now"", did the ole' find>replace for names and removed all helicopter references. Ended up getting an A-.",""
"lq86ylh","AnorhiDemarche","2024-10-04 00:36:25 UTC","If you can't remember a character try ""they didn't leave much of an impression on me. What did you think?""

Then the other person can talk and you can have your memory jogged.",""
"lq89oym","Menacingly","2024-10-04 00:53:06 UTC","You have MULTIPLE people in your life who do this? How exhausting.",""
"lq828pe","Handyandy58","2024-10-04 00:07:09 UTC","No, I have not. Granted, I rarely come across such judgmental people, and any case I would not be ashamed pf not having read something no matter the circumstances.",""
"lq9wbf7","Cuni95","2024-10-04 09:20:48 UTC","My ex boyfriend told me he loved the patrick rothfuss series and he gifted me the books. I adored them. While I was reading them, I was telling him everything and I was supper enthusiastic about it. After a few weeks I realised he lied. He never read the books, he know nothing about the series and I found his lie infuriated. Why lied about something like that? It was stupid.

If he can lie so easily about that… he can lie a big time. It change the perspective I had about him. I caught more lies eventually and broke up with him. 

Do not lie if you can told the truth: I’m not in the mood right now for that kind of book, but thank you so much for your recommendation. I will put that in my list and i will considerate it in the future. Hope we can discuss it another time! 

End of the story.",""
"lq87s8s","MochaHasAnOpinion","2024-10-04 00:41:25 UTC","One time. It was my senior year of high school and we were doing Wuthering Heights. Me, the bookworm, hated it. Try as I might, I couldn't get into it. I was also struggling with senioritis and was having a very rare conversation in class when Mrs. Nelson cut me off and asked me if I had finished the book. I lied through my teeth and said yes. So she said, ""and you're going to ace the test?"" I said, yep. I paid attention in class and the movie and got an A on the exam. I felt really bad and eventually read the book. Sorry, Mrs. Nelson.

As for the other part of your question, I can read a book for the first time and forget most of what it's about (until I start rereading them and it starts to stick). Plus I'm terrible with names lol. Sometimes I'm rereading and the whole story floods back to me as I go, but when I first picked it up, I didn't remember a thing lol. Other stories stick like glue.",""
"lq86myg","Cubsfan11022016","2024-10-04 00:34:27 UTC","I lied about reading the Bible as a kid",""
"lq85t9a","zeugma888","2024-10-04 00:29:18 UTC","You can go with - I have read it, but I don't remember much about it. I remember I enjoyed it at the time but I don't remember the details.
I'm just not as into reading as you are.

Life is easier, really, if you don't tie yourself in knots to impress others. They should  like you for who you are if they don't then don't waste your time on them.",""
"lq86syv","Deleted","2024-10-04 00:35:28 UTC","I have such bad reading retention I tend to lie about not having read a book so people don't ask me questions about what I read or specifics about what I thought and make me LOOK like I'm lying about having read it",""
"lq89sul","LaughingHiram","2024-10-04 00:53:46 UTC","I have a 20% comprehension rate. Everybody accuses me of not having read the book.",""
"lq8gwwy","noknownothing","2024-10-04 01:38:16 UTC","Why not just be honest? Why worry about what they think?",""
"lq8hwnr","kilaren","2024-10-04 01:44:37 UTC","I have 2 English degrees, so yes. I have done this many times. Sometimes, I never actually said I read a book, but I did write papers and take tests over books I started but often could not finish because I worked 2 jobs at 50-60 hours a week and was a full-time student. Sometimes, I just kind of laughed and nodded along when people talked about books that were required reading in public schools and that many in the class seemed to have read. I read a lot as a kid and teenager, but went to a Christian school. Our required reading was very different and I had never even heard of a lot of required reading books until I was in college. I did finish many books but sometimes had several semesters with about ~30 novels assigned across my classes. So I am still trying to play catch-up but I also don't really want to. I am more truthful outside of an academic setting. 🤭",""
"lqa1d82","Erebus25","2024-10-04 10:17:29 UTC","Never had that sort of experience. I mean who the \\*\\*\\*\\* are they that I would have to lie and pretend for them?",""
"lq83z2l","WhatIsASunAnyway","2024-10-04 00:17:56 UTC","If I haven't read a book I haven't read a book, it's that simple really. No amount of pressure is going to make me say I've read something I haven't. 

And I've never had someone say I haven't read a book either. If someone doubts my personal experience they're not worth my time",""
"lq81gik","Letters_to_Dionysus","2024-10-04 00:02:19 UTC","would have failed out of the English degree if I didn't LOL SparkNotes is a lifesaver",""
"lq822t1","WOTNev","2024-10-04 00:06:08 UTC","I've only ever lied in high school about it to the teachers, and I was someone who loved reading books as I was growing up but there were just some books that we were forced to read that were just so soooo unpleasant to read that I couldn't bring myself to finish them. 


In your situation, instead of lying, I think I would just be firm on my reasoning for not wanting to read something. 

It doesn't matter if you're busy or have a lot of time, if the book doesn't sound like something you'd enjoy reading why would you have to force yourself to read it?",""
"lq8a8d8","Jessrynn","2024-10-04 00:56:25 UTC","No. I just say I'm a mood reader and I can only really read what I want to. It has the benefit of being true. You may want to reconsider how much you interact with these people.",""
"lq8d443","Successful-Escape496","2024-10-04 01:14:10 UTC","You've made me cringe for my younger self, who was probably overly pushy a few times about how friends should read a particular book. I don't think I was ever so pushy anyone had to resort to lying, though.",""
"lq8ei8e","gormholler","2024-10-04 01:22:52 UTC","I a voracious reader but that's me. Some books I just couldn't get into. Real readers just want others to enjoy as much, in my experience. No need to lie, it's too much work. You're not required to follow every suggestion.",""
"lq8ese3","green_waves25","2024-10-04 01:24:38 UTC","Yes, but now I’m a librarian, so I realize it’s not a big deal.",""
"lq8hedq","Hungry_Imagination_2","2024-10-04 01:41:26 UTC","Only to my professors!",""
"lq8j3u4","Exhausted_Biscuit","2024-10-04 01:51:54 UTC","Never lied about having read one, but I have lied about my opinion of a few; knowing it's a favourite of the friend who suggested whatever it was, I didn't want to shit on their favourite book. Even ""it just wasn't for me"" often leads to them trying to convince you to re-read it or the next one if it's the start of a series, and I'd rather in that situation that they thought they made someone happy with their suggestion that's all. 


Definitely forget the plot/characters of things I've only read once,  and more than a few months ago. Especially if I'm put on the spot about it. I could have read something hundreds of times, but if you ask me something specific that I'm not expecting or in front of a group and I might as well have never heard of it. ",""
"lq9hout","way_lazy24","2024-10-04 06:30:13 UTC","I lied to my teacher about reading Anna Karenina. It wasn't required reading, but she saw I had borrow it from the library, and was so excited and proud. She told me to do a project on it because she loved it so much.

It was far too dry and I didn't make it past 3 chapters. I Sparksnoted the rest and made my presentation. Sorry Mrs. Marcum.",""
"lq9w365","Shadalan","2024-10-04 09:18:07 UTC","I scored top marks on my class at GCSE which involved among other assigned books The Great Gatsby. I'm a big reader but hated the first few chapters of that book so much I just refused to continue.

Read a summary the night before and bullshitted with some big fancy words English teachers find impressive expecting to get maybe a B. Turns out my vague, generalising accidentally got everything right somehow lmao",""
"lqdqf6z","Admirable_Art_9769","2024-10-04 23:39:36 UTC","i once posted my favorite books bookshelf here on reddit and a guy assumed i didn’t read all of them… like?? i literally said these are my favorites. why would i lie? 😭💀",""
"lqdsubs","10Kmana","2024-10-04 23:55:46 UTC","I once won a semi-prestigious short story contest that had to be written on the themes and topic of a well known author's book series. I literally skimmed the Wikipedia for the plot, I had never read a word of his books, saw my ex play the videogame quite a bit, but that was IT. Got invited to the capital city to receive my prize and meet said author in this whole ceremonial thing. There I am, standing in front of a crowd of strangers and some press people taking photos, holding the diploma I got for interpreting this author's work, and shaking hands with the GUY WHO WROTE THAT WORK, when suddenly he leans in to say something to me. I tense up in anticipation, absolutely convinced that this is it, he's about to put me on the spot with some super specific question about his books that I won't be able to answer and expose me as a total fraud and an imposter in front of all these people; literally, my worst nightmare about to happen before my eyes and I am powerless to stop it at this point. I basically grind my teeth through my socially awkward frozen smile and ever so slightly lean towards him to hear what judgment he has to pass. And he says: ""I'm so sorry, but I didn't actually read your story""

To this day I still wish I had said what was my first instinct to say to that: ""That's okay, I didn't actually read your book"". But really I just stood there in total shock because it was so ironic, my eyes must have been wide as saucers in those press photos

Ohhh... I have never had to fight to hold back laughing out loud so hard as in that moment. What karma was that?!",""
"lqe5b4n","SirZacharia","2024-10-05 01:21:27 UTC","Tbh often if I talk about that I try to read more than 50 books every year they ask if I can even remember what I’ve read, as if I’m not actually reading them.",""
"lq84tv2","synthetic_medic","2024-10-04 00:23:11 UTC","I've lied about reading Stephen King novels that I watched the movie of to avoid awkwardness with pretentious assholes.",""
"lq85gdg","redseca2","2024-10-04 00:27:05 UTC","I was a voracious early reader and my middle school teacher didn't believe when I submitted a book report on Crime and Punishment. I had to walk her through the book to believe me. By then she was giving me an A and I didn't even bother telling her I was now half way through War and Peace.",""
"lq88pls","Bodidiva","2024-10-04 00:47:04 UTC","Only as a 7th grader doing a book report. 

It was an oral report. 
I chose The Hobbit.
I read part of it. 
Mashed it up with Star Wars and The Never Ending Story.
No one in class had read it.  
I got an A- for being nervous. 

Regarding your situation. It's not really your problem if they are offended you don't read their suggestions. You can tell them: it's sounds like you enjoyed it, thanks for sharing. 

You can also let people know you read something so long ago you need a refresher on who a character was.  

If someone can't understand these things then it's still their problem 🤷.  

I have a friend who reads mostly the opposite of what I do. She REALLY wants me to read TJ Klune bc he's her favorite. I am excited to talk with her about his books, but they don't grab me, so I'm not likely to read one. I'll still be happy she's happy about his new books though.",""
"lqbfmyy","Dodoria-kun413","2024-10-04 15:51:51 UTC","A shocking number of commenters here are really insensitive and tactless. I agree that if someone is genuinely getting offended when you haven’t read a book they recommended, maybe you should find better company. However, anxiety is a bitch, and sometimes you don’t want to disappoint people (especially if they’re close, and that book means a lot to them or was written by them). Telling an insecure (or perhaps even mentally ill) person to “grow a spine” is not going to help, lol. Would think readers would at least understand, even if they don’t agree. I thought books were supposed to foster empathy. Welp.",""
"lq86549","terriaminute","2024-10-04 00:31:21 UTC","My memory's not great; husband frequently knows more about any given book we both read than I do. 

I read the entire Bible specifically to have done it, but the takeaway has been, ""I've read the whole thing. Have you?"" to people who want to preach at me. Worth it? Sometimes. I have been told ""Oh you did not,"" but when I assure them it's true, they stop questioning. Perhaps out of fear. :)",""
"lq83ggp","Express_Hedgehog2265","2024-10-04 00:14:44 UTC","I majored in English, of course I've lied about reading books",""
"lq8bqba","khinzaw","2024-10-04 01:05:34 UTC","I got accused of not having read Tolkien and downvoted on r/television because I said Orcs having close and caring family units doesn't really match how he writes about them.

I was told that *anybody* who had read *The Hobbit* would know otherwise, because *obviously* Bolg brings an army specifically to avenge his father, despite that book having exactly one mention of Orcish lineage and doesn't attribute Bolg's presence to it and in fact gives an explicitly different why the goblins are there.",""
"lq84rwm","aamycha","2024-10-04 00:22:52 UTC","Lying to my teachers about reading a book for class, yes. Besides that , no.   
There really isn't a reason to lie. If you haven't you haven't. No need to force it. It's also just me but I would limit interactions with people that gets offended if I don't do what they want.  
As for forgetting about the whole story after you've read it. There's plenty of books that I've read that I have no idea and recollection of what it's about and what happened. Lot's of people are like that, so don't worry and think that it's only you.",""
"lq86bn1","Just-Ad-6965","2024-10-04 00:32:29 UTC","Nah. Everyone has their preference. What's the point of lying? And if someone were to accuse me of lying, again, why? I have been accused of making up words and lying about to sound smarter or cheat at Scrabble.  🤣🤣That was VERY annoying, but I just stopped the interaction,  moved on, and didn't interact with them again. To be clear, that person was not in my circle. I didn't dump someone over it, but it did reveal quite a bit about their character.",""
"lq86cg5","Letrabottle","2024-10-04 00:32:37 UTC","I never lie about having read books because I see nothing wrong with reading summaries and analyses of books that I'm not willing to actually read.",""
"lq86eax","do_over_2024","2024-10-04 00:32:57 UTC","I lied about reading _War & Peace_ and I regretted it the moment I said it. I was old enough to know better that such white lies serve no purpose and I hate myself for having such a weak ego to stoop to that lie. I should have come clean right then but was too much of a pussy. 

I have seen several adaptations of it so I could talk about it intelligently but the thing is, I lied when there was no reason to. I wasn’t even trying to impress anyone.",""
"lq86i7m","CheeseburgerCated","2024-10-04 00:33:38 UTC","I have lied about not reading a book... I was in a book club and the I read the second book in a series we were reading way ahead of the rest of them because it was so very good. By the time the rest of the club got around I acted like it was my very first time reading it 😅",""
"lq86qj1","chasinggodzilla","2024-10-04 00:35:03 UTC","I tried reading lord of the rings for the first time  at 14/15. I was an avid reader at the time, and my uncle knew this, but he said it would be impossible for me to read such a difficult book. 

I told him it was my second time reading through it and I didn't think it was that hard. He was surprised and never bothered me about reading anything ever again.

I finally read it at 27.",""
"lq8730o","Theonewhoknows000","2024-10-04 00:37:09 UTC","My friend was excited about a book  they have been telling me to read for a while that I didn’t want so I read a summary and some reviews.",""
"lq876al","EstablishmentLevel17","2024-10-04 00:37:42 UTC","Teachers. I love reading but hated reading what was given to me . Nevermind home stress which was a wreck in distracting my brain .
Summer school I did well at so did read... Less stress. Less homework. I could focus more...
And that is how I read my least favorite book of all time: a day no pigs would die.",""
