"comment_id","user","time","message","parent_id"
"lqbd3j4","buttsharkman","2024-10-04 15:38:19 UTC","If someone gave me grief about not reading a book I'd tell them to eat a bucket of dicks. Lying about reading a book and doing research to back it to appease an asshole seems crazy to me",""
"lqbdrq1","Necessary_Bag9538","2024-10-04 15:41:55 UTC","I can understand being frustrated about not being believed about having read a book. I've got to say, more power to you on reading Pride and Prejudice. I tried a couple of times and couldn't get through the first chapter because of the amount of words to say one thing. I had to buy the cliff notes to summarize what I read. 🤦🏻‍♀️ Now I just watch the movie and call it good😁😂",""
"lqbf3pz","Angelfrom_Sky","2024-10-04 15:49:00 UTC","No, why",""
"lqbicbp","1readdit1","2024-10-04 16:06:04 UTC","Not in recent years",""
"lqbimwc","J-Adore-Line","2024-10-04 16:07:38 UTC","You’re just not into books. I am, but my friends are not. And they are still my best friends. They don’t judge me and I don’t judge them. Everyone (ok some people dont and that’s even something to not be ashamed for, if I didn’t have the chance to go to school I wouldn’t either) knows how to read so what’s the difference if you just don’t like books so much. Or not at all. You’re the same person. They already love you. They’re just trying to find some common topics. And if books is not it, you’ll find some other things to talk about. Like your lives and everything that’s happening. Just like you’re doing right now ❤️ just be yourself you are perfect as you are, with or without books 💛🧡🩷",""
"lqbo8au","Comprehensive-Fun47","2024-10-04 16:37:38 UTC","I haven't really been in this situation. I'm usually honest about book recommendations. That I'll try to get to it eventually.

The best thing to say is ""thank you for the recommendation. I'll add it to my list."" No commitments..

If someone is being really pushy about it, say you appreciate the feedback and know they'd love to have someone to discuss the book with. Maybe they could join a book club to find someone who is also dying to discuss the book.

Just be firm that your time for hobbies is limited and you like to choose your own books.

Also, I don't lie about books I've read or not read. I'm honest about that too. I ""read"" One Hundred Years of Solitude, but I couldn't tell you a single thing about it. It was very much in one ear out the other. Maybe I'll give it another try someday. I would be honest if someone asked me.

There's no need to jump over all these hurdles just to, what, make someone like you? They should like you regardless of your taste in books.",""
"lqbofqj","battleangel1999","2024-10-04 16:38:44 UTC","These people signing your checks or grading your papers? If not there's no reason for you to lie to them. Especially if they're supposed to be your friends. Grow a backbone and just tell you you couldn't/didn't want to finish it. It's not the end of the world.",""
"lqbu0kb","A_Powerful_Moss","2024-10-04 17:08:12 UTC","No, but the amount of people who lie about having read ‘Don Quixote’ baffles me. For some reason that book just seems to inspire lies in the hearts of Men. Anytime someone says they’ve read it and the first thing they mention is the windmills 9/10 they haven’t read/finished it.",""
"lqbvby5","EtairaSkia","2024-10-04 17:15:13 UTC","When I started borrowing books from the local library where I was spending the summer at 8 y/o, the librarian would accuse me of not having read the book I was returning because “it’s unbelievable a child can read six books in one day” (it may sound unbelievable, but those were books meant for children aged 7-12, not a big deal, and I’m an incredibly fast reader), so she started asking me questions on all the six books everyday. She ended up knowing the whole saga, because I wouldn’t miss a single answer…",""
"lqbwix1","Aware-Mammoth-6939","2024-10-04 17:21:34 UTC","I had someone accuse me of not reading A Scanner Darkly  because I misjudged the length of the book. This is after I wrote an in-depth post about the book itself.",""
"lqbyi6p","dearboobswhy","2024-10-04 17:32:04 UTC","I was a middle school TA for a year, and worked with the English Language Arts teacher, so the kids were always reading some book or other. I would help those who were falling behind or needed extra support to make sense of what they were reading and engage with the questions they were given about the reading. I did not read a single one of those books, but no one ever caught on. By the time I was done, I had helped kinds thoroughly analyze a bunch of books I never even read.

I also took a grad level English lit course as a college freshman, didn't read any of the books, somehow got looked to as the resident expert in one of the books (I had read that one in highschool), and got an a in the course after writing essays on 2 books that I skimmed during the test (it was open book so we could pull quotes). That's actually how I found out what happens in 1984.

I'm the best book bs-er I know 😂",""
"lqc2jsl","Violet351","2024-10-04 17:53:36 UTC","Not once in my life have I lied about reading a book. I have nearly 300 unread books on my kindle and I really only read certain genres",""
"lqcceip","SuitableEpitaph","2024-10-04 18:46:31 UTC","I have suggested a book I thought was good, but turned out others didn't like it. Nothing accusatory about it.",""
"lqcfgyk","Western_Stable_6013","2024-10-04 19:02:46 UTC","I read what I like to read and I don't care about what others say or thing I have to read.",""
"lqcfomd","yr_golden","2024-10-04 19:03:55 UTC","Once, I think. One of my teachers gave me that book, interested in my opinion, I don't remember how it was called, but it written by the same guy who did Jonathan Livingstone seagull. I've read like 10 pages, and wasn't particularly interested in characters or their problems, my impression was that this was about mid life crisis, and I was like what, 15? But I was too embarrassed to keep the book long enough to read through it, so I returned it, saying that I've read it and dodged any questions about it. I still feel kinda bad for it cause that teacher was genuinely interested in my opinion about her favourite book..",""
"lqcqy0t","AuthorJgab","2024-10-04 20:05:09 UTC"," I lied to my 10th grade English teacher about reading Great Expectations.  I still haven't read it.  

There, I feel better already!",""
"lqdkgko","Shorogwi","2024-10-04 23:00:30 UTC","I’d never lie about reading a book even if it’s recommended a 1000 times. I literally have heaps of books I want to read, so I tell people I’ll try to get to it when I can. And I don’t feel bad about it. I have books I want to read that I haven’t yet, so someone’s recommendation is going to the back of the line unless it piques my interest.",""
"lqe7ki4","Able_Memory_1689","2024-10-05 01:37:38 UTC","I’ve lied a few times… but it rarely goes well so I try not to.",""
"lqeflma","labtech89","2024-10-05 02:35:56 UTC","No and no. I don’t have anyone who I talk to about books.",""
"lqf3e24","FeministInPink","2024-10-05 06:06:54 UTC","""George Wickham? He was completely forgettable, and wholly unnecessary to the story.""

Where's the lie?",""
"lqf6lr4","SIRENVII","2024-10-05 06:43:04 UTC","People like this are just pretentious, pandering, jerks. They really wanna come off as some brilliant scholar who has the most philosophical view on the most complicated of literature. Its really just a way to make themselves feel big by trying to belittle you. 

Once, I worked with a girl just like this. Man, she thought she was just the smartest little cookie. I don't remember what book it was she was reading because I wasn't interested in it. She walked over to me one day and starts story dumping about this book. I'm like.....k.....she explains that there's this very complicated family tree and it's kind of like game of thrones and that it so frigging good. Still uninterested I just smiled and said cool. Then she says "" you've read lotr right?"".....yes. they are my favorite. ""Well it's that level of reading, so you should be able to handle it."" I just stared at her until she walked away with that stank face you make when a fart just lingers.",""
"lqffz16","EconomicsFit2377","2024-10-05 08:33:38 UTC","No, never, what would I have to gain by lying.

I read a Percival Everett book based on a Reddit recommendation...never again.",""
"lqhmms4","mano-vijnana","2024-10-05 17:51:55 UTC","I just read, man, I don't care about the social games around it.",""
"lqiqf28","Gamma_The_Guardian","2024-10-05 21:25:52 UTC",">They know i'm not busy but don't understand I'm not as disciplined and productive as they are.

They're book snobs. Don't feel like you have to prove anything.

>I don't have a good memory so I can only remember details of a book I've read in the last few weeks. Then I forget.

I'm the same way. Even my favorite books, I'll forget the names of my favorite characters. The only time I remember concrete details is when I take notes for book club to jog my memory.",""
"lqj78m9","PeachGlass6730","2024-10-05 23:02:06 UTC","I have msitakenly cuz i thought I had but I actually hadn't so i lied to myself and everybody around mem",""
"lqjhckj","Jedi-girl77","2024-10-06 00:03:23 UTC","I would never lie about reading a book because I’m a terrible liar and I feel like they could instantly tell. If I don’t want to read the book, I just tell them something like “it doesn’t really sound like my kind of thing”. If it’s something I feel I might actually like but I just don’t have time to read it anytime soon or I have things on my TBR list that I want to get to first, I’m honest about that.",""
"lqk0cjr","quantcompandthings","2024-10-06 02:06:53 UTC","i don't remember ""George Wickham"" either but i do remember ""wickham."" i think it's the first name that throws people off, like who even remebers by the end of the book what any of the males' first names are? Every man and married woman seem to go by last name.",""
"lqkqkby","Slyfoxymagikarp","2024-10-06 05:29:15 UTC","I lie about reading books in school projects. I just look up a summary on YouTube and call it a day.",""
"lqkqoj4","Slyfoxymagikarp","2024-10-06 05:30:22 UTC","Oooo pride and prejudice!! It’s about the guy from the place who did the thing then met the person who did the other thing…. Yeah I have no idea 🤷‍♂️",""
"lql00qr","Deleted","2024-10-06 07:05:04 UTC","haven't encountered the situation but it seems roughh 😬😬 I feel so bad for you and atleast you're taking time to read a summary. If they aren't laying off and it got to the  point where you have to lie, then be careful around them. If they don't respect ur decline then how good off a friend are they? I'm not saying they aren't good friends(who am I to judge) but I feel like they should've respected your decision and if they didn't,it could apply to other topics aside from books. Just be happy and do what you think is right.",""
"lqs4idm","Chocolate_Cravee","2024-10-07 14:24:10 UTC","Yes, in high school had to read about 50 books in 4 different languages. For some of the books I only read the excerpts.",""
"lqv6j1n","zedbrutal","2024-10-08 00:29:57 UTC","I got called out for reading Gravity’s Rainbow.  Lady was convinced no one actually reads it.  Joke was on her as I described the craziest parts in great detail and answered everyone’s questions.  Having said that don’t read it as it’s a slog and not worth the time required.",""
"lr6vip1","Neat-Referenceperson","2024-10-10 02:04:43 UTC","Only the American Girl Doll books in the 90s because they were too expensive for my mom, and it sounded cool to say that I read them lol",""
"lspewto","Nataliabambi","2024-10-19 16:28:49 UTC","It was school reading. I had some health issues at the time and either forget or didn’t make it on time to read it. I doubt the teacher knew. I had always good grades from that school subject.",""
"lq84mep","raelik777","2024-10-04 00:21:56 UTC","LOL, so in one of my classes in high school, we read To Kill a Mockingbird, and also watched the movie to compare the two. The hilarious part was that the teacher did such an outstanding job giving comprehensive information about the book during class... that I just took notes and didn't read the book. I aced every single test about the book :D :D",""
"lq87a8k","Melodic-Activity669","2024-10-04 00:38:22 UTC","Yes, I was trying to convince my father in law to go vegan and I told him to read this book (I told him I read it; when I just finished a chapter or two). He read the whole book and asked me a question about one of the last chapters. I told him that wasn’t in there — and he got out the book and showed me. I had to confess I lied. I did not fully read the book. It was a good lesson lol",""
"lq8sp5m","Horror-Struggle-6100","2024-10-04 02:54:34 UTC",">Have you ever lied about having read a book? Alternatively, have people ever accused you of not having read a book?

Yes, I took English/literature classes in High School.",""
"lq920jg","ruminatingpoet","2024-10-04 04:01:53 UTC","If someone suggests me books I add it to my tbr and then later remove it based on preface or review on this community or Goodreads. It's not polite to shun the recommendations down immediately so tell them it's in your tbr. I forget the details of the books I read and movies I watch but that doesn't mean I didn't enjoy it. I read somewhere that it's okay if you forget the book you read or the movies you watch but don't forget how it made you feel.

Enjoy!",""
"lqar328","SunStarved_Cassandra","2024-10-04 13:35:40 UTC","I haven't encountered this with books, but I regularly encounter this with TV and movies, both of which I hardly ever watch.

Sometimes I get people freaking out because I haven't watched whatever the new franchise darling is. ""Omg!!! You haven't watched [movie]?!! You HAVE to see it. Go home and watch it now,"" they'll loudly exclaim. It's very off-putting. Some take it a step further and try to grill me about it later.

Some people are more calm about it, but it's still awkward. I don't know why these sorts of people (and the ones in your life) can't get past the idea that not everyone has the same time, mental focus, and interests as they do.

When I encounter these people, I stand my ground. ""Yes, I have not seen [movie], and have no plans to. Why are you shouting at me?"" ""I'll watch it later maybe, but I've got other things going on now."" ""If you don't drop this subject, there's going to be a problem."" Etc.",""
"lq8jhoh","bianca_bianca","2024-10-04 01:54:14 UTC","All I could say is…I wish I had your problem. So no, I cannot relate at all.",""
"lq81yj9","Traditional_Level406","2024-10-04 00:05:25 UTC","Tbh I say I’ve read a book after reading. >50% of it. More than half is enough to evaluate if you like it or not, and if you don’t…why slog through? (Unless it’s required for school)",""
"lq81qbb","Reader124-Logan","2024-10-04 00:04:01 UTC"," A decade or so ago, I had a conservative boomer decide to give me a pop quiz on Ayn Rand. I answered her questions, made a couple of observations about Rand’s early life, and then recommended a couple of biographies from our library’s collection.",""
"lq89cia","LateRabbit103","2024-10-04 00:50:58 UTC","I lied about reading this really dense book about plants for a woman I pined over.",""
"lq908m8","haleyhop","2024-10-04 03:47:54 UTC","tbh if you’re lying about reading books sometimes, it doesn’t surprise me someone would accuse you of lying about not reading other books (even if you have read them). i’ve never been accused of lying about reading a book but i also haven’t lied about anything that silly before.

if someone suggests a book i’ll either pull out my phone to tell them i’ll look it up or put it on my list of books to read in the future. if i don’t want to read something and someone keeps bringing it up i’ll either tell them i want to prioritize reading XYZ first, or i’ll tell them “i’m not usually a fan of (whatever genre) so maybe not for me.” no one i talk about books with has ever gotten offended by that.",""
"lq9dx9y","StrategicTension","2024-10-04 05:50:34 UTC","I have never read a book",""
"lq8494s","Tardis-Library","2024-10-04 00:19:40 UTC","My 8th grade English teacher. We had to do oral book reports and I chose a book I’d read half a dozen times.

I got up there and had a very dramatic panic attack and gave a 17-second book report.

He dramatically threw my evaluation form in the trash.

I’ve rarely hated a teacher more.",""
"lq82jnc","msmika","2024-10-04 00:09:02 UTC","Same, my go to is ""it's in my to-read pile but you know how those can get"" and then we talk about how many books there are to read.","lq81o7j"
"lq8jkmm","AffectionateCable793","2024-10-04 01:54:43 UTC","And it isn't a lie.

Most of us have stacks of unread books. Also, a bunch of books on-hold with the the library.

Then there's book club commitments.

Most books recommended to me go to the back of the line.","lq81o7j"
"lq8cq97","lisbethsdragon","2024-10-04 01:11:45 UTC","This, it’s not a lie at all 🥲","lq81o7j"
"lqc48cu","DickDastardly404","2024-10-04 18:02:36 UTC","This is why we have the phrase ""I'll add it to the list"" 

You're under no obligation to do what people tell you. If they recommend a book you're not bothered for, just thank them for the recommendation... ""I'll add it to the list"" That's it. Nothing more required from you

But you can just be honest. If they're being pushy you can just tell them it's not your sort of thing, or that you had a look, but weren't interested.  

I'd say lying and pretending you've read it is the worst option.

Have I pretended to know about stuff to look cool? Yeah. As a teenager, but it's a bad look as an adult.","lq81o7j"
"lqajily","simplymeliz","2024-10-04 12:47:29 UTC","I even have a stack of e-books to read! (Thanks Bookbub!)","lq81o7j"
"lq8jdx8","limbkeeper","2024-10-04 01:53:35 UTC","Or they need to grow a spine 😂 Why would anyone do this as an adult","lq823zv"
"lq9ch5d","bookishcarnivore","2024-10-04 05:36:00 UTC","This just brought back memories of when I had to do book orals on a book we read in the second language we were being taught in school.

I was *awful* at the language and definitely couldn't get through a full book so I would pick a random English book I had read and just talk about it. The kicker being that I would ""translate"" the titles, so that it was *clearly* a book in that language.

The problem was that I had not realised yet it was highly unlikely to be a one-to-one translation haha. I can still picture my teacher asking me to repeat the name, in total confusion lol.","lq823zv"
"lq8jeh4","Ben_Kenobi_","2024-10-04 01:53:41 UTC","Also, to teachers when I was much older.","lq823zv"
"lq8uh7f","BJntheRV","2024-10-04 03:06:46 UTC","I regularly did this in school. I've always lived to read and always hated being told what to read.","lq823zv"
"lqbik8v","filthy_harold","2024-10-04 16:07:15 UTC","In pre-school at 5 years old, I was somewhat able to read. I could do really basic picture books and some text in computer games but hadn't mastered novels yet just because there were so many words and it overwhelmed my little ADHD brain. Another kid was already reading novels and I was intensely jealous so I lied about how good I could read. I would spend recess skimming through my Magic Tree House Kids book and pretending like I was reading. I'd just skip over a sentence if I couldn't get through it. I was technically reading a book but not really just to impress the pre-kindergarten teachers. Pretending to read actually helped me practice and I was eventually actually finishing the books quickly.","lq823zv"
"lq898sc","Party_Middle_8604","2024-10-04 00:50:20 UTC","Lol I did carry around Brothers Karamazov in seventh grade. If someone had asked me I would have said yes, I guess.","lq80ue7"
"lq8i8es","r0botdevil","2024-10-04 01:46:31 UTC","Some people are just really insecure.","lq80ue7"
"lqc5cft","DickDastardly404","2024-10-04 18:08:34 UTC","Do you really not understand? 

When you're young, looking mature, well read, more intelligent, interesting, or cool feels important. 

People lie because it makes them look better to know about stuff. 

Teenagers are not socially intelligent, and it can be a lot easier to lie than to feel left out. 

I would also agree with you, not lying is the best option, but we can be empathetic about it.","lq80ue7"
"lq8clj5","Optimal-Ad-7074","2024-10-04 01:10:57 UTC","🤣  give that man tenure.  ","lq85cql"
"lq8io27","madcapAK","2024-10-04 01:49:10 UTC","I keep copies of Ulysses, Infinite Jest, and Gravity’s Rainbow together on my shelves because I feel like they would be buddies","lq85cql"
"lq8e8xe","Junior-Air-6807","2024-10-04 01:21:16 UTC","“No body has read this very popular book that’s really fun to read”","lq85cql"
"lq8zh4a","hurtsmeplenty","2024-10-04 03:42:08 UTC","To me it sounds like op may be a bit of a people pleaser surrounded by tactless assholes. I think it's a bit weird for friends to be so pushy on reading a specific book, I love listening to my friends rant about books they read, even if they aren't my genre or author.","lq85beh"
"lq82kbg","Whimsy_and_Spite","2024-10-04 00:09:09 UTC","I wonder which actual book is the one the most people have started and never managed to finish, and why is it Ulysses?","lq8199z"
"lq8cckv","sadworldmadworld","2024-10-04 01:09:24 UTC","My Paradise Lost professor wanted to do a book club with our class over COVID to finally get himself to read Ulysses.

Nobody succeeded.","lq8199z"
"lq81no2","nrith","2024-10-04 00:03:33 UTC","It’s good, though.","lq8199z"
"lqb233b","helvetin","2024-10-04 14:38:57 UTC","i actually enjoyed some of it, but the final chapter made it _absolutely_ worth it. one of my favorite endings to any book i have read.","lq8199z"
"lq8d8uw","ohslapmesillysidney","2024-10-04 01:14:59 UTC","“OH, but you have to keep reading! It gets better!”

*eyes roll into back of head*","lq83ffj"
"lq89exr","Party_Middle_8604","2024-10-04 00:51:24 UTC","What’s the story, Wishbone?! 🤣","lq83i2o"
"lq8didv","sadworldmadworld","2024-10-04 01:16:39 UTC","I really need some stats on what percentage of their books most English majors read. Presumably we all aspire to read all of them or we wouldn't be majoring in it, but realistically...well. My percentage is not very high.","lq84u31"
"lq8gf2x","AnAbsoluteMonster","2024-10-04 01:35:03 UTC","I also did all the reading, and would meet with professors during office hours to get more book recs. Safe to say I was the student all the others hated, but I just love reading so much and at the time I was fast af at it. I also loved writing essays. Based on this thread, I was a little freak.","lq84u31"
"lq8cb50","Loud-Persimmon-7961","2024-10-04 01:09:09 UTC","I was thinking about how I wouldn't lie about reading. But you've reminded me I definitely have.","lq81qef"
"lq880ef","makaay786","2024-10-04 00:42:49 UTC","Yes, and even when we pass you, we know. 😔","lq81qef"
"lq93we2","theAgamer11","2024-10-04 04:17:24 UTC","I technically didn't lie except by omission, but it turns out reading the first few chapters and one chapter in the middle of a book is sometimes all you need to get full points on a high school book report.","lq81qef"
"lq8ab4e","Party_Middle_8604","2024-10-04 00:56:53 UTC","Yeah. This is something that maybe an English major or someone in publishing would do and worry about.","lq875o6"
"lq9yfwg","atheista","2024-10-04 09:45:34 UTC","I have ADHD and I can love a book to bits but 3 days later barely be able to tell you anything more than the vaguest overarching plot points.  The same thing happens with movies.  It amazes me when people can quote from books and remember intricate details.  If you grilled me on the books on my bookshelf you'd think I'd never read a single one.","lq86fuh"
"lqbqb1f","Comprehensive-Fun47","2024-10-04 16:48:37 UTC","It's usually projection. There are probably books she pretends to have read and wanted to catch you in the same lie.","lq819cu"
"lqbfl0c","buttsharkman","2024-10-04 15:51:34 UTC","There must have been a lot of  padding if it took you that long to realize that","lq90n8x"
"lqdv1ed","Finger_Trapz","2024-10-05 00:10:37 UTC","That's what 13 years without Winds of Winter does to a community. Seriously you can watch their descent into insanity in real time. Out of any book series I've ever known, ASOIAF by far has the most dedicated community to fan theories. Its all they have left, speculation and overanalysis of what already is published.","lq82t7t"
"lq820ym","Handyandy58","2024-10-04 00:05:50 UTC","Why did you pursue an English degree if you didn't want to read the material?","lq81gik"
"lq8gwy7","Sweetartums","2024-10-04 01:38:17 UTC","You should look into audio books since thats what a lot of people do nowadays","lq84tv2"
"lq8bgn3","Emotional-Hair-1607","2024-10-04 01:04:01 UTC","I remember a summer of just reading thick hundred page books like that. Crime and Punishment, Moby Dick, War and Peace and every Dickens novel.  I read from breakfast to well after dinner because I was too young for a summer job and we were too poor for summer camps.  I've never had such a great slice of time to spend on nothing but reading since.","lq85gdg"
"lq8j55a","bianca_bianca","2024-10-04 01:52:06 UTC","Not even this sentence?

>Hold to the now, the here, through which all future plunges to the past.","lq8eikn"
