"comment_id","user","time","message","parent_id"
"lq91bjt","Key-Wallaby-9276","2024-10-04 03:56:20 UTC","When I was 4 i randomly picked up my older sisters easy chapter book and read the whole thing that day. My mom thought I was just playing around and didn’t question it. But when my dad got home I told him I had read the whole thing. He did not believe me at all. He questioned my mom on it and afterwards he sat down and asked me comprehension questions regarding the book. I aced it. My second chapter book was the magicians nephew by cs Lewis. My dad also asked comprehension questions on that. But after that he always believed me",""
"lq91fho","irelandiscrazy","2024-10-04 03:57:12 UTC","All the time. I even did this to my friend. He sent me a manuscript and wanted me to read over it and make sure everything sounded alright. I said it was great. I didn't even open it.",""
"lq93ytw","Tonkarz","2024-10-04 04:17:58 UTC","I don’t mean to presume, but these sound like ADHD symptoms.",""
"lq94jm9","Magneticthought","2024-10-04 04:22:53 UTC","Oh yeah I relate - I forget books. Like some of my most favorite, treasured books that I’ve read multiple times. Nope, still can’t remember. My husband, when we first met, asked me my favorite book and he immediately read it to impress me. But as soon as he wanted to sit and talk about it, I was blown away by my own inability to recall basic stuff. He’s become very familiar with my short memory span lmao. Doesn’t mean that i am not thoroughly enjoying it as Im reading!",""
"lq956j0","_Molotovsky","2024-10-04 04:28:20 UTC","Infinite Jest is, in my opinion, the number one ""oh yeah, I've definitely read that..."" book.",""
"lq9734v","Meow_101","2024-10-04 04:45:03 UTC","Lol. Yes, so many times, and wrote argumentative papers on it. 

But yeah, I usually don't lie because no one ever asks me about my books. If you want to make them drop it, just go on and on about how they have to read this new *insert smut book* and throw in some wild dirty details. They either will be funny about it or be freaked out.",""
"lq97lf1","Bonjour19","2024-10-04 04:49:37 UTC","I accidentally did this recently. Someone asked me if I'd read a book and I was like ""yes!"" then when they started enthusiastically talking about plot points I realised I had been thinking of a different book entirely... But they were SO pleased to talk about it with me that I felt too awkward to confess so I figured I'd just blag it and read it asap so it wasn't a lie... But then the book turned out to be a 600+ page sci fi epic that sounds ABSOLUTELY BATSHIT so I was both very unconvincing in my lying to the point of raising suspicion and absolutely haven't managed to read it yet. A double fail. Honesty would have been the better policy.",""
"lq987ud","Good0nPaper","2024-10-04 04:55:17 UTC","Back in school, there were two books we were required to read.

*Stranger in a Steange Land,* and *Catcher in the Rye.*

As a scifi lover, I really, REALLY tried with *Stranger.* But it was just. So. Fucking. DULL!

eventually, I would just read a paragraph, skip a few pages, read a paragraph, etc. I got an 85% when I filled out thr questionaire.

For *Catcher,* we had some options for our project, from writing a report, to mapping Holden's trip theough New York, to filming a trailer.

I took my camcorder, saw some guy hanging out on a frozen lake, filmed him being introspective for about ten minutes. Never saw his face, ao no privacy issues. Then, one shot of me from behind, since I had a similar jacket.

Cut together some shots of him with Linkin Oark's ""Breaking The Habit,"" and I got an A- on it; probably helped that I was the only one who filmed a trailer.

The best part?

I didn't read a single word of that book. Not a fucking word.",""
"lq98uzo","Aggressive-Foot1960","2024-10-04 05:01:10 UTC","I’ve been an avid reader since childhood and I was always above my reading level in school. So once I went through most of the children’s books in the library, I started reading classic literature. I was 11 years old when I read Pride and Prejudice for the very first time and it opened my eyes to a whole new world of reading, I was obsessed. 

On my first day of school that same year, my teacher wanted to have all of us get to know each other better by doing an exercise where we took turns saying our Name,Favorite color,favorite food, favorite movie, favorite book and such. When it came to my turn I answered that my favorite book was Pride and Prejudice. My teacher raised her eyebrow and said “hmm…are you sure you’ve actually read that and you’re not getting it confused with another book?”
I said “Yes Mam, I’m sure. I just read it for the first time a few months ago.”

She then proceeded to quiz me on the book and I answered her questions the best to my ability and she STILL didn’t believe I read it. She kept saying things like “Now, you know if you watched the movie on BBC it doesn’t count as reading it right? Did your mom tell you about it maybe after she read it?”

I eventually just gave up trying to convince her, but she eventually did ask my parents at a parent/teacher conference how much did I read at home to which my parents replied “we’re so proud of her reading comprehension and love for books, she’s took an interest in classic literature and loves to talk to us about it!” My parents said she acted stunned when they said that lol.",""
"lq9dzdx","dickbutt_md","2024-10-04 05:51:10 UTC","If they recommend a book and get pushy about it, just say, oh, you know what I have read? And then name another book and ask them if they read that. If they have, then talk about that book. If they haven't, then tell them about it and recommend they read it.",""
"lq9h9hn","Realistic_Minimum196","2024-10-04 06:25:35 UTC","In school maybe. But as an adult no.  No need to lie about having read a book.  Geez",""
"lq9hch7","arkhamius","2024-10-04 06:26:28 UTC","Sure, at achool",""
"lq9imue","Alcarinque88","2024-10-04 06:40:28 UTC","In high school I couldn't decide which book to do a report on, I was reading so many. I procrastinated so much that I lied about reading LOTR of all things. I did eventually read the entire trilogy later that year, but I had only read enough to do a book report on it and some weird coat hanger mobile with some dangly pictures. I knew enough that was different between the book and the movie that I passed the book report. I think my teacher may have given me the pass because she knew I would have read the book if I wasn't so busy reading a bunch of others, and that I would eventually read them.",""
"lq9iudz","AwkwardYoinker","2024-10-04 06:42:45 UTC","lied once: a stephen king book. fairy tale? i lost interest a couple chapters in but didnt want to hurt any feelings as my coworker loved it and wanted to talk about it.

one time my english prof said that i hadnt read the book i was assigned for my lit crit essay because i only chose to have my criticism applied to one character. (joy luck club)",""
"lq9j0i7","deltalitprof","2024-10-04 06:44:36 UTC","It starts with saying you read Moby Dick when you haven't. Then it progresses to transforming into the people you're around.  Pretty soon you're piloting a plane upside down across the Atlantic.",""
"lq9jbsf","StoicSpork","2024-10-04 06:47:58 UTC","A friend sent me a manuscript of her fantasy novel. It was unreadable.


I responded that I read it and thought she had talent, but I was not the target audience and couldn't say anything informed about it.


This was a mistake. She ended up getting some cold rejection letters and learned her friends (because I was not the only one who took the easy way out) are all lying shits.",""
"lq9mbkx","alteredxenon","2024-10-04 07:21:46 UTC","Yeah, at oral exam in Soviet high school I very convincingly lied about having read War and Peace.",""
"lq9mvq1","chasemedallion","2024-10-04 07:28:18 UTC","One way to gently deflect/filter down recommendations is to ask the recommender to personalize it by telling you why they think _you specifically_ would enjoy it (eg “seems different than what I normally go for; was there something specific about this that made you think I would like it?”).

Good recommendations should be personalized anyway, but in practice some people tend to recommend whatever they enjoy without much consideration of others’ tastes.",""
"lq9mxpk","Comradeswoops","2024-10-04 07:28:56 UTC","Many, many times. For varying reasons. I already knew plenty of the book plot from watching the film adaptation or I just wanted to seem intelligent.",""
"lq9oax5","wahajama","2024-10-04 07:45:00 UTC","No, I haven’t. For you own sake - tell them to bugger off if they are this pushy. They have no right to bully you into doing things you don’t want, but unfortunately some people just don’t get it unless you are extremely firm with them. Stand up for yourself, you don’t have to do what they want, they do not get to decide what you do with your life. These people are so damn annoying, had a co-worker just like this.",""
"lq9oqw6","imdfantom","2024-10-04 07:50:12 UTC","Not as far as I know.

I may have done so unwittingly.",""
"lq9ots7","emoduke101","2024-10-04 07:51:07 UTC","So far, not had the displeasure to do that. but if someone recommends me to read a book I've zero interest in, the best way about it is to deflect with ""I'll consider"" (which we all know means otherwise!), then shift subject",""
"lq9sk3s","GiraffeAnd3quarters","2024-10-04 08:35:50 UTC","I've never claimed to have read a book that I didn't at least open and flip through.",""
"lq9tccs","alpine068","2024-10-04 08:45:20 UTC","I strongly believe that everyone has lied at least about 1 book. Just the same for movies.",""
"lq9uz9q","iDontLikeThat86","2024-10-04 09:04:57 UTC","Slightly unrelated but I read very very quickly so when I was a child I was constantly accused of not reading/not reading properly by both parents and all my primary school teachers and getting quizzed on the content of a book was something that happened quite a lot lol",""
"lq9xbf2","dionysoursugar","2024-10-04 09:32:32 UTC","Nah cause who cares",""
"lq9y3mi","medeski101","2024-10-04 09:41:42 UTC","I have not. As I find lying detrimental to social relationships. At some point I my have a lied about it to a school teacher.",""
"lq9yj41","losethemap","2024-10-04 09:46:34 UTC","I often forget details from books I’ve read. I’ve had people at my house accuse me of not reading my books and just having them “for display”.

They don’t know that’s because I am obsessive with keeping my books pristine and don’t crack the spine, and take care not to wear and tear while reading. I also have almost everything I own in hardcover with a jacket, so you can’t see the spine even if it’s cracked.",""
"lqa0y6d","NedvinHill","2024-10-04 10:13:06 UTC","My grandmother loves a swedish musical, I love the books. I have yet to see the musical, I might when I have read the last book in the series. She thinks the way she remembers the musical is Canon. Whenever we meet she tries to bond over this mutual interest we have, but she is also interrogating me on details as if to catch me lying about having read the books. It’s very weird, gatekeeping grandma? Let us just enjoy our experiences as they are, individually",""
"lqa2dfc","N4t3ski","2024-10-04 10:27:59 UTC","Just remembering that ozzyman episode with the dogs yapping through the gate at each other until it opens. 

""Have you even read the Quran!?""",""
"lqa2y85","Devi_Moonbeam","2024-10-04 10:33:52 UTC","Yes when I was in junior highor possibly slightly younger, I told my grandfather I had read War and Peace. Because I had. He refused to believe me and made fun of me, basically calling me a liar. I don't know why he found this so amazing, because I read constantly and I read all kinds of things.

I'm now older than he was at the time this happened, and I have never forgotten this disrespect.",""
"lqa6u6q","justcallmeani","2024-10-04 11:10:45 UTC","i think we have no obligation in point of fully remembering a book that we did read. That would be a heavy burden to carry. Whole point is just get enjoyed, gain a different vision that's become totally different perspective, learn to see the whole colors which is we didn't think there could be until we see it. A book is a spotlight that will help you to extend your field of view. 

Eventually all the books we did read has a effect on us weather we noticed or not. 

I suggest you that don't let that turn into an obligation. Be free.",""
"lqa7f9y","Hare_Eric","2024-10-04 11:15:56 UTC","lie or not is all fine ,if they accuse u",""
"lqa9dhc","StoicComeLately","2024-10-04 11:32:19 UTC","No I haven't. But everybody's different. I actually have book covers of different sizes because it's nobody's business what I'm reading. If someone recommended I read a book that I didn't wan to read, I would just say thanks for the rec, and if they pushed I would be direct and say I'm probably not going to read it, not my thing, etc.

You don't owe anyone a read of a book they suggested. It's hours of your time. I read Pride and Prejudice too and I can't remember who George Wickham is either? Is he the milk-toast guy the sister was supposed to marry?  It's ok to say, ""Geez, it's been a while and that book was hella boring. I don't remember that character well.""

Watch this:  
While I read literature and more elevated books once in a while, mostly I read horror and smut. Do you think that's lowest-common denominator reading? That's fine, you're probably right, but I work hard and like to give my brain a rest and enjoy something light and fun. It's cool if that's not for you. I don't read to impress anyone.",""
"lqaa0u5","AnonymousCoward261","2024-10-04 11:37:37 UTC","When I was a kid, I dropped a quote from Machiavelli in 9th grade history class. Impressed the heck out of my teacher.

But I hadn’t read Machiavelli at the time. I had read *The Machiavelli Interface*, an 80s sci-fi novel that opened with a quote from it.

I later read *The Prince* in college.",""
"lqaakbq","effugium1","2024-10-04 11:41:58 UTC","Certainly. As a kid I lied about having read books in order to get a personal pan pizza from Pizza Hut through the Book-it program. I did read most of the ones I got credit for, but if I got halfway through a boring book and didn’t want to finish it, I just lied. 😆",""
"lqaf9u4","NakedFairyGodboy","2024-10-04 12:17:44 UTC","Funniest was when I told my coworker excitedly I had published my first book. 


Coworker: ""Have you read it?""
Me: *confused* ""...I wrote it?""
Coworker: ""But have you read it?""",""
"lqag0so","TheShadyGuy","2024-10-04 12:23:07 UTC","Yeah, I have lied about reading books, I went to college.",""
"lqagfyf","Hattapueh","2024-10-04 12:26:11 UTC","At least I have met many people who claimed to have read classics but obviously never did. 
Fuck off Yvonne, you didn't read all of Shakespeare by the age of 7.",""
"lqai280","KaylaBlues728","2024-10-04 12:37:39 UTC","Harry Potter... all of them. 

Yeah I know it's a hot take or something but I'm just not a fan but all my avid reader book lover friends are so...yea.

Tho, i did read the first book. I didn't completely not read the series.",""
"lqaivbc","Dave80","2024-10-04 12:43:10 UTC","I haven't lied, I've definitely read 1984. I know that sometimes they're at war with Erasure but then they'll change it and be at war with the Pet Shop Boys and Erasure will be their allies.",""
"lqajarg","marcorr","2024-10-04 12:46:01 UTC","I've definitely lied about reading a book before, usually just to avoid the whole awkward ""you have to read this"" conversation.",""
"lqajciq","simplymeliz","2024-10-04 12:46:20 UTC","My answer to the topic is no and no, but I'm a dragon reader.  Don't ever feel pressures to admit reading something you haven't.   I'm pretty sure there are books and genres that all of us on this thread haven't read.  We all have different tastes.  Also, not everyone likes to read.  Nothing wrong with that.  I'm an avid reader, the rest of my family isn't.  If we've read the same books (aka Bridgerton series - which I read years ago) I'm usually in shock they even know they exist.",""
"lqajfol","SD_Gavarron","2024-10-04 12:46:55 UTC","People that know me always say something like ""Oh Steve has read so many books!"" and then someone will always come asking: ""Have you read this? or that?""  
Books aren't a list of ""20 things to do"".  
There are billions. And though Brandon Sanderson may be a trend (or your trend), I might be reading ""The importance of F\\*ck you"" at this time. Or just not like Sanderson's writing style.

Don't lie. You are justified either way",""
"lqak7w8","Chance_Novel_9133","2024-10-04 12:52:06 UTC","Not quite on topic, but I actively participated in a discussion in college on a book I hadn't read and had the professor thank me for my insightful comments. It's my proudest moment of academic bullsh#ttery.",""
"lqal9bm","Lupus600","2024-10-04 12:58:51 UTC","I think ppl will figure out whether I'm lying because I'm a terrible liar so I just don't lie that much in general. Plus, it's books. Nobody's read all of them so what's the matter if there are some books that I haven't read?",""
"lqam2yc","ohfrackthis","2024-10-04 13:04:14 UTC","I've never lied and it definitely annoyed people lol. I cannot be arsed to read whatever anyone else wants me to.",""
"lqamdia","GratedParm","2024-10-04 13:06:09 UTC","I’m in any circles of other readers, so I’ve only lied about reading books for school.

Coincidentally, the one time a professor made a comment on essay as to whether or not I had read the book, I did in fact read the book. My essay was garbage, and I probably had some garbage understandings, but I did read the book (it was Native Son).",""
"lqamrpo","TheBookGem","2024-10-04 13:08:42 UTC","I did plenty back in school when it was for assignments",""
"lqan4v7","InfiniteRest7","2024-10-04 13:11:02 UTC","Only for school. I basically did the CliffNotes version and did a book report about it. Super embarrassing. I think I still got an ok grade on it. I believe it was The Good Earth by Pearl S Buck, but I didn't read it so I can't be entirely sure it was that book. 

I have found that later in life a book paired with audiobook works for me. I would often have the computer read books aloud for me or read book aloud to be able to make it through them. I don't know if it's ADHD or what, but I can focus on what's happening much better this way.",""
"lqarljs","VcuteYeti","2024-10-04 13:38:52 UTC","Maybe in high school",""
"lqaroo5","AceFireFox","2024-10-04 13:39:24 UTC","Why would you lie about reading something? If you haven't read it, you haven't read it, so what? If someone wants you to read it and you either haven't gotten to it yet or don't want to then the person just has to suck it up, calm tf down and back off. 

Also the accusations of having not read it is such bullshit. But on that, why would it matter or should you care about someone's baseless accusation. That said maybe they know you're lying about having read something so when you've actually read it they're think you're lying. Idk I feel like these are connected somehow.",""
"lqartfr","WorldGoneAway","2024-10-04 13:40:13 UTC","Only in school.

A fun example was that we ended up reading 1984 in an English class, then we had to do a book report on a dystopian novel. I picked Huxley's Brave New World. The due date came and went, and I had not even touched the book yet. So the night before the paper was due, I crafted an amazing bullshit book report that I, by some miracle, manage to get a B on. It wouldn't be for another 15 years before I actually get around to reading it.",""
"lqau399","Horriblefish","2024-10-04 13:53:40 UTC","There are too many books and too little time to spend it caring what other people think about your reading habits. I had someone recommend me a non-fiction book so I could 'be informed' on a topic. Normally it was the kind of book I wouldn't read but I figured what the heck I like this person enough to want to follow their suggestions. Powered through the book brought it up and they told me 'oh I haven't read it, was it good?""

I'll still take recommendations but I'm not going to care if someone tells me that me not reading such and such implies anything because I guarantee you they haven't read a thousand of the other 'classics' or 'must read' books",""
"lqawgly","Scared_Ad2563","2024-10-04 14:07:22 UTC","I don't have a lot of book lovers around me, but I don't bother lying. I love the horror/thriller genre, and while I don't read them exclusively, I'm just really picky about the books I read outside of it. I'm not into romance at all, historic fiction, biographies/autobiographies, I've outgrown YA for the most part, many classics just put me to sleep. Obviously, there is nothing wrong with anyone reading or enjoying those, but it's not going to be me. I just tell them I'm sure it was a great experience for them, but I am not going to have the same experience and I've no interest in cracking that novel open. They can be mad or offended, that's on them. I don't recommend books to them, either.",""
"lqayhrz","HopelesslyCursed","2024-10-04 14:18:55 UTC","I was at a house party and struck up a conversation with somebody about 1984, and some other guy walks up and goes ""what are you guys talking about?"" We were like ""uh, books"" and the guy did the slowest fade out of the room, and just before he walked out he goes ""yo, I wait for the movie, yo!"" The guy I was talking to says to me ""that was like the worst thing he could've said. He should have just said 'cool!' and left, but now we both think he's an idiot.""",""
"lqayy43","aberrantname","2024-10-04 14:21:28 UTC","When I was in primary school we had a competition on who read the most books. I took Three bears and a guitar from the library and tried reading it, but for some reason found it too difficult. I couldn't connect the sentences with one another, none of it made sense to me and I remember thinking ""this is some advanced reading"". It was not. Still, I reported to my teacher that I read it and when she asked me some questions about it, I had no idea what the story was about. It was humiliating. I couldn't even remember the names of the bears.",""
"lqb0oxm","Wisdomlost","2024-10-04 14:31:12 UTC","We got offered like 7 different books in a class back when I was in school. I really wanted to read this one book and the teacher said I had to read a different one. I didn't read the assigned book and instead just leeched off the group for a passing grade because I was stubborn about not having been allowed to read the book I wanted to. I never ended up reading the book I wanted to on my own though so really I was just an ass for no reason lol.",""
"lqb10ad","zacholibre","2024-10-04 14:32:59 UTC","I’ve never lied about reading a book, but I have been accused of it. I used to have a Goodreads profile which I mainly just used to keep track of what I was reading. Didn’t use it for reviews or any of that. An acquaintance and I became friends on GR and he accused me of lying about reading Ulysses by James Joyce. I took a grad seminar that year where the entire point was to just read that one book.",""
"lqb1ijr","funkyrdaughter","2024-10-04 14:35:48 UTC","I just wouldn’t lie. It doesn’t even have to be about books. If I was being pressured then it’s just the “You know I was going to do that, but then I just carried on living my life.”",""
"lqb2nmc","cMeeber","2024-10-04 14:42:05 UTC","Yeah this super pretentious guy accused me of lying about having read books. On Facebook lol. And my mom corrected him smh. Cute but also embracing haha.

I love reading books of movies. Like if I watch a movie, like it or am interested, I see if there’s a book and then read that. So many times a movie is based off a book.

I think a made an FB status about reading the Shining. I love Kubrick films. So I read a lot of the books their based on. And this guy was like, well you should read the book that Eyes Wide Shut is based on. I was like, I have read Dream Story. And A Clockwork Orange. And Lolita. And he was like, I seriously doubt that.

What a jerk. He was always negging me for something.",""
"lqb8fa3","baseball_mickey","2024-10-04 15:13:12 UTC","Are you my English teacher?  Then no.


If not, then yes.  I would lie to my english teacher all the time when I hadn't done the reading.  Now?  Why.


I also forget details of books.  In March 2020, a friend wanted to start a book club.  Her first pick was The Amber Room.  I'm reading it and thinking it sounds very familiar.  I went to my Apple Books, an app I hadn't used in a long time, and saw I had it in my library.  I had already read it.


Since then, I've kept better track of my reading (google sheet, goodreads, storygraph), and also kept notes & highlighted books as I read them.",""
"lqb98cg","adorablenightmare89","2024-10-04 15:17:34 UTC","Being pushy and insisting I have to read a book will   make me want to read it less. But no, I have never lied about reading  a book.",""
"lqb9rlo","Fweenci","2024-10-04 15:20:27 UTC","Don't reward pushy people. Thank them for the recommendation. That's it. That's all that's required. If they push, change the subject. If you're feeling friendly, you could just say you probably won't read it so they can talk about it freely without fear of spoiling it for you. Sometimes I really just want to talk about a book I read without having someone else's rating system hijack my excitement. (""Oh, I gave that 3 stars."" Who cares.) My friends who read different genres or who don't read fiction are great listeners when I'm excited about a book.",""
