"comment_id","user","time","message","parent_id"
"lq88uog","Minecart_Rider","2024-10-04 00:47:55 UTC","No to both.

Even if I wanted to lie, I'm such a bad liar my face turns red and I tear up lol, which is probably also why I've never been questioned on if I've actually read a book despite also having a terrible memory. I had a novel study in high school where my teacher did private verbal interviews about our books the day we finished them and I forgot the main characters name throughout the whole interview!

Who are these people who are being so pushy with you? If you keep lying you are going to get caught(if they haven't already picked up on it, which might be why they question you about books you have read). If you aren't interested in that book, haven't gotten around to it, etc just tell them that. You can tell them it's not for you, or you will check it out later. I've never met anyone so pushy that they wont drop it after saying those lines, and I've met a lot of people who recommend books that I'm super not into, included someone who saw me reading a book on the history of Barbie fashion and thought I'd love the ""enemies to lovers wizard romance"" she'd just finished lmao",""
"lq88xqd","P_Grammicus","2024-10-04 00:48:27 UTC","Fitzwilliam Darcy 

Yeah, I have a couple of times, if I recall correctly.  Certainly once for a particular English class. 

As a bookseller I have done the “uh huh, uh huh” a few times when a customer is waxing enthusiastic about the ninetieth book in some series or other when I’ve only read half of them.",""
"lq88zc5","PopeJohnPeel","2024-10-04 00:48:43 UTC","In high school I was experiencing a lot of executive dysfunction (untreated ADHD) and thus lied my ass off through the entire Catcher in the Rye unit. Eventually it got to a point where I thought to myself ""Damn, this book seems really cool."" I ended up actually reading it over winter break after the unit on it had wrapped up. I've read it every winter since. I have a tattoo of Holden's hat. I found in it a lot of comfort and validation and a cautionary tale as well given how mentally ill I was at that point in my life. 

After all that I never lied about reading a book again. Also, Darcy's first name is Fitzwilliam!",""
"lq89gdu","Odoyl-Rules","2024-10-04 00:51:38 UTC","I did a whole ass book report on The Hobbit in fourth grade. My teacher assigned it to me as a special assignment, because I was ""such a good reader that was up for the challenge!""

I hated it. HATED IT! Turns out I have aphantasia and fantasy is a genre that just doesn't work for me, but I didn't know that when I was 10. 

I didn't want to let him down, so I did the best I could having read only three or four pages. I thought I did well! Then my teacher asked, ""Well, what about the dragon??""

Caught completely off guard, I answered, ""Uh, I didn't think that was a very important part of the story.""

Needless to say, I was busted.",""
"lq89mbi","elbilos","2024-10-04 00:52:39 UTC","In highschool, once. I don't think I've ever needed to lie about reading a specific book, besides then.  
Never got around to reading Macbeth. I did read Romeo and Juliet, and Hamlet, though.",""
"lq89ui5","RediscoveryOfMan","2024-10-04 00:54:03 UTC","No, I’ve never done this. Reading is my own hobby that I derive value from independently from everyone around me. If someone was pushy about me absolutely needing to read something, and then got offended after I say “I won’t get to it”, then I will do nothing and wait a few years for them to become more mature…",""
"lq89wfd","Gancuta","2024-10-04 00:54:23 UTC","Yup. Back in my high-school days. It was a school assignment, but my teacher figured out that i was lying. She made me read to book overnight in order to avoid a bad grade. Sufficient to say, I've learned my lesson.",""
"lq8apw7","MadOvid","2024-10-04 00:59:24 UTC","Leviathan by Thomas Hobbes for a liberal studies course. And it's not that I didn't read it. I just didn't read all the parts the teacher wanted me to read. Because it's a super important book that's also super tedious to read.",""
"lq8axs3","somastars","2024-10-04 01:00:44 UTC","I was accused of not reading many books. Back when I was a childless young adult, I read like 75 books in a year, and posted that I’d done so as an end of year wrap up on FB. A classmate in library school, who had friended me on FB, called bullshit and demanded to know all the titles I’d read. Thankfully I track my reading in LibraryThing and tag books by year read, so I was able to back my claims up.",""
"lq8baf9","Obwyn","2024-10-04 01:02:56 UTC","Yea, I lied about reading Silas Marner.  I just read the Cliff's Notes and wrote my papers based purely on that.

  
I've never been accused of not reading a book that I said I read.",""
"lq8brw6","KHanson25","2024-10-04 01:05:50 UTC","… I read most of The Sun Also Rises

But I just stopped caring. ",""
"lq8by8p","iballguy","2024-10-04 01:06:54 UTC","I exclusively do audio books now, and when people ask me if I read something I listened to, I feel self-conscious enough to say "" I listened to the audio book."" Instead of just saying yes I read that.",""
"lq8c6gn","euphoriapotion","2024-10-04 01:08:20 UTC","yes, back when I was still attending school years ago, when the teacher asked us if we read assigned book, I've always said yes lmaoo... Not that they believed me, considering we had to take mini test about each book. Those were the times.

I don't really lie about reading a book. Perhaps once or twice to my mom when she was really pushy (but you know what moms are like lmao, sometimes they can't take no for an answer). When it comes to online spaces I don't feel the need to lie - if someone is particularly pushy, a block button exoists for a reason.

When it comes to Pride and PRejudice it's one of my favourite books, but tbh I haven't read it in years, I mostly remember what happened in the 2005 movie. I have to re-read it lmao. (Fitzwilliam Darcy is the best though)",""
"lq8ce2w","Optimal-Ad-7074","2024-10-04 01:09:40 UTC","only in the sense that i speed-read many of my English college assignments and then wrote (probably transparently bullshit) exam answers on them.   I actually read the French ones, for some reason.   


I don't know any pushy fellow readers,  and I read so much without pushing from anyone, that I'm pretty confident in my ""I read what I read, so back off"".   both of those things are a help.  ",""
"lq8cnme","WeeTater","2024-10-04 01:11:18 UTC","Only once. I was talking about books with a guy on a dating app and I said my favorite book is Abraham Lincoln Vampire Hunter and he said that was a movie. I said it was made into a movie but it was a book first. He called me a liar, then began this huge tirade insulting everything from my eyebrows to my parents and then blocked me.",""
"lq8d1c8","johjo_has_opinions","2024-10-04 01:13:41 UTC","I am a terrible liar so I don’t typically try, and I have a bad memory so I’m more likely to say I haven’t read something when I have!

No one has accused me of lying that I can remember, but that’s probably because I give off both big nerd energy and mean energy 🤷",""
"lq8d280","Readsumthing","2024-10-04 01:13:49 UTC","No, but I remember back in the day, some pundit calling Bill Clinton a liar for saying one of his favorite books was The Last of the Mohicans. He said that *”no one could read that book!”*

Dude was a Rhodes Scholar ffs. I only have a high school diploma and I read that book! The language is super old fashioned, but if you can read Pride and Prejudice, you can get your head around the early American vernacular. It’s a great book and very different from any of the movies.",""
"lq8dd2p","Big_Shirt_7760","2024-10-04 01:15:44 UTC","When someone recommends a book I say I will add it to my TBR pile. If they ask me if have I have read it o just say I haven’t gotten to it. People are pushy and I totally get you don’t want to disappoint them.",""
"lq8dhi3","cloudsongs_","2024-10-04 01:16:29 UTC","I have not but I had a friend who described The Handmaid’s Tale to another friend and she straight up lied about something in the book (I was reading the book at this time) and I was so surprised. It was such a shocking lie too which was unnecessary given how shocking the actual book is",""
"lq8dked","UsernamesAre4Nerds","2024-10-04 01:17:00 UTC","Only once, for a book report, and they were spot on. This was before I was confident to make a report saying ""you know what? I didn't finish the book, it sucked, but I gave it a fair shot.""",""
"lq8dpg0","gnostic_heaven","2024-10-04 01:17:53 UTC","Hahaha I haven't done that with books, but have done it with movies for that reason. My husband loves 80s and 90s movies and early 2000s romance movies and for a long time if he asked if I saw one I was purposefully avoiding (e.g. The Notebook) I'd just be like, ""yeah, I think I saw that one"" and offer up a key plot detail or something. I'm often not entirely ignorant of the movie, and have a lot of pop culture knowledge, I just don't want to be the captive audience of the TV and my husband while I watch something I managed to avoid the first time around lol. 

With books, I find that it's difficult to turn down fantasy/sci fi/YA recs without offending the recommender. I had a friend who was super into fantasy -- like Ursula K LeGuin and NK Jemisin -- who are good writers!! but I personally just canNOT get into the genre, absolutely no offense to anyone who likes it, but it puts me to sleep. I think she was lowkey so offended that I didn't share her tastes, and she would even accuse me of being ""insecure about my intelligence"" because I preferred literary fiction. I don't see it as an intelligence thing (am not about to call the two above mentioned authors unintelligent) but I just really love lit fic, I love realism, and I like magical realism/surrealism/experimental fiction when it veers outside the realms of normality. 

As for your other point, I had another friend (another fan of sci fi/fantasy - this one liked Heinlein and Philip K Dick, William Gibson, and Anne Rice) make a snide comment on the fact that I was reading Anna Karenina when we were in 10th grade. She was like, ""I heard that book was even more boring in the original Russian"" and I think it might have been a jab to suggest that I wasn't really reading it. I definitely read it and enjoyed it. Felt like I was expected to defend myself or something but all I said was ""Really? I think it's good."" (Although I definitely also couldn't have told you the ins and outs of the political subplot in Levin's sections.) Whatever, you're not reading things to prove yourself to other people. It's just reading, you're not even out *doing* anything; you don't have anything to answer for lol. Who cares what they think.",""
"lq8drtb","buzzfrightyears","2024-10-04 01:18:18 UTC","Yes. Nostromo by Joseph Conrad. I passed my A level with an extraordinary amount of bs and still get that sinking feeling thinking about it",""
"lq8e7pp","OldTiredAnnoyed","2024-10-04 01:21:04 UTC","All the time in HS because I hated Shakespeare (still do, wordy prick) so I just read the cliff notes & faked it.",""
"lq8edow","katea805","2024-10-04 01:22:08 UTC","If someone asked me what I thought of anything in Pride and Prejudice I would say “I have no thoughts except how much I hated the writing style”. I am not a fan of classic literature (for the most part). I don’t remember jack from that book. Not because I didn’t read it, but because I didn’t enjoy it.",""
"lq8eikn","Drusgar","2024-10-04 01:22:56 UTC","Since I didn't understand a single sentence in the first 30 or so pages of James Joyce's ""Ulysses,"" I suppose I've kind of read the book, given that I'm unlikely to understand a single sentence in the next 500 pages, either.

You can just save yourself the trouble and just read the cover, which is perfectly fine literature.",""
"lq8f40l","doctorbonkers","2024-10-04 01:26:41 UTC","I lied about reading How to Read Literature Like a Professor for my AP Literature class… but outside of the very few books I was supposed to read for school and didn’t (The Fellowship of the Ring, and I never completely finished Frankenstein) I don’t think so!

Side note, I’m a huge fantasy fan (I actually almost exclusively read fantasy these days) but having to read LOTR at age 12 killed my interest in it. Who decided The Fellowship of the Ring was good for 6th graders?? Way too dense for me at the time",""
"lq8fxgu","r0botdevil","2024-10-04 01:31:56 UTC","Never lied about reading a book, and never been accused of not reading a book, but I did once kinda embarrass myself by making a reference to a book I hadn't read.

Made a reference to The Picture of Dorian Grey in conversation with my ex back when we were dating, and she said ""Oh that's one of my favorite books, when did you read it?"" I had to sheepishly admit that I *hadn't* actually read it. Went and bought a copy, read it, loved it.",""
"lq8hrd0","littleblackcat","2024-10-04 01:43:45 UTC","Only to teachers when the book was boring, and I spark notes it so I could finish the assignment and keep reading the books I actually wanted to read.  
""You must read this book"" - ""No, this one's not for me""

or just ""no"". Who cares if you offend them. Are you all academics or writers? (I mean academics or writers aren't like this)",""
"lq8hrzi","raccoonsaff","2024-10-04 01:43:51 UTC","I've never lied about reading a book, I'd feel too guilty I think! But I have been accused of not reading 'properly' or skim reading books, like if I hadn't remembered a certain detail etc? I'm sorry I have a bad memory!!",""
"lq8hy15","PublicCraft3114","2024-10-04 01:44:49 UTC","Yes in high-school. Wuthering Heights. It was an English set work book. I tried a few chapters, found it incredibly dull and read a study guide about it instead. As it was a good study guide I got an A in every test and nobody accused me of not reading it.

Alt:
I used to argue with fundamentalists a fair bit, they would accuse me of not having read the Bible, so I would make them look up their claims. They were wrong. I had read that book, they were just parroting their ignorant pastors.",""
"lq8i0jz","Zetech","2024-10-04 01:45:13 UTC","I’ve read Neuromancer but it confused me so much that if you asked me anything about the book my answer would sound like I never read it. 

Dunno if that’s related. Just needed it said. Godspeed",""
"lq8iceq","Gatsby520","2024-10-04 01:47:12 UTC","I was a high school English teacher. I’ve known literally hundreds of kids who lied about reading a book. I may have done it once or twice in grad school….",""
"lq8icgr","Ecstatic-Yam1970","2024-10-04 01:47:12 UTC","Before my adhd was diagnosed I'd regularly read 75% of books and call it good. Now when I go through my goodreads I'm not sure if I actually finished some of them or only mostly did. It is a bit awkward. ",""
"lq8idcn","dogecoin_pleasures","2024-10-04 01:47:21 UTC","FYI, when it comes to classics the big lie is when we say that we are ""re-reading them"" not just reading them, since we mustn't admit it's our first time lol. 

BTW I know who Wickham is, but the first name threw me too at first. The awkward truth is that imo our lack of memory is really a lack of reading comprehension because reading whole books is hard these days.",""
"lq8j05z","Tatterjacket","2024-10-04 01:51:16 UTC","I have done a humanities degree with a number of gargantuan reading lists, so although it's not my proudest moment, I have absolutely lied that I have read a book.",""
"lq8jwp7","harley4570","2024-10-04 01:56:49 UTC","I did... a gal at work was reading Mystic River....I only knew  about it from hearing her talk about it...I asked ""who do you think did it?"" She said a name,  I said,""If you had another guess, who would you pick""...She said another name, I smiled, winked, and walked away...I told another gal I had no idea who anyone was and who really did it.. Turns out Mary's second guess was correct",""
"lq8kf0w","jackspratzwife","2024-10-04 02:00:02 UTC","I’ve had people question whether I had actually read a book due to how much I actually remember what happened in it, when trying to get them to read it…",""
"lq8lszr","funkypunk69","2024-10-04 02:08:46 UTC","A few times I was able to ""cliff notes"" a book report.  I would read the synopsis on the back of the book, depending on how large the book was I would divide it into sections. I would read small sections of each division.  I always made sure to read most of the beginning and the end. 

I would try to start the book report.  If I had issue or I felt that I was being deceptive I would go try to go read some more about that character or in that area.  So sometimes I didn't really read the whole book, but I did put in a bunch of effort and conceptualized my interpretation of the story to pass the class.  

There was a lot going on in my childhood and many changes.  So emotions and stress were things in high supply in my youth.

The lesson I learned is the devil is in the details. The method that works most of the time does not work all of the time.   

That one time you may really, really need all of the details or overlook info you never considered.  A lack of perspective so to speak. 

Oh, like cherry 🍒 picking certain sentences from famous books instead of reading, understanding, and living by the principles expressed in these famous books.  Please be sure you are applying them wholly on yourself in full prior to asking someone else to bear that cloak.   In action, in voice, and in form. 

Good luck 😁

Be Well",""
"lq8nyid","kas-sol","2024-10-04 02:22:42 UTC","I don't think I've done it since book reports back in secondary school. 

I've had a few people doubt I read throgh some more dry texts because they were about topics I wasn't expected to be interested in, but that's it.",""
"lq8oqr2","Deleted","2024-10-04 02:27:57 UTC","I havent. Not both, fortunately😉.",""
"lq8plw5","foamy_da_skwirrel","2024-10-04 02:33:40 UTC","Only once... I was way into the LOTR movies and had some t shirts of it and decided I wanted to read the books, so I went to a used book store not even realizing I was wearing one of those shirts and got a boxed set of the trilogy 


The person checking me out was like oh you must be rereading these and my stomach fell as I realized I must have looked like a huge poser 


I was like oh hahaha yeah of course and stuffed my bread sticks in my bag and ran


  I mean I've read a gazillion books but an not into fantasy so getting into the movie first for that one was unusual for me lol",""
"lq8pz76","Zikoris","2024-10-04 02:36:06 UTC","I don't think I've ever had someone not believe I read a specific book, but a lot of people don't believe I read the amount of books I do. I started reading a book a day in 2021 and really liked it, so I kept going. For me it feels really normal at this point, but to other people it's a little extreme. 

I haven't lied about reading a specific book, but there have been times I've been mistaken when it was a long time ago and I actually read a book with a similar title or story.",""
"lq8qz3o","BigUptokes","2024-10-04 02:42:43 UTC","In grade school a friend asked if I had ever read *Lord of the Rings*.

My bluff was called shortly after when continuing the conversation as it turned out the book was in fact *not* about boxing.",""
"lq8rjgq","icax0r","2024-10-04 02:46:36 UTC","hah, a friend recommended a book to me which I ended up really loving, I was blabbing on about it to her some time after that talking about one specific part and she was like, ""uhh, I read it a while ago and I don't remember that part....what happened?""  Funny because I know for sure she's read it and wasn't lying about that, and also very relatable because I also tend to remember more impressions of books than specific details.  I've also read Pride and Prejudice and definitely don't remember George Wickham.   Anyway I wouldn't lie about having read a book (but can absolutely relate to doing that to get someone to just leave me alone about it) -- lately I'm more at a phase where if people are going to be mad about me not reading it, that's their problem.",""
"lq8s468","Appropriate-Duck-734","2024-10-04 02:50:33 UTC","A lotta of people don't remember characters name so that's not grounds to think someone didn't read the book. Usually in a conversation will the person not describe the character so you can remember? 'Oh, that guy...' That's what I usually do and see people doing. 


As for making up you read the book, you not harming anyone so do you. Perhaps with time you'll get more comfy saying you didn't and letting that go no matter the friends reaction. ",""
"lq8uy8h","Inevitable_Window436","2024-10-04 03:10:00 UTC","I get accused of not actually reading or enjoying the books I like. It's weird.

I like to pick from Calssic Lit because they span over all genres, and I have tremendous luck in adoring the ones I pick up- Not all but the vast majority. 

But people think I'm just trying to be snobby or ""look good. """,""
"lq8vtn9","Richard_D_Lawson","2024-10-04 03:15:56 UTC","My high school English teacher assigned us ""The Human Comedy"" by William Saroyan.

I never read it.

When the open-book test came, I read the questions, skimmed a few paragraphs in the book, and jotted down a few facile lines.

I not only got an ""A"", the teacher read some of my answers out loud to the class.

I've still never read the book.",""
"lq8w7mx","StandardBee6282","2024-10-04 03:18:44 UTC","I’ll usually either borrow the book but say I don’t know how long I’ll take to read it as I have plenty of books in my pile or no offence but it just doesn’t sound like my kind of book if that happens to be the case.
My memory is also bad, I can really enjoy a book and almost immediately forget virtually everything about it and then wonder why I bother reading at all.
In the last couple of years I’ve read two books which I’m sure I’ve read before but not a single thing in it have I remembered from last time. I quite like that bit of failing memory however as I can probably read more in the future I know I’ve enjoyed and they might seem like new to me again.",""
"lq8x6a2","AquariusRising1983","2024-10-04 03:25:46 UTC","When I was in college I sometimes lied to make myself sound more intelligent, pretending I had read a book— particularly a classic— that I hadn't.

But I'm in my 40s now and it's probably been close to 20 years since I did such a thing. Frankly, I find it silly that I ever felt the need to lie about something so petty. Now, I *have* read a lot of what are considered classics, and if I haven't, I just own up to it. 

I also have a bad memory and while I've never been accused of not having read a book, I have received some sideways glances when I can't remember important plot points or whatever. 

I have to say, to your friends or whoever is pressuring you to read these books to the point that you feel the need to lie about it, CHILL OUT! They are just books and you have a life to live! While there are books that I think everyone should be exposed to, I would never shame anyone for not reading them.",""
"lq8x8d4","Pretty_Detective6667","2024-10-04 03:26:11 UTC","Reminds me of the skit from Portlandia where they have all read everything. Someone mentions something (literally anything) and everyone at the table has already “read it.”

It’s okay if you don’t care to read certain things. Just say you don’t care. No need to lie. 

And yeah, I’ve read Pride and Prejudice like ten times so of course I know who Wickham is but he’s not the main character lol. And Darcy’s first name is Fitzwilliam. Doesn’t exactly roll off the tongue 😂",""
"lq8z8kb","Banana_rammna","2024-10-04 03:40:22 UTC","This only happens when *Finnegans Wake* comes up in my life. I’ve certainly read all the words of the novel, does that mean I understand what’s being written? I honestly don’t think I’ll ever understand what’s going on…",""
"lq8zwo4","honeybebegom","2024-10-04 03:45:23 UTC","When I was in high school, I was a short, conventionally attractive girl. A typically jaded nerd guy called me a liar when I said I had just finished reading The Dark Elf Trilogy by R.A. Salvatore.

Ohhhh he grilled me harrrrrd. He did not like that a cute girl could be interested in the same things he got bullied for. He was so smug when I couldn't tell him everything that happened in the gap of Drizzt leaving Menzoberranzan and having to fight his undead father before heading topside. Like... the mindflayers and stuff were cool but it dragged a bit for me.

That monster was 3 books in one and the highlight for me was the training academy thing and the whole one drow who assumed another's identity and even disfigured himself. Not to mention obtaining Gwenyvare. 

I sometimes wonder what would have happened if I told him I spent my weekends doing hardcore raiding in WoW with my amazing guild. I was sad and embarrassed by him at the time but I understood that hurting people tend to hurt others.",""
"lq918oh","tabs_jt","2024-10-04 03:55:42 UTC","Never read a book for school but told my teachers i did because I wanted the time to read books I enjoy (if this counts). 

I think you need better friends tbh. When I recommend a book to someone and they just say it wasn’t for them then I wouldn’t pressure them to read the book anyways. 

(And I read pride and prejudice like 10 times and saw the move more times than that and I had to think about who wickham was xD )",""
