"comment_id","user","time","message","parent_id"
"lqcsrg5","GingerIsTheBestSpice","2024-10-04 20:15:11 UTC","I enjoyed it. It's not a big literary masterpiece and it isn't meant to be. It's a good beach read. I've also read Daisy Jones & the Six and boy, if you disliked this one for quick resolutions and lack of real, detailed struggle, you'll hate that novel so much. Avoid it! Watch Fleetwood Mac behind the music instead.",""
"lqcxrzj","Silly_Somewhere1791","2024-10-04 20:43:02 UTC","It’s a combination of Rita Hayworth (abused by her father; Cuban passing as white) and Elizabeth Taylor (shrewd femme fatale who won an Oscar and married a million times). It wasn’t a brilliant book but it reads better when you know the inspirations and can fill in the gaps yourself. 

That said, it’s the same >!daughter/interviewer!< twist as Daisy Jones. ",""
"lqcxf4h","No_Confidence5235","2024-10-04 20:41:03 UTC","I think the struggle wasn't really about making it as an actor; that part came more easily to her largely because of her beauty. The struggle was more about hiding her sexual orientation and her same-sex relationship because she was a public figure during a time where LGBT people, especially celebrities, generally had to remain in the closet.",""
"lqcse22","October_13th","2024-10-04 20:13:08 UTC","She’s compared to Marilyn Monroe because of all the alterations she had to go through to become famous. So dyed blond hair, new name, seductress persona, that kind of thing. 

Her marriages & love life *were* the struggle. She is >!lesbian or bisexual!< and can’t be with the person she really loves. Her whole life is constantly choosing between her fame and her real life. She chooses fame until finally she doesn’t. 

Her most lasting marriage was to a >!gay man!< who was the only person who could really understand her predicament. But he ultimately ended up choosing differently than her if I remember correctly. He chose a more private life and less fame? I think? 

The reason she chose Monique to tell her story is because she feels immensely guilty that she’s been keeping her ex husband’s secret about >!being Monique’s dead father’s lover and being the reason he was driving when he crashed the car and died. But she had to promise not to say anything since that would have revealed all of their true identities,!< and she is trying to explain why that was such a big deal at the time. 

I think the book went viral on TikTok for the wrong reasons. People didn’t want to spoil the nature of her relationships so they sort of overemphasized the “vibes” and the movie star qualities of Evelyn Hugo but I don’t think that was really the point of the book. It was more about people struggling with their identity and trying to choose between fame and their public image vs their private life and true identity. 

It’s not the best book I’ve ever read, but I thought it was interesting!",""
"lqctpbo","Deleted","2024-10-04 20:20:23 UTC","i feel like this is unpopular opinion but the way i see it is that Evelyn Hugo is a narcissist. the book tells us about her ""struggles"" because that's what Evelyn wants us to know, that she is a victim of circumstances. but the more you get to know her story it shows that what led to her misery is mostly her own selfish choices and imo, karma as well. it's what made the book interesting for me and i liked it for that reason.",""
"lqcpjmc","bepis118","2024-10-04 19:57:28 UTC","1) I think 7 Husbands is fine for what it is and is honestly overhated- I think you were maybe expecting literary fiction or maybe a thriller/mystery when this is basically a step above a beach read, maybe upmarket book club fare. It covers Evelyn’s entire life in like 300 pages so while it does “tell” a little too much, this is necessary. It’s meant to be a lighter read with enough twists and turns to keep you interested. 

2) Evelyn is not a “Mary Sue” just because they don’t show enough of her struggling. That’s not what a Mary sue is. A Mary Sue would basically be wish fulfillment. Evelyn has plenty of flaws, she can’t openly be with Celia and they have a tumultuous relationship, her daughter passes away….its hard to see where she is a Mary Sue. She has a successful career, sure, but there would literally be no book if she didn’t, and characters are allowed to have good things happen to them.

Basically you’re going to Olive Garden and complaining that they don’t serve enchiladas.",""
"lqd2k09","lrm223","2024-10-04 21:10:01 UTC","I think this book is aggressively... Meh. It was fine, nothing amazing. Clearly a lot of other people felt differently and really love it. Good for them. But I am glad to see other people feeling comfortable enough to say they hated a book that has been so hyped up in the media. ",""
"lqcsbeg","DarthLaters","2024-10-04 20:12:43 UTC","It felt like a gay book written for straights (is Love Simon in the room with us?)… something didn’t quite click.

I agree with a few of the things you said, but enjoyed it enough anyway. Not life changing, but a decent (albeit, underwhelming) way to pass time.",""
"lqcwr5v","INeedSomeTea0618","2024-10-04 20:37:22 UTC","The part when she revealed the reason behind choosing Monique is soooooo underwhelming.",""
"lqcykrd","EducationalKnee2386","2024-10-04 20:47:29 UTC","I heard Elizabeth Taylor was pretty disappointed with 7 husbands, too.",""
"lqd2f2d","RobotIcHead","2024-10-04 21:09:12 UTC","I finished the book but was not impressed,  the conversations between a lot of the characters felt staged.  Close friends (who also work closely) never see or speak unless it was on a movie set, restaurants or something that was setup.  The journalist (Monique) felt flat despite all the other stuff that happened, she never questioned or worked to get more details, may as well have been a tape recorder.  Evelyn Hugo felt heartless to me, she used people to the point of cruelty.  There are a lot of ways a better writer would have handled the situations.  But it is a cheap throwaway book not far removed from a teen girl romance.  Honestly it felt manufactured.",""
"lqd3ix6","RocketGirl215","2024-10-04 21:15:38 UTC","I was also disappointed but did finish it, then gave it away.  

I was only a couple chapters in when I flat out said to someone that it felt like I was reading a rough draft. I haven't read any more of the author though so maybe that's just her style and it's not my thing. 

I had no investment at all in Monique as a character. I also felt like I was supposed to be super surprised and shocked at the beginning of the >!Celia!< plot as if the very idea of a relationship was some sort of bombshell, which was annoying.",""
"lqd5br4","Professional-Bee-137","2024-10-04 21:26:14 UTC","It felt like I was watching a fluffy hour long documentary about who has already had their life all over the zeitgeist. They want to skip the stuff fans already know, but they need just enough context for the new information thats being brought up.",""
"lqd63zm","TemporarilyWorried96","2024-10-04 21:30:53 UTC","Still haven’t read this book. I tend to avoid a lot of “BookTok” books because they tend to be very overhyped for me. I’ve heard from readers of color that TJR doesn’t do POC representation well and I’d rather read books about Latine characters BY Latine authors. (Also, I just don’t like TJR as a person.)",""
"lqdxiq9","undergarden","2024-10-05 00:27:15 UTC","Can't speak to the specifics here, but I'm disappointed at how many books have the formulaic title THE ADJECTIVE NOUN OF FIRST NAME LAST NAME.",""
"lqdlpgq","Immediate-War2731","2024-10-04 23:08:39 UTC","I agree I think Monique as a non character. I understood why Evelyn chose her to do the interview but I felt the twist was cheap and it was too late in the book to get a proper resolution.  Monique had no character development throughout the story. I wished Monique’s story parallel Evelyn’s - like a Julie and Julia type story.
I also was annoyed with how Monique never challenged Evelyn - always tried to justified her actions, how she wasn’t in the wrong and was a victim. 
Same with her being Cuban - I wished we could see Evelyn struggle with allowing herself to be whitewashed in Hollywood and the media - maybe show her having internalized racism against Hispanics and think less of other actors who have the same or similar ethnic background as her. Hollywood and the media have historic racist past and it would have been interesting to see how Evelyn dealt with this and how it played into her romantic life. 

I did enjoy Daisy Jones and the Six more. Did not like the ending- it completely erased the reason why choosing and staying with Cecilia as the right choice for Billy. Also I wished Cecilia had something going for her outside of Billy and their girls. She should have been seen as a designer whether interior or fashion. Cecilia is the cool girl that is mentioned in Gone Girl (if that makes sense).",""
"lqe0wai","PerfectiveVerbTense","2024-10-05 00:50:18 UTC","I realize that this is a *me* problem, but I will actively avoid any book called ""The Numbered Things of Quirky Name"".",""
"lqfboj5","easy_turnip_recipes","2024-10-05 07:41:48 UTC","The lack of 'show don't tell' in this book was honestly infuriating. The author barely showed ANYTHING and the constant yapping of the characters and the over explaining in the pov characters' inner monologues was annoying as hell. Like, in the year of our lord 2024 I would expect more from a book hailed by critics. I have a hard time dnf-ing books (I have to finish if I started), so I finished reading it, but I was sooo irritated by the end of it. And as many people mentioned, the>!queer storyline felt lackluster.  Like, I felt as if these two women had zero chemistry and the author just randomly put them together. !<A disappointing read all in all.",""
"lqcu3cy","PinkToucan_","2024-10-04 20:22:35 UTC","I love everything about the book— EXCEPT for the “big” twist at the end. I was FAR MORE disappointed with the twist ending in “Daisy Jones and the Six,” another of Taylor Jenkins Reid’s books. I think she is a wonderful author, and unlike you— which is obviously fine! — I think she does an amazing job creating intricate and complex relationships between characters; none of the characters feel one note to me. However, she for some reason seems to love a twist, but they always feel so forced…",""
"lqd5lw3","midnightpocky","2024-10-04 21:27:55 UTC","I also thought this book was just okay. The premise is interesting but the writing left a lot to be desired. The characters didn’t feel very real and there was too much telling not enough showing. ",""
"lqcw181","willreadforbooks","2024-10-04 20:33:23 UTC","Yup, I felt the same. The characters all felt two-dimensional and the plots kinda boring. I felt similar after reading Daisy Jones and the Six, and realized the author just steals ideas from past decades and fictionalizes them. Just not particularly well. Daisy Jones is apparently a stand-in for Fleetwood Mac, and I always thought of Evelyn not as Marilyn Monroe but as Elizabeth Taylor. That’s when I decided to not read any more of her books. I always go to Goodreads and look for the one star reviews after hate-finishing or DNFing a book. (Of course all of these books still have a 4+ rating, so I aso don’t trust Goodreads for book recs)",""
"lqcrlqe","SomeKindoflove27","2024-10-04 20:08:46 UTC","Yea I was disappointed too. The ending was pretty lackluster and I could already tell how they were going to tie the loose threads together it just felt lame. You missed nothing by not finishing",""
"lqd042l","Odd-Drawer9226","2024-10-04 20:55:59 UTC","I’m so grateful for this post! I hate this book so much! :D My expectations were too high for it, and it’s not even a mid read.

No struggle - agree a big time. For me, it was strange how she didn’t talk much about being Cuban expect for being raised up in a poor area (which told me nothing as I’m not American) and dying her hair to get more roles. And when her new Cuban maid didn’t realize Evelyn is Cuban, Evelyn had a sudden thought about loosing her roots or something…. It was a short and sudden sentence, so I don’t even know what to think of it. She didn’t even notice Cuban’s revolution, that was mentioned in the background. The same for Monique - “I was not like the others. But I got a cool job, and my boss is also not white.” Ok, I guess? Am I supposed to feel something for these characters? Same for being gay - I felt no struggle in here. “If they know, they will come after us” - this way you can be anxious about anything, I.e. “what if meteor falls on my house? What if i walk late at night and something bad happens to me?” I didn’t feel that Evelyn and co were in danger.

But the biggest thing I hate about it (idk if you read it or not) is Evelyn herself : >! In the end, she noticed that she was aging, and she stopped receiving interesting (= sexualized) roles. She hated it and decided to finish her career. And aaaaafter that, she was finally ready to choose Cecilia and live “without hiding”. So, with 7 husbands and 1 love of her life, she loved no one. She did everything that suited her and no one else. Somehow it’s supposed to be an inspiring feministic figure, when in fact she is just a selfish attention-seeker” !<",""
"lqcyrg5","Old_Put2217","2024-10-04 20:48:30 UTC","I thought it was ok. I also ""read"" it as an audio book while high as a kite so...",""
"lqdxq2k","nosleepforthedreamer","2024-10-05 00:28:37 UTC","I stopped reading any new bestsellers because somehow they almost always hook you with an intriguing premise and great beginning, then lose steam about halfway through. The ending is pretty much always anticlimactic or a ridiculous “twist” out of nowhere.",""
"lqeq5hc","alysnotmad","2024-10-05 03:58:59 UTC","Why do you assume the struggle was about her making it as an actress? The real struggle, as I thought was very clear in the book, was her having to choose between fame and the love of her life, Celia. She is not a Mary Sue because she clearly had flaws that were fatal and often self-destructive. She wasn't willing to give up her life as a movie star for a quiet life with Celia, and this broke their relationship time and time again.",""
"lqd5x8b","theshieldsarestillup","2024-10-04 21:29:47 UTC","TJR should never write poc characters again. A more thoughtful author would have explored Evelyn’s move to the U.S. and the shift in culture/language and how she adapted but nope we just skipped right over that. Don’t even get me started on Monique. As an actual biracial woman unlike TJR, Monique’s pov was insulting. I couldn’t finish the book because I felt so alienated, I couldn’t believe how popular it was.",""
"lqdg3rl","TemperatureRough7277","2024-10-04 22:32:22 UTC","""That said, I read Jennette McCurdy's I'm Glad my Mother Died last year, and it's really increased my standards in historical fiction. If that was a 10, this is a 2. That's mainly why I rank it so low.""

What in the heck? That book is a memoir, not historical fiction. I can't take your review seriously if you're getting genre wrong in this way, not because genre is super important or anything, but because you are comparing non-fiction and fiction genres and apparently not seeing how incredibly different the skillset is to do each of those things well.",""
"lqf6nu5","DrunkOnRedCordial","2024-10-05 06:43:43 UTC","I've read a lot of Hollywood biographies and autobiographies, so I could have pretty much written out TJR's reading list by the end of the book. It was fun seeing how she fictionalised all those little Hollywood anecdotes about abusive husbands, arranged marriages to cover up homosexuality, fatal car accidents being hushed up (looking at you, Clark Gable), secret babies (you again, Clark Gable). 

But I'd rather read the autobiographies because you get the genuine flawed and shallow people trying to make sense of their own extraordinary good fortune and the downside of trying to live up to an image (Lana Turner).",""
"lqd4fq0","ExcessiveCharm","2024-10-04 21:20:58 UTC","We read this book for book club and it was universally hated from the 9 of us. She’s a narcissist and I did not care about her at all.",""
"lqd54hg","Specialist-Map-8952","2024-10-04 21:25:03 UTC","I think it's a fantastic book for people just getting into or back into reading, I LOVED it when I read it a few months after getting back into reading after 10 years. Now that I've read more books I think my original rating is definitely overinflated, I still think it was a fun enjoyable book but definitely loved it more because of my lack of other books to compare it to.",""
"lqdot1k","Soy_Saucy84","2024-10-04 23:28:54 UTC","I'm about halfway done and not really interested in finishing it...pretty disappointed.",""
"lqefy2a","northawke","2024-10-05 02:38:30 UTC","Personally for me the most annoying aspect was the two-dimensionality of the characters. They are only defined through their relationships with others and those relationships are also quite superficial. These were simply not fleshed out human beings with interests, flaws or complexity. I finished the book, but severely underwhelmed.",""
"lqf3zv9","IntelligentSource754","2024-10-05 06:13:37 UTC","Why is Reddit showing me posts from 2021",""
"lqf49j2","daniizle","2024-10-05 06:16:37 UTC","my theory is she’s just writing very detailed outlines for the eventual screenplays she wants to sell!",""
"lqf8yen","missxfaithc","2024-10-05 07:09:58 UTC","I didn’t like the interview being used as a framing device for the story. But I generally don’t like it when stories are structured that way, so it’s not a personal thing against this one. The chapters/sections from Evelyn’s POV were fine overall, but I loathed the parts with the interviewer lady. Like, I didn’t care about her whole subplot with her ex-husband or whoever the fuck he was at all. It was just so boring to me. Also, the writing of the book itself just kind of got on my nerves. I read it quite a while ago now, but I believe the “present day” sections were told in first person (I don’t remember if Evelyn’s chapters were or not) and all the “I” statements in them started to really annoy me as the novel went on. Because, from what I remember, sentence after sentence would start with “I”. Like, I did this, I went here, I, I, I. And that’s why I usually don’t like first person POV in books. It gets way too repetitive way too fast. And aside from that, the writing also just felt a bit too simplistic, I guess? Like, it had a YA vibe to it even though it’s not YA. Which you might think you make it easier and quicker to get through, as the writing style is by no means flowery or anything like that, but I STRUGGLED to push through this book. I had to set it aside after reading like maybe the first 100 or 150 pages and then I literally didn’t finish it until like a year or 2 later. That’s how much I just couldn’t get into it. The ending part, like explaining what happened to Evelyn and Cecelia and all that, was fine. I enjoyed getting to learn what happened to them and how their relationship eventually ended up. But the actual ending of the novel was just kinda meh, imo. Again, there was no point during the story where I actually cared about the interviewer lady. I never felt connected to her as a character. She just kinda fell flat to me, and compared to Evelyn I don’t think she was fleshed out nearly enough. I think I ended up rating the book 3 out of 5 stars on Goodreads.",""
"lqfjmkb","earl_grais","2024-10-05 09:18:01 UTC","I really, really hated the ‘gossip column’ sections… they were written in the tone of early noughties People mags and not at all in the tone of Golden Era media. 

Even worse, I was listening to the audiobook and the narrator made the baffling decision to sound like a presenter on E.T. 

I wanted to love this one and really should have, but the author absolutely flubbed the tone of the ‘Old Hollywood’ scenes.",""
"lqg3k5q","smifypz","2024-10-05 12:37:51 UTC","Old thread I know but I was so uninterested in the Monique storyline. It felt so pointless and the ""reveal"" existed because the author needed to justify the slog of the wraparound story.",""
"lqg496a","dodooos","2024-10-05 12:43:08 UTC","I finished the book but it was nothing special to me either, I expected a lot more because of the hype. I didn’t quite enjoy the dialogues, I found them boring with no meaning or emotions.",""
"lqgpcnc","Jaggedlittlepill76","2024-10-05 14:53:59 UTC","I thought it was awful and a waste of time so I gave up. Boring story, crappy writing and unlikeable characters.",""
"lqgtunb","writeswithtea","2024-10-05 15:18:38 UTC","I listened to the audiobook, and if I’d read the words with my own eyes, I would have not finished it. The story could have been much shorter and the author could have made the point with fewer husbands.",""
"lqisc4u","IsThataNiner","2024-10-05 21:36:39 UTC","Couldn't agree more. It's a forgettable book and the writing is distracting and cringey. Cringey specifically as she writes a character who is mixed race in the US and I have no idea why she thought she had the insight for that. ",""
"lqkxu4u","queteepie","2024-10-06 06:41:29 UTC","Just finished the audiobook and I actually agree. It wasn't a very good book. The story is disjointed and there is no real point to it. It's like the author went ""what if I wrote a book where the plot twist is a shocking death and jammed gay stuff in it?"" And we ended up with this story. 

I gave it 2 stars.",""
"lqosk4v","Guilty_Compote_4197","2024-10-06 22:22:03 UTC","i liked the book cover lol",""
"lqd8yit","ryannitar","2024-10-04 21:47:48 UTC","Meh, I agree there were things that were cliche about it and some things were shallow, but It seems like you just didn't connect with the story and that's fine.",""
"lqdq0ab","onceuponalilykiss","2024-10-04 23:36:52 UTC","I haven't read this book because it does actually sound mediocre, but criticizing a book for ""show don't tell"" because it doesn't explicitly detail every event/phase of life is a pretty funny thing to say. By that logic writers like Ishiguro, Peake, or Pynchon are all hacks lol.",""
"lqd4rlc","Weary-Sport-4355","2024-10-04 21:22:56 UTC","I do think there could have been more to it. i enjoyed it personally because it shows lots of flaws and it was enjoyable for me. but there could have been a tremendous amount of work done",""
"lqfvbrw","dogecoin_pleasures","2024-10-05 11:28:15 UTC","I'm going to read this soon, as I gradually work down my list of booktok recommendations lol.

So far I have devoured some, like Funny Story by Emily Henry, and been underwhelmed by others. 

I feel like if you have high standards you may also be underwhelmed by lessons in chemistry. Don't even bother with ACOTAR, lol, its like three poorly written fanfics in a trenchcoat!",""
"lqfw4em","littlegreenwhimsy","2024-10-05 11:35:34 UTC","I finished 7HoEH, but couldn’t really claim I enjoyed it, for a lot of the same reasons as you. All but one of her other books I’ve read (Daisy Jones and I want to say Maybe In Another Life) had the same problems: high concept but iffy characterisation, sloppy eleventh hour twists that annoyed rather than thrilled. (I also started but didn’t finish Malibu Rising so I can’t comment on it, but I certainly wasn’t enjoying it). 

I keep trying Taylor Jenkins Reid because I thought Carrie Soto is Back was so fun (and is a much more character driven novel), but I think the fact we must face is that she’s quite a love-hate author. If you like plot-driven twisty page turners, you’ll likely enjoy. If character development is more important to you, you might not.",""
"lqhl8yw","Glittering_Sea_4441","2024-10-05 17:44:31 UTC","I am torn with this book. It kept me entertained and yet I can't shake off the feeling of the >!killing-of-your-gays-trope!<. I mean, pretty much everyone who is not heterosexual >!dies.!< >!Bobby dies, his boyfriend dies, Celia dies, Evelyn dies, Monique's at least bisexual father dies. !< And you can't say ""well gay people died during this times"", but the don't die due to aids. Aids is discussed and how they deal with it during these times, but no one of the main gay characters >!dies due to aids.!< As a bisexual woman myself that rubbed me the wrong way. As someone else said, it feels like this is a gay book written for straight people.",""
"lqihrq6","baby_sharkz","2024-10-05 20:39:17 UTC","It wasn't great. I didn't even finish it I was so bored. I believe someone in the comments mentioned that there was a lot of ""said, not shown"" and I agree with that. There is just very little substance and it reads like fan fiction.",""
"lqjs42j","Plastic_Ad_9034","2024-10-06 01:12:00 UTC","I only read it because at the time, it was surging in popularity. I get a little fomo about books that a lot of people rave about. For some reason, these books usually disappoint me. My taste must be a little left of center or maybe a little highbrow. T7HOEH did not hit for me.",""
"lqjz43i","acadiatree","2024-10-06 01:58:37 UTC","I read it on a beach. It was the only thing I had with me, so I got through it, but good god, it was rough going.",""
"lql4cjs","DaisyDuckens","2024-10-06 07:53:47 UTC","You lasted longer than I did. I found it so boring.",""
