"comment_id","user","time","message","parent_id"
"lqd846o","theshieldsarestillup","2024-10-04 21:42:44 UTC","Yeah it seems the author failed to understand that throwing a label on a character does not equal representation. Turned me off from trying any of her other books!","lqd6p5g"
"lqp5wse","themaknae","2024-10-06 23:42:14 UTC","I'm 28 and I don't kiss teeth first??","lqok4pv"
"lqfla4i","BohemianGraham","2024-10-05 09:38:28 UTC","This. Just google the before and after pictures.","lqdp4oc"
"lqjofxz","Beautiful-Story2379","2024-10-06 00:48:14 UTC","She had hairline electrolysis, so not really a bunch of plastic surgery.","lqdp4oc"
"lqisrmc","Filibust","2024-10-05 21:39:10 UTC","Okay? If I got anything wrong about Gitanos, please correct me because the last thing I wanna do if offend anybody but I’m failing to see how Gitanos are Latinos.","lqisdvc"
"lqczwrt","iwasoveronthebench","2024-10-04 20:54:52 UTC","Despite the fact I loved the book as a gay person, I did giggle a bit at the scenes where they learn about the Stonewall Riots. Very spoonfed for a straight audience.","lqcwwpg"
"lqd1hf2","rosie_purple13","2024-10-04 21:03:46 UTC","I'm about to start this book and I'm here like what was so bad about it? Oh that it wasn't dragged on for longer, got it.","lqcwwpg"
"lqdaoap","theshieldsarestillup","2024-10-04 21:58:07 UTC","I guess agree to disagree on this one because I also found Evelyn to be an extremely flat character and I get what OP means. The story is about finding out this woman’s life beyond the name on the page, yet she still just felt like a name on a page. Surely Evelyn would have more thoughts on what it felt like to immigrate to a new country and learn a new language. OP didn’t read to me as wanting more trauma but rather wanting more introspection, I felt so detached from Evelyn and I think we were supposed to care about her and her story but I didn’t, thus why I didn’t finish the book. I looked up the ending and that made things even worse for me… really just cancels out any emotional connection. Idk, just my take though; I’m glad others were able to have a good time with it, I never like missing out on shared fun!","lqd922t"
"lqepyu6","TemperatureRough7277","2024-10-05 03:57:26 UTC","The publisher actually added the half to The Seven and A Half Deaths of Evelyn Hardcastle, which was originally The Seven Deaths of Evelyn Hardcastle, because it was too similar to Evelyn Hugo. It was an attempt to differentiate the two (and does make some narrative sense).","lqeh659"
"lqhqbab","Silly_Somewhere1791","2024-10-05 18:11:26 UTC","Exactly. And either way I was just explaining the broad strokes behind the public figures TJR based her book on; it’s not on me to answer for that. 

We’re at a point where Rita and Liz are no longer common knowledge so people think Evelyn is based solely on Marilyn when the title itself is pure Liz. ","lqfla4i"
"lqj2r4v","Silly_Somewhere1791","2024-10-05 22:36:33 UTC","Because the Gitano DNA is a contributor to her non-white looks but in 1940s Hollywood it was the Spanish heritage that was the bigger deal. Rita’s real name was Margarita Cansino and she came from a dynasty of famous flamenco dancers. She “looked” Mexican in the eyes of Hollywood even though she was Spanish. Gitanos were very integrated into Spanish life and culture. ETA Hollywood execs deemed her “too Latina.” The nuance wasn’t there but it was what she had to work around. ","lqisrmc"
"lqlek1n","BohemianGraham","2024-10-06 09:51:51 UTC","They just see blonde woman on cover, and automatically think Monroe.

I wonder what sort of comparisons and hype Silvia Moreno-Garcia's The Seventh Veil of Salome will generate. I did enjoy that one slightly more, and apparently TJR is a huge fan. 

I've only read The Seven Husbands of Evelyn Hugo by TJR, and I liked it because I got the references. Not the greatest novel I ever read, but because of my interest of the golden age of Hollywood, I enjoyed it more than most would.","lqhqbab"
"lqj9jhs","Filibust","2024-10-05 23:16:08 UTC","I’m aware that Gitano isn’t white. I even acknowledged that in my initial post when I edited it. What I’m not getting is how that makes her Latina. Maybe Hollywood saw her as Mexican but she wasn’t. Also this is Hollywood in the 40s. Of course they don’t bother to acknowledge her true ethnic group and just label her from a completely different ethnic group that they’re more familiar with. Thats problematic on its own.

What I’m getting at is that Rita Hayworth wasn’t Latina and I’m still puzzled on why she’s still labeled that way. Gitano and Cuban are very different despite obvious Spanish influence. Hope this makes sense.","lqj2r4v"
"lqjl7jp","Silly_Somewhere1791","2024-10-06 00:28:02 UTC","They saw that she was dark and from Spain and that several generations of her family were flamenco dancers. She herself was a flamenco dancer named Margarita Cansino. I feel like you’re operating in bad faith by pretending not to understand why racists 80 years ago would label her Hispanic, but in any case it’s not my job to convince you of the reasons behind other people’s bigotry. ","lqj9jhs"
