"comment_id","user","time","message","parent_id"
"lqvyyn5","YearOneTeach","2024-10-08 03:33:15 UTC","I think this was an okay book if you were just looking for something easy to cruise through. Great for a day on the beach or something like that, not so great if you were hoping for something with a lot of depth.

I personally found the twist very predictable, and felt like Evelyn was meant to be this larger than life character but never really lived up to that expectation. Readers were just to kind of buy into her reputation, when there was nothing really of substance within the character itself. There were also so many life lessons or themes they were trying to get across in the story that just kind of fell flat.",""
"lqd7ub3","sagelface","2024-10-04 21:41:07 UTC","This book sucked. I agree",""
"lqeqzpl","Anenhotep","2024-10-05 04:06:10 UTC","I’m with you. Kind of a stinker, in fact.",""
"lqe14xz","abacteriaunmanly","2024-10-05 00:51:57 UTC","Yeah I found it rather dull, especially for something set in Hollywood. I think the author was too worried about making her lead likeable that there just wasn’t much of a plot.",""
"lqe1gy6","boooooooooo_cowboys","2024-10-05 00:54:14 UTC",">She then becomes a famous movie star with a rising career in just a few pages. WHERE WAS THE STRUGGLE??? It wasn’t a story about her childhood or her struggle to become famous. It was a story about her and Celia, and secondarily about how her desire for fame conflicts with her desire to live her personal life the way she wants. You can like or dislike that story, but it’s clearly the whole point of the story. ",""
"lqetmvq","miserablembaapp","2024-10-05 04:29:30 UTC","I hated this book. The writing is absolutely atrocious.",""
"lqf0wbg","iamapizza","2024-10-05 05:40:12 UTC","My impression was that it's written in the form of a movie so the author can collect royalties.",""
"lqhuxhi","themaknae","2024-10-05 18:36:09 UTC","I was interested at first but stopped liking it as I went along. By the end, I I yeeted it into a trash can lol. There were so many little things that annoyed me about it, but the two that I distinctly recall a year later are 1) how do you chip a tooth on a TV screen? and 2) why skip over the process of trying to conceive a child (the natural way) with your gay husband bff?? That’s so interesting and complicated and could have been so compelling, but nope. The book skipped from “we decided to try for a child” to “we had a child.” I also felt that the title didn’t really match the book.",""
"lqcxiqj","classical-brain222","2024-10-04 20:41:36 UTC","The letter from the main characters father discovered near the end of the book is really good... also the ending between Evelyn and Celia when the latter is near her death... at times it can get a little to sexy fan fic for one's taste admittedly

Also what they do to her best husband is quite an emotional hit as well",""
"lqd1scm","Spider-man2098","2024-10-04 21:05:33 UTC","Am I imagining things, or are naming conventions for books are getting a little strange? There’s 10000 Doors of January, the First Fifteen Lives of Harry August, this one, The Invisible Life of Addie LaRue that someone mentioned yesterday. There’s probably more. I don’t even mind, but I’m wondering if it’s just me.",""
"lqdd15a","Dependent-Value-3907","2024-10-04 22:12:51 UTC","I agree with you so much. I think this book is extremely overrated as is everything else by Reid. I want to love her books, I’ve read so many of them, and none of them have been nearly as good as everyone tells me they are. Obviously these things are subjective but I really don’t understand the hype for Reid especially when her prose is just. Not that great. She has really interesting ideas that I want to love but they always play out in such a cliche way. Nothing in any of her books has ever surprised me. My favorite was probably Daisy Jones and that, much like Evelyn Hugo, was just a fictional story inspired by real people and played out in a very obvious and cliched way. I simply enjoyed the way that one was written until I finished it and was left feeling, well, nothing. 😂 but I’m glad other people enjoy it even if I don’t understand the hype.",""
"lqd0zsf","Extreme-College-4942","2024-10-04 21:00:57 UTC","I really enjoyed. It isn’t a big literary masterpiece, but I think is very interesting and very engaging. Me personally don’t love a very serious book, end up finding it boring. But I think this book is perfect for a person that doesn’t want to read a very deep and serious book. 8/10",""
"lqfbn4u","thewhitetulip","2024-10-05 07:41:20 UTC","I was once recommended a book that said ""this book is 7 husbands of evelyn hugo + something else"" And I totally misread it to say 7 deaths of evelyn hardcastle 😅 Stuck with a beach read now 😂😂😂",""
"lqg6htz","bookishlibrarym","2024-10-05 12:59:10 UTC","I loved it!",""
"lqcrv8p","MulberryEastern5010","2024-10-04 20:10:13 UTC","I read that book a couple years ago. While I don't think I hated it as much as you did, I also found it to be a bit overhyped. If you want, I can tell you why she wanted Monique to do the article, and even that doesn't amount to much in the end. You might be all the more glad you didn't finish",""
"lqdgmkz","Oshioki108","2024-10-04 22:35:42 UTC","Yeah this book was awful. I did not get any glitzy, rich Hollywood vibes. All the characters were so unlikeable for me. The woman Evelyn was in love with was so annoying??? I didn’t DNF but it was a slog and I started skimming through the last chapters",""
"lqcuedb","tsmiv","2024-10-04 20:24:17 UTC","I kind of liked Daisy Jones so I thought I would read Evelyn Hugo.  I checked it out from the library, but as soon as I saw ""smash the patriarchy"" on the dedication page; I knew it was not for me.  Lol!🙄",""
"lqehpuh","Cometstarlight","2024-10-05 02:51:43 UTC","Don't feel bad. A good friend of mine DNF'd this book too. She called it ""utterly boring and forgetful."" Literally tossed it in the bin.",""
"lqen34o","juliaGoolia_7474","2024-10-05 03:33:34 UTC","That was an insufferable book.",""
"lqf72qt","Anigerianlovesgarri","2024-10-05 06:48:27 UTC","The gay romance was boring and underdeveloped and you’re right. I did enjoy it the first time but I started hating it because a lot of straight girls were praising Celia and Evelyn’s love story like they were amazing sapphic representation. I guess this is where my frustration comes in. I have never seen a queer woman be that amazes by that relationship",""
"lqd80lx","look_a_new_project","2024-10-04 21:42:09 UTC","If you're interested in the struggle-grind to become a top celebrity, maybe check out Skip Beat (anime or manga). It's not ""literature"" but boy does the author nail the MC's dedication to her craft and achieving her goal. (The romance plot/subplot explores every cringy corner, just be warned. IMO it's still worth it for the main plot.)",""
"lqdzlno","kinderbrownie","2024-10-05 00:41:21 UTC","Read like gossip magazine",""
"lqq4obh","Select-Government680","2024-10-07 03:33:31 UTC","I personally loved the book. I loves that Evelyn was so adamant about being bisexual. It was a really easy read and I thought it was pretty well written.",""
"lqctttq","Grogg2000","2024-10-04 20:21:06 UTC","Jehovas",""
"lqd3ayl","riziger","2024-10-04 21:14:22 UTC","I think TJR is love or hate. 7 husbands was on my ‘to read’ but I read both Daisy Jones and Carrie Soto and have decided TJR is just not for me. They’re all really highly rated and sound good in the summary / early chapters but tend to fizzle out and by the end I’m just reading to finish the book and not really caring what actually happens. ","lqcsrg5"
"lqd8q15","FlagshipHuman","2024-10-04 21:46:22 UTC","DJATS just annoyed the hell out of me by heaping praise on Daisy and repeatedly highlighting the fact that everyone was obsessed with her rather than driving the plot or painting a picture of the world of music back then. Even the physical descriptions of her hair and eyes felt so fanfiction like. Poor Camilla is just >!treated like an obstacle to overcome. Not to mention, the descriptions of their songs were so boring. I’ve not heard the song. It’s not a real thing. I have no emotional investment in it. Why are we spending paragraphs about it??!<

A bit of it might be on me, because I went into it as a huge classic rock fan, who had just finished Bob Spitz’s biography of Led Zeppelin, and boy that book had me hooked. So I expected DJATS to pull me into that world through the power of fiction. Not only did we barely see the music scene, we’re listening to >!Daisy constantly whine despite everything working out nearly perfectly in her favour. Even her and Billy having the love-hate thing gave off no sparks or chemistry. Certainly nothing warranting albums worth of content. And then Camilla dies, a convenient event for the main pair to get together.!< It just pissed me off, honestly. They could’ve added so much lore and painted the world more richly. There’s abundant material out there. So the book felt bland against actual biographies and documentaries. Even the personal dynamics of the characters are so flat that it fails to really create any impact on the reader.","lqcsrg5"
"lqi8m9p","Vegetable_Block9793","2024-10-05 19:49:39 UTC","Maybe it was the fact that so many people have raved about it, but I just wasn’t into this one and did not finish","lqcsrg5"
"lqfrviz","Bananacreamsky","2024-10-05 10:54:26 UTC","I had a great time reading it too.  I read it in one day, at the lake, and it was perfect.","lqcsrg5"
"lqd8xdr","Filibust","2024-10-04 21:47:37 UTC","I thought Rita Hayworth was white though. Her father was Spanish. So her being Latina is a misconception.

EDIT: so some are saying that her dad was Romani? So I was half wrong. But that still doesn’t make her Latina.","lqcxrzj"
"lqdk46m","blinkandmissout","2024-10-04 22:58:18 UTC","I'd zoom out just one bit more. I think the central theme/conflict is the duality between the person and the persona.

Other characters projected a lot of fantasy onto the persona of Evelyn Hugo: the famous and sexy blonde bombshell. Few people knew or valued her real self and she made a ton of career and marriage choices to preserve the fantasy - even at the expense of living authentically. Celia was a big part of that, but not the only example.","lqcxf4h"
"lqdd71b","CryptographerBoth779","2024-10-04 22:13:53 UTC","I agree, I just wanted to point out that in the book Evelyn specifically makes a point of saying that she’s bisexual, and is annoyed with people saying she’s a lesbian because she loves Celia. ","lqcse22"
"lqeap6v","ThruTheGrapeVines","2024-10-05 02:00:15 UTC","I agree with this! I felt like it was the first time in a long time where the main character of the book I was reading was unlikable, and that was okay (and also kind of the point).

ETA: Maybe that means I need to read more books 😂 but it did remind me that I don’t always need to feel like I should like the main character or agree with their decisions.
But it is definitely an easy beach day kind of read.","lqctpbo"
"lqd0k40","Valkaeriy","2024-10-04 20:58:29 UTC","Could not have said it better","lqctpbo"
"lqfwnbn","Deleted","2024-10-05 11:40:18 UTC","[removed]","lqctpbo"
"lqcvrwi","Anxious-Fun8829","2024-10-04 20:31:55 UTC","Or like going to Olive Garden and complaining that they use Parmesan cheese instead of Parmigiano-Reggiano. 

I agree the book was fine. It was a fun read. Seeing as how it's called The Seven Husbands... I assumed it would focus on the marriages so wasn't looking for a bildungsroman, which is what I guess OP was looking for.","lqcpjmc"
"lqd6ytq","theshieldsarestillup","2024-10-04 21:35:59 UTC","There are plenty of light reads that were executed way better than Evelyn Hugo, let OP trash it if they want. For how hyped it was I think it’s fair to expect that we would get above average writing and character exploration. Having a negative opinion about a book does not mean we were asking for too much!","lqcpjmc"
"lqcxj03","Easy_Flounder252","2024-10-04 20:41:38 UTC","Agree 100%. It felt like the plot was assumed to be elevated by just the basic fact that a character was queer. I read this a few years ago to be fair, but I remember many chapters ending on a cliffhanger-type note of “and that’s when I realized I was attracted to a woman”…I do understand the social norms were wildly different in the day, but reading as a queer person it felt a bit alienating?","lqcsbeg"
"lqepjoj","Deleted","2024-10-05 03:53:50 UTC","TJR seems to be unable to write romantic relationships well. I don’t know what it is. They’re easily the least interesting parts of all of her books. There’s so little chemistry between the characters that get together that I wish the parts about them were left out. In Carrie Soto, it was the least interesting part. The FMC and her father seemed to have more of a genuine connection. TJR can write family relationships pretty well, but she misses the mark on romantic relationships every time for me.","lqcsbeg"
"lqdn0l5","Both-City-1341","2024-10-04 23:17:09 UTC","Couldn’t have rolled my eyes harder!","lqcwr5v"
"lqep4a9","Deleted","2024-10-05 03:50:17 UTC",">! The same twist happened in another TJR book, so I already saw it coming !<","lqcwr5v"
"lqfn0kz","Rowdy_Roddy_2022","2024-10-05 09:59:30 UTC","We're not necessarily supposed to like Evelyn Hugo. It's not normally my type of fiction at all but I enjoyed it because in a Walter White sort of way she straddles that line between hero, anti-hero and even villain. Obviously not to the same extent, but I never got the impression she was a character we were supposed to admire. She even admits this numerous times herself. She did what she had to do to survive in Hollywood.","lqd2f2d"
"lqdwrzd","bubblyintkdng","2024-10-05 00:22:15 UTC","I hated the book to be honest, for me one of the most boring readings that I did last year. The style was poor, the characters didn't have any charm, Evelyn is not a good person but it is also not interesting, there was so much babbling... Will never read anything from the author again.","lqd3ix6"
"lqfubhl","TemporarilyWorried96","2024-10-05 11:18:40 UTC","God yeah the formulaic titles really annoy me, same with the “A Bowl of Mac & Cheese” naming convention for fantasy books.","lqdxiq9"
"lqeokto","CuriousMonster9","2024-10-05 03:45:48 UTC","It felt to me like TJR ripped off The Age of Innocence’s ending for Daisy Jones, where Billy is Newland Archer, Camila is May Welland, and Daisy is Ellen Olenska.","lqdlpgq"
"lqeeubw","Deleted","2024-10-05 02:30:19 UTC","No seven and a half deaths of Evelyn hard castle for you then.. man that is a mouthful..","lqe0wai"
"lqd32nh","Logary","2024-10-04 21:13:01 UTC","The twist at the end of Daisy Jones upset me because of how forced both the twist itself was and the scene it was in were","lqcu3cy"
"lqeo1ly","CuriousMonster9","2024-10-05 03:41:25 UTC","The twist in “Daisy Jones & The Six” really reminded me of the end of “The Age of Innocence.”

Billy = Newland Archer

Camila = May Welland

Daisy = Ellen Olenska","lqcu3cy"
"lqcz7n1","ImLittleNana","2024-10-04 20:50:59 UTC","I use goodreads to find people that hate the same books I do, then check out which books they’ve loved.  Works especially well if their review details why they didn’t like it, and I share those reasons.","lqcw181"
"lqd44wp","Black_roses_glow","2024-10-04 21:19:14 UTC","For the Last Part: Evelyn being self absorbed is the whole Point of her character.","lqd042l"
"lqfn7wg","Rowdy_Roddy_2022","2024-10-05 10:01:57 UTC","Where on earth did you get the idea she is supposed to be an inspiring feministic figure from?","lqd042l"
"lqf6tga","GLITTERCHEF","2024-10-05 06:45:28 UTC","Exactly, the book started off good and fizzled out and I didn’t bother reading until the end because I was over it.","lqdxq2k"
"lqe9vds","mjts2020","2024-10-05 01:54:16 UTC","Literally put it down after the introduction to the first few characters, a few pages in. I  couldn't stand the stereotypes.","lqd5x8b"
"lqd6p5g","TemporarilyWorried96","2024-10-04 21:34:23 UTC","I’ve heard many readers/reviewers of color mention this! I forget which book tuber it was but I watched a good summary as to why her Latine rep in TSHOEH and CSIB is…… not good.","lqd5x8b"
"lqeoavj","CuriousMonster9","2024-10-05 03:43:31 UTC","This is exactly me! I picked up Evelyn Hugo when I was in a reading slump, and it got me right out of it. Now I know TJR books are reliable for that for me.","lqd54hg"
"lqg4mri","Hurtmione","2024-10-05 12:45:56 UTC","I listened to the audiobook during a reading slump, and I really was keen to find out what happened and keep listening. 


I know it's not a perfect or very ""literary"" book, but I enjoyed it, and the voice acting on the audiobook was amazing. I think the audiobook format was well suited to the dialogue heavy writing style.


I read DJATS a few years ago and I can't remember much about it but I enjoyed that too. 


I have been reading the Daevabad trilogy by S A Chakraborty at the same time I was reading Evelyn. It is a really rich fantasy with excellent world building and lots of politics. It was definitely a richer and more absorbing read, but sometimes I just want to dip in and out of something that doesn't require as much investment. 


It's easy to remember the characters in a book like Evelyn, it's sort of tropey and gossipy and that's not for everyone but sometimes a book like that is a nice change of pace for me.","lqd54hg"
"lqok4pv","BohemianGraham","2024-10-06 21:34:05 UTC","Not to be insulting, but how old are you? I can easily see someone chipping a tooth on the old CRT TVs with the glass screens.","lqhuxhi"
"lqd7nea","Lucky_Whole7450","2024-10-04 21:39:59 UTC","I think this is it for me. All her things come highly reviewed but of the three I’ve read I’ve had reactions like that of OP. I’ve given her a good go but her style while an easy read just isn’t what I pick up a book for. 

Now that I’m in this post I realise I’ve never understood what a ‘beach/holiday read’ was but it’s clicking that this sort of thing would probably fit into that genre well. 

Side note - but I ruined a beautiful camping road trip once by reading something beautiful but miserable (a la a little life) and I understood after that that what you read while on holiday can really dictate how the trip goes! ","lqd3ayl"
"lqdblnd","sikonat","2024-10-04 22:03:52 UTC","Same. Justice for Camilla. It’s why I can’t watch the tv show bc of course they tweaked Camilla","lqd8q15"
"lqddssh","Dependent-Value-3907","2024-10-04 22:17:41 UTC","This! I absolutely hated how Camilla was treated and it ruined the whole thing for me. While I was reading DJATS I enjoyed how it was written and flew through it but when I finished I was left wishing I’d just spent that time watching a documentary.","lqd8q15"
"lqirypi","Silly_Somewhere1791","2024-10-05 21:34:31 UTC","A big thing in music fiction is an inability to write concerts. Everything is house parties and studio time. Daisy’s peak came during a stretch of tv performances. ","lqd8q15"
"lqdp4oc","Silly_Somewhere1791","2024-10-04 23:31:03 UTC","He was Gitano. She changed her name and had a bunch of plastic surgery to appear white. ","lqd8xdr"
"lqisdvc","Silly_Somewhere1791","2024-10-05 21:36:55 UTC","Eeek learn more about Gitanos before you use it as a mic drop to justify digging in your heels about a lightweight work of fiction. ","lqd8xdr"
"lqdfipz","October_13th","2024-10-04 22:28:37 UTC","Oh thank you! I put both options because I couldn’t remember. I just remembered that >!Celia was the love of her life.!<","lqdd71b"
"lqcwwpg","bepis118","2024-10-04 20:38:14 UTC","like Evelyn and Celia’s romance was very much giving “this is a gay book written for straight people” but it was pretty engaging and fun for what it was.","lqcvrwi"
"lqd922t","bepis118","2024-10-04 21:48:24 UTC","We can certainly critique light reads. Personally, I don’t think I really ever bought in to the central love story between Evelyn and Celia so it’s not a top tier read for me. But OP’s gripes don’t make sense -  this book covers Evelyn’s entire life so yes, certain parts (like Evelyn working as a waitress before she becomes famous) are skipped past, but that doesn’t mean Evelyn is a “Mary sue”.

It sounds like OP wanted something similar to “A Little Life” where Evelyn’s experiences with childhood abuse or DV are a central part of the story and like…this just isn’t that book. Personally I would have preferred the book to skip past a lot of Evelyn’s earlier life precisely so we have more time to explore Evelyn and Celia’s relationship. 

 I think this book was hyped precisely because it is a step above “BookTok” romance/smut fare while still being a very widely accessible book that you can finish in a weekend. I think it’s a great book for people who are just getting into reading.","lqd6ytq"
"lqdfguo","Dependent-Value-3907","2024-10-04 22:28:17 UTC","This. I say this as a queer person, I have to wonder if this book would’ve had anywhere near the success it did if it weren’t for the “twist” to the story that Evelyn is queer. Obviously the author has had plenty of success beyond this so it’s not like I think it would’ve been a total flop but still.","lqcxj03"
"lqfs3a0","RobotIcHead","2024-10-05 10:56:37 UTC","She didn’t do it to survive Hollywood, she thrived there, she was more ruthless than a lot of others.  But I had a lot of trouble with her motivations: protect herself? She had zero compassion for anyone other those inside her circle, even then was selfish.  There was other ways to establish the motivations and reasons.  But the big problem with the motivations is that they make unlovable: so why should those inside her circle care about her? I felt she barely cared for her daughter until after her friend/daughter’s father died.  All of this shows the weakness of Monique’s skill as journalist and the author.  But the book is popular so what do I know but it could have been a lot better.  And normally I would be type to say no point in looking for depth in a shallow pond because this book is not worth it.  It is a throwaway holiday book, mildly engrossing.  Looking for anything beyond that is pointless.","lqfn0kz"
"lqegn39","Romanticon","2024-10-05 02:43:39 UTC","Which is too bad because it was a great book.","lqeeubw"
"lqeh659","PerfectiveVerbTense","2024-10-05 02:47:37 UTC","Yeah, bonus points if it has a ""half"" of something that can't (typically) be divided in two. So quirky! So mysterious! Eye roll.","lqeeubw"
"lqczvwt","willreadforbooks","2024-10-04 20:54:44 UTC","Ha ha! Brilliant","lqcz7n1"
"lqft88a","Odd-Drawer9226","2024-10-05 11:08:07 UTC","I cannot copy the whole book and paste here, but Evelyn is always portrayed as a strong, independent woman, who got it all. We see it in the articles, blog posts, Monique’s reaction to Evelyn. We see it from Evelyn herself, talking about her determination to build a career and be on top. I’ll be glad to listen to you if I’m wrong, but I don’t see anything in the text that would contradict this statement.

A few things that I consider cruical:

1. The book was dedicated to someone with the words “smash the patriarchy, sweetheart”; - a clear message from the author of what she had in mind while writing the story.

2. During the interview, Evelyn is basically teaching Monique that you have to be like me, or you will not succeed. And Monique end up doing what Evelyn taught her to (doing what SHE wants, no matter what it means to others), which looks like she is following Evelyn’s advice. So, Monique accepts Evelyn’s lessons and continue her route? I know irl I’d do the same thing, but for the story’s sake, if Evelyn is supposed to be a bad person according to the author, there should have been hints. Instead, there are a lot of parts that glorify Evelyn, and none, where the author condemns her actions or behavior. I expected the author to channel her “actual” feelings through Monique by rejecting writing a book, saying a narcissist doesn’t deserve the sympathy. See next point.

3. Monique has been respecting Evelyn through the whole story until the end: “I know she is ok. She has the right to die as she lived, entirely on her own terms …. Holding the power of it all in her own hands”. - that’s the “portraying a strong feministic figure”, isn’t it?

4. In the end, Monique’s book is about how complex Evelyn Hugo was and how great her love to Celia was ????

“And that is this: Evelyn Hugo was bisexual …..  she wanted you to know that because she loved Celia …. Because loving Celia St. James was perhaps her greatest political act” - I saw no love, hun. She loved only herself through the whole story.

“…. Because over the course of her life, she became aware of her responsibilities to others in the LGBTQ+ community to be visible, to be seen” -  Did I miss that part where she becomes aware??? No, she was just dying, didn’t care, and was actually living in the century where being gay is safe and fine!

“Doesn’t it bother you? That your husbands have become a headline story?”…. And her answer was quintessential Evelyn. “No”, she told me. “Because they are just husbands. I am Evelyn Hugo. And anyway, I think once people know the truth, they will be much more interested in my wife” - the author is trying hard to make me sympathize with Evelyn and make me see her as a strong but complicated woman, who had a heartbreaking love story.","lqfn7wg"
