"comment_id","user","time","message","parent_id"
"lrpcwgh","Synaps4","2024-10-13 11:20:30 UTC","I think you need to start small. Something with easy words that you will enjoy.

Trying to read crime and punishment when you struggle with a website is like trying to do gardening with a nuclear weapon.",""
"lrpdebh","clashvalley","2024-10-13 11:25:26 UTC","Start reading kids books and work your way up. Don’t try to translate it word for word, just gist read and only google ones that come up often and you’re unsure of",""
"lrpe84s","y0kapi","2024-10-13 11:33:28 UTC","Read with a kindle or kindle apps or any e-reader that got a dictionary.

It’s insanely powerful as a non-native reader. You’ll learn so much, but don’t expect to ever master all words. It’s lifelong learning!",""
"lrpeeor","Jarita12","2024-10-13 11:35:13 UTC","Start with something you either know and read before or something relatively easy. We have books where one page is in English and translation is on the other side so you can compare so I am sure something like that exists almost everywhere.

My first book in English was Harry Potter. I was about 15 when book 5 was out and it took a few months to get translated version and also, spoilers were everywhere so I did not want to wait. They even said who would die in the book on TV news like a few hours after the book was out. I was in the middle of reading it and was pissed.

In any case, that is an example of a relatively easy book to read. I was surprised how much I understood, I found what the new invented words meant (like within HP world - Quidditch, that had our own word - kudos to the translator who is one of our best) but struggled a bit with not so common words (like I could not figure out what ""Couldron"" meant, it was not in any dictionary I had :D )

But otherwise, it was relatively easy read because it was still aimed at children and young adult. Lots of ""He said"", ""She said:""....

And I went from there.

So I recommend to start with something relatively easy, have a dictionary at hand and it will help you to get through it and you learn new words.

I tried that with a couple of German books as well but my German got very rusty since high school and I am constantly kicking myself to read and talk in German but I am struggling and failing :D

(I am Czech, btw.)",""
"lrpfx2b","saya-kota","2024-10-13 11:49:11 UTC","I agree with everyone else, start with something simple. The first things I started reading in English were fanfics lol. I used a Firefox extension so I could get the meaning of a word by hovering it, so the suggestion to use an e-reader with a dictionary (Kobo is great!) is a good idea. 

Some tips my language teachers gave me over the years :   
-To not always try to translate/look up each word you don't understand. Read the entire sentence/paragraph and try to understand what the word is from context, first. (I was also told to watch shows/movies without subs first, to work on comprehension, and then use subs to see if you got everything)  
-To not look up translations, only definitions",""
"lrphc7r","Lumpyproletarian","2024-10-13 12:01:49 UTC","Honestly, I’d start with a children’s book you know well.  I used Harry Potter y la piedra filosofal and it was just difficult enough to be interesting without being so difficult I got disheartened",""
"lrpez96","urhiteshub","2024-10-13 11:40:36 UTC","Start with dialogue-heavy simple stuff. Like comics, comics are a fine way to start. Children / young adult books, also. Things you've already read in your native tongue. 

Asimov, for example, and specifically the Foundation series, I had found to be easier to read than most other books, when I first started reading in english.",""
"lrpmk54","ExpertPath","2024-10-13 12:44:44 UTC","Question unclear, just start reading. By book 3 you won't notice anymore",""
"lrpgo9q","LadyRosy","2024-10-13 11:55:58 UTC","For me it helped to start with easy books, I was already familiar with. Mainly Harry Potter.

But there are also books that are specific for learning and training vocubulary at the end of every chapter.",""
"lrpj4jf","Linziclaire","2024-10-13 12:17:00 UTC","I started with Harry Potter. I got the audio and digital versions from Libby and slowed the audio so I could follow along.",""
"lrpv2ie","NorthernSparrow","2024-10-13 13:45:32 UTC","Hey OP, I have been in the same boat when trying to get through official government webpages in Brazil. People’s advice in this thread is good for learning a language generally, but just be aware that official documents will use specialized vocabulary, formal phrasing and a lot of complicated syntax, to the point where it can feel like a different dialect. Like, with Portuguese I felt like I had to learn three different forms of the language: (1) informal spoken language, (2) fiction writing, (3) “official” written Portuguese, which includes not just things like tax forms and visa forms, but also a lot of formally-written nonfiction like newspaper articles. (like for example, look up a newspaper article that is reporting a Supreme Court decision and you’ll see how specialized the vocabulary can get)

What I did when I was learning was carefully (and slowly) read the top story of a reputable newspaper every day (yes, an actual newspaper - I chose the most famous one in the country - that’ll give you exposure to “official” writing style). I also read fiction books, AND ALSO watched Portuguese tv shows & movies with captions on. You have to read very slowly and be willing to keep pausing to look up words and phrases you don’t know. I used to spend so much time rewinding and replaying a movie scene that it would take me a week to get through one movie, lol. 

Google Translate is a godsend, but keep going back and forth between Google Translate and the original text to figure out where multi-word phrases start and end. (example: “get down”, “get over”, and “get across” all have informal slang meanings that are very different from each other! And if you just look up “get” you won’t discover those phrases.) 

I found it really helpful to keep a little journal where I wrote down every new word and phrase (writing it down helps you remember it). This will take a long time - think of it like your project or hobby. I used to work on Portuguese  two hours every night, and even after three years living in Rio I still felt like I still wasn’t truly fluent. But I’d got to the point where Brazilian friends thought I was fluent. You will get there.

BTW if you need help navigating a complicated document right now, find a trusted friend who is a native English speaker who can sit down with you and go over it line by line. Feel free to dm me if you want assistance (so many Brazilians helped me with stuff like this, and I would love to pass on the favor).",""
"lrqhu9m","reUsername39","2024-10-13 15:57:46 UTC","the best advice I got (probably from somewhere here on reddit) was to focus on dialogue heavy texts.  'diary' style books like Diary of a Wimpy Kid are pretty good along with graphic novels.  I also find something written in modern language rather than something old-fashioned (like Crime and Punishment...or in the case of the first book I attempted The Secret Garden) to be so much easier.  

I'm currently so proud of myself for how well I'm doing with a book I'm reading in German.  It's a newly released thriller with a lot of dialogue-heavy sections.  When I sit down to read, I have a pen and my phone open to Google translate.  I can get by without translating much, but I choose to stop and translate some words on most pages so I can remember them better and build my vocabulary...usually new adjectives I haven't encountered yet.  I write the translations directly in the book.  It's so amazing to me that I'm actually enjoying reading this book.",""
"lrqlqb5","bluesky_greentrees","2024-10-13 16:19:15 UTC","No tips here, just wanted to say good for you for reading books in your second language. Stay strong, you've got this.",""
"lrr81ai","CC-5576-05","2024-10-13 18:18:12 UTC","Brother if you struggle with the embassy's website you need to start with children books not crime and punishment. I'm not judging here we've all been there, but starting with something that's way out of your league will just discourage you from continuing.

When I started reading in English i started with short stories and children's/teen books.",""
"lrpf8wu","Erebus25","2024-10-13 11:43:02 UTC","Flashcards to learn common words and reading everyday however much you can at the moment. Modern books first.  
You can supplement this with tv shows or something similar you enjoy.",""
"lrpffvc","Book_Lover_fiction","2024-10-13 11:44:49 UTC","English is my second language I started reading English fiction books starting of this year and now I can read heavy classic from authors like dostoyevsky, Albert Camus",""
"lrphg6r","Starless_Voyager2727","2024-10-13 12:02:46 UTC","Always start with a children or middle grade novel. I am a non native English speaker and I started with The Diary of a Wimpy Kid series. ",""
"lrpl8ef","alteronline","2024-10-13 12:34:20 UTC","there are websites with books in two languages. like: studyenglishwords .com they offer side by side translations by paragraph",""
"lrply64","Xan_Winner","2024-10-13 12:40:00 UTC","Go read something more simple, like comics. It's fun and a lot easier! You'll slowly get used to it and can then go on to more complicated things.

Books for teenagers can work well, or things with a lot of repetition.",""
"lrpmwh5","strange_socks_","2024-10-13 12:47:21 UTC","Try graphic novels or comic books first. The pictures help :P (this is coming from someone trying to get used to read in their 3rd language).",""
"lrpol0e","ProfessionalTill4569","2024-10-13 12:59:55 UTC","I started reading books that had one page in my first language and one in English, after that I read Philosopher's stone, which has easy vocabulary and had read many times before. I've read almost 200 books in English now and couldn't have done without reading those first",""
"lrq7ii8","CrazyJoe29","2024-10-13 15:00:33 UTC","+1 for Kids books. Bonus is: they’re pretty good! The other day my wife was like, “why is ‘hedgehog’ in your vocabulary?!”

Because I read a story about a jaunty little hedgehog-man, what’s it to you? (I’m 42 BTW)",""
"lrqja4d","gonegonegoneaway211","2024-10-13 16:05:41 UTC","Stuff with images is easier so you can follow the story even if you're confused like manga/graphic novels/webcomics/fan translations of popular comics etc. 

The other option is short story anthologies because its just easier to get through shorter stories without giving up in frustration.",""
"lrqmfm0","SaffronOcean96","2024-10-13 16:23:11 UTC","I started reading in English (my second language) at 13 with The girl with the dragon tattoo. To this day, I'm very grateful I literally only picked up the murder plot and not the entire context - even though I was at the level of a native 13-year old, there was the vocabulary I didn't even know existed in my native language. So, depending on your age, choose appropriate books! (Which you would understand in your native language too.)

If you're looking for adult books, James Patterson has a very easy to read style and published several crime books.",""
"lrqrfpq","SinclairLore","2024-10-13 16:50:39 UTC","Try watching movies with subtitles in your second language",""
"lrqrwpf","Deleted","2024-10-13 16:53:17 UTC","I’d pick something you’ve already read and enjoyed, but read it as an ebook. That way you can highlight phrases and translate them very easily.",""
"lrrgfyf","wiggert","2024-10-13 19:03:09 UTC","Harry Potter and The Twilight Saga were an easy read and helped me a lot.",""
"lrrv7eh","Alyss_Liddwell","2024-10-13 20:22:16 UTC","English is my second language and I wasn’t good at it nor was I confident using it a few years ago. I started small to build vocabulary and confidence by reading fanfictions online. I did it first with oneshot of fandom that I liked and easily knew of the characters and universe. It was rough : I was checking the dictionary all the time and wrote down every new words. But since I loved the fandoms and started with really short stories, it was easier to keep being motivated. I even started translating a few to improve myself. I naturally read twoshots, then threeshots. And before I knew it, I was reading full fanfictions as long as published novels, only driven by the curiosity to know the story and not focusing of every little things I didn’t knew of or learned yet. A few years after my first english fanfiction, I finally read my first paper novels. And now I don’t care about reading either in my first or second language : I still make mistakes when I need to actively use it but my general comprehension is good enough to enjoy content in it, which is enough for me.

I’m sure you can do it ! Don’t be too harsh with yourself : you’ll learn as you go, tiny step by tiny step. Just be sure to choose a subject you love or interested in so it doesn’t become a chore. :)",""
"lru6hk0","Anenhotep","2024-10-14 05:56:51 UTC","Let me recommend that you also read out loud, at normal speech level, whatever you set out to read. Doesn’t matter if you mispronounce or have an accent! When you do this, maybe 20 minutes a day, you are training your eyes, your ears, your mouth and your brain all at the same time. It’s very possible that you’ll make a lot of progress quickly. When I go to a place that speaks one of the languages I speak, but I haven’t spoken in some time, I read out loud everything in that language for about three days before my arrival. Then  I arrive properly “warmed up” and functional, instead of stumbling around in that language for the first couple of days.",""
"lrphzuy","Nehtak","2024-10-13 12:07:27 UTC","Id sau start with manga or comics if you até into it",""
"lrpiexv","DesiBoo2","2024-10-13 12:11:00 UTC","When I learn a new language and I want to start reading, I usually begin by trying a children's book. They use easier language and shorter sentences. I am learning Italian now and bought a few fashion magazines, but they're too difficult. So I bought 'Good Night Stories for Rebel Girls' in Italian because they are short texts, and I also have that in English, so I can read them side by side and compare.",""
"lrpf7hn","whatinpaperclipchaos","2024-10-13 11:42:41 UTC","Books you’ve liked can be helpful, *buuut* heavy classics like Crime and Punishment runs a good risk of just make things worse. Like synaps4 said, gardening with nuclear weapons.

Children, middle grade, and YA litt is awesome because it’s meant to be more available for a younger target audience, so the language isn’t necessarily going to be *the* most difficult thing you gotta deal with. Heck, there’s some pretty good picture books out there that you could use to boost your confidence if you need the odd break. I know some family friends who used comics to help with the language learning, and have a book club friend who’s using books with shorter chapters to have that morale boost as she’s trying to get more into the language.

Main point: take easy, gentle steps as your introductory point, then it’ll be easier to try to get to those heftier texts down the line e.g. when you feel like a government web page ain’t such a struggle. There’s a bunch of different ways of doing it, and guaranteed literature that’s enjoyable to read while you’re doing it. Could also ask a librarian if they got something that could help (guaranteed easy access point, cause there’ll be others who’s trying to get better at the language with the help of the magic of the ✨library✨).",""
"lrpfbp2","TinyTrackers","2024-10-13 11:43:46 UTC","Start with an easy book that you will enjoy, maybe like a childhood favourite. This is the tedious bit: look up everything you don't know that you can't derive from context. That way you'll learn new words, sentence structures, etc.",""
"lrpg0fv","FranklyWrites","2024-10-13 11:50:03 UTC","It might be too pricey for you, but I've found LingQ amazing for this. You can import web pages, ebooks, YouTube videos etc. into the platform and then read along, clicking any word you don't know the meaning of. I've finished two full-length novels this way and it's been so much more motivating for me than struggling through text on its own because it actually feels achievable. My goal is to be able to read eventually without it holding my hand, but this lets me take baby steps in that direction. I am, however, fortunate to be learning a language that is currently free.

You can also sometimes find books that have two languages (the one you're learning and your native one) side by side, which can be helpful.",""
"lrpgtco","FoggyGoodwin","2024-10-13 11:57:12 UTC","When I studied French, the book I read was Notre Dame de Paris. It is the only book in French that I have read. Maybe you _should_ start with Crime and Punishment.",""
"lrphvbm","willemlispenard","2024-10-13 12:06:24 UTC","When I started reading in English (I’m dutch), and I actually started with books for young teens (dork diaries), then YA (just stuff like. John Green and Suzanne Collins) and whenever there was a word I didn’t get I would just look it up. It takes a little longer but it’s fun to learn new words to me. I wouldn’t translate every sentence, but so long as you know the gist it will be ok!",""
"lrphznx","RebelxMouse","2024-10-13 12:07:24 UTC","Start with something you’ve read and enjoyed in your native tongue, but in English. You’ll already know the storyline so it’ll be more about understanding it in a different language.",""
"lrpj55k","KnittedTea","2024-10-13 12:17:08 UTC","I would try to get a book that is aimed at learners or one you think you'll like. Check out your local library, they might have a few books in your target language or be willing to order some in for you. 

I like target language newspapers and magazines. I can read German knitting patterns and some of the news items, but politics are beyond me for now. 

I have read books in English since I was about 13. I think I started with Agatha Christie books, but can't remember if they were the first ones or just early on.",""
"lrpoqza","Melonpanchan","2024-10-13 13:01:08 UTC","Just start. Get something you are interested in. No one is judging or watching you. It's just you and the book. 

Did it when I was 16 with way to complicated fantasy books, never looked back and just plowed through. I still have a strangely broad vocab in medieval weapons... It got me to the point that I usually can't say if I read a book in my native language or English.

In my fourth language (Japanese) I started by rereading Harry Potter in Japanese.",""
"lrpq3sb","pracharat","2024-10-13 13:11:02 UTC","Read something that you're really enjoy.   
A little background: I am a very fast reader, for ordinary novel usually 5 pages per minute.   
I started with I-Robot, it takes me around 3 minute per page for the first 80 pages then at the end of the book it's 1 min per page.

Around the 3rd book I can read as fast as my 1st language.",""
"lrq2c1n","Confident-Zucchini","2024-10-13 14:30:34 UTC","Read English translations of books that you have already read.",""
"lrq5lk3","Lycaeides13","2024-10-13 14:49:35 UTC","Definitely a kids novel you've read before, like Harry Potter or something",""
"lrq6gnc","kaoshitam","2024-10-13 14:54:32 UTC","For me, because English is my third languages, the key is to just go for it. Just consume it. When you don't get some part, just ask someone.",""
"lrq6p4a","OwlStrict3208","2024-10-13 14:55:52 UTC","Go to the library and check out a variety of books in genres that interest you. I’d even try middle grade/YA books as sometimes the language is a little more simple in those books. Just read what grabs your attention. Don’t focus on the length of time it takes you to read the books either. English is incredibly hard and as a native speaker, I couldn’t imagine having to learn it as a second language. You could also try Duolingo. It may help a bit as well. You got this!",""
"lrq7rrf","Humble_Explorer_4854","2024-10-13 15:02:00 UTC","When I did it I would read twice, the first time with a dictionary or look up meanings and the second time I would read it fluently and also learn some new words",""
"lrq8grn","Kenpachizaraki99","2024-10-13 15:05:53 UTC","Start with kids books or even baby books then work your way up",""
"lrq8qwi","Melapetal","2024-10-13 15:07:29 UTC","In addition to children's books, which has already been suggested, I find magazines are another great option. While the content is for adults, magazines are usually* written at a low grade level and have lots of pictures to give context. 


*Careful which magazine you pick though. I'm talking pop culture and general interest type magazines, not the equivalent of the New Yorker. ",""
"lrq9l6c","DismalSetting3880","2024-10-13 15:12:16 UTC","You could try with cozy mysteries or vampire books if you like the gender. For example Charlaine Harris, Cleo Coyle",""
"lrqdltv","hbmindia","2024-10-13 15:35:03 UTC","If available, start with comic books.",""
"lrqevbw","PrintsAli","2024-10-13 15:41:56 UTC","If you already have a good base, I would just recommend learning from a good ole fashioned textbook. You'll learn the rules of the language, as well as the important vocabulary that you are missing. You can do the same with books, but it will take a lot of effort to actually learn anything on your part, and you'll have to figure out grammar rules entirely on your own, which may or may not even be done correctly depending on the book. The knowledge you already have will help, but it won't make it easy. 

Since English is your first language, you'll be able to find a textbook that can teach you most of the well-spoken languages in the world, though very obscure ones maybe not.",""
"lrqf5it","aoibhealfae","2024-10-13 15:43:26 UTC","I think it's a skill that works better as a kid or teen, when your brain was actively developing pathways. English is my second language and I primarily read in English instead of my mother tongue (Malay). I remember basically staring at a page familiarizing with the words and then repeat it over and over many many times. I also have marginal Traditional Chinese and Japanese reading comprehension which was enough to read comics, occasional subtitles, recognizing signs and name of places or food ingredient.   
  
At the moment, I am reading Eka Kurniawan's Beauty is a Wound in Bahasa Indonesia which is challenging for me as a Malaysian and I am reading it along with the English translation. Despite sharing similar vocabularies, Indonesian language are different than Standard Malay language. I just stare at the page, check the dictionary and then try to lose myself into it even if I didn't know the exact word and meaning. As long as I can maintain having a context of everything, then with more repetitive exposure to it, then you'll start to pick up the language and hopefully learn to write in them as well. That's how I learn to read and write in English. Unfortunately, I still mess up the grammars since my brain tend to mix all the languages as I think.",""
"lrqh7hu","Confutatio","2024-10-13 15:54:23 UTC","Short stories by Roald Dahl and E. A. Poe are a good start.",""
"lrqvycn","CharmedMSure","2024-10-13 17:15:19 UTC","I have studied French on and off since I was a child, and have never felt confident about speaking it, although I can understand spoken French on a very limited basis. However, I have gradually achieved a level of reading French that allows me to enjoy reading French language mystery novels (albeit slowly). I started with “Sueurs Froides” by Pierre Boileau et Thomas Narcejac. Perhaps starting by reading a book in a genre that you enjoy in English would be helpful for you, also.",""
"lrqw9o9","flyawaywithmeee","2024-10-13 17:16:59 UTC","CHILDREN’S BOOKS",""
"lrr06qv","colutea","2024-10-13 17:37:25 UTC","Just start reading. If you don't know a word, look it up if it's essential for the context, if not, move on. I learnt English by reading a lot in high school. Started out by Harry Potter and such. Currently, I am learning French and Japanese. I just pick any book I like. I prefer eBooks now, as lookup is faster. Children's books are not necessarily easier since they may contain more slang. If you're really just starting out, you can buy the book in your target and native language.",""
"lrr0lnc","jp_books","2024-10-13 17:39:37 UTC","Start with books written for younger audiences, then up to YA novels as you get more comfortable. Avoid stuff written long ago as the 1800s vocabulary might not translate to the way people actually speak.",""
"lrr39p5","CurlyBarbie","2024-10-13 17:53:19 UTC","I usually read the book at least twice in my native language, then I read the book in my 2nd language.",""
"lrr9ok1","seacattle","2024-10-13 18:26:50 UTC","I like graphic novels",""
"lrrbyrc","La_Lanterne_Rouge","2024-10-13 18:38:53 UTC","I taught myself to read English by reading books I had already read in my original language (Spanish). The first book I bought in the US was Tarzan of the Apes.",""
