"comment_id","user","time","message","parent_id"
"lrrclgt","Sailor_MoonMoon785","2024-10-13 18:42:18 UTC","I’m starting to read in a new language, but I wouldn’t DREAM of trying to dive right into something as complicated as Crime and Punishment, even if I’ve read it in my native language before, if I am still struggling with short texts in the new language. Heck, I know I’m not ready for Artemis Fowl in my target language yet, and I’ve read that book in English more times than I can count since middle school. 

Children’s books and graphic novels are your friend right now. Build up your fluency with kids books. And graphic novels are great for building vocabulary because they actually have higher rates of unique words per page than traditional prose does. 

You’re not going to benefit from trying to read at a text complexity you aren’t ready for yet in your target language. There’s reading above your level for added challenge and then there’s being completely lost and frustrated. Don’t do that to yourself.",""
"lrre8yc","argleblather","2024-10-13 18:51:13 UTC","I have been checking out spanish-language children's books on my kindle. That's usually about where I'm at, and there's a lot of repetition and pictures. 

It's how I learned most of my English words, so I feel like it helps.",""
"lrrnkvg","parc_guell","2024-10-13 19:41:27 UTC","I started with romantic books (2nd and 3rd languages). Worked very well.",""
"lrrr7ql","Professional-Pace-43","2024-10-13 20:00:44 UTC","I like diving right into the deep end by reading regular non-fiction or literature meant for native adult readers. The key is to use chatgpt, that not only translates but also teaches grammar. It took me over an hour to fully understand 1 paragraph. But I learned so much. I quite enjoyed it.",""
"lrs0uo0","LevelPerception4","2024-10-13 20:52:50 UTC","Read a book in your second language while listening to the audio version in English.",""
"lrs0x89","mandajapanda","2024-10-13 20:53:12 UTC","I do not necessarily agree with kids' books. There are readers specifically designed to help learn the language as you read. These are often what we start with in school. 

I remember reading Le Petit Prince, I think second quarter, but it was a lot harder than my prèmiere étape.",""
"lrs3uxj","just_reading_along1","2024-10-13 21:09:26 UTC","Start reading YA or maybe even children's books and try not to look up every word you don't know. See if you can pick up the meaning via context. Otherwise it becomees a real chore.",""
"lrs4uth","maraudingnomad","2024-10-13 21:15:01 UTC","For me, it is about 30-50 pages of getting used to it, then I no longer know about it.",""
"lrsb6os","anonymouse550","2024-10-13 21:51:24 UTC","If you have Kindle unlimited, Ana Martin makes graded readers. I find them very helpful",""
"lrsi8gw","ItsDefinitelyNotAlum","2024-10-13 22:34:00 UTC","In classes, we started by reading newspaper articles and watching films with subtitles. In my spare time I read a simple book in both languages, paragraph by paragraph.",""
"lrskg2r","Dinna-_-Fash","2024-10-13 22:47:37 UTC","I would add to the start with easy books, …check if your library has the audiobook version. It will help a lot to do both at same time.",""
"lrsl7ns","Deleted","2024-10-13 22:52:22 UTC","personally i started reading picture books and have worked my way up to reading actual novels. i recommend, especially since you’re not proficient yet, that you read things you already know. i’ve read harry potter several times, so i already knew what was going on. it made it much easier for me to understand words, since i knew what they would’ve been in the english version. that might work for you. be prepared to keep a dictionary or something near you because, even if you know the plot, you WILL encounter new words. better yet, keep a copy of the english version next to you while you read.",""
"lrslycj","SnafuTheCarrot","2024-10-13 22:56:59 UTC","I'm a native English speaker and wanted to learn Norwegian. 

Duolingo was a big help there. It is one of the most robust series in the app. Babbel is apparently pretty good as well. 

A friend in high school once told me the best way she learned a language was to have a dictionary in that language and translate word by word from target language to native language. Eventually the vocabulary sinks in. This is an indirect approach to acquiring the grammar, but it helps there too. 

I like detective novels, so I bought copies of the first Harry Hole detective novel, The Bat Man by Jo Nesbo, originally written in Norwegian. One copy in Norwegian, one copy in English. So I can check my work. 

I also found text that looks geared towards 8th graders, that introduces Norwegian grammar while telling an engaging story along the way. 

Lot's of people recommend watching tv in the target language. Have heard good things about that.",""
"lrsmu56","breastfedtil12","2024-10-13 23:02:29 UTC","You pick it up and start reading it.",""
"lrso048","ItsaLynx123","2024-10-13 23:09:40 UTC","I started like people start reading...I started with children's books, then moved up through the skills. I also find reading books you already know is nice because it's easier to follow and learn the unique patterns that will appear in literature.",""
"lrt2ln1","JeremyAndrewErwin","2024-10-14 00:43:48 UTC","Graded readers worked for me. Clozemaster helped me learn the vocabulary. I read almost exclusively on kindle, which has built in dictionaries.

I have learned to read in French, and I am on the verge of learning to read in German. There are all sorts of   reading skills that you probably need to relearn in your target language-- how to follow a plot, how to remember characters, how to infer vocabulary from context, how to read for hours and hours willingly. I could feel it working, so chasing that bit of dopamine kept me reading.

notes: some authors of graded readers are much better than others. Beware of AI generated crap. 

I prefer to read books that I have not read before. The only thing that my limited command of French and German allows is plot. If I am already familiar with the plot, I'd probably end up comparing it to the time I read it in English, and the foreign language version will pale in comparison. In a few years, things may change...

One funny thing-- ""Trigger warnings"" never made much sense to me, until I was reading a book in German, and out of the fog of semi-comprehensible narrative came a somewhat too vivid description of a corpse. If I had read the same book in English, I would have been able to anticipate it, or skip hurriedly by.",""
"lrt4tfp","jenh6","2024-10-14 00:57:52 UTC","Read your favourite children’s book again.  Like magic treehouse in that language.",""
"lrt9rhi","Deleted","2024-10-14 01:30:46 UTC","Kids books are great",""
"lrtj58y","thatbob","2024-10-14 02:32:28 UTC","Comic books worked for me. I read the Fantastic Four *en Español* and had tons of context clues to figure it all out.",""
"lrtpu8n","Real_Bumblebee5144","2024-10-14 03:18:39 UTC","I found books with parallel text helpful. English on one side, the language I was learning on the other. I read the non-English pages, referring to the English pages when I got stuck. It helped me learn to comprehend more complex grammar and longer, more involved sentences and paragraphs.",""
"lrtsa7e","___mithrandir_","2024-10-14 03:37:23 UTC","Unironically read books written for children or teenagers. Perhaps read a translation of an English book you've already read. Sort of a Rosetta stone lol",""
"lru2y6d","orundarkes","2024-10-14 05:15:18 UTC","Start with kids books and work your way up.

You need to know most of the vocab so you can pick up new words from context. Googling what a word means leads to just not internalizing it properly.",""
"lru47dn","valiantdistraction","2024-10-14 05:29:51 UTC","I go for either the Bible (I'm not religious, but it's in every language and has got easy words and a lot of repetition) or Harry Potter (easy words + made up words, and I know it). Neither were picked because they're my top choices to read, but because they're easily obtainable in any language and fairly easy to read.",""
"lru8smz","Ok-Piano-5144","2024-10-14 06:23:42 UTC","Several possibilities: 1) use graded books. The language will be much simpler,  but you will still able to enjoy the story. 2) choose a book you have already read and enjoyed- knowing the plot helps immensely 3) start with short stories,  not a brick of 1000 pages. 4) don't stress over words you don't understand  - a lot of meaning can be picked from the contest, just skip bits that are unclear and go on. 5) choose action over description and philosophical musings.  I hope it helps  )))",""
"lru9k2h","Izrathagud","2024-10-14 06:32:14 UTC","Watch movies in your language with subtitles in your second language.",""
"lruebga","Player06","2024-10-14 07:30:04 UTC","What language are you studying? This page has a bunch of beginner practice reading material for various languages: https://comprehensibleinputwiki.org. You should start small with something from there.",""
"lrurj75","SabbyRinna","2024-10-14 10:12:25 UTC","To add--listen to audio books! Helps with pronunciation and will improve your conversational language skills.",""
"lrv3n82","Senior-Group-2107","2024-10-14 12:04:25 UTC","I started by reading short stories and poems. I also picked authors who don't use an extremely complex vocabulary in their books - for ex. Stephen King. And then I was just increasing the difficulty. I started reading in German this way a couple of years ago and now I'm nearly fluent. ",""
"lrvoz2e","MarcusQuintus","2024-10-14 14:26:47 UTC","I started with children's books that I'd already read in English, so that the reading level was lower and where I already knew the story.  
I then moved on to chapter books that were available in both languages so that I could cross reference the story.  
Finally, I moved on to proper adult books that weren't translated.  
This process took nearly a decade and I took significant breaks in between. Keep at it and don't expect immediate results.",""
"lrw1lvv","Cuni95","2024-10-14 15:36:29 UTC","I started with harry potter and it worked!",""
"lrw1mkv","Deleted","2024-10-14 15:36:35 UTC","I am reading some Percy Jackson novels in French to brush up my vocabulary. I’ve read the books & loved them tonnes of times, so I’m not getting lost while reading.",""
"lrw5p1f","Hospital-Hopeful","2024-10-14 15:58:01 UTC","it may sound stupid but a good way is too read some children literature first",""
"lrxqngg","helvetin","2024-10-14 20:55:32 UTC","what's funny is eventually i would like to be able to read \\_Crime and Punishment\\_ па-Русски. so far my most effective technique are bilingual texts, with the Russian original on the left-facing page and the English translation on the right. here's one i'm reading now - \\_Great Russian Short Stories of the Twentieth Century \\[Dover Dual Language\\] :  [https://bookshop.org/p/books/great-russian-short-stories-of-the-twentieth-century-yelena-p-francis/11787852](https://bookshop.org/p/books/great-russian-short-stories-of-the-twentieth-century-yelena-p-francis/11787852)",""
"lrzllqu","Optimal_Owl_9670","2024-10-15 03:51:30 UTC","English is not my first language. I’m proficient now, able to read very complex texts, but when I was starting, I got myself a nonfiction book from a used bookstore and I would read 2-3 pages at a time. It was about a subject I was comfortable with (history), targeted towards non-specialists, so written in relatively accessible language. I highlighted words I didn’t know, tried to discern their meaning from the context. I looked up their meaning only when I was done with a chunk of text, to not break my pace, and also tried to get their pronunciation correctly. I would also read passages aloud. Obviously, this is a tedious process and takes away from the reading pleasure. At some point, i started reading movie and fashion magazines in English - pretty easy language, but complex and correct enough that you are having a good reading time. Strictly in my experience, it’s much easier to start with nonfiction, be it books or articles. Fiction will contain more metaphorical language, more words you might not be familiar with etc. As an alternative, middle grade can also be a good starting point, as they are usually written in shorter simpler sentences, with less flowery language, and a more accessible message.",""
"ls05ho0","UUDDLRLRBAstard","2024-10-15 07:02:59 UTC","I started with audio books... i was reading Rhythm of War and saw that the library had a copy, so I checked it out. El Ritmo de Guerra.  

Took about an hour to start to pick word and phrases out, I had to lower the speed to .75 (In English I listen at 1.75x usually). Fantasy might be less helpful as it tends to have made up words. Can be interesting tho.  

It helped that I was familiar with the story beats already, and I also enjoyed the exposure to spoken Spanish.  

The voice acting for Syl by the male narrator was... something else.",""
"ls0q7gw","effronterie_lunaire","2024-10-15 10:57:10 UTC","As others have said, comics/graphic novels are a great way to start easing yourself into it. I then moved on to the Harry Potter series in my target language because I had read the entire series so many times as a teen that I'd basically memorized some passages, so it helped me not have to look every third word up and I unconsciously learned a lot of vocab just by soaking up the new words because I knew the context. From then on it's been easy going. Apart from books, the covid years weirdly helped me because to get accurate news about the pandemic in my area (I live in a country where my target language is spoken) I needed to read the news in that language, and since the situation was changing so quickly I kept myself updated every day via the news, and reading a bit every day helped my brain slowly feel less exhausted as it became normal for me to read in that language daily. Good luck with reading :)",""
"ls262co","inabookhole","2024-10-15 16:25:36 UTC","I started reading in my second language by choosing children’s and young adult books. I know the stories might not really be your thing and could sometimes seem... a bit simple, but if you look at them purely from a vocabulary or grammar perspective, they’re perfect.

If you can find a series, like Harry Potter for example, that gradually targets an older audience as it progresses, you’ll be able to improve your language skills step by step, which will help you better understand what you’re reading and integrate new vocabulary.

One tip I’d give you is to start with a book you’re already familiar with in your native language, so you have a rough idea of what each part of the book is about. This will make it easier to follow the story. As you gain knowledge and proficiency in the new language, you can explore different titles.

It might take a little time, but I assure you that you’ll start to see results fairly quickly.",""
"ls7d3ym","Showtimus","2024-10-16 14:18:11 UTC","One of the best tricks to get into it, I learned it from my next door neighbor in Bolton Landing upstate New York.

Back in 2005 I was part of one of those work an travel experiences. I 'am a Chilean person, now 44, then 25. My next door neighbor was a Brazilian girl, same age and she was committed to practice and improve her English skills to the next level, so she start reading books and, at the same time, listen to the audiobook... Honestly, a very clever way to guide you during the whole experience of reading in a second language.

It also have some great perks.. for example, long time ago I was reading Armada, by Ernest Cline, and decided to also  play the audiobook, just for the fun of it, and because it helps to keep you practicing once you are not using, in this case, English on regular bases. 

This audio book was read by Will Wheaton, so basically I was experiencing NERDvana.

Give it a try.  It is worth it.",""
"ls7fsk3","milkisterrifying","2024-10-16 14:33:20 UTC","I don’t know if the ‘read kids books’ is always helpful advice, often children’s books have made up or highly specialized vocabulary that could be confusing for language learning (Roald Dahl comes to mind.) Plus, the thing you’re going to be motivated to read the most is what you’re interested in. For ease in reading level you might find something that suits around middle/grade or YA, but I really recommend picking a book that genuinely sounds intriguing to you.",""
"ls7qjx5","Unhappy_Current8928","2024-10-16 15:31:51 UTC","Hey! I am an avid reader and learnt Swedish and German solely by reading books in those languages. Here is my takeaway:
 Most people who talk about using books to learn a language offer extremely unhelpful and unrealistic advice. Jumping straight to complex works like Goethe's Faust to practice your german, just because it happens to be one of the greatest literary works in german is not a particularly good idea and yet people kept suggesting it to me. Annotating books and looking up every single word isn't going to be particularly helpful either, nor is it sustainable in the long run. 


 Reading books that are easy or books you have already read as others mentioned is a great place to start. Regardless of that, read books you are actually interested in reading to ensure that the whole thing won't feel like a chore. I would also suggest starting with books that have been translated rather than written in this language as the vocabulary is usually simpler. Remember the more you read, the more often you see the same words over and over again and the easier it is to learn them.  


I for one read a lot of agatha christie books in Swedish. They are easy to read, keep you wanting to read more to see what happens and use everyday vocabulary. If you like crime fiction in general I'd say it's the perfect genre for language practice. ",""
"lrphvx8","Letters_to_Dionysus","2024-10-13 12:06:32 UTC","I would check out the library and see if they have any picture books",""
"lrpjbgr","BookLover6362","2024-10-13 12:18:35 UTC","Instead of reading books start playing an online game like Grepolis on a server using the language you want to learn. In convos with game alliance mates you will learn all the basics. Then you can start reading books.",""
"lrpf2w9","NommingFood","2024-10-13 11:41:31 UTC","That sounds like an apt comparison 😆","lrpcwgh"
"lrqffyn","adlittle","2024-10-13 15:44:58 UTC",">gardening with a nuclear weapon

Thank goodness Project Plowshare stopped before it got to that point.","lrpcwgh"
"lrrfh6e","Acid_Monster","2024-10-13 18:57:54 UTC","I’d also suggest reading something you’ve read multiple times before, and know well. 

Something like the first Harry Potter book is a great example for a lot of people, since it’s a low reading grade and many people have read it a lot of times.","lrpcwgh"
"lrqkznj","ktrezzi","2024-10-13 16:15:06 UTC","I'd try it with children's books that are interesting for grown ups, my favourite is Gombrich's ""A little history of the world""","lrpcwgh"
"lrsr1rr","OptimisticOctopus8","2024-10-13 23:28:45 UTC","To be fair, nuking a garden does get rid of weeds *very* quickly. A nuclear bomb is also effective as a pesticide. Maybe too effective.","lrpcwgh"
"lruuk52","Pvt-Snafu","2024-10-14 10:45:07 UTC","I recommend starting to read fairy tales that you know in your native language.","lrpcwgh"
"lrpe0hs","NommingFood","2024-10-13 11:31:27 UTC","So something like the equivalent vocab level of Geronimo Stilton? Fortunately the language also uses english alphabets so I don't have to start with baby/toddler books 😅","lrpdebh"
"lrpetra","NommingFood","2024-10-13 11:39:12 UTC","Ooh I'll look around for an e reader app. Thanks! I'm too used to gutenberg or physical books if it's a novel","lrpe84s"
"lrpogpr","graduallydecember","2024-10-13 12:59:03 UTC","+1 for Harry Potter! Read it in French when I was learning - translator made up their own puns and word plays that aren't in English so that's a bonus :D","lrpeeor"
"lrrwshj","SquashCat56","2024-10-13 20:30:48 UTC","Agreed! I've also read Harry Potter in two of my second languages. It's a lot easier if you have read the books in your native language first, but with patience it's pretty doable if you haven't as well!","lrpeeor"
"lrs3f1m","klassobanieras","2024-10-13 21:06:55 UTC","+1 for rereading a book you already know. I had good results with Stephen King.","lrpeeor"
"lrz1jld","Visible-Paramedic-80","2024-10-15 01:38:56 UTC","Ahaha I also read Harry potter when starting to read in Japanese!","lrpeeor"
"lrpge4j","NommingFood","2024-10-13 11:53:25 UTC","Oh wow, translation is all I go for when idk what the word means. Thanks for pointing that out. I'll check out Kobo","lrpfx2b"
"lsr38nc","Glass_Possession1470","2024-10-19 22:10:37 UTC","for curiosity - how many books did you read to be able to read heavy classic?","lrpffvc"
"lrz3gql","CrazyCatLady108","2024-10-15 01:50:57 UTC","you would like to read it на Русском. just to get you closer to that goal.","lrxqngg"
"lrygjh7","cryincrawdaddy","2024-10-14 23:26:35 UTC","I read the Harry Potter books to help me with Portuguese…it’s a great choice!  Not only do the books increase in difficulty with each volume, they were popular enough that they might also be available as audiobooks (I was able to find them on YouTube). I found the combination of reading and listening to be very helpful.","lrrfh6e"
"lrt1zbi","Synaps4","2024-10-14 00:39:51 UTC","Yes and reading crime and punishment in a foreign language is very effective at exposing you to challenging new vocabulary.  Maybe too effective.

Hence the comparison.","lrsr1rr"
"lrpg36q","Sunny-890","2024-10-13 11:50:43 UTC","I'm currently reading a Diary of a Wimpy kid book in my target language and I've picked up a lot of vocabulary and some grammar from it, and my level is around B1-B2. I highly recommend reading books like that, even if it's just to learn a little bit of vocabulary.","lrpe0hs"
"lrpow9x","daniu","2024-10-13 13:02:12 UTC","Harry Potter series were written for the children in the corresponding school grade they were about and have noticeably increasing language levels across the books. 


You can also try comics, Tintin or Asterix maybe. ","lrpe0hs"
"lrq96za","Merle8888","2024-10-13 15:10:03 UTC","I started with news articles, then moved on to fiction once those were no longer frustrating! ","lrpe0hs"
"lruopr6","Deleted","2024-10-14 09:40:25 UTC","Goosebumps might be a good option too, check it out""","lrpe0hs"
"lrpoud1","Smooth-Review-2614","2024-10-13 13:01:49 UTC","For apps, Kindle, Nook, Kobo, and Adobe all have apps. If you have downloaded Gutenberg Project books odds are you used Adobe Digital Reader. 

These are all free. You just pay for the materials you buy. ","lrpetra"
"lrpq3ej","Pawsandtails","2024-10-13 13:10:58 UTC","I did this. My kindle has the vocabulary builder active and as I highlighted a word it stored it, so you could practice it afterwards. Helps tremendously to learn new words.","lrpetra"
"lrw11l0","FalcoLX","2024-10-14 15:33:27 UTC","I used the Kindle vocabulary builder list to track all the words I looked up, then I added them to anki flash cards so I could practice them. Chances are that if you look up a word once, it will reappear later in the same book. ","lrpetra"
"lrqzf8a","Rosewood5763","2024-10-13 17:33:27 UTC","I can't get over the fact that Tom Riddle is Tom Elvis Jedusor in the French translation.","lrpogpr"
"lss7iw8","Book_Lover_fiction","2024-10-20 02:28:25 UTC","Crime and Punishment, The Idiot 
Just these two !

But I still can't read Dickens books","lsr38nc"
"lrz7e86","helvetin","2024-10-15 02:16:12 UTC","естественно","lrz3gql"
"lse6aiq","flipgirl12","2024-10-17 17:22:05 UTC","A different perspective. I have read the Harry Potter books in three languages and the only ones I really liked were in my main language. I feel like this is because there are a lot of completely made-up words that did not flow easily in my reading in the foreign languages and sometimes I wasn't sure if something was actually a real word or made up.


Eta: I wrote this comment before finishing the whole thread. And wow, the reviews about reading Harry Potter in other languages are definitely mixed!","lrygjh7"
"lrqons7","thelaughingpear","2024-10-13 16:35:27 UTC","Harry Potter is a terrible recommendation for people with a B2 or less in their 2nd language. The book is easy in one's NATIVE language because kids grow up learning words about textures, furniture, magic, architectural elements and just naturally absorbing that information. In a SECOND language it's extremely tedious and can even be discouraging.","lrpow9x"
"lrv8gi6","thisismego","2024-10-14 12:41:20 UTC","In German they managed to get close: Tom Vorlost Riddle","lrqzf8a"
"lrqq5r8","daniu","2024-10-13 16:43:42 UTC","No idea how it reads in your first language tbh, I only read it in my third and fifth (English and Chinese, respectively).


The point of reading is not learning vocabulary but getting a grasp on sentence structure is where I'm coming from, but ymmv of course. ","lrqons7"
"lrqweu5","CharmedMSure","2024-10-13 17:17:43 UTC","I enjoyed reading the Harry Potter books in French (not my native language), starting with the first book. Oddly/fortunately, I had not previously read the books in my native language.","lrqons7"
"lru7pmy","ZuzKas","2024-10-14 06:11:12 UTC","I think it might be hard for someone, but I read HP in my Language for so many Times that I didnt have any issues when I read it in original, so maybe if someone know the book already it might not be that hard 🤷","lrqons7"
