"comment_id","user","time","message","parent_id"
"lstmcdm","EverybodyLovesCrayon","2024-10-20 10:32:03 UTC","This is specific to two authors.  I've always liked Dostoyevski better than Tolstoy.  But my favorite book is Anna Karenina (Tolstoy).  I've read multiple books by both.",""
"lstmjer","sassyroe777","2024-10-20 10:34:17 UTC","How do you guys even have favorite books? I get a new favorite every week. I'd have to say favorite in this trope or favorite in this genre to even be able to give a true list😂😂 I have many favorites.",""
"lstxwoc","astrotastic_el","2024-10-20 12:23:07 UTC","Wow, you and I are actually literary soulmates.",""
"lsu1d06","QuyynseyFae","2024-10-20 12:50:07 UTC","Until recently, my favorite book was ""Lamb"" by Christopher Moore, who happens to be my favorite author. I read ""Project Hail Mary"" (Andy Weir) recently, and the more I think about it, the more I believe it's taken the spot of favorite for me.",""
"lsu4ehm","ibite-books","2024-10-20 13:11:50 UTC","oscar wilde, the picture of dorian gray

but is he my favorite author? i’m not sure",""
"lsu9mef","Disastrous_School399","2024-10-20 13:46:59 UTC","Consider the Preston and Child series with FBI agent Pendergast.",""
"lsumptc","VG_writes","2024-10-20 15:04:40 UTC","Haha, well, my favorite book is *The Last of Love...*and it just so happens to be written by my favorite author (it's me!). I mean, who else can capture my inner monologue so well, right? 😂

But in all seriousness, I think there's something special about writing a book and seeing your creative vision come to life. Plus, supporting myself is a full-time job, and what better way than to read (and re-read) my own masterpiece? The post-apocalyptic romance genre needed a little shake-up, and I decided to deliver!

How about you...favorite book and author combo?",""
"lsus50v","red_scarf_fairy","2024-10-20 15:34:51 UTC","A Good Girl's Guide To Murder - Holly Jackson",""
"lsv091j","Khajiit_knows7","2024-10-20 16:18:36 UTC","My favorite book is The Once and Future King by EB White but my favorite writer is Erik Larson",""
"lsv7y6g","Own_Kaleidoscope5512","2024-10-20 16:59:05 UTC","By favorite author is my favorite author because he wrote my favorite book, so yes",""
"lsvl68m","Yellow_Loquat_553","2024-10-20 18:05:52 UTC","My favourite book is Atonement by Ian McEwan but I struggle to connect with any of his other books I've read so far. I also love The Virgin Suicides by Jeffrey Eugenides, but I haven't read any of his other works. So no, my favourite book is actually not written by my favourite author. Tbh I don't even know who to choose as my favourite author. Jane Austen probably.",""
"lswci1u","Emotional-Deer-2618","2024-10-20 20:23:34 UTC","One of my favorite books is Almond and it‘s not written by my favorite author. The rest (which is 3 books) are all written by my favorite authors. I think that’s mostly because I‘m already familiar with the writing style and because I love it I already know what to expect.",""
"lswpogl","Yeomanticore","2024-10-20 21:31:26 UTC","Big time. Angels and Demons by Dan Brown. Planning to start collecting Dan Brown books for Christmas as gift to myself, haven't read them since college.",""
"lsws4v7","Deleted","2024-10-20 21:44:59 UTC","Proust, In Search of Lost Time. It took me decades to muster the courage to read it, but I think the timing (no pun intended) was right for me.",""
"lsxaf3d","Euphoric-Image-6491","2024-10-20 23:33:30 UTC","Yes!  The Book of the New Sun by Gene Wolfe",""
"lsxpr13","Raincleansesall","2024-10-21 01:08:54 UTC","My favorite book is “Golden Vanity,” by Rachel Pollak. It’s an obscure science fiction novel that stuck with me and is the first book I ever bought on Amazon years ago. I remember it took weeks for a copy to be found (back in the early days you could request used books and someone or something would hunt them down). These days there's a Kindle version. My favorite author is James Thurber. His essays are hilarious and resonate today. They also offer a window into what life was like in the early 20th century.",""
"lsxuoaz","HokieBunny","2024-10-21 01:39:29 UTC","My favorite Richard Adams book is Shardik. 

My favorite book is Blood Meridian, but even though I have tremendous respect for McCarthy as an author, I think a ""favorite"" author would have to be someone whose work I found more uniformly enjoyable. Susanna Clarke maybe, even though she's only written a few books? Maybe Jeff Vandermeer?",""
"lsxv4va","QuietRulrOfEvrything","2024-10-21 01:42:20 UTC","Robert Heinlein wrote both FRIDAY and STARSHIP TROOPERS, two books that I truly wish I could read again for the first time.",""
"lsxvv6e","buzzfrightyears","2024-10-21 01:46:56 UTC","Favourite book is Tin Drum Gunther Grasse and my favourite author is Angela Carter",""
"lsybd06","a__kitten","2024-10-21 03:27:23 UTC","I don't have singular favorite anythings really, there's a handful of authors and books that I could probably convincingly argue as having that position. But! One of my favorite books is *Neuromancer* and one of my favorite authors is William Gibson so yeah. Kinda.",""
"lsynscd","abczoomom","2024-10-21 05:09:52 UTC","I have never felt so far removed from humanity as I do from this post. I feel entirely uncultured and under educated reading these lists. I’ve never heard of far too many of them. If forced to choose a single book, I would say Tam Lin by Pamela Dean. If forced to choose a single author, Mercedes Lackey. I am not young, I have read classics, I have even loved a few. But there we are. 

Also, and I mean this with love because I don’t want to judge anyone’s taste, I cannot believe the number of people who said Watership Down is their favorite. I’m low-key concerned for you. I have read it. I have seen the movie. I read it because I liked the movie. That was the most depressing book I have ever come across, and how it got made into a cartoon that was shown unironically to children I do not understand. Honestly the only book that has ever disturbed me more was My Sweet Audrina and if you know anything about VC Andrews you can make your judgement call on that.",""
"lsz5z0p","malifer","2024-10-21 08:28:12 UTC","No. I use to not have a favorite author. I may like a book, but not be interested in the premise of the author's next book. 

My favorite book, ""Is Do Androids Dream of Electric Sheep?"" by Philip K. Dick. This may have been one of those perfect books at the perfect time, but it really spoke to me. There is so much about a desire to be loved and needing a sense of belonging in a dreary Sci-Fi setting. One day I hope somebody turns the book into a movie. 

My Favorite author Terry Pratchett. I will read every book he wrote. His humor and wit amuse me to no end and make me think I could never write anything as good. The worst book by Pratchett I will still think is good. I savor the Discworld books. I can't read them back to back, because I find I lose appreciation for them. I have to read other books in between that will always seem mediocre by comparison. One day I will read my last Discworld book and I will be quite sad.

Favorite Discworld book, The Truth, in which the newspaper is invented in the fantasy world and hi-jinks ensue.",""
"lt0iqqu","EveOfEV","2024-10-21 14:55:36 UTC","My favourite author used to be Philip K Dick. It was a serious obsession! Then I read Earthly Powers by Anthony Burgess and no one else mattered. 

My favourite author tends to shift with a new favourite book — Chuck Palahniuk was my favourite writer before I read Philip K Dick’s The Three Stigmata of Palmer Eldritch, which is such a work of perfection. Now I’ve shifted to Carl Jung as my favourite. But Earthly Powers is still the best gd book I have EVER read, fiction or nonfiction. Just thinking about it gives me chills.",""
"lt10t1j","Impossible_Strain319","2024-10-21 16:30:52 UTC","Maybe? Cormac McCarthy is my favorite author and his Suttree may well be my favorite book.",""
"lt12mga","Legal_Mistake9234","2024-10-21 16:40:16 UTC","I’m not sure who my favorite author is but I’ve read a bunch of Elizabeth Wein’s books but I’ve also read a bunch of Orson Scott Card. But I don’t think so. I think my favorite book is the Book Thief or maybe Stories of Ibis. I think I’ll say my favorite author is Wein and my favorite book is Book Thief which isn’t written by Elizabeth Wein so, no I guess.",""
"lt3djis","Fun_Camp_2078","2024-10-22 00:01:07 UTC","Dostoevsky favorite writer.
Favorite novel The Brothers Karamazov.",""
"lt5u5uw","Deleted","2024-10-22 12:26:44 UTC","My all time favourite is The seven husbands of Evelyn Hugo written by Taylor Jenkins Reid. I also read Daisy Jones & The Six but I didn't like it as much as the one I mentioned before.",""
"lt7pr5o","Fit_Blacksmith_8180","2024-10-22 18:36:00 UTC","The Grapes of Wrath, John Steinbeck

Works for me",""
"ltdh78y","Aware-Mammoth-6939","2024-10-23 17:30:16 UTC","I just read Tales of Watership Down. I love those novels. Stephen King is probably one of my favorite writers, but East of Eden and Timbuktu are probably my two favorite books, but I wouldn't call Steinbeck or Auster my favorite writer.",""
"lwuispn","Max__Fischer","2024-11-13 01:35:11 UTC","For me, yes: My Ántonia.",""
"lspjsu7","Jamgee93","2024-10-19 16:56:03 UTC","Favorite book: The Great Gatsby
Favorite author: Haruki Murakami",""
"lspnh88","Will12182015","2024-10-19 17:15:43 UTC","Yes and no, but that's because my #1 and #2 are at times interchangeable. My favorite author without question is V.E. Schwab, but my #1 favorite book is Middlegame by Seanan McGuire with The Invisible Life of Addie LaRue coming in a very close second.",""
"lsq3mc0","Marcja-","2024-10-19 18:43:54 UTC","for me it really depends i read dark romance and my fav book is the ritual by shantel tessier but my favorite author is neva altaj. i just didn’t really enjoy the rest of shantel’s tessiers books this much and nevas books are all amazing just none of them is like my favorite",""
"lspj83r","spursbob","2024-10-19 16:52:52 UTC","My favourite sci-fi/fantasy author is Jack Vance. I assume Simmons is a big Vance fan since the author character in Hyperion is famous for writing books titled The Dying Earth and mentions he could title the books with that same since the copyright of the Vance books has long ceased.","lspi0qr"
"lspped8","ArmadilloFour","2024-10-19 17:26:10 UTC","*The Terror* was a masterpiece, and in a weird, flawed way I think *Abominable* was too. Yeah it had a ton of really slow chapters on alpinist equipment, and yeah the climax was sort of dumb, but I thought that it was 95% a hypnotic and meditative ride that I loved taking.","lspi0qr"
"lsq269o","FertyMerty","2024-10-19 18:36:05 UTC","I looooooove Hyperion Cantos and sadly didn’t like any of his other books. I read them before Hyperion so I took way too long to try his best work.","lspi0qr"
"lspnxat","pleasecallmeSamuel","2024-10-19 17:18:10 UTC","You beat me too it! I've been slowly working my way through Simmons' bibliography after finishing the Hyperion Cantos, and I just finished Summer Of Night. He may very well be my favorite living author of fiction!","lspi0qr"
"lsqgvu8","Alternative_Lack22","2024-10-19 19:59:12 UTC","And I have all of her books!  And the rest of British best detective mystery/thrillers writers, numbered in sequence on the backs (on little circle label) in tubs, in storage.  Bring one box home at a time to reread and reread and…","lspklae"
"lsqq553","Ukyo__Kuonji","2024-10-19 20:52:11 UTC","Instant upvote","lspklae"
"lsrin5f","Majesticsomething408","2024-10-19 23:46:05 UTC","and his humor. Or god, the moment when he described the moment when he wanted to look at the time, by habit aimed for the hand looking for the watch, but came across his now tattooed number. Then made a fool about himself to ease the pain a bit. THIS. THIS IS WRITING.","lspjb8h"
"lsrwmns","PM_BRAIN_WORMS","2024-10-20 01:16:20 UTC","Are you going to answer the question?","lspjb8h"
"lsu3hwx","Warm-Soup-Soft-Heart","2024-10-20 13:05:33 UTC","The Ballad of Reading Gaol is really really great. Loved it when I read it, just like with The Picture of Dorian Gray. Oscar Wilde is one of my favorite authors, too. :)","lsq4259"
"lstlq4d","KindlyReception5906","2024-10-20 10:25:03 UTC","That is really surprising to me! Orlando takes all the quintessential Woolf elements and just turns it up a notch. So you have tried the waves and or Mrs Dalloway? They have the same playfulness, focus on time and gender themes?","lspou9m"
"lspr46n","iverybadatnames","2024-10-19 17:35:34 UTC","My Antonia was such a good book. I was blown away by how good her descriptions were, especially when describing plants and landscape.","lspjzjd"
"lssh9p1","stupidshinji","2024-10-20 03:36:11 UTC","I'm about halfway through Shadow of the Torturer and was wondering the odds of finding someone mentioning Wolfe in this thread. Surprised I found it so quickly lol.","lspjzjd"
"lsske1q","stupidshinji","2024-10-20 03:58:56 UTC","Gravity's Rainbow is my favorite book but John Barth is my favorite author (Pynchon is a very close second). I'm long over do for a reread of both Mason & Dixon and Moby-Dick.","lsppn2s"
"lsqfc9c","BabyAzerty","2024-10-19 19:50:27 UTC","Did the report make the book your favorite? Or was it the other way?","lsppq30"
"lsqnrbo","Acid_Monster","2024-10-19 20:38:35 UTC","Oooh good to see Tchaikovsky on here, assuming you mean Adrian Tchaikovsky? 

I’ve read the first two books in the Children of Time trilogy, about to read the third, how did you find book 3 (no spoilers please :) )

And how do his other books compare for you? Children of Time was incredible when I first read it!","lspnfcw"
"lsq1q28","Deleted","2024-10-19 18:33:40 UTC","Have you read Beagle's new book?! It's called ***I'm Afraid You've Got Dragons*** and it is wonderful.","lspzm43"
"lsq2mji","FertyMerty","2024-10-19 18:38:32 UTC","Reread Lonesome Dove this year…what a book. Made me so nostalgic for Texas.","lspmfup"
"lsqf869","LittleBlag","2024-10-19 19:49:47 UTC","I’m the same! I’m always impressed by people who can so confidently point at a single example and say “that one!” Mine changes with my mood, the season, time of day, etc etc","lsq11ew"
"lsvjvq5","pltkcelestial18","2024-10-20 17:59:25 UTC","I'm the same.  The only favorites I can name with no question would be my favorite color (blue) and favorite holiday (halloween).  But I don't have favorite books or authors or bands or movies or tv shows or genres of any of those.

There's definitely books I gravitate towards and I can say I like a particular author, but I wouldn't say any one is my favorite.","lsq11ew"
"lsrocn1","Squirrelywhirl","2024-10-20 00:22:49 UTC","I love Danse Macabre! Have you read On Writing? Love that one too","lsprswd"
"lsqkuxb","Appropriate-Look7493","2024-10-19 20:22:08 UTC","It’s a pretty good choice. Better than most of the favourites listed here.","lsqac31"
"lsy1es5","sausagekng","2024-10-21 02:21:59 UTC","Could've written this answer myself. Love Jane Eyre a lot as well.","lsqac31"
"lsr09ir","ms_merry","2024-10-19 21:52:00 UTC","I absolutely loved that book. I didn’t realize until after I read it that it was Ishiguro. Totally different from the three I’d read previously.","lspv7i5"
"ltbig7p","megbnewton","2024-10-23 10:25:30 UTC","He’s one of my favorite authors!","lspv7i5"
"lsqmcv3","metropolisone","2024-10-19 20:30:35 UTC","Stephen King is also my favorite, but my favorite book is The Left Hand of Darkness. While LeGuin is definitely up there in my favorites, I just find King to be a comfy read. I'm almost certain I will enjoy a book of his.","lspik73"
"lsxnwza","Raincleansesall","2024-10-21 00:57:39 UTC","Fear and Loathing is my go-to gift book for readers who have never experienced this book. So frikkin’ awesome.","lsphvp8"
"lspr9vj","Fro_o","2024-10-19 17:36:27 UTC","I would hope your life philosophy is not based on Humbert Humbert xD","lspjr8w"
"lsqfly7","BabyAzerty","2024-10-19 19:51:58 UTC","Very solid. Nice books.","lspjr8w"
"lspmtet","NOLA-Gunner","2024-10-19 17:12:09 UTC","Going to to tackle Ulysses soon, any tips ?","lspiwy2"
"lsqn38a","videovillain","2024-10-19 20:34:46 UTC","I really enjoy Jung too! Never read Ellenbetger’s book though, now I will!

You might enjoy “Being You” by Anil Seth and “I Am a Strange Loop” by Douglas Hofstadter.

They both are more science, math, and reasoning heavy when it comes to consciousness, but because they are done so well it really is interesting and fun if you’ve already got a solid footing and interest in consciousness!","lsps9sn"
"lsqz96w","peggysnow","2024-10-19 21:45:48 UTC","I adored the whole Beartown trilogy!","lspk4in"
"lsr28an","rumosz","2024-10-19 22:04:18 UTC","Complicity is great, if you're curious. The Bridge is also considered one of his best.","lsptcw0"
"lsxofu0","Raincleansesall","2024-10-21 01:00:52 UTC","“East of Eden” is amazing. I read this for the first time a few month ago based on a comment I read on this sub. Even my wife, who is not a reader, got into it when I told her what was going on. At night I’d read to her and if a few days went by without a chance to catch her up she’d wait up so I could catch her up and read some more.","lsq2il3"
"lsxoo6d","Raincleansesall","2024-10-21 01:02:20 UTC","“Wool” is great! I really enjoyed that book. Howey has a great, smooth, and easy storytelling style; excellent dialogue, too, if I remember correctly.","lsq4dbb"
"lsx9gnw","ttttxxx555","2024-10-20 23:27:35 UTC","Ranking the sequels? Dune messiah let me down, hard. Partly for the story itself and partly bc my book club edition copy had shit printing that would be so faded as to be barely legible on 1/3 of the pages… and mostly because of both. Didn’t have the energy to read further even though I have all six on the shelf","lsqmqza"
"lsr73f2","PsychologicalLet3","2024-10-19 22:34:34 UTC","Also planning to re-read The World According to Garp to decide if it’s a favourite. 

Edit to add that The Great Gatsby is also up there!","lsr6w7l"
"lt7ullm","Fit_Blacksmith_8180","2024-10-22 19:00:58 UTC","if you have not read it yet, I recommend ""The Moon is Down"" not as well known as many of Steinbeck's other books, but one I really liked and I think I have read most everything he wrote, by far my favorite author.","lsr9hco"
"lspo38f","pleasecallmeSamuel","2024-10-19 17:19:04 UTC","Simmons is definitely a Vance fan! He even wrote a novella set within the Dying Earth universe.","lspj83r"
"lsyq07o","3choplex","2024-10-21 05:31:10 UTC","I enjoyed basically all of his books up until Drood/the Terror, etc. At that point he got way too long winded, although some after then were good.","lsq269o"
"lsqg9ck","Deleted","2024-10-19 19:55:38 UTC","[deleted]","lspnxat"
"lstq6s5","Eudaimonia1590","2024-10-20 11:13:16 UTC","Ohh yah that is pretty tragic/comical. But i dont really see him using humor that much... or maybe i am just not seing it. There is that scene when they all arrive in Auswitz and some old guy have a strap for his hernia, which he is told he is not gonna need...   
But do enlighten me more, do you remember any other examples where you see him using humor?","lsrin5f"
"lsvoghv","spooniemoonlight","2024-10-20 18:22:04 UTC","Oh I found that the waves was much harder to get into because it was way more abstract than Orlando was to me. Orlando’s writing system became clearer to me the more I read and I related to their feelings etc and found it beautiful. But the waves was impossible to follow because you had to follow the very very abstracts thoughts of too many characters at the same time and I couldn’t understand what I was reading. I think bc Orlando only focuses on… Orlando it’s easier to end up getting it. But also I gave up the waves and didn’t finish it. And never read Mrs Dalloway","lstlq4d"
"lsskxyd","sporkscope","2024-10-20 04:03:04 UTC","Come check out the Gene Wolf subreddit!","lssh9p1"
"lsv73s8","Aliphaire","2024-10-20 16:54:35 UTC","It was already my favorite. My teacher was surprised that I chose to read it.","lsqfc9c"
"lsqo4da","Taste_the__Rainbow","2024-10-19 20:40:39 UTC","The Final Architecture is a really solid space opera trilogy. I loved book 3 of the Children series but it’s a matter of taste for sure.","lsqnrbo"
"lsq2s32","iverybadatnames","2024-10-19 18:39:22 UTC","Beagle's new book was so good! I'm surprised it doesn't get mentioned very often because I loved it. It was such a fun twist on the usual dragon story.","lsq1q28"
"lsrt64f","jonnywarlock","2024-10-20 00:53:32 UTC","Yep. It's also one of my favorite King books. I really hope he writes a proper full-length autobiography someday.","lsrocn1"
"lsze1pm","VictorWardBodyDouble","2024-10-21 10:02:06 UTC","Ive ended up giving every copy I've bought away, definitely a must read.","lsxnwza"
"lsptt2w","shy5","2024-10-19 17:50:19 UTC","No, not Humbert lmfao (my lawyer brought a rope and a chair into his room for some reason)","lspr9vj"
"lspnbtc","The_Red_Viola","2024-10-19 17:14:54 UTC","Get *Ulysses Annotated* by Don Gifford and maybe also *The Bloomsday Book* by Harry Blamires.","lspmtet"
"lsshxyl","strandgard","2024-10-20 03:41:00 UTC","Oh, I have no interest in science, math or reasoning anymore(or morality for that matter). I like the religious fanatics, the mystics and alchemists.","lsqn38a"
"lsructz","bigwilly311","2024-10-20 01:01:13 UTC","Same but the second one is my favorite","lsqz96w"
"lst0723","Pink_Star_Sprinkles","2024-10-20 06:19:14 UTC","Thank you! I will add to my reading list!","lsr28an"
"lt82nji","TacoLePaco","2024-10-22 19:42:25 UTC","I have everyone of his works in my TBR, hoping to read everyone of them, so definitely going to be reading that one at some point.","lt7ullm"
"lsras73","Opanterra","2024-10-19 22:57:30 UTC","Scariest book Ive ever read.","lsqg9ck"
"lsq8jmm","PlasticBread221","2024-10-19 19:11:43 UTC","Did you like any of his other books? I adore Unicorn and liked A Fine and Private Place, but then The Innkeeper’s Song was sort of weird and Lila the Werewolf simply awful (just my opinion ofc). Want to read Dragons at some point though :3","lsq2s32"
"lsrzozo","Squirrelywhirl","2024-10-20 01:36:42 UTC","That would be soooo good! On writing is one of my favourites too, it’s great","lsrt64f"
"lsqbuvm","iverybadatnames","2024-10-19 19:30:29 UTC","I've only read three of his books. The Last Unicorn, The Way Home and I'm Afraid You've Got Dragons. I started and stopped another one of his books but I don't remember which one.

The Way Home is actually two novellas. The first one had Schmendrick and Molly Grue in it and the second one had a new character. Neither story really captured that magic I was hoping for.

Dragons was amazing though. It was whimsical and the characters in it were a lot of fun.","lsq8jmm"
"lsrt6zb","Turbulent-Display805","2024-10-20 00:53:41 UTC","I thought A Fine and Private Place was really lovely and adored The last Unicorn.  I’m adding I’m Afraid You’ve Got Dragons to my tbr, and probably not any others.","lsq8jmm"
"lsqjpjr","PlasticBread221","2024-10-19 20:15:29 UTC","Ohhh now that you mention it, I actually read one of the novellas I think, Two Hearts, about the little girl from the village plagued by a gryphon or some beast like that. It’s obviously not as memorable since I forgot to list it but then again Unicorn set the bar *very* high. :) Will look into the second one!","lsqbuvm"
"lst8ts9","PlasticBread221","2024-10-20 07:55:17 UTC","Hope you haven’t decided to avoid his other books based solely on my comment. Plenty of people liked them well enough. 😅 Even, bafflingly, Lila the Werewolf which imo is only good for kindling and even then the resulting smoke might make you nauseous. Ehm.","lsrt6zb"
"lstf4ie","Turbulent-Display805","2024-10-20 09:08:03 UTC","😂 Evocative imagery.  Fair enough, though.","lst8ts9"
