"comment_id","user","time","message","parent_id"
"lsyu15p","Chipring13","2024-10-21 06:12:13 UTC","I’d rather reviews like yours over the first page of GoodReads which is literally just rewriting the synopsis of the book 20 different ways. Just tell me if you liked it or not!!! I already read the description I don’t have to read it from your review too!!","lsu443j"
"lszzc3a","phone-alt","2024-10-21 13:00:55 UTC","I keep a private book journal for this very reason! (Basically just a powerpoint where I put the book cover and my thoughts).


It's never posted anywhere so I can get all my honest opinions out without harming any feelings or getting into any internet arguments in the process. 


It's more of a diary/personal project than a formal book review. I'd recommend it for anyone who doesn't want to post publicly.","lsu443j"
"lwdd7il","ef-why-not","2024-11-10 05:36:52 UTC","Just reminding you that you are NOT stupid or dumb! It's actually the process of writing itself that helps to make scrambled egged thoughts (not that there's much wrong with that though) into cohesive and comprehensible ideas. You can totally do it! ","lsu443j"
"lsxyisu","FoxTofu","2024-10-21 02:03:37 UTC","Just the first sentence you wrote there made me think that I would love to read your reviews.","lsu443j"
"lsy1wl7","Silent_Ad379","2024-10-21 02:25:10 UTC","Write a messy review just to get your thoughts out","lsu443j"
"ltdus71","bread-is-my-friend","2024-10-23 18:38:28 UTC","I think I would like it if Goodreads had a private review function so I could express my thoughts about books without others seeing it. Currently I track my books on goodreads and in a spreadsheet and in the spreadsheet I have a cell for writing any comments I have. The good news is that actually expressing your thoughts on books makes your brain less scrambled though lol","lsu443j"
"ltfgx26","crk109","2024-10-23 23:49:27 UTC","You are definitely not stupid and I like the way you express yourself. I think you really should write reviews!","lsu443j"
"lswfosv","canijusttalkmaybe","2024-10-20 20:39:53 UTC","> Sometimes as I’m reading, I think about what I will write too haha, like for example right now I’m listening to a book whose main character I hate, and I can’t wait to write about why I hate him lol.

Most characters are pretty meh. Every once in a great moon, there's a character that's exceptionally memorable. But for my liking, finding a character you can really hate is a delight.","lsu77qa"
"lwddmvv","ef-why-not","2024-11-10 05:40:32 UTC","Oh this is so true. Sometimes it's so important to know what the strengths and the weaknesses of the textbook are and there's literally nobody on the internet who has mentioned the textbook in question. Wish people wrote more about textbooks! You're doing such a great thing when reviewing them! ","lsu78f3"
"lsuxdf7","terriaminute","2024-10-20 16:02:59 UTC","This is awesome.","lsu78f3"
"lsvrjci","Glass_Possession1470","2024-10-20 18:37:31 UTC","Just wanna say personal feeling matters - sometimes I feel I cannot find logistics for my like/dislike, but I would just express it out.","lsu5uld"
"lsvoejy","Dry_Writing_7862","2024-10-20 18:21:48 UTC","Same. Specific thoughts only. More so, I review some books on social media if I feel led but certainly not every book. I feel like a star rating suffices just fine.","lsutgxs"
"lsvwgp4","violetmemphisblue","2024-10-20 19:02:44 UTC","I agree! I find GoodReads reviews and the like to be kind of worthless in determining what to read. In part because of the people who review the way you mention (Character is named Kyle, I hate that name, I couldn't read it! Or, story took place in my hometown, love to see it, five stars!) And in part because so many ""reviews"" are actually book reports. I don't want a full synopsis! Or they're meaningless to me because Katie just puts it's her favorite book of the year, but I don't know what else Katie has been reading, so what's it in competition with? At most, if I'm picking for a book club or something, I'll scan reviews to make sure the book seems in alignment with the vibe of the group, but the rest of it just makes me kind of roll my eyes...like, go for it and have fun, but it's not really that serious.","lsuzp2w"
"lsy9aaq","Honeycrispcombe","2024-10-21 03:13:16 UTC","Yeah I have a book journal I love but I don't feel the need to write reviews (although I did have a book blog for a while that I enjoyed too!)

It's nice to jot things down without worrying about how it's written.","lsuad9j"
"lsvh6ty","MultiFazed","2024-10-20 17:46:04 UTC","Glad I'm not the only one. I'll happily share recommendations with friends and family, but the entire world at large doesn't need my personal opinions about products or services.","lsu8oq4"
"lsuq2vk","Delicious_Maize9656","2024-10-20 15:23:24 UTC","Every type of book, and on Goodreads if you write many reviews, you can rank among the top 100 reviewers for this week, this month, and this year. That's pretty cool!","lsuldx9"
"lsvt8rk","Delicious_Maize9656","2024-10-20 18:46:17 UTC","Is that your app? Wow, that's really cool! May I ask how long it took to create an app like that?","lsvpom5"
"lsy4mau","goatlover19","2024-10-21 02:42:21 UTC","I won’t yuck someone else’s yum in reviews. Yes, the reviews are for other readers but that also includes readers that enjoy the book. A 3 star or below rating says everything it needs to. I don’t need to go into detail why I don’t like a specific book. (If there’s a major flaw in the book I might address it but me just not enjoying a book, nah I won’t say that.)","lsy3o7m"
"lsy2lps","asexual-Nectarine76","2024-10-21 02:29:29 UTC","I have a disclaimer in my profile that I'm only writing book reviews for myself; that I'm not trying to be a rockstar reviewer on goodreads.","lsu9srj"
"lsvv09f","CocoaBleu","2024-10-20 18:55:13 UTC","One time an author came to me specifically to ask me to read and review their book and I was like noooooooo… I am not good with this for a couple of reasons: I don’t like insulting people. And 2. I don’t work well when I am being expected to give an opinion on something I know that someone put a lot of effort in. Unfortunately I didn’t like the book and then I was in the dilemma of what to say because they was on me for my opinion. I think I wrote something like “This book is a rollercoaster ride with too much alcohol involved.” The books MC drank way too much and kept making stupid choices because of it, I only finished it because the author kept checking in with me… 🤦🏾‍♀️","lsu5xxs"
"lsugyds","Braign","2024-10-20 14:32:13 UTC","Damn this thread is so cute 🥲 also a lil bit of ""tell me you have anxiety without telling me"" lmao","lsu5xxs"
"lswby9o","ghjkl098","2024-10-20 20:20:42 UTC","I get it, but reviews are not for authors they are for other readers, so if an author reads reviews they either need a tough skin or to stop reading them","lsu5xxs"
"lsyysrt","Mornedhil","2024-10-21 07:04:24 UTC","Oh I used to be the same but once I wrote a review specifically to hurt the authors feelings! I initially wrote a very mild review but then found the authors social media where they posted screenshots of negative reviews and absolutely bashed on perfectly fine critique: calling reviewers names, saying they lack critical thinking and good taste. So mean! I went back and rewrote my review to be more straightforward and it get sooo good tbh","lsu5xxs"
"lt1rlu0","kkmockingbird","2024-10-21 18:48:03 UTC","Yes 100%! I definitely got way more into this book once I started actively hating the MC lol. ","lswfosv"
"lsvxafr","BabyAzerty","2024-10-20 19:07:01 UTC","Thank you 😊 

Yes I built it (I am an iOS developer). I couldn’t find exactly what I wanted which is a book tracker with a focus on note-taking and free of all kinds of distractions. 

Also, I usually read classics and I have a few books which are « Complete » editions with many stories in a single volume, like « Complete Stories » of Edgar Poe. 

I was surprised to see that there wasn’t a single app which could support multi-stories books. 

As for the time, it took me about 2 months to create a minimum viable product and another 2 months to fix all the bugs, improve the UX, make it less a « me » app and more a « everybody’s » app.","lsvt8rk"
