"comment_id","user","time","message","parent_id"
"lsu443j","Artistic_Regard","2024-10-20 13:09:50 UTC","I have much opinions and I wanna write reviews, but I can't words no good and my thoughts are scrambled eggs so I don't write reviews. I guess what I am trying to say is I am too stupid and dumb to write a reviews and people will be mean to me saying my opinion is wrong and I will second guess myself and wondering if maybe I just didn't explains it well because I can't do words or maybe I am just wrong or have bad taste. In short, I have no spine and I am a coward.",""
"lsu77qa","kkmockingbird","2024-10-20 13:31:09 UTC","I have a goodreads and always star rate them… I would say I end up actually writing a review for probably half. I usually end up writing one if I have really strong feelings about the book. Sometimes as I’m reading, I think about what I will write too haha, like for example right now I’m listening to a book whose main character I hate, and I can’t wait to write about why I hate him lol. 

That being said, my mom asked me to send her emails with reviews of every book I read so she can get recommendations. She doesn’t have Goodreads/isn’t great with technology lol. So I do end up writing a short review for every book in the end lol, I usually write her like 1-2 sentences though and it’s just a short summary/blurb and high points of why I did or didn’t like it but also I try to tailor it to her tastes too. ",""
"lsu78f3","Delicious_Maize9656","2024-10-20 13:31:17 UTC","For textbooks, there are far fewer people writing book reviews compared to fiction, which I find really heartbreaking because textbooks are also important for many people and for our society. So if I finish a textbook, it’s a must for me to write a book review on Amazon and also on Goodreads. The authors who work really hard should receive more appreciation.

  
P.S. My field is physics.",""
"lsu5uld","Deleted","2024-10-20 13:21:49 UTC","[deleted]",""
"lsu9dr6","censorized","2024-10-20 13:45:26 UTC","Nope. I don't read reviews on those sites, so I don't write reviews on those sites.",""
"lsutgxs","helloviolaine","2024-10-20 15:42:02 UTC","I only do it if I have something specific to say. I once read a nonfiction book about something Sherlock Holmes related and the author casually spoiled multiple Agatha Christie books without warning, which wasn't exactly something I expected because the book had nothing to do with Christie. I thought people should be warned and mentioned it in my review. I usually give a star rating, mostly for myself, but I don't really bother if all I have to say is ""I liked this""",""
"lsuzp2w","DisastrousBike62","2024-10-20 16:15:34 UTC","Honestly, here’s a shocker: I hate writing book reviews. I’m that person who thinks not every opinion needs to be shared online. Not sorry about it. Do we really need more people clogging up Goodreads with reviews like ""I hate this book because the main character has the same name as my ex""? No thanks! I just enjoy reading for the experience, and if the book’s good, I let it live rent-free in my mind. I'm not saying sharing thoughts is bad,  but come on, some folks act like their reviews are the most important thing about the book. Write your reviews if it makes you happy, but let's not pretend it’s a necessity for everyone. Some of us prefer to keep our opinions off Amazon’s top results.",""
"lsuad9j","Maiden_Sunshine","2024-10-20 13:51:49 UTC","Occasionally. I mostly keep private notes, but sometimes I will write written notes on Goodreads or Storygraph. If a newer or smaller author I will sometimes try to write a public review, but still rare.


I don't read reviews until after I finish a book though, or never plan to read it. 


I also don't publicly rate often because most of my reads are 3.5 - 4.5 and Goodreads doesn't have half stars yet. So only solid 3, 4, or 5 get rated.",""
"lsuarpa","Bodidiva","2024-10-20 13:54:20 UTC","Sometimes but not often enough. I struggle to review without spoilers and I don't want to be that person.",""
"lsvcjj8","CleverGirlRawr","2024-10-20 17:23:02 UTC","Nope. And I never read them either, because reviewers tell you the whole damn story. I like to know if something is sad, funny, a character-driven story, etc. but beyond that I don’t want to read about it because of spoilers and people thinking so highly of their own opinions. ",""
"lswo960","SpartiateDienekes","2024-10-20 21:23:47 UTC","Nope. Honestly, outside of my close friends and family I don’t see why anyone would be interested in my opinion. 

I do notice the irony of typing that opinion on a Reddit thread.",""
"lsu4irx","blueblueberry_","2024-10-20 13:12:41 UTC","Sometimes I do, sometimes I don't. If I do it's to process my thoughts and feelings about what I read, so it's for myself more than for a third person to read.",""
"lsu8oq4","Maximus361","2024-10-20 13:40:58 UTC","I’m 53 and have never written a book review or any kind of review at all actually, not for restaurants, hotels, products, movies, etc…",""
"lsu6pme","doonkune","2024-10-20 13:27:42 UTC","Reading is a personal journey. If you want to collect your own reviews so you have a tangible representation of what you've completed I can support that. I personally would never do that because I'm a re-reader.",""
"lsu94ry","Elegant-Ad-1540","2024-10-20 13:43:51 UTC","Well, I have a notebook where I write reviews. I don't like writing reviews on any websites or apps.",""
"lsud7kw","Anxious-Fun8829","2024-10-20 14:09:31 UTC","As someone who relies heavily on reviews to decide if I want to buy or start a book, thank you to all those who write them. ",""
"lsudt52","Mmzoso","2024-10-20 14:13:12 UTC","I tend to write reviews about books that I feel strongly about, good and bad. For books I’m passionate about I want to urge as many people as possible to read it and for books that are awful I want to warn readers not to bother. I guess I feel like I have pretty decent judgment in what constitutes a great read.",""
"lsuhrsw","Alternative-Garlic-9","2024-10-20 14:37:00 UTC","I don't, but I save some quotes on Goodreads after each read to remember the emotions I felt while reading the book :)",""
"lsuir0r","BigYellowWang","2024-10-20 14:42:39 UTC","I have a really short term memory and I've forgotten books I've read in the past. Nowadays I take notes on my phone of everything I read, scenes I enjoyed, prose or quotes I like.

As others have said, I try to keep my reviews and notes subjective, no point in writing a summary when reddit and wikis have ton of them. Also some books may be well written but tedious or boring to read. There's no point in leaving a favorable review for those.",""
"lsum1c7","A_Rogue_Robot","2024-10-20 15:00:52 UTC","I don't write reviews but I journal my thoughts after reading a book. Sometimes I'll reread a book then revisit my journal and have a completely different perception that I can add in there",""
"lsuma7p","Reflect_move_foward","2024-10-20 15:02:15 UTC","I have a reading diary, I usually will write a few sentences about what I liked /disliked, thoughts about the theme or the writing.
I finish a few books every week and it helps me slow down and process before moving on.",""
"lsunxge","JettsInDebt","2024-10-20 15:11:27 UTC","I think half the reason I read is to write reviews at this point. It's such a rewarding feeling to finish reading someone else's work, and then find out why you felt the way you did about it.

I'm not the type of person who reads tonnes of books a year or anything, and generally takes a while to read one at a time. Most of my reviews are for books I've enjoyed reading, because I go out and hunt for books that seem specifically catered to my interests, so they tend to be fun to write and not anger inducing to write.",""
"lsvslmj","KhaosElement","2024-10-20 18:43:00 UTC","Never once. I'll tell my friends about it, but that's it.",""
"lswejrc","canijusttalkmaybe","2024-10-20 20:34:16 UTC","Talking (see: writing) about anything is a good way to help you remember. Until you speak, your thoughts are kind of a chaotic jumble. In the course of speaking your thoughts, they become much more set in stone. It also helps you refine your thoughts, because you have to deal with them directly instead of just *having thoughts* floating around. This is a good trick for problem solving too. Just have a conversation about the problem. Even if it's just with yourself.

While I don't review books hardly ever, I do talk to people about them. Sometimes I read stories I don't tell anyone about, and those are the ones I probably don't remember any details beyond generalities after 2 or 3 years. I might remember some characters or events, but I can't remember the writing style, or the way information was revealed, etc.

Occasionally I'll see a book on a list that I read a long time ago that I never ""talked"" about, and I'll get the urge to write a review for it just to kind of put a pin in it. But since it's been awhile, I don't really have that spark, or the information necessary to really explain my impression. And I'll probably never have it, since I didn't have it to start with.",""
"lsxnxip","depressanon7","2024-10-21 00:57:45 UTC","I have a notebook for reviews, mostly so I can remember the book and collect my thoughts. Or rant if it was a 1 star, lol",""
"lsxs4xd","Mollykate123","2024-10-21 01:23:40 UTC","Only if I love the book. I do not leave bad reviews.",""
"lsu3h9o","nthn-d","2024-10-20 13:05:25 UTC","I have only just started reading books these last couple months, and this is one of my regrets. I was making a list of books I've read when I realized how it would've been nice to have left a couple paragraphs to myself of what I thought about the books right after I've finished them. Maybe I'll start doing it from now on.",""
"lsu5y5e","CuriousAstra","2024-10-20 13:22:29 UTC","I used to write them religiously but I've fallen off of it.. I need to start writing them again.",""
"lsu6801","liarandathief","2024-10-20 13:24:23 UTC","  Goodreads lets you write private notes about a book. I use those to give a brief summary and my thoughts on the book and if I want to read any sequels, etc.",""
"lsu6c9z","CarpeDiemMaybe","2024-10-20 13:25:12 UTC","I never thought that my opinions and thoughts would be interesting to share with people in the form of a review until very recently that someone told me that I should give it a shot. Still thinking about it though",""
"lsu793d","the88shrimp","2024-10-20 13:31:24 UTC","No but I've considered doing very brief plot / character synopses for each chapter. This would be especially useful for when reading a series or large books if I ever need to recap and don't want to reread entire novels.",""
"lsu96nv","Rindover","2024-10-20 13:44:11 UTC","i only did this with one book because i thought it was VERY underrated its called ""a girl called justice"" by elly griffths",""
"lsu9lus","Pink_Star_Sprinkles","2024-10-20 13:46:53 UTC","I have started reading a lot more since lockdown and most recently I joined Goodreads to compile a list of books I want to read. 

I have pondered on writing reviews, much for the reasons you have said but I lack confidence as my writing skills are not brilliant (struggle with grammar, punctuation and spelling) and am self conscious people will be judging me for it 🫣

I bullet journal and I did start one solely for reviewing books but I misplaced it through all the house moves over the years.",""
"lsuam19","the_bluehead","2024-10-20 13:53:20 UTC","I don't write ""real"" or public reviews, but I do take notes on StoryGraph for every book I read, writing down things I like / don't like about the writing, plot and characters, any theories I come up with while reading (I read a lot of thrillers and mysteries and I love trying to guess what's going on), stuff like that, just for myself.

And it definitely helps me to better remember what books I've read! I also just love scrolling through my Storygraph notes every now and then, rereading what I thought about the books I read and what I was feeling while reading them. Sometimes it's even kinda entertaining (some of my notes are wild).",""
"lsubtiv","Kiltmanenator","2024-10-20 14:00:52 UTC","I started tracking my reading last year because I wanted to just see how much I had gotten through and what my reading habits look like overall, and the reviews were just incidental. But now I found I enjoy the reviews just as much if not more than purely posting for the sake of tracking what I read. It has helped me think more deeply about what I enjoy and what frustrates me, and it's also generated some nice commentary from people on my social media that I don't normally otherwise talk to.",""
"lsuc3cn","Basic_Two_2279","2024-10-20 14:02:34 UTC","I don’t write an all out review but I’ll jot down some notes while reading and any final thoughts after finishing. I don’t post what I do online, just for my personal thoughts to help keep track of what I’ve read and not necessarily for every book.",""
"lsueckf","agentgravyphone","2024-10-20 14:16:31 UTC","I write reviews on storygraph and also in my own reading journal.

I really like having something physical that I can flick through and remember different books",""
"lsuep0n","merurunrun","2024-10-20 14:18:38 UTC","Only when I feel like I actually have something interesting to say about what I read.",""
"lsuhfah","Responsible-Crab-902","2024-10-20 14:34:58 UTC","When I finish a book, I always go over a lot of pieces in my head and wonder why, but rarely write it down or communicate it to anyone. As much as I wanted someone to talk to about the book, it was rare to find someone who was reading the same book at the same time, so I did it all in my head.",""
"lsuj0y2","Lucky_Butterfly7957","2024-10-20 14:44:13 UTC","I have a fb book group that i really enjoy. I rate and review my books there; there is an intrinsic understanding that you are stating your opinion. People disagree and that's fine with everyone",""
"lsuldx9","VG_writes","2024-10-20 14:57:16 UTC","I try to write reviews for most books I read, especially when the story resonates with me. It helps the author and also lets me process what I just read on a deeper level. When a book manages to evoke emotions (whether it's a gripping dystopian world or a complex relationship dynamic), I feel more inclined to share my thoughts.

How about you...what types of books push you to leave reviews?",""
"lsum7dn","poopsinpies","2024-10-20 15:01:48 UTC","I review them in my own personal Word file: a synopsis of the book and plot, and my thoughts. I note the overall story and characters so that in the future if I'm ever thinking ""what was that book where the lady found the shoe of the missing girl in the pond behind her home"" I can do a quick search.",""
"lsumdma","emoduke101","2024-10-20 15:02:47 UTC","If I have burning thoughts about a book, then yes. Whether good or bad. Then I share to my book group if I feel like it. 

There are times when I did enjoy a book but don’t review it cuz it’d otherwise be me merely rehashing the summary or spoiling it (which shouldn’t make up the entirety of reviews imho). This is usually the case with non fiction.

If a book is bad, I tend to get long winded!",""
"lsuohwa","MANGOlistic","2024-10-20 15:14:37 UTC","I do, but only if I have something interesting to contribute to the existing dialogue about that book because my reviews often end up being such deep dives into the book that they're several thousand words long. It takes a lot of time and attention, so if my only thoughts are the same praise or complaints as all the other reviews, I don't tend to bother.",""
"lsuvadn","South_Honey2705","2024-10-20 15:51:53 UTC","Sometimes I do it really depends on my mood. I used to do a lot more reviewing of books when I received Advance Reader Copies from publishers to read and review. But then I was like forget that, I want to read and review books that I actually like to read and review on my own terms. Made a huge difference for me though I don't do much reviewing these days on Goodreads unless something really strikes me. I just live vicariouly through others reviews and sites like lithub and kirkus.",""
"lsuwre1","terriaminute","2024-10-20 15:59:46 UTC","Since joining Goodreads in '16, yes.",""
"lsuxf6p","chere100","2024-10-20 16:03:15 UTC","Depends on the book. If the story is good or bad enough, and I wanna let people know, I might write a review. If the book was just sort of mid why waste my time writing a review? I could already be reading a better book.",""
"lsuzslk","mosselyn","2024-10-20 16:16:06 UTC","Not usually no. I only leave a review if I find a book especially bad or especially amazing, and not always, even then. 

Why? Because I am a lazy sod and a bad human: I read most of my books on my Kindle and usually can't be bothered or don't remember to waddle over to my computer to write up a review when I'm done.",""
"lsv1duj","Fearless-Reward7013","2024-10-20 16:24:34 UTC","I have been trying to leave ratings for every book I've read this year to keep track of them. If it has really annoyed me or blown my tiny mind I'll leave a review, especially if there are mounds of reviews gushing about how great it is because sometimes it feels like I've read a different book. So 5 stars or 2 stars.

A 3 or 4 starrer will usually just get the rating. An exception would be when there is a character that I think we're supposed to like but I have found pretty obnoxious, or it's touted as a feminist novel or something and it's far from it and none of the other reviews reflect that. It's like shouting into the void, and nobody reads them, but it stops me shouting about it in my own head for days.",""
"lsv2xid","Back-end-of-Forever","2024-10-20 16:32:41 UTC","I tell myself I should do it more often, and I would like to, but so far I've only written exactly one review, on goodreads, of a pretty niche book that I absolutely loved, that had only a couple reviews",""
"lsv4gct","baseball_mickey","2024-10-20 16:40:42 UTC","I have co-read about 100 books over the past 5 years with a good friend.  She recently called me out for not writing reviews.  She said, ""just one sentence at least"".


I will often highlight extensively in kindle, and put notes in too.  Then I export that.  So, kind of a mishmash that I have record of myself.  I did this partially because highlighting and annotating does help memory of books.


At the beginning of our co-reading time, we had a 3rd who suggested reading **The Amber Room**.  I had serious deja vu while reading it.  Then idiot me realized, 'you read this already'.  So, I began tracking my reading better *and* taking notes/annotating.  FYI, you can export your highlights from e-books you get from your library, and if on the same kindle account, the highlights should be there again if you re-check it out.


Sometimes I feel like books don't warrant a review, but then, my friend's voice comes into my head and says, ""just one sentence"".",""
"lsv6y2k","BJntheRV","2024-10-20 16:53:45 UTC","I rarely write book reviews because I feel most reviews are subjective. We like what we like. My exception is favorite books I feel everyone should read and terrible books that are just poorly written, full of grammar errors, or end in cliffhangers.",""
"lsv8z84","Dr_MoonOrGun","2024-10-20 17:04:34 UTC","I typically only write reviews if a book really fell short of what I was expecting or if I thought it didn't meet they hype. It's easy to write a good bad review. It's much more difficult to write a good good review.",""
"lsvbifq","__CaptainNemo","2024-10-20 17:17:43 UTC","Yeah, I look forward to writing reviews. It helps me remember the story and organize my thoughts. I put all of my reviews on Goodreads.",""
"lsvcakm","Silent-Beyond-7123","2024-10-20 17:21:46 UTC","I would like to write reviews but then I read the existing reviews for that book and am like, other people have summed up my thoughts pretty well, so I don't need to write. But I do wanna get into the habit of writing reviews.",""
"lsvg9wq","wizardsfrolikgardens","2024-10-20 17:41:35 UTC","I don't really do reviews tbh. I dunno why, I just never felt the urge to",""
"lsvgcrd","AffectionateCable793","2024-10-20 17:41:58 UTC","Usually, but there are times when I need to think about what I read. If the book was a book club pick, I would do a review after the book meeting.",""
"lsvlqd4","shinneui","2024-10-20 18:08:42 UTC","I bought a huge notebook recently and write a short summary of every book I read. I print out the book over and stick in there, put the name of the author, which series it belongs to, the main characters, etc. It's quite fun!",""
"lsvoj0z","conjunctlva","2024-10-20 18:22:25 UTC","I try to write something short, concise, and most importantly, what I think would be most useful for prospective readers. 
I always bring up whether I liked the prose and pacing, because I think that can really make or break a book. Then mention themes, character relationships, anything else that stood out in a good or bad way.

Some people write DNF reviews but I only write a review if I finish the book.

And it’d it’s a self-publish, more niche, or a debut, I try to be more constructive and useful for the *author* as well in case they read it.",""
"lsvpom5","BabyAzerty","2024-10-20 18:28:09 UTC","I always write a personal review on my little [book app](https://apps.apple.com/fr/app/bookopedia-note-track-books/id6511193246?l=en-GB) :)

It helps me structure my thoughts and I enjoy reading the notes at the end of the year. 

Also, it helps a lot when talking about a book years after reading it, you know when you need to recommend it to friends (or not!)",""
"lsvrsya","heyboyhey","2024-10-20 18:38:52 UTC","I only do it when I disliked the book and only for myself to read. It's always easier to remember what I loved about a book than what I didn't and I kept finding myself in the situation of not being able to defend my position because I had forgotten what it was that I hated so much. It was too frustrating so now I make sure to write it down.",""
"lsvvj4a","skylerae13","2024-10-20 18:57:57 UTC","I do. It’s mostly for me and my recollection of the book. It takes a few minutes after to jot it down in Goodreads and then it’s there when I need a refresh. I also post on my instagram stories about it.",""
"lsvyhex","SoMuchToSeeee","2024-10-20 19:13:00 UTC","It's a really good idea. I have a hard time with memory and it would really do me some good to be able to look back at my own summaries.",""
"lsvzsx4","Freakjob_003","2024-10-20 19:19:48 UTC","Depends on the book, and especially its length. For something as long as Malazan, I'll take notes on my phone for a review, which will double as a reminder of the convoluted plot.

A 4 star book I liked may get a few sentences, or it may get a few paragraphs, depending on how much it hooked me or how well certain aspects were done. Worldbuilding, character chemistry, comedy, etc. Conversely, a 2 star book might get nothing or a few paragraphs on why I disliked/DNF it; *Bored Gay Werewolf* recently got the latter.",""
"lsw1x8i","Inara_R","2024-10-20 19:30:30 UTC","I used to write written reviews in a notebook but I read much faster than I write and I could not follow. Nowadays I just write a review on Goodreads, sometimes short ones, sometimes longer ones. I may get back to the notebook eventually because I loved writing those.",""
"lsw64vr","HopefulOctober","2024-10-20 19:51:29 UTC","I'm too insecure for that - if I like a book and I see a bad review, even if it's just one bad review among a bunch of other good reviews, I will think to myself that I have too bad, simplistic taste to see how this book sucks and feel stupid. I have the converse to a much lesser extent where if I dislike a book and find good reviews I feel stupid for not being able to understand the depth and wonder of that book, though not as much as my mom does...",""
"lsw6q4s","dreamsofaninsomniac","2024-10-20 19:54:23 UTC","Usually only if it's for a small author or book that doesn't have many reviews already. If it's something really popular with a lot of reviews already, I don't feel I can add anything that hasn't already been said. I'll just leave a star rating then and write personal notes to myself so I can remember a book and whether I liked it or not.",""
"lsw7rge","UnrelatedKarma","2024-10-20 19:59:33 UTC","A big part of my enjoyment of a book comes from the review writing process. I weirdly feel like it makes me a “better” reader.",""
"lswa25l","catskii","2024-10-20 20:11:06 UTC","I only write reviews if I find a book so terrible it hurts to not vent about it",""
"lswajca","Emotional-Deer-2618","2024-10-20 20:13:28 UTC","I have a lot of friends who would read my reviews so sometimes I‘m too embarassed(?) to write a review. But I started writing in a book journal and you‘re right it helps remember the storyline!",""
"lswbna8","ghjkl098","2024-10-20 20:19:07 UTC","Sometimes. I find it more of a pain on the kindle, it was a lot easier when i read on my ipad. I review if it is particularly good or particularly bad, but not always if it’s just average.",""
"lswdmi8","Working_Complex8122","2024-10-20 20:29:27 UTC","rate them on goodreads and write a short and mostly confused text about my feelings and thoughts on the book. It's entirely subjective and is mostly for myself to remember some novels and my thoughts at the time of reading than it is for anyone else. Although I mostly go into detail when something was really bad and simply recommend it strongly if it was truly great because I don't want to be the one to implant some sort of expectation of a specific realisation or feeling when reading the book. They probably hit every individual individually.",""
