"comment_id","user","time","message","parent_id"
"lswe8pi","MacaronPractical3814","2024-10-20 20:32:41 UTC","Wonderful to read!  I aspire to do so as well in the nearby future. Thank you for the inspiration.",""
"lswes7m","softpaintbrushes","2024-10-20 20:35:27 UTC","This isn’t exactly the same thing, but I have a reading journal that I love, and I thoroughly enjoy updating it every time I’ve read a new book. I’ll generally write down my thoughts on the characters, the style of writing, and whatever else comes to mind. I also generally give it a star rating out of five. 

I don’t often write reviews on Goodreads - I generally add any new books that I’ve read to my shelves, and I usually try and give them a star rating, but I feel a bit awkward trying to write reviews. The few times that I do write reviews, it’s mostly just for myself.",""
"lswf1ck","plainoldhuman","2024-10-20 20:36:43 UTC","Honestly, I'm not really good with words, and i can't express myself as good as I wish I could. So i just write my reviews in my personal journal. I can go back and re-read my reviews whenever I want to, and it's a little secret of mine, lol",""
"lswfq83","DronedAgain","2024-10-20 20:40:04 UTC","Only for books that were awesome and I'd want others to read it. 

I don't see a point of writing a bad review for a book, unless it's non-fiction and clearly inaccurate or wrong. 

That reflects how I use reviews, too. I will get a book or a music CD if enough people rave about it.  A bad review or two will not make me not get it, unless the review brings the receipts on a non-fiction book that's BS.",""
"lswju9q","Ranger_1302","2024-10-20 21:00:34 UTC","No, before. Then I know what to not waste my time on.",""
"lswndla","BlacksmithNo7341","2024-10-20 21:19:04 UTC","No. On my goodreads I just give updates whilst i’m reading the book and half of the time it’s just me exclaiming at something insane that happened or something. But I really don’t like rating books. I know my favourites and that is enough for me",""
"lswnee8","DaHolk","2024-10-20 21:19:11 UTC","Noooo...

I have big enough problems with already remembering too much anyway.
I don't know how old you are, but at some point the more and better you remember EVERYTHING you have seen, particularly in fiction, you get to the point of everything already being (involuntarily or not) derivative and repetitive. And that is fine, because in some way or another it's targeted at the next and next generation of people who haven't read the things you have. So it's new to them.

If you couple that with the statistical notion of it becoming increasingly more likely that ""the best version (yes, to you) of a concept is one you already DID read/watch"" the bigger the pool of ""things you already read/watched"" gets...

No, investing additional time to make that problem even worse does not sound appealing to me.",""
"lswpdpr","dvoorhis","2024-10-20 21:29:48 UTC","Only sometimes. I usually do rate them on Goodreads but not always write something.",""
"lswyn3q","Slowandserious","2024-10-20 22:22:29 UTC","I want to start doing this. But I dont want to write a “public” review. 

I just want it for myself. Doesn anyone know the best app/platform for this?

Or should I just start opening a google sheet 😅",""
"lsx336y","AJL42","2024-10-20 22:49:02 UTC","I always write a review. It's mostly for myself or people I'm close with to reference.",""
"lsx5bqc","iverybadatnames","2024-10-20 23:02:27 UTC","I don't write reviews because I'm usually too excited to start the next book. But I'm thankful to everyone that does.",""
"lsx6bwi","dodadoler","2024-10-20 23:08:32 UTC","Whatever weirdo🙄",""
"lsxavtb","Melloburden","2024-10-20 23:36:22 UTC","I write reviews sometimes depending on what I read. I need reviews for my new book if anyone is interested. It is about demonic attack and deliverance and is called: Satan, Get Out in the Name of Jesus and is available on Kindle. I also created a Good reads group.",""
"lsxf350","Scrapbookee","2024-10-21 00:02:49 UTC","I write thoughts as I go, then once done I write private notes on Goodreads that are spoiler-filled.

That way if someone asks what I thought about it, I can actually remember, but it's only for me to read since it's spoiler-filled.",""
"lsxj47d","suzeka1","2024-10-21 00:28:08 UTC","I can't even figure out what to read",""
"lsxnruh","primiperegrino","2024-10-21 00:56:46 UTC","Since I got rid of Twitter, Goodreads reviewing  provided me an outlet for writing and thinking about stuff. Its for the better too, because for me my book-reviewing material is an outcome of pondering about a specific material for a bit of time. This is the opposite of clout posting wherein knee-jerk reactions written as hyperbolically as they can be is the encouraged style",""
"lsxokf6","Teddy_canuck","2024-10-21 01:01:40 UTC","No. Occasionally I do but they're usually pretty short and succinct because to truly cover a book well, it takes an investment that I'm generally not willing to commit to.",""
"lsxqo73","Deleted","2024-10-21 01:14:40 UTC","Only if I wanna give it 4 or 5 stats. I ain't reviewing a story with 1-3 stars if I don't like it or don't finish it. Must respect the grind.",""
"lsxrr51","Morbidity6660","2024-10-21 01:21:18 UTC","This might be embarrassing but I had the idea to do book reports (yes like school) to actually help me retain the content I consume, I just couldn't find anything that felt right and not super childish. Maybe reviews are a better way to go about it though",""
"lsxsja8","originalslicey","2024-10-21 01:26:13 UTC","Only since I’ve had a kindle unlimited subscription.  Now I read so many books in the same genre that I will absolutely forget if I read a book or if I liked it if I come across it again. And I frequently re-read books in a series when a new book come out. Like, I’ll re-read books 1-5 when book 6 is released. If I’ve written a review, that saves me from re-reading books I didn’t enjoy or it refreshes my memory enough that I don’t have to re-read them if I don’t want to, or don’t have to continue the series if I don’t like the previous book well enough.",""
"lsxtnnn","Lakemichigandunes","2024-10-21 01:33:06 UTC","Such a good idea",""
"lsxv3ws","OldTiredAnnoyed","2024-10-21 01:42:10 UTC","Only if I enjoyed the book. I don’t leave bad reviews for books because what I like (or dislike) really is very personal & I don’t want to give an author a shitty review just because I happened to not enjoy his or her work.",""
"lsy2efz","asexual-Nectarine76","2024-10-21 02:28:13 UTC","Yes I do, because otherwise I would never remember that I read that book. Also, I like to remember parts that I connected with, or that made me laugh, or whatever; I quote parts sometimes.",""
"lsy3o7m","goatlover19","2024-10-21 02:36:19 UTC","I star rate them and write basic reviews only for books rated 4 or 5 with keywords of feelings, and who I recommend the book to. If it’s below 4 stars, I’ll star rate them and only add tags for the vibe of the book (I.e. mysterious, funny, sad, tense, etc) 

For example one book I wrote 4 stars-  “Insightful, thought provoking, engaging, funny. This book is perfect for anybody who studies neuroscience or works with animals! Versatile information that I found very helpful in my own career. I appreciate his contributions to the field and he makes me want to continue learning more!” *Are We Smart Enough to Know How Smart Animals Are* a nonfiction book by Frans De Waal",""
"lsy62p9","PatiThePurplePenguin","2024-10-21 02:51:49 UTC","I have just started and LOVE IT! I used to always forget if I read a certain book or not just based on the title, and now I can remember it better. I also love, as you stated, that it gives me more time to interact and dive deeper into the boom. ",""
"lsy8x63","Siggney","2024-10-21 03:10:50 UTC","Not immediately after, i finally gather all my thoughts after like a year",""
"lsy8zqr","ItsStaaaaaaaaang","2024-10-21 03:11:19 UTC","Nah. The world doesn't need my poorly thought out and uneducated critique of whatever random sci-fi or Grisham-esque book I just read. 

In fact I have the terrible habit of rating everything I read 4-5 stars (I rate to keep track of my reads on goodreads) as I'm terrible at discerning between okay/good/great books. It's like, idk I just spent many hours over a couple weeks reading the thing. I guess I liked it. 4 stars! And if I really liked it it's 5.  I'm much better at having opinions on games and movies/tv than books. I guess because it's more immediate and probably also because I've been exposed to much more critique of those mediums than I have with books. I'm not really into the book scene. I find a book that looks interesting and read it and read some threads here and that's about it.",""
"lsy9h1x","BionicgalZ","2024-10-21 03:14:31 UTC","I do. I don’t work hard at them though — they are mainly for me.",""
"lsydmwg","mightyjor","2024-10-21 03:43:36 UTC","At some point I decided to write a full Goodreads review Everytime  I finished a book. I didnt have any friends on it when I started and I do absolutely no promotion or anything, but finishing a book is a pretty monumental task and it makes me feel like I accomplished something big and allows me some time just to feel cool about it.",""
"lsyq2x2","potterhead2079","2024-10-21 05:31:55 UTC","I usually prefer to write review when i really enjoyed reading book or I hated it.",""
"lsysxfa","luz-c-o","2024-10-21 06:00:34 UTC","I write notes about them in my phone but don’t post them. I honestly don’t know why because I write reviews about everything else. But my book reviews mostly talk about how I felt or how I can apply whatever lesson I gathered from it so idk if anyone would gain from them.",""
"lsyvf8t","Primary-Plantain-758","2024-10-21 06:27:04 UTC","I do it for the same reasons even though I'm really not that good in reviewing. I did it in my notes for a while but I didn't stick to it so now I simply review on goodreads and/or storygraph.",""
"lsz04iy","ConstantReader666","2024-10-21 07:19:27 UTC","I hadn't thought of it helping me remember. I do write reviews to support the authors and I keep them on my computer to refer back to if a discussion about the book comes up, but you're right, writing about it helps imprint it on memory.",""
"lsz2hpc","AccomplishedPipe1164","2024-10-21 07:47:01 UTC","This is a great idea but I don’t know if I would follow through. Do you write notes while you are reading the book?",""
"lsz7nbb","cinnamonbunsmusic","2024-10-21 08:48:04 UTC","Yes I do! Unprovoked backstory: I have made a conscious effort to avoid reading books for most of my life. Faked my way through school and an entire degree. But during lockdown, I decided I needed a hobby outside of a screen and chose books. Fast forward about 3 years and I’m proud to say I’m currently reading book number 106! I decided right from the start to keep track of my reading journey, so I started an Instagram account to post my thoughts at every step. The reviews sometimes contain my own reflections on the reading journey or other aspects that are not normally included in a straight forward review, but it’s really more for me than anyone else (as evidenced by the staggering 4 likes I get on a post these days). If you’re interested at all, my handle is @macsimonsthoughts on Instagram",""
"lszilhk","chocnutbabe","2024-10-21 10:49:04 UTC","I do! Writing my thoughts helps me make sense of what I’ve read. It’s also a good way to practice writing outside of work. I also think it’s my way of helping future readers decide if the book is worth buying/borrowing/reading.",""
"lszmc2e","marcorr","2024-10-21 11:23:12 UTC","I don’t always write formal reviews, but I do jot down my thoughts in a journal right after finishing a book. I think sharing reviews on platforms is a great way to contribute to the reading community.",""
"lszrnlk","inabookhole","2024-10-21 12:06:08 UTC","I've been writing reviews of the books I read for a while now on Goodreads and for various websites. At first, it was something I did for fun, almost playfully (although I always tried to be objective in my judgment), but now it’s become a habit that relaxes and inspires me. I don't do it so much to remember the different books I read, but rather to gather my thoughts and share an opinion on the content. That’s why I try to write the review the same day I finish reading. If I need some time to process the content or reflect on it, I still try not to wait too long.",""
"lszt49g","Talking_on_the_radio","2024-10-21 12:17:17 UTC","I do love reading book reviews after I finish a book.  It makes me feel less alone in the experience. ",""
"lt015cz","maraudingnomad","2024-10-21 13:12:48 UTC","Only when I have something to say. I usually also write movie reviews nowadays, more as a way to keep track for myself, though getting thumbs up on IMDB is a bit of dopamine though...",""
"lt04i6k","anabeat","2024-10-21 13:34:02 UTC","I do! I started writing reviews on my Goodreads account in late 2021 and have kept it going for every book I've read since. It's a bit tedious since it can take me a while to express my thoughts in a coherent and organized manner, but I feel like forcing myself to articulate what I love and don't love about the book I just read helps me remember it more. On average, I write about two paragraphs, but sometimes I can go up to three or four depending on how impassioned I feel about it haha.",""
"lt07eug","Master-Reference-775","2024-10-21 13:51:43 UTC","I do not. Star ratings on Goodreads through my Kindle are as much as I do. I have to write required product reviews all the time for 4 programs I’m in, and it gets tedious. I read for personal enjoyment, and I read 100+ books a year, so I opt out of the review aspect.",""
"lt131o2","Springroll_Doggifer","2024-10-21 16:42:24 UTC","I do, but mine are never as in depth and well thought out as so many others I see. Usually mine is “good plot, great character development and pacing, awesome world building… 9/10”",""
"lt154b9","dianthuspetals","2024-10-21 16:52:52 UTC","I wish I had the time and headspace to write reviews for books, but my thoughts are often all over the place that I'd probably spend hours trying to write a review. I'd rather spend those hours reading my next book.",""
"lt1scak","sniffer28","2024-10-21 18:51:46 UTC","I also do it always but only on Goodreads and have only read 10 to 15 books",""
"lt1wj9t","_selwin_","2024-10-21 19:13:15 UTC","Well i usually info-dump on amyone who'l listen, sometimes in text format. I feel like thats my version of a book review",""
"lt4ug41","bobsbottlerocket","2024-10-22 06:26:57 UTC","no, i don’t really care about other people’s opinions on books and i don’t care to share mine lol

i just finish my book, return it to the library, and then i’m on to the next one",""
"ltbfwvp","Library_Spidey","2024-10-23 09:59:29 UTC","I used to all the time. Life has gotten a lot busier and I haven’t written one in years. I still will verbally recommend books to friends!",""
"ltd5w6m","Exact_Swordfish5241","2024-10-23 16:33:36 UTC","yeah, I also write down some quotes in my notebooks",""
"lthilv9","Sudden_Hovercraft_56","2024-10-24 09:36:04 UTC","Strangly I review them in my head.  Unconciously i'll start replaying parts of the story in my head and then my inner monologue will start to speak about it as if reviewing it.",""
"ltlhjhc","Simmyona","2024-10-24 23:16:32 UTC","Only if I really liked/loved it or loathed it. Books that we're luke warm just get three stars and that's that.",""
"lu0bjv1","Upstairs-Corgi-640","2024-10-27 13:57:28 UTC","I would have written book reviews if I knew people actually wanted to discuss it with me.

I used to write out reviews online. But nowadays, it seems almost impossible to do it anywhere where I can have honest discussions.",""
"lt6tso4","Mad4YearOld","2024-10-22 15:51:32 UTC","If I feel like a book has left a considerable emotional impression or conveyed some novel ideas that I consider to have left a positive impact on my life and which I would therefore like to come back to or remember the book that they came from, only then will I write a review. (Still mostly for myself though.)",""
"lt8mplp","Ceritow","2024-10-22 21:23:33 UTC","Always, I like to analyse it too, and I really want to share sometimes, but I'm too scared.

Now my obsession is ""No longer human""",""
"lt9uc2v","Daisies_specialcats","2024-10-23 01:34:51 UTC","I write reviews so I remember I read the book. I read so much, if the book wasn't that memorable I'll forget unless I see a few lines randomly from the middle of the book. It helps me keep track.",""
"lta7vhg","PocketSable","2024-10-23 02:57:24 UTC","I used to write book reviews for everything I read. But at some point, I could only think of so many ways of saying ""book was okay, not great, not bad"" or ""book had redeeming qualities, but it wasn't my cup of tea"". Now I really only write reviews if I am super passionate about the book, either good or bad. I recently got tonal whiplash from a book so bad I had to write down my feelings after I finished it because, as I said in the review, seeing no one else talk about how insanely stupid the characters became at points made me feel like I was taking crazy pills and I absolutely needed to rant about it.",""
"ltbr70u","categoryisbody","2024-10-23 11:41:52 UTC","Depends on how strongly i feel about it- a lot of times, I am too lazy to write reviews. Unless I absolutely have to (positive or negative). But I always rate it. Always. That helps me know i have read it and even remember it.",""
"ltfglcc","crk109","2024-10-23 23:47:32 UTC","I sure do!  I have a blog where I talk a bit about the books I read. I love to write as well as read, so it's a lot of fun for me. Even when I don't really like the book!  lol",""
"ltgtgrv","Vahdo","2024-10-24 05:09:46 UTC","I made a commitment to start doing so in 2021 so that I could betterremember books.


That said, I'm currently about 10 reviews behind at the moment... from books I read months ago. It'll be a little challenging, but I'll get through them.",""
"ltmjb30","No-Razzmatazz-380","2024-10-25 03:07:59 UTC","No. I find it extremely hard to conceive of anyone else wanting to know my opinion of a book (or anything else) unless they know me. Writing very occasional comments right here is the best I can do! For myself, I keep a record of what I’ve read but it doesn’t include commentary.",""
"ltngqwq","reUsername39","2024-10-25 08:10:04 UTC","Last year someone gave me a book journal to record my thoughts after reading each book and I liked that it helped me remember how I felt about the books I've read.  This year I started using StoryGraph and began by just clicking the boxes and leaving a star rating for each book but recently I've been forcing myself to leave a more detailed reviews in place of last year's journal.  My 'reviews' are in place of my journal entries and entirely just for me.",""
"lsu9kxu","jaslyn__","2024-10-20 13:46:43 UTC","i write reviews not because i want to remember. but because i want to forget.",""
"lsu9wp4","action_lawyer_comics","2024-10-20 13:48:50 UTC","I do, though I prefer to talk about them in relevant subreddits than on Amazon or Goodreads. 

Reading is increasingly solitary for me, I don’t have reading friends I can recommend books to. Sometimes I’ll recommend a book to my wife, then it will sit unread for months (other times she will read it right away or we’ll listen to an audiobook together, it’s just that a lot of them aren’t her thing). So writing a post gives me a chance to talk to others about it I wouldn’t have in real life. I’ll post a review too, because that helps the author, but I’d rather have the conversation than dissect my opinion like a literary autopsy",""
"lsu9srj","GlitteringHappily","2024-10-20 13:48:08 UTC","I only started keeping Goodreads reviews over the last week or so as a new project and I’m thrilled to announce everyone writes them and most reviews don’t get read! it seems all the reviews that get engagement are from pillars of the community who engage in a load of groups and get books sent to them to review for free. No one looks at my goodreads and it’s quite liberating to put my poorly written and formatted opinions out on it! 

Not trying to make you write reviews, but if you’re just concerned about them being seen or criticised it’s pretty easily avoided.","lsu443j"
"lsuc5f8","Anxious-Fun8829","2024-10-20 14:02:55 UTC","I mainly read reviews to see if I want to start/buy a book and, for what it's worth, I really appreciate the dissenting, odd man out reviews. When all the reviews seem to be 4 or 5 stars, it seems very... inorganic. No book is universally good.


So, if you want, please write your ""wrong"" reviews, you will be doing a favor to the people who use reviews to gauge if the book is right for them.","lsu443j"
"lsu73bq","RatsWhatAWaste","2024-10-20 13:30:18 UTC","I have a hard time believing that because this comment was written pretty understandably. I got a really good sense for your personal thoughts on the matter, seems like it would translate really well for a book review","lsu443j"
"lsur9gl","hippydipster","2024-10-20 15:30:01 UTC","Rather than write reviews for other people, write them as notes to your future self.","lsu443j"
"lsu5xxs","SaborDeSoledad11","2024-10-20 13:22:27 UTC","You are not alone, I feel the same way!!! I also worry about hurting the author’s feelings if they see my review 🥲","lsu443j"
"lsvmt81","Gene_Parmesan486","2024-10-20 18:14:05 UTC","Just based off of this I would like to read one of your book reviews","lsu443j"
"lsxndfc","primiperegrino","2024-10-21 00:54:22 UTC","If this helps, posting your reviews on GoodReads will be safe from scrutiny because its a small needle in a 100,000-review haystack. That’s what made me choose GoodReads over Instagram. Discoverability is non-existent, which is for the better for us shy types","lsu443j"
"lsup2tk","EmerlineLA","2024-10-20 15:17:51 UTC","I think your writing is fine, but if you're so worry about other people being mean you can choose to keep your reviews private. Put your thoughts in the private note section of Goodreads or in a google doc, only sharing if and when you want to.","lsu443j"
"lsuxltq","Very_empathetic_216","2024-10-20 16:04:15 UTC","You are NOT stupid or dumb! It can be very difficult to make your thoughts into words that others will understand the way you do. I don’t have a college degree, although I’ve taken a LOT of college courses. My favorite ones were English classes. After those classes I could write really well for a while. I’ve forgotten a lot of what I learned through.","lsu443j"
"lsv1p2r","baki--","2024-10-20 16:26:14 UTC","You are not too stupid or too dumb. To write down your thoughts in a coherent manner that's satisfying enough is a skill and needs practice. Just write them for yourself and keep going. And eventually you might shock yourself with what you wrote.","lsu443j"
"lsuvnmf","South_Honey2705","2024-10-20 15:53:50 UTC","Throw it out there practice reviewing on paper maybe?","lsu443j"
"lsuxwxg","turquoise_mutant","2024-10-20 16:05:52 UTC","You don't have to do it publicly on Goodreads though, you could do it in Word on your computer and keep it private. 

Personally, I write ones on Goodreads but then I also write a review in a private doc on my computer where I really just say everything I want to say because you can be completely free if it's private. I also put books in there I didn't finish or books I don't want to review on GR for whatever reason. 

Reviewing books is a nice way to keep track of what I read and the thoughts I had about books. But yeah, just do it privately if you are bothered by sharing.","lsu443j"
"lsvcens","littlebugs","2024-10-20 17:22:21 UTC","So, I rarely write reviews on Goodreads, but I recently got started with StoryGraph and they have just some boxes to check, pace of the plot, do the characters grow in the story, are the characters likeable, etc, check the boxes for different tones of the story (mysterious, informative, reflective, etc), and I love checking the boxes. Writing comments? Not so much. I write my own reflections in a little book journal just for myself.","lsu443j"
"lsvrm7x","canigetauuhhh","2024-10-20 18:37:55 UTC","I'm the same so I write it in a journal. It's mine, it's private, and I can reflect on how I interpreted the book and not get that deep anxiety of posting my opinions. Plus I can decorate it.","lsu443j"
"lsxo9uc","C_ReadsBooks","2024-10-21 00:59:51 UTC","Why don’t you have a private bookstagram account so you can still post your own thoughts for yourself, or those you know won’t judge you? I use my bookstagram as my book diary and every time I recommend a book to a friend I can share the post with my thoughts on it to them!","lsu443j"
"lsulsgz","Deleted","2024-10-20 14:59:29 UTC","You know, I felt the same way, my head roars with thoughts it doesn't possess words to articulate. So I started sharing my amateur thoughts on a private Instagram account with just friends whose negative opinions I have stopped caring about. It has helped me tremendously, just the effort I put in now to articulate my thoughts, however badly, has made me improve. Still don't have the confidence to post it publicly though.","lsu443j"
"lsv4n3a","baseball_mickey","2024-10-20 16:41:41 UTC","Do you know how many people love scrambled eggs?


Make a burner account and leave them anonymously.","lsu443j"
"lsxpc01","shmixel","2024-10-21 01:06:17 UTC","Write them on StoryGraph where there's no reviews comments. And literally write anything, even bullet points, to start (or forever!). it doesn't have to be that serious","lsu443j"
