"comment_id","user","time","message","parent_id"
"luodik4","Optimal-Ad-7074","2024-10-31 11:02:48 UTC","this is a great post. i see something similar between the two libraries that are within 1000 metres of one another, around where i live.  

i don't really feel right actively cannibalizing the more privileged one, but i dont put my own contributions in there anymore.   i also try to put in multiple books at a time, because a free library with one or two items in it is just sad and doesn't inspire anyone else to start using it.",""
"lup3xnr","BasicReputations","2024-10-31 14:01:19 UTC","At the end of the year, our title 1 school gifts new, beautiful, relevant graphic novels to our kids.  At the end of the year during locker cleanup I fish dozens of copies of them out of the trash, brand new and unread, so I can hold on to them for next year's kids.  We also pick up many that are shredded and tossed around the schoolyard.


Most of my optimism on this topic died years ago.",""
"lup7cd8","Antique_Ad_1635","2024-10-31 14:20:19 UTC","Options for helping fuel your local (less well 'funded') free library:

\\*When you resell your books, always ask them if they will give you back the books they won't put on the shelves, because you want to put them in the free library. (Most stores now just take everything even if they don't think they can sell them, but if you mention free libraries most of them will give them back to you for that purpose. They want to help too.)

\\*There are also often library sales where they will sell you kids books for a discount in bulk, which is good free-library fodder. Especially if your local Friends Of The Library group knows what your goal is, they'll help out too, as they end up with donations they can't resell.

\\*As OP stated, Goodwill/HPB Outlets and other thrift stores will often do bulk sales on ""poor condition"" books, many of which are sold by the pound and actually have decent reads in them.

\\*Hosting a ""book drive"", similar to a food drive, in your neighborhood get surprising results. (If you're part of a community, like a church or whatever, you can often organize a big one of these and have books for multiple donations.)

\\*Make sure your friends with younger kids know that when the books (and toys!) fall out of favor with their young ones that you have a place to take them that won't reject them for 'condition issues'. I found out a lot of these get thrown out!",""
"lupleb8","BlobTheBuilderz","2024-10-31 15:35:35 UTC","We have a gift giving one near me. 

I saw someone post they had put 225 individual pairs of new socks that were still in packaging (bear in mind it’s a tiny town). Every single pair was gone within the hour. 

Someone showed up and took them all. Giver was mad and said I was gonna keep refilling it periodically and now was finding other ways to do it. 

Some people are terrible.",""
"lupu8w4","Jeciao","2024-10-31 16:21:52 UTC","I worked in a library in a diverse community with moderate poverty and above-average crime rates. Across the street was a shelter for people experiencing homelessness, and within walking distance were various businesses and schools. Our regular patrons included kids, teens, parents (mostly women), and individuals facing housing or mental health challenges. We used to have a book swap rack in the vestibule (an area not covered by the security camera) where patrons could take a book without checking it out and leave one if they had any to share. Only mass-market paperbacks were allowed. Once finished, they could return the book at the front desk, though people often put them back directly on the rack.

One day (I wasn’t on shift at the time), a man came in with a cart and took all the books. He repeated this on another occasion.

The reality in communities with limited resources is that a few people may misuse these services, impacting the whole community. We eventually moved the rack inside to prevent this again, something we should’ve done years ago, but in my five years working there, this was the only time our swap system was taken advantage of.

Unfortunately, incidents like this cause hesitation around supporting communities with honor-based systems, where there may be a greater risk of theft. It’s often the kids and families who would benefit most who miss out as a result. I don’t know what to say or what the solution is. I read another comment that mentioned people need income first, and books second. If we improve people’s lives, things like this might not happen. I like the thought of that.",""
"lupzqtt","strandedmammal","2024-10-31 16:50:36 UTC","My kids went to a private school in Oakland CA on a partial scholarship. We had a book drive there where parents just brought in their duplicate kids books / literature. There result was a room filled as high as you could reach with boxes of books. I loaded up my van with books and volunteers to distribute the books to local public schools and when we got to the schools they had few books on their classroom shelves - some had ZERO. More than one teacher was crying as we unloaded - I just don't understand how it can get to that point.",""
"lup7lwt","jeremy_degroot","2024-10-31 14:21:46 UTC","https://www.hindislibraries.org/ is a nonprofit that can help you get the 4-6th grade appropriate books that are hard to come by. I've looked at using them to stock my little free library that's on a popular walking route near our middle school, but so far the community has kept it going.",""
"luonifc","Pretend_Classic_7832","2024-10-31 12:19:48 UTC","It would also be interesting to know what the distribution of publicly-funded libraries is across these communities, staffed with paid and trained librarians and supporting community events and programs for all ages. The little free libraries are charming and reflect the good intentions of people, but they are dependent on individual charity, and the word “free” in their title is a bit confusing — aren’t regular libraries free at the point of access, too? It seems unsurprising that the phenomenon of little free libraries has arisen during a period of attacks on publicly-funded institutions and their value.",""
"luqobhz","H0pelessWanderer","2024-10-31 18:58:02 UTC","I was caretaker for a LFL in a low income area and one thing that was useful was posting on nextdoor just flagging for people when the library was empty. That usually prompted a community refill :)",""
"luorm64","Both-City-1341","2024-10-31 12:47:42 UTC","Based on the library closing detail, I’m in the same area of Ohio, and our suburban LFL also is always full of religious tracts and pamphlets lol.",""
"luon5cw","858Librarian","2024-10-31 12:17:12 UTC","You may want to check in with your local library. The Friends of the Library group may be willing to help by supplying you with books for this.",""
"luohjrr","BigSpoonFullOfSnark","2024-10-31 11:37:01 UTC","To everyone who thinks the low income libraries are empty because their communities do not value reading, consider that people are probably stealing and selling those books.

I live near a free ""take a book/leave a book"" library on a street corner that is covered with notices begging people not to steal/sell the books, but it doesn't matter.

Multiple times per week someone will come by and take all the books at once. They'll then add them to their cart with a sign that says ""Book Fair"" and try to sell them along with other stolen items.

IMO it's not that low income communities don't value reading. It's that being able to give away quality books is a luxury that rich people have that most others do not.",""
"lur4j2q","queceracera423","2024-10-31 20:24:01 UTC","We had to remove a free little library in a lower income neighborhood because the kids started using it for drug exchanges. Ruined it for everyone.",""
"luq2lsg","Euphoric_Chemist_462","2024-10-31 17:05:31 UTC","It shows culture does plays an important role in education and potential future success",""
"luoux4b","alien-1001","2024-10-31 13:08:34 UTC","We have an awesome free library (it's at a persons home) they get so many donations it's incredible. They have a separate area covered by a tarp with other donations such as food and clothing. They are old so it must be hard for them to keep up. You can always open your own!",""
"luob4db","ConstantReader666","2024-10-31 10:40:59 UTC","There's a solution to this. 'Borrow' from the rich kids free library and return to the poor kids free library.",""
"lupi2rs","Alaira314","2024-10-31 15:17:58 UTC","Another note about the ebooks...I work at a library, and the < 20 crowd seems less fond of ebooks than my own generation was. They'll come in asking for school reading, and we won't have the physical book available without a wait(because you waited until august to do your summer reading, you fool!), but it's available through libby or even project gutenberg if it's a classic. They nearly universally look at me like I've grown a second head if I suggest that as an alternative to stressing over having to buy the book, though. Despite being otherwise glued to their phones, they seem to prefer physical books. Maybe they want to be able to multitask texting/watching videos while they read, and the e-book apps make that too unwieldy? Can't say.",""
"luq9ztg","One_Olive_8933","2024-10-31 17:43:38 UTC","I have one across the street from me. It’s an upper middle class neighborhood and every day many people stop to look, take a book, and leave a book. There’s multiple in the neighborhood and some older adults walk around the neighborhood looking for good swaps. They’re all very neat and tidy, and the homeowners who have them take good care of them. I could never see that happening in the towns I grew up in.",""
"lupkv4s","Zestyclose-Detail369","2024-10-31 15:32:46 UTC","sadly this problem goes beyond libraries 

chain grocery stores are nicer in the wealthier neighborhoods (more selection, cleaner, etc), chain movie theaters, even chain fast food, etc , etc",""
"lupg68a","alleyalleyjude","2024-10-31 15:07:52 UTC","Thank you for posting this. I work for a big book store chain in Canada, and every year we do a fundraiser drive where each store partners with a school to buy books for their library. I’ve heard first hand from librarians and teachers just how bad the kids WANT to read, but the school isn’t given resources to make it happen. 

I’ll go through our books and see if there’s a little free library somewhere I can donate to 💕",""
"luphpa1","Killians_","2024-10-31 15:15:59 UTC","I live in a not so great area in ohio as well and we have one in our neighborhood and the books just keep getting stolen.",""
"lupyjli","CementCemetery","2024-10-31 16:44:23 UTC","Inspired me to donate some books and leave them in various parts of the city while I’m out and about. Thank you! Keep reading.",""
"luro0mu","Deleted","2024-10-31 22:15:17 UTC","What makes me sad is the same thing. They installed 4 free little libraries in 2 housing properties. The 1st property the little library is on a hill for some reason & the door doesn’t stay shut. So the books just fallout. When they 1st installed them we were super excited but were only met with really old children books, bibles, devotional & board games that didn’t have all the pieces. We go right up the street to the park in a beater neighborhood that has a free little library & there are always so many good books. I often see parents putting new books or children getting a book or two when we’re at the park playing. I also noticed that reading is not encouraged in the area we stay in. So the books that were in the free little library when they 1st installed them the children ripped them up and they were just all over the property. I’m an avid reader & encourage my children to read to. I keep my books unless it’s a book I DNF then I put them in the free little library or I give them to a friend who may be more interested in it than me. For my children if they don’t have an emotional attachment to the book we ask friends and children around the neighborhood if they want any books. They also like to keep books but as they get older they get new books & grow out of their old books. So we can let them go more easier. I can say that since we started giving books to the neighborhood children that more of them are reading. I often get asked by one of the children if I can buy them a book & I go straight on ThriftBooks & get it for them. Our little library wasn’t even installed properly and is more for show than actual usage. I don’t donate to the free little libraries in the better neighborhoods because I find the children & give them the books. They love coming to talk to me or my children about the books they’ve read & I love it so much.",""
"lus78ni","RelevantStrongBad","2024-11-01 00:17:42 UTC","If anyone needs books for these shop your local library's book sales! We always have tons and tons of extra books at the end of ours, and our library at least has a ""pay what you want"" model.",""
"luoet0b","n3ws4cc","2024-10-31 11:14:08 UTC","It's a wonderful initiative, though! Maybe the community that set it up would help pitch in to get some more bulk pockets for the empty ones if they're that cheap. And maybe you could ask at the school if someone knows who the biblethumper is or put a notice requesting no religious texts. For a kid, nothing would kill the intention to read like a stack of bibles, i would imagine.",""
"luq1c8z","cowinabadplace","2024-10-31 16:58:52 UTC","There's no way to do these things in poor neighbourhoods because you need a high floor of behaviour, i.e. the worst behaviour has to be good. Poor neighbourhoods have low behavioural floors. Anything that can be transmuted into money at a higher rate than their day job, if they have one, will be transmuted into money.

In rich neighbourhoods, the commons is less valuable exploited than shared at some utilization. In poor neighbourhoods, they race to exploit it. Poor neighbourhoods cannot have nice things.

I would not run a free library in a poor neighbourhood. It would have to cost money. I grew up in one myself with a paid library and it was very effective. You place a deposit and then get to borrow books. I think that's a good model.",""
"luplstq","unorganized_mime","2024-10-31 15:37:43 UTC","If you have an address to send it, I’ll send some books.",""
"lupluio","jabberwockxeno","2024-10-31 15:37:57 UTC","I have a ton of books from my childhood and teen years I want to donate somewhere, but I don't know how to find places to do so or what would be better options then others.

Any advice?",""
"lurf7m6","Interesting-Fish6065","2024-10-31 21:23:00 UTC","Thank you for putting those books in that library.

I teach in a book desert—it’s the most populous city in the state, but there are virtually no opportunities to buy new books in the city limits, even if your parents have a little extra money for that.

Libraries are key, and the more there are, the more conveniently located they are, and the better stocked they are, the more kids will read.

I have a classroom library. I’ve had kids thank me on behalf of their parents for making available books that younger siblings of my students ended up reading. 

Access to books makes a difference.",""
"lurjjen","Mgrecord","2024-10-31 21:48:09 UTC","Fight for a school librarian and library in every school!",""
"lurlb3l","OldTiredAnnoyed","2024-10-31 21:58:33 UTC","We have them dotted all over the place & I try to spread out my donations. 

I found 12 boxes of books from when my kids were small so every week I’ll take another five books to one of the libraries & share the love around. 

I think these little free libraries might be one of the best things we have ever done in our community. Reading is so important & should be encouraged.",""
"lusup9f","Estudiier","2024-11-01 02:49:02 UTC","Thank you for caring.",""
"luw4zro","5starsomebody","2024-11-01 17:55:03 UTC","I am a librarian and help stock little free libraries around me with discarded library books(as part of a library agreement with the city bla blah blah). Would your library be open to a partnership like this? Especially if they had a volunteer or 2 to help move things around?",""
"lupm0ce","FemHawkeSlay","2024-10-31 15:38:48 UTC","I live in a struggling majority black neighborhood and ours was just full of bibles, that really pissed me off. There's a church on every darn street corner here; there's no lack of access to Jesus for those that want it. 

I'm unemployed right now but that's something I'd like to contribute to when my cards are a little better.",""
"luq7mk7","HoneyBadger_grrr","2024-10-31 17:31:25 UTC","My children went to a Title 1 school where we had a set up a “Book Nook”. Twice a week at lunch we would bring the book cart out and the students could purchase a book for 25¢ or trade in their book for a new book. We partnered with our local Half Priced Books store and they donated the books for our cart. This was run by parents with permission from the school. 

The school was 80% Hispanic and most students were in the ESL program. They loved the opportunity to have access to books. We had fiction and nonfiction. Some of the most popular books were nonfiction like kids cookbooks or how to write cursive handwriting.   

Most of these students had never been to a public library because their parents did not speak English or were undocumented so they were fearful of filling out any forms thinking they could be deported.  After finding that out I arranged for all the classes at the school to take field trips to the library where the students were able to get their own library cards.  Books are so important for kids and while our city has so many LFLs now, unfortunately there aren’t any that I have seen in the neighborhoods surrounding this school.",""
"lur7dyi","heidismiles","2024-10-31 20:39:25 UTC","I did my student teaching in a very affluent neighborhood. The teachers *asked parents for money* on Back to School Night, and they got it! They were all talking about it in the lounge. Parents donated a few hundred dollars each. 

It really is wild how different people's lives are depending on their ZIP codes.",""
"lurt118","ChildhoodWitty7944","2024-10-31 22:46:41 UTC","This thread has a lot of privileged and sad comments",""
"luqaou0","Confident-Mix1243","2024-10-31 17:47:12 UTC","Same lesson you learn when volunteering: if the local community prioritizes something they'll make it happen. You can help fund it of course, but building a school in a community that doesn't already have an education system (could be outdoor, or in teacher's house, or in a church...) won't make them care. Nice neighborhoods have well-stocked little libraries because they have a literate culture, not because of anything outsiders do.",""
"luq6kuw","ilvtowearoldldyswtrs","2024-10-31 17:26:03 UTC","Hey, you said Ohio and not sure if it's northern but if you are in or around Cleveland, have you reached out to the kids book bank for books? I know they have a little free library program and disperse tons of books to the community.",""
"luqjloz","JamieC1610","2024-10-31 18:33:26 UTC","I am also in the Dayton area (the library branch closing was a big hint).   I just joined the Junior League and  a major focus for the Dayton league is children's literacy.   There is a group that goes around to a bunch of little free libraries in lower income areas to stock them.  If you would let me know the ones that you see that are always empty, I can see if we can get them added to the list to stock.",""
"lurkuf8","Litarider","2024-10-31 21:55:48 UTC","I volunteer at a food bank. The kids books that appear in my LFL never move so I now take them to the food bank.",""
"luvby6x","Lin771","2024-11-01 15:23:52 UTC","I’ve been thinking that laundromats may be a great place to leave childrens’ books.  Haven’t spoken ti the owner, yet.",""
"luoy4nk","OutsidePerson5","2024-10-31 13:28:02 UTC","Note also that in Utah they are trying to press criminal charges against people who have Little Free Libraries with books the Mormon Elders don't like.",""
"lup8vu8","ohwhatanerd","2024-10-31 14:28:47 UTC","This is such a lovely and inspiring post! It's my day off and I can't wait to go to the Goodwill Bins and stock our neighborhood free libraries.",""
"lup4jlx","davetek","2024-10-31 14:04:46 UTC","This post hit hard. The contrast between the well-stocked little libraries and the ones that are neglected or even misused is a sad reflection of the larger inequalities that exist. Books and education are such foundational tools, and seeing areas that lack access because of socioeconomic divides is disheartening. Kudos to you for taking the initiative with your local library and for highlighting ways people can help. Even small donations can make a huge difference for young readers who might not have access otherwise. Thanks for sharing and making us all a bit more aware.",""
"luqs9mn","InAnAltUniverse","2024-10-31 19:18:51 UTC","It's not often you find someone with conscience, the will to help the little guy and most of all the ability to craft words well. You sir/madam, are a unicorn.",""
"luskx02","math-yoo","2024-11-01 01:44:12 UTC","Vote for your library levy. The big free library is more important than the little free book disposal box.",""
"luqs4mm","Ironlion45","2024-10-31 19:18:07 UTC","Well, it sounds like you're doing good work, but it sounds like there's a lot more that could be done; a community organization might be able to generate more interested volunteers and donations.  

That problem with the public library could be solved by convincing administrators to budget for hired security during the hours immediately after school.  Leave the kids who are studying and reading in peace, kick out the troublemakers.   I think that's actionable.",""
"lurddb6","darkmattermastr","2024-10-31 21:12:27 UTC","I am not surprised ",""
"lurxl0n","Mouler","2024-10-31 23:15:34 UTC","We put one up. Books were shredded within 3 days. Door ripped off.",""
"lusm0if","Deleted","2024-11-01 01:51:04 UTC","It sounds a LOT like youre my neighbor OP given the library closures you referenced. I didnt even know we had a little library nearby. Good on you, my house is bursting at the seams with books and this neighborhood has many readers. Maybe we can help.",""
"lut26l4","dbcher","2024-11-01 03:43:31 UTC","This is just one of the many ways the system is made to keep the poor, poor and the rich, rich.

Those with money can afford to live in a better area, that area has better schools thus the kids do better and learn more and then go on to better jobs.

Those without money live in poor areas, these areas have bad schools thus the kids do worse and have to fight to survive. This means they often do not go on to higher education and end up in minimum wage type jobs.

The rich need to keep their slave class uneducated so that they can make their money off the poor peoples backs and get richer.",""
"luv361r","LethalxLetha","2024-11-01 14:36:44 UTC","I mean, you could always take the stuff from the better one to the other one like a book Robin Hood!",""
"luqtb5z","iowanaquarist","2024-10-31 19:24:23 UTC","There is *nothing* wrong with shuffling the contents of the LFL. Take some books from each of the well stocked ones to fill the understocked ones. Repeat as needed.",""
"lup0hzb","grindermonk","2024-10-31 13:41:54 UTC","Bottom line is that in impoverished areas there is greater demand for free books than there is in wealthy areas. 

Whether it is because kids are desperate for good reading material or someone is desperate for anything of value to sell in order to improve their situation, it shouldn’t really matter.

Libraries, large or small, need to be curated. Good on OP for taking that task on at the LFL by the school. Sometimes the volunteer curator has an agenda. Religious pamphlets etc are a prime example of that. Folks that judge others who take books without fitting their ideas of who the books are for also have an agenda. Maybe the homeless person loves to read as an escape from a hard life. 

Most books at a LFL don’t get returned. It only makes sense that they end up somewhere else, and that place just may be a used book shop, thrift shop or a blanket on the sidewalk. Many folks rely on selling items they perceive as having value.

The take home  message is: keep stocking those libraries. Clean out the trash and curate their collections with care and take joy from the disappearance of those books. Chances are they’re enriching someone’s life. It doesn’t matter whose.",""
"luqx8e0","Beautiful-Quality402","2024-10-31 19:45:13 UTC","Poverty is one of the greatest evils.",""
"lur7d7z","CosplayPokemonFan","2024-10-31 20:39:18 UTC","This is why I took over the lfl near the foodbank. It’s surrounded by multiple low income apartments and the homeless encampment is two blocks away. I take all my “unwanted” books there. Been in my library a month? Transferred over. Slightly worn? Transferred over. Scribbled on? Transferred over. Adult book? Transferred over because only kids books move in my neighborhood. Religious book? Transferred over because my library is religious free but that one isn’t and is next to two churches. I have almost never had a book last over there more than a week. Keeps my backstock from being too much and lets the books go in circulation over there.",""
