"comment_id","user","time","message","parent_id"
"luonvz7","onecupofspam","2024-10-31 12:22:27 UTC","Myriad of studies show better level of education correlates positively with higher income","luoktia"
"luoopls","onecupofspam","2024-10-31 12:28:13 UTC","Did she stop after getting electronic devices / more tv time btw?
Genuinely curious, as I have a toddler whole loves reading books together (for now)","luoktia"
"luuf9zr","Willow-girl","2024-11-01 12:10:17 UTC","True, but if donors get wind of the fact that someone is regularly cleaning the whole library out and taking it contents elsewhere, they may think twice about giving. 

I just had this argument elsewhere on a slightly different topic. Often people's intent in doing good works is to benefit their neighbors and local community. When this charity is abused, it tends to dry up.","luql52m"
"luovig3","gorgossiums","2024-10-31 13:12:13 UTC","Is there a bus route? Does it operate at the time you need it? Does it go where you need to get? How much does it cost? Will it still be running when you’re finished doing whatever you’re doing? What happens when the buses stop running and you still need to travel?","luov6rl"
"luphvsj","Onedayyouwillthankme","2024-10-31 15:16:56 UTC","distribution is likely quite random","luphkok"
"lus43nv","Polkadotlamp","2024-10-31 23:57:17 UTC","Yep, that’d do it","luponf4"
"luskp5s","gripperjonez","2024-11-01 01:42:47 UTC","I’m completely okay with leaving all religions out of public institutions. You are welcome to practice where and what you will, but don’t shove it down anyone else’s throat. -and before you try to both sides this, ALL religions should be treated with equal indifference in public spaces. I won’t insist on statues of baphomet or trying to convert your children to Buddhism or Jain  or Hare Krishna and you keep whatever god or gods you believe in to your damn self unless asked for or about it. ","lur1keu"
"lusgw2x","uconnhuskyforever","2024-11-01 01:18:32 UTC","I never would have thought about the easy open features, especially for protein. Makes perfect sense.  Thanks for sharing this tip!","lupi7vg"
"lupyjcy","moonchylde","2024-10-31 16:44:21 UTC","If you have access to a Costco, their Kirkland canned chicken has pull tabs!","lupi7vg"
"lurp6at","sparklestarshine","2024-10-31 22:22:29 UTC","I have poor hand strength, so I can chip in!  I can use a modified can opener but like pull tabs - there are tools ( a screwdriver used as a lever is my fav) that help. The advantage to buying pull tabs is that the other end can still be opened with a can opener, so it meets both preferences. But yes, anything is better than nothing!  And now I’m thinking that I should buy can openers to add to my unhoused Christmas giveaway bags this year","luq11ce"
"luteh7p","DeGloriousHeosphoros","2024-11-01 05:35:54 UTC","I'm not sure, but opening a tin can with a knife can be really dangerous; the sharp metal can can easily cut or puncture skin. Most modern can openers (AFAIK) kinda curl the sharp bits so that it's less dangerous. Besides, I'm not sure that every homeless person who's living out of a bag would even have a suitable knife for this.","lur3oxw"
"luqek5u","Optimal-Ad-7074","2024-10-31 18:07:01 UTC","i'm fine with you having your own opinion, so long as you no longer feel it's necessary to coach me into sharing it.","luqbczg"
"lutd3bt","Optimal-Ad-7074","2024-11-01 05:21:21 UTC","i'm starting to find it a bit weird and irritating that so many people make it their business to question or second-guess what i think about this.  

 i take books from that box if i intend to read them /endof.    that's my perception of the entire social contract implicit in the lfl thing and for whatever reason it matters to me *personally* to honour it.  people put their books in that box in the spirit of 'hey, maybe you'd like to read this; feel free.""   if i would NOT like to read it i leave it alone.  if i would not like to read it, it's not my book to remove.  

 anything i do take probably will end up in the under-blessed other box anyway, after i'm done with it.  as i mentioned, i do take most of my own contributions to that one.   but i'm not shifting books around from box a to box b just for the sake of doing it.","lusod8d"
"lurw5b0","A-Grey-World","2024-10-31 23:06:27 UTC","Yeah, I mean, how many junk bits of literature are produced to be discarded? Every bit of electronics that has an instruction manual that's never opened. Every dumb commercial conference that prints out a publicity material that is utterly pointless. Every magazine, sales pamphlet etc etc.

Who cares if half of them end in the bin!","lurfpjd"
"lutxzkk","Gumshoe212","2024-11-01 09:29:20 UTC","What was the reason for throwing them out instead of donating?","luqjaoz"
"luq3d37","slipperyMonkey07","2024-10-31 17:09:27 UTC","Yeah I have a little stamp I got off etsy that says ""little free library, always for free never for sale."" with a little illustration that I stamp on the inside title page. You have to go out of your way to read the text, from a distance at a glance it just looks like a little illustration the book has printed in it.

It is tough. I know the people taking the books to sell are probably desperate since they are trying to sell books. But since I usually donate YA or middle school level books it is also not fair to have the books taken when a kid loses out on what might be their only way to get books. 

But some doing it are just assholes. I only started the stamping a few years ago when one library owner found out the garage sale crowd had added raiding the libraries to their route. With the only ones being raided being the low income ones. Having several prioritizing POC authors. 

Most of the garage sale crowd of course being upper middle class people from the neighboring village / suburb. With the free is free mind set. But I guarantee they would never touch a little library in their community.","lup9ixb"
"lutykgk","Gumshoe212","2024-11-01 09:36:04 UTC","You're wife sounds like my kind of woman. You've got a keeper.","lupfrd9"
"luq3xmy","Awesomest_Possumest","2024-10-31 17:12:25 UTC","And the McKay's where I am, which is one of the originals now moved, overprices the hell out of stuff now. When I moved in ten years ago it was a good deal, I'd get books for my classroom for quarters, but the past couple of years they've up charged everything and it's just ridiculous.","lupcrw3"
"luq444e","Good_Ad_1355","2024-10-31 17:13:22 UTC","Are you in NC? I love McKay's","lupcrw3"
"luq9ha4","BallerGuitarer","2024-10-31 17:40:59 UTC","Damn looks like Barbara Walters came back from the grave.","luq15zp"
"luuruia","PugsnPawgs","2024-11-01 13:33:06 UTC","I can't steal if it's for free. That's the whole point 🤷‍♂️","lus0j0l"
"luq8oa5","LowClover","2024-10-31 17:36:49 UTC","You're absolutely an evil leech if you take books from a little free library and resell them. There are other ways to get by.","lupbwcv"
"lur7m8t","Drink-my-koolaid","2024-10-31 20:40:41 UTC","Not one or two kids taking ALL of it.","luqtieb"
"lup4628","stickinitinaz","2024-10-31 14:02:39 UTC","I love that thought and hope it is true for many children.","lup0jh9"
"lurmz0f","afeeney","2024-10-31 22:08:47 UTC","I think it's mostly a [crabs in the bucket](https://en.wikipedia.org/wiki/Crab_mentality) mentality and a small but loud message that reading/studying is ""elitist"" or ""eggheaded"" or ""nerdy"" or even ""acting white.""","lur86mr"
"lurx2sp","yazminslide","2024-10-31 23:12:22 UTC","I will say it's not pride in stupidity. When you don't have access to education, you value other kinds of intelligence whether that's being street smart or other things. 

I think from my experience from a lot of kids from lower socioeconomic backgrounds that I tutored is that school is frustrating and they believe they can't do it. If you go to the r/teachers subreddit, you'll see that teachers don't have enough resources and students can even graduate without learning the skills necessary to actually read and/or write well. Students are frustrated that they're not understanding the work so they take pride in social skills instead because they've been failed by the school system. They see ""book smarts"" as less valuable to the microcosm they're in.

Also, depending on the neighborhood you grow up in, there may not be any role models around that are college-educated. If your family hasn't gone to college, it makes it less likely that you will go to college. If your parents never had time to read to you and instill a value of learning in you, then it's less likely that you will have that. A neighborhood may value street smarts or social skills over everything else. 


Finally, I think that people that come from higher educational backgrounds can talk about things that are not a main concern for people from lower socioeconomic backgrounds. For example, at college, I had friends who talked about going to Europe and even Florida for spring break, and I could do literally none of that. My main concern was rent, money for textbooks, work and where my next meal was coming from. Also, they may feel judged or embarrassed for not having high levels of education and feel that these people who aren't like them won't respect them.","lur86mr"
"lusqeiq","thrownawaynodoxx","2024-11-01 02:20:04 UTC","Crabs in a bucket mentality plus generational trauma with a helping of ""fuck you, i got mine"" mentality. 


Trying to succeed in any field that requires higher education except for a select few such as teaching is ""white people shit"". Serious ambition is a personal attack. The sense of supportive community in these areas tend to be pretty lacking, so there's wildly inconsistent encouragement of children to succeed.","lur86mr"
"lup7b4d","kindathrowawaybutnot","2024-10-31 14:20:07 UTC","I was going to edit my comment but I'm just going to make another instead. 

I could've phrased my comment better, but kids can be very bad at understanding consequences. Sometimes a kid will not understand something can burn them until it does. They just won't get that a boiling pot of water is hot, when they've been told, when they've literally seen it boil things, until they get close enough for it to hurt. You can do your best to try to protect them, but sometimes the lessons won't stick no matter what you do. Occasionally you need to make the consequences before something else has worse ones.

I hope I don't have to make this clear but I'm not advocating for hurting kids. Sometimes, though, a kid will only learn through being hurt, so it's best to make that hurt be in an environment that supports them through that, and minimize the pain as best as possible. In rare cases, it might be better to create a situation where they're going to be hurt in a lesser way to save them greater hurt later. Because if you eliminate hurt entirely, they will not be a functional person, and they won't know how to deal with hurt. 

Please, let me know if I'm wrong though.","lup062h"
"lup6tqz","bunnylover726","2024-10-31 14:17:26 UTC","That's how it is at my daughter's school. I see kids themselves snatch up all the books.","luop4mv"
"lup0xls","digitalnoise","2024-10-31 13:44:23 UTC","IIRC, you don't 'own' ARCs in the legal sense - they are 'loaned' to the reader/reviewer, and the publisher can demand they be returned at any time.

Obviously, the penalty for not returning is likely to be removed from the ARC program, which for people who review for their jobs could be devastating. 

Granted, large publishers may not really care - but all it takes is one particularly zealous employee to make everyone have a bad day.","luoxmik"
"luoohd5","n3ws4cc","2024-10-31 12:26:37 UTC","Not necessarily, though. They might value the books, but if the few bucks they can get for them means food on the table that could outweigh the relative 'luxury' of reading a book.","luonsud"
"luurch5","stickinitinaz","2024-11-01 13:30:09 UTC","Agreed 100%.","lut51ve"
"luqnfyd","Zora74","2024-10-31 18:53:33 UTC","Which still doesn’t mean that the community devalues reading. It just means that now books are harder to access.","luqgdr5"
"lutkjql","Zora74","2024-11-01 06:45:52 UTC","If you have x number of non-readers in each community, then you have communities that value reading equally. 

If it is not for the non-reading members of one community to steal books to sell and not worthwhile for the non-reading members of the other community to steal books to sell, then what you have is a difference in income levels and resources, not a difference in how much the communities value reading.  

Affluent communities will have better access to resources because they are affluent. Having resources means being able to provide resources.","lut3ufd"
"luovznv","stickinitinaz","2024-10-31 13:15:08 UTC","Too bad we don't have a government dept making sure our kids learn and have access to all the books they want to read. ","luooygv"
"lup01ft","Waywoah","2024-10-31 13:39:15 UTC","Yes, because everyone has the same access to education, and no one with an education has ever had trouble finding work.

College is incredibly expensive, even with loans, and a high school degree does nothing to help with jobs","luooygv"
"lv049m8","Freyas_Follower","2024-11-02 11:38:40 UTC","For a variety of reasons.

A complete lack of medical care, a complete lack of social support, Not a mention a complete lack of social services and mental support for people who are already addicted.

For many, there is no other escape from pain itself.

But, fixing it would involved a complete rehabilitation wouldn't it and single payer healthcare, wouldn't it?","lv00use"
"lupcupq","muffinfight","2024-10-31 14:50:15 UTC","Their library will always be full, though? And reasonably, so will their personal collections, provided to them by parents who don’t have to decide which bills to pay this month. 

I don’t think it’s a viable solution either, but not because I think the rich kids will miss out on anything. Inconvenience and annoyance for the adults, maybe. Hell, a better solution may be to have a locked box with a slot next to the rich kid’s free library. 

Presumably these parents want to do some good from the convenience of their regular schedule, so why not label it for xyz other free libraries? If someone shuttled the books to the other free library it may have more effect than simply robin hooding the rich kid library.","lup67ys"
"luqduob","STFUisright","2024-10-31 18:03:19 UTC","Holy moly just a tad aggro! Take it down a notch, this is a civilized sub.","lupuwgr"
"luq50wr","Leungal","2024-10-31 17:18:07 UTC","Maybe little free libraries are different where you live, but at least where I live there's zero expectations or obligations to ever return a book placed in one.  It'd be considered polite to place a book in if you take one out, but the entire point of the system is to encourage and promote sharing of books, and literally nobody puts a book in a little free library expecting to ever see it again.

Claiming someone is ""stealing"" from a little free library would be like claiming someone is ""stealing"" from a pile of scrap wood left on someone's lawn with a sign posted next to it saying ""FREE WOOD""","lupuwgr"
"lupygjb","SoulSerpent","2024-10-31 16:43:56 UTC","I don’t really see it that way. If I donated a book for anyone to read and return (which I’ve done a few times at these LFLs) I would not give a single fuck which box it ended up in and who was benefitting from it. As long as they stay in circulation the spirit of the donation is the same and I’m not territorial about it in that way. 

But regardless you’re ignoring the point that nobody called wealthy people evil.","lupuwgr"
"luqbpaq","CANDY_MAN_1776","2024-10-31 17:52:20 UTC","These people obviously grew up in neighborhoods too dumb to operate a free library.","lupuwgr"
"lupqyoq","cat-orphanage","2024-10-31 16:04:33 UTC","Yes, I’m absolutely not saying you’re doing this. If you have the extra time, you could also try organising donations through something like Facebook - lots of people have kid’s books like serialised books like Goosebumps and required reading for school that their kids have outgrown. Usually the hardest part of things like that is actually physically getting the items, so like I said it depends on how much time you’re able to allocate to things like this. The buying the books by weight is a great idea though.","lup91ft"
"lup1kn5","cat-orphanage","2024-10-31 13:48:02 UTC","Try doing that with literally any actual library (which are also free btw) and find out how it’s theft when you hear from the cops.

If you can get to the “rich” area to steal from children, you can spend twenty minutes and ten dollars in a thrift store and avoid thieving from eight year olds to begin with.","lup157q"
"lup1ldy","Deleted","2024-10-31 13:48:10 UTC","[removed]","lup157q"
"lup6476","Accelerator231","2024-10-31 14:13:34 UTC","I want you to try it so that we can see what happens.

Why are you even on a book subreddit if you're not going to use any of the information?","lup157q"
"lup6a81","Accelerator231","2024-10-31 14:14:30 UTC","""Your honor, I stole the money meant for hurricane victims so that I can give them to cancer patients! I didn't steal anythi-"".

Urgh","lup2ipl"
"lup30d6","cat-orphanage","2024-10-31 13:56:07 UTC","Yes, if something is donated with the intent to stay in a specific area for the use of that community, it’s theft to deliberately appropriate the donated items. Is there some reason an adult can’t either buy these books cheap, or failing that organise donations, instead of stealing from small children? The phrase “like taking candy from a baby” isn’t aspirational.","lup2ipl"
"luxx974","Anhao","2024-11-01 23:50:28 UTC","> High demand for reading in the community is what creates full libraries

Nah it's money that does that.","luqdwhn"
"luqi9ey","grindermonk","2024-10-31 18:26:24 UTC","I think you are mixing up supply and demand and you are making assumptions about how the books are being used.

I didn't say reading is valued. I said the books are valued. It isn't a little FREE library when you start putting strings on who gets to take the books and how they choose to use them.","luqdwhn"
"luofku9","shadowrun456","2024-10-31 11:20:43 UTC","What? How do you get ""some innate thing"" from this?","luoez7s"
"luom6vr","shadowrun456","2024-10-31 12:10:21 UTC","I never blamed **anyone**. I genuinely don't understand why so many people interpreted my post as me trying to assign blame. Or apparently me being racist? Can you quote which part of any of my comments are racism or assigning blame? Can you quote the exact part please?","luokhbh"
"luoghqx","shadowrun456","2024-10-31 11:28:20 UTC","Do you agree that the best solution to poverty is education? That is what I was saying. If you agree with that, then you agree with that I said.

1. Poorer people have less opportunities for education.
2. Less opportunities for education leads to people making less educated choices.
3. People making less educated choices leads to people making less money.
4. People making less money leads to people being poorer.
5. Go to step 1.","luoffbr"
"luogmol","shadowrun456","2024-10-31 11:29:29 UTC","Yes, and education is the best way to help them. That was my point. If you agree with that, then you agree with that I said.

1. Poorer people have less opportunities for education.
2. Less opportunities for education leads to people making less educated choices.
3. People making less educated choices leads to people making less money.
4. People making less money leads to people being poorer.
5. Go to step 1.

If you give people education, that leads to them making more educated choices, which leads to them making more money, which leads to them having more opportunities for education, which leads to them making more educated choices, etc.","luofdf8"
"luv2a3q","ankdain","2024-11-01 14:31:52 UTC","So you're point is people who grew up middle class and with stable backgrounds/childhoods, strong community with a focus on good education were able to return to that standard using the skills they had formed pre-internment?

Yeah, cool I agree that's not too surprising.  Like if I had my all my money taken away tomorrow, that doesn't suddenly erase the fact I had stable loving family growing up, that taught me valuable skills about health interpersonal relationship, managing money etc and now have a good university level education.  I can go to that job interview I need to get back on my feet, present and speak well and get hired, then be reliable employee etc.  There's a good chance I'd be able to get back to being middle class after losing it all because I have a stable set of middle class skills I can rely on - I know how to be middle class and how to manage that.

But that has nothing to do with someone who grew up with shitty parents on food stamps being semi-malnourished, getting a shitty education in an underfunded school in a shitty community having a much higher chance of staying in that shitty situation does it?  In any one case each individual is free to make their own choices and all have potential ways out of their situation, but statistically people stay in their lane - poor people stay poor, rich people stay rich etc.  So at a person level, it's absolutely on the individual not to fuck themselves up, but if it was 100% only up to the individual then every generation would have massive social shifts as each individual fell/rose to their true place.  But that isn't seen, and most people don't drastically move social/economic situations, so society at large obviously has to play some part in it.  That doesn't mean an individual can't escape their circumstances, loads do, but denying that your initial starting conditions play a part is just absurd.

It's like denying that someone born into the US has better chance of getting rich/famous than someone born in slums of Hati.  Starting conditions matter, so does personal accountability - but one doesn't mean the other isn't relevant.

So yes, poverty is trap.  Is it inescapable?  No.  Should we still hold individuals accountable for their actions?  Yes.  But can we also accept that there is more we could do to help with the stacked deck?  Also yes.","lur6lus"
"lute1c5","shadowrun456","2024-11-01 05:31:13 UTC",">But a persistent obstacle to education is indifference to being educated

Or, in other words, they have not been educated to value education.

>and worse, patterns of disruptive behavior in school.

Or, in other words, they have been (mis)educated to act disruptively.

>Poor behavior by adults = poor parenting = kids doing poorly in school. 

Or, in other words, they have been (mis)educated to behave poorly and to parent poorly.

Every single point arises from the same - lack of education. The solution to all of them is education.","lut6ps3"
"luoow78","flamingochills","2024-10-31 12:29:28 UTC","Reading is a basic skill though you don't need higher education to do it, the majority of people working in factories with nothing past a high school education can do it. Paperbacks are popular and for the masses and a great many of those masses work shit jobs.","luonvz7"
"lup0pop","somerandomguy1984","2024-10-31 13:43:08 UTC","The studies I’m more interested in are the ones that show a typical CEO reads like 50 books a year while the typical low wage earner never reads.

That’s my point.  And I’m saying reading is the driving force, not the financial situation.","luonvz7"
"luorzob","flamingochills","2024-10-31 12:50:08 UTC","Honestly she says that she got bored with the words and couldn't imagine the story in her head and yet she loves the Harry Potter films and other stuff so yes I think visual is easier and reading takes more effort. She's happy reading for work though and passed her accounting qualifications with flying colours which sound rather dry to me so it's not an intellectual thing.

I tried so hard when she was younger and bought loads of books for her but nope. She is stubborn so beware that behavior in your children ,she admitted that she did the opposite of what I wanted growing up just because 😂","luoopls"
"luoyecg","Competitive_Lab8907","2024-10-31 13:29:38 UTC","what's wrong with a bicycle? the bus is slow, costs money, reeks of diesel fuel, smokes like an exterminator and there's people on it.

When I was a kid we rode bikes to the library because it had AC in the summer, there were no bike trails but there were homeless people, gangs and cops all hassling us then,  it wasn't exactly safe.... what's changed that prevents this now?

""bikes cost money""... kids bikes are free from trash, that's why the homies ride them","luovig3"
"lupiagu","logitaunt","2024-10-31 15:19:07 UTC","they're not distributed - they're built/purchased by the property owner. Privately owned, but shared with the public. You see them more in higher income and higher education communities, so it's strange that mine doesn't have any.","luphvsj"
"luu714x","websterhamster","2024-11-01 11:02:15 UTC","Sure, but that's a red herring. We're talking about books here, and the concept of censoring books about topics one might disagree with has already had devastating effects in several states. If you insist on removing religious texts from libraries, someone else will insist on removing LGBT or feminist texts as well.

I can tell you have strong feelings about this subject, but please consider the consequences of advocating for such a fundamentalist policy.","luskp5s"
"luqpmxv","Kerrytwo","2024-10-31 19:04:56 UTC","It does seem weird that you're seeing this issue but unwilling to take any steps to fix it?","luqek5u"
