"comment_id","user","time","message","parent_id"
"luqbgeg","Kindly-Article-9357","2024-10-31 17:51:05 UTC","My local library is a \\*gorgeous\\* building. When I was a kid, I absolutely loved being in there. I could and did spend hours in there, at least once a week. Not once do I ever remember seeing someone behave so badly they needed more than a warning to straighten up. On occasion a few teens might speak too loudly, but a stern shush from the librarian quickly put them back in line. It was accepted that people who were not able to abide by the expectations for respect of the quiet were not welcome. 

I tried to instill the same love of the library in my own kids, but things were already changing by then. I noticed way more unaccompanied kids who obviously weren't ready to be unsupervised in public. They demanded more time and resources from the staff to keep them from disturbing other patrons. 

I also think a big contributor was that local care homes started bringing severely disabled people to the library for outings, because it was free and a low-stim environment. I understand their reason for doing so, and yes, disabled people should have access to and be welcome everywhere anyone else is. Yes there should be some considerations extended for them that you don't extend to abled people. 

But it shouldn't be at the expense of others trying to utilize that space for its intended purpose. When you have a library that's supposed to be a quiet and low-stim place, and then you bring in groups of people who are not able to respect and preserve that quiet and low-stim place for others but can't be shushed because that's abelist, others \\*will\\* get upset and frustrated and stop using the place.

The last time I set foot in my library was 10 years ago. It was obvious the people in charge still loved it dearly, that they were still doing their best to put on amazing programming and to meet the needs of the community in spite of the challenges. But it was also full of mentally unstable and stinking people who are only there to kill time in the heat or AC until they have to leave. It's full of unattended and ill-behaved kids whose parents are using it as a free daycare. It's full of organizations using it to avoid paying for their own programming and spaces for mainstreaming profoundly disabled people.

These days the library devotes much of its resources to addressing the challenges they face managing its patrons. A lot of how they do this is by tailoring services to these groups. I don't need those services. The environment is incompatible with what I need and want in a library. Not only is it no longer an enjoyable place to be, it's no longer a \\*safe\\* place to be.

So why on earth would I go there?","lupmkqw"
"luu06p2","ArchaicBrainWorms","2024-11-01 09:53:59 UTC","All LGBT no brakes","lur2jcb"
"luq7l85","happyhappyfoolio2","2024-10-31 17:31:14 UTC","Home of the fighting beavers!","lupssqw"
"luqjaoz","Lifeboatb","2024-10-31 18:31:51 UTC","I had no idea those stamps were to prevent theft. Our public library was actually involved in a scandal a few years ago when they put hundreds of books in a dumpster, so it didn’t seem like an issue.","luouvn7"
"lup9ixb","muffinfight","2024-10-31 14:32:18 UTC","Stamping the inside cover could be a viable alternative in that case.","luol99a"
"lupfrd9","bythog","2024-10-31 15:05:39 UTC","I'm in the ""good"" neighborhood of my town, too. 

Also I know for a fact that many of them were sold because I've found some of them in yard sales and second hand stores. There is no way a person other than my wife bought a new copy of ""The History of Crosswords"" in this town.","lupf1ia"
"lupcrw3","ExcitementOk1529","2024-10-31 14:49:50 UTC","It is in fact a McKays","lupckos"
"lurymh2","NomNomNews","2024-10-31 23:22:12 UTC","To be honest, I haven’t noticed. I just know that my library is the most popular one in the neighborhood (there are several). Constantly new books, and it goes from completely full to 50% full to totally full again.  

It’s so popular, that I built on a separate space for kids books. Those disappear FAST!

I see people pull up in cars to drop off boxes of books, I see people walking their dogs browsing it. It’s pretty heartwarming!

-

The key to having a successful, popular library, is you have to be brutal about “curating” the junk.

Once a week (trash day) I go in there and get rid of all of the books placed there by people who feel guilty about throwing out their old crap books. 

I toss the Hawaii tour guides from 1985, the college textbooks from 1990, and the really beat-up and discolored brown pulp fiction books (the small softcover books printed on cheap, thin paper).

Nobody is ever going to read any of those.  It’s never a lot, maybe two or three every week, but if you don’t do it, it will take over your library quickly.

The libraries that no one uses in my neighborhood are filled with all of those, because they keep getting added and never taken away.","luqfmsv"
"luqb7ag","gunn3r12","2024-10-31 17:49:48 UTC","Oh yeah that totally makes it okay because chosing to be an art student is the epitome of struggling","lup5g81"
"luq15zp","Knowsbetterdontcare","2024-10-31 16:57:58 UTC","And what have you done to make up for the damage you did? You say you were a thief for the sake of your art education. Did it pay off?  Are you successful now? How many aspiring writers lost out because you put your art before their opportunities? 

Do you donate money? Time? Free art?  How have gone back and tried to make things right?","lup5g81"
"lus0j0l","thewimsey","2024-10-31 23:34:20 UTC","Except they weren't a godsent treasure. 

You were stealing them.","lup5g81"
"lupbwcv","joyce_emily","2024-10-31 14:45:08 UTC","This sub sometimes paints book sellers as evil leeches. But in my personal experience, they’re just poor people trying to get by","lup5g81"
"luqtieb","shmixel","2024-10-31 19:25:27 UTC","Are the kids not supposed to take the candy at Halloween??","lup5b0m"
"lup0jh9","Good_parabola","2024-10-31 13:42:08 UTC","Yep!  That’s why having a stand to quietly help yourself to some books without anyone having to know is golden.","lup01pc"
"lur86mr","Drink-my-koolaid","2024-10-31 20:43:43 UTC","But *why* is there resistance to education? Why is there pride in stupidity and ignorance? Is there a reason? (serious)","lup01pc"
"lup062h","kindathrowawaybutnot","2024-10-31 13:39:59 UTC","I feel like something like that should have harsh, extremely harsh, consequences for the individual. Because they aren't going to understand that what they're doing is a problem otherwise. Put a camera on the box, find who is doing it, make them do community service or something for the amount of money they're literally stealing. Many people are just incapable of grasping an issue until it hurts them directly.","luoufwx"
"luop4mv","Good_parabola","2024-10-31 12:31:05 UTC","I would say yes.  Kids who don’t get much are probably grabbing them up. 

My kids’ school has a bookcase of free books, I watch kids walk by and take stacks of books with them when it’s restocked. Good.","luooev3"
"lupnqg3","stormcharger","2024-10-31 15:47:48 UTC","Second hand books take way too long to sell, I don't really see people doing it for money","luooev3"
"lur3jgp","WTFwhatthehell","2024-10-31 20:18:41 UTC","from my own years in school school, some kids love reading, some kids love to ditch school and go drinking down by the river and burn things. 

Books are nice and flammable.","luooev3"
"lwxyeim","Appropriate372","2024-11-13 17:01:23 UTC","Likely hoarders unfortunately.","luooev3"
"lupwb16","0FFFXY","2024-10-31 16:32:40 UTC","Maybe the people stealing the books can't read, so a pictogram instead of a notice might be more effective.","luooev3"
"lup06o9","Good_parabola","2024-10-31 13:40:05 UTC","Stolen clothes, shoes, knock off stuff, things like that.  ","luozku7"
"lurr77w","AdagioOfLiving","2024-10-31 22:35:08 UTC","You could argue that “education bad” is a much more backlash worthy thing than “I prefer Judaism to the Catholic Church”, although that doesn’t mean black people are inherently bad as much as some white assholes try to make it seem that. Just means that that culture - hood culture, specifically, not black culture - is bad.","luor4et"
"luqf3dh","camergen","2024-10-31 18:09:50 UTC","I think there would have to be a tipping point, where enough books have been rejected that it is no longer worth it for people to ransack these libraries hoping to flip the books for cash. 

But for that to happen, a majority would have to have the stamp or labeling, and I don’t see that happening.

Maybe someone could take the stamp to their local free library and stamp all the books at any given time. Doing so enough times might potentially discourage someone from attempting to sell these books.

But I’m just brainstorming ideas here. It seems wrong to me that these books are being sold instead of going to their intended purpose.","luolqkd"
"luoxmik","Sea-Tackle3721","2024-10-31 13:25:01 UTC","Why would anyone care what the publisher says? They can't restrict you from selling a book you own. I'm surprised the store even humors you.","luou4b4"
"luu31bi","Gumshoe212","2024-11-01 10:23:53 UTC","""\\[B\\]ut if you’re saying that it’s okay to steal because you’re poor, you’re saying that all the poor who DON’T steal are just being dumb, letting the “smart ones” get ahead.""

While I wholly agree that stealing damages a community, this is specious reasoning. Understanding, or attempting to understand, why someone poor is stealing books isn't equivalent to thinking poor people who don't steal are dumb. No one stealing books to resell is getting ahead by any sane or generous person's estimation.","lurrmmm"
"luonsud","shadowrun456","2024-10-31 12:21:50 UTC",">There are kids who would love and appreciate those books, but odds are they don't even get a chance to see them.

>The only way to find the good stuff is to be lucky enough to check the library immediately after it was donated. Within a few hours, someone will come by and steal all the valuable stuff so they can sell it.

Exactly. It's the ""crabs in a bucket"" effect. Those who steal the books, damage the education (and therefore future wealth) of those kids who're interested in the books. The reason they steal and sell the books, is because they were not educated to value the books as an educational tool themselves. If they've been educated to value books as an educational tool, then they wouldn't steal books to sell them, and would not damage the education of the kids who're interested in books.","luomw5p"
"lut51ve","shadowrun456","2024-11-01 04:07:11 UTC",">Our children should not have to be scavenging for free books, especially the disadvantaged. I don't see many comments addressing that

I mean, I am the one who is literally addressing that in all of my comments. Yet people accused me of being ""classist"", ""racist"", and ""blaming the poor people"" for doing that.

>rather they are class and race blaming. ""Steal books from the nice ones and put them in the shitty ones"" is one of the top freaking comments.

That's also what I explicitly called out in my first comment.

>Sad seeing all this apparent concern and energy being apllied in a useless direction.

I'm afraid that one of the replies hit the nail on the head:

>Redditors love to virtue signal by deliberately misreading what what other redditors wrote, so that they can feel superior by attacking that person.

>That's what's going on here.","luovm99"
"luqgdr5","camergen","2024-10-31 18:16:37 UTC","It does make prospective donors hesitant to donate more, though. It’s a bit depressing- you think “I’ll donate this book but chances are, somebody’s just going to shovel it into a trash bag and sell it”. 

It dampens enthusiasm/support for the concept, since others have ulterior motives. Of course, you can’t let this mean you don’t put books in for others, as you want to think of the positives of such a program, but I can see where it would lessen enthusiasm.","luowfof"
"lut3ufd","shadowrun456","2024-11-01 03:57:04 UTC",">A few people stealing books doesn’t mean that a community doesn’t value reading.

What? Of course it does mean that it values reading *less* than the community which doesn't steal and sell books.

If there is `community A` and `community B`, and `x%` of `community A` members steal and sell books vs `y%` of `community B` members who steal and sell books, and if `x > y`, then `community A` values reading less than `community B`, by definition. This is not an opinion, it's an objective mathematical fact based on basic logic.","luowfof"
"luppcbp","kokodokusan","2024-10-31 15:56:08 UTC","It's insane that you have to say this.","luowfof"
"luoup41","Deleted","2024-10-31 13:07:10 UTC","I don't want to sound cynical, but in general across my experience the people who were stealing things to sell them were not doing so to eat, they were doing so to buy drugs.","luooct4"
"lup7ixx","Accelerator231","2024-10-31 14:21:18 UTC","Regrettably, I am more cynical. I do not think that it is for any good use.","luooct4"
"luooygv","shadowrun456","2024-10-31 12:29:55 UTC",">Or they have no other way to make ends meet and value eating more than the books.

>Don't get me wrong, that doesn't make it okay, but there are a lot of other possibilities as to why it might be happening

If they had received education when they needed it, then they wouldn't be unable to make ends meet, and would therefore not steal the books. That's all I'm saying.","luooct4"
"lupk0b4","dexflux","2024-10-31 15:28:15 UTC","Thank you for that, truly. Too often are socioeconomic issues framed as (individual) moral issues. As you said, it's not that low income families do not value reading. It's likely that they can't afford to. I wanted to highlight that we should draw the conclusion that it's a systemic issue that can be solved (and, in theory, quite easily so).","lupgy5w"
"lur8qic","dexflux","2024-10-31 20:46:42 UTC","Education is more than reading alone, most certainly. You said it yourself: *free* scholarships and *financial* aid bring education to people that couldn't afford it otherwise. You can't read yourself out of poverty without solving the poverty problem first. In addition, the (non-financial) costs of poverty compound over time, worsening the problem.

Education is also *certification*. The document that states someone has achieved a Bachelor of Science, for example, will likely be more accepted than the very same knowledge without the document. Speaking for states in the WEIRD demographic in particular.

Other than that, (formal and institutionalized) education isn't something one does alone at a desk by just reading. It's interacting with teachers, practice and feedback. It's children getting meals in school so they don't have to learn on an empty stomach. It's university students building networks. If you *could* get an education - reading yourself out of poverty - to lift yourself up, people would likely do just that. But there is much more to it than just reading.","luqq74v"
"lv00use","dexflux","2024-11-02 11:05:47 UTC","That then begs the question how and why people enter the vicious cycle of addiction in the first place, doesn't it?","luvgm0d"
"luqfka8","Moldy_slug","2024-10-31 18:12:19 UTC","Well, for starters because the LFL’s in my area rarely have nice new hardback books. They mostly have the heavily worn, damaged, outdated books people couldn’t get rid of at a yard sale for $0.25.

For seconds, because even though I’ve known plenty of people who literally earn money by digging through trash bins to steal cans for the five cent deposit, I’ve never known someone who stole used books for money. Books are heavy, bulky, easily damaged by weather, and the ones you can get for free are already worth next to nothing.

Perhaps the little free libraries in your area have much nicer books that someone could actually sell for a profit.","lup9gf5"
"luu6bch","BigKarmaGuy69","2024-11-01 10:55:37 UTC","Yeah we should also bus the “rich” kids to the dysfunctional schools and vice versa. Only fair","lutbha2"
"lup67ys","Deleted","2024-10-31 14:14:09 UTC","[removed]","luoxjfw"
"lupuwgr","Deleted","2024-10-31 16:25:18 UTC","[removed]","lups2oo"
"luot1f4","RiverSong_777","2024-10-31 12:56:47 UTC","I love how your comment reminds me of A Series of Unfortunate Events.","luoqljb"
"luoy8p9","Deleted","2024-10-31 13:28:43 UTC","Oh, Dusty, *in*famous is when you're MORE than famous. He's not just famous, he's INfamous!","luoqljb"
"luozxto","demisemihemiwit","2024-10-31 13:38:40 UTC","Insightful comment","luoqljb"
"lup91ft","bunnylover726","2024-10-31 14:29:39 UTC","Yeah, I know that the people who maintain the nicer LFLs put a lot of time and effort into it. Plus the nicest one in my area has a security camera and motion triggered light on it to prevent that exact sort of thing, so even if I wanted to steal everything, it would be extremely stupid.

Has anyone here seen the posts on r/Halloween from people in nice neighborhoods who suddenly started seeing kids from all over the place getting driven into their areas? And with the inflow, they can't afford to give candy to all of the children anymore, so they just shut their lights off and nobody gets candy. A lot of them feel terrible about it too.

So I get books from the ""books by the pound"" bin. It diverts waste from the landfill. A lot of the books are still in great condition.","luozy97"
"lup1d40","ExcitementOk1529","2024-10-31 13:46:51 UTC","I used quotes for both “stealing”and “reappropriating” because I think it gets murky once anyone takes donated items for a purpose other than the donor’s intention,. But I think stealing is still a harsh assessment once the owner has relinquished ownership. 

Here, the clear the intention is for the books to go to the children of that school. OP would be trying to keep to the general purpose of going to children, but at another school.  However, If the reason the other library is empty is that those books are being taken for sale (as someone suggested in another part of the thread), she would be accidentally facilitating that on a broader scale instead.","luozy97"
"lup157q","not_falling_down","2024-10-31 13:45:36 UTC","How is is theft to move books from one *Little* ***Free*** *Library* to another *Little* ***Free*** *Library*?","luozy97"
"lup2ipl","Deleted","2024-10-31 13:53:24 UTC","[deleted]","luozy97"
"luuesrl","Willow-girl","2024-11-01 12:06:43 UTC","Exactly! And these kids can barely write, even in the upper grades. I don't know how teachers grade their work when much of it isn't legible. 

Looking at their penmanship, you can tell that they were never taught the correct way to form letters. I guess it wouldn't be so bad if we at least taught them to touch-type, but they can't do that either.","luqzed6"
"luqdwhn","CANDY_MAN_1776","2024-10-31 18:03:34 UTC","Wrong. There is demand in the ones where the libraries are full. High demand for reading in the community is what creates full libraries as people generously stick them in there when they are done reading.  

In the communities with empty libraries there is no demand for reading. People are stealing them and trashing them, at best. And there is no demand for reading by the people buying the books to put in there. Simply put, reading isn't valued in those communities on the demand or supply side","luqd8x6"
"lus5qw0","Crossbowhunter88","2024-11-01 00:07:58 UTC","Oh so you drank the Kool aid too? Cool.","lus5hqw"
"lus7wgv","books-ModTeam","2024-11-01 00:22:05 UTC","Per [Rule 2.1](https://www.reddit.com/r/Books/wiki/rules#wiki_personal_conduct): Please conduct yourself in a civil manner.  Do not use obscenities, slurs, gendered insults, or racial epithets.

Civil behavior is a requirement for participation in this sub.  This is a warning but repeat behavior will be met with a ban.","lus5hqw"
"luoez7s","n3ws4cc","2024-10-31 11:15:36 UTC",">The difference in behavior explains why those areas are high income or low income","luoef92"
"luokhbh","ankdain","2024-10-31 11:59:38 UTC","That's fine.  That's not what you wrote originally.  You're not being botted, you're just blaming innocent kids for the reason heir families are poor (literally saying their behaviour explains their families economic situation lol).  Just comes off as really out of touch/arrogant, especially when doubling down on it playing the victim.  If you want to stop getting down voted maybe don't write posts blaming literal children then expecting everyone else to understand you meant something totally different.","luohp3d"
"luoh65p","ACarefulTumbleweed","2024-10-31 11:33:58 UTC","mixed housing and mixed use zoning instead of putting low-income neighborhoods without reasonable access to grocery stores/food, or jobs, or at least transit adjacent. But when poor kids are mixed into rich kids schools, BOTH groups do better. But with school funding being tied to local municipality and student outcomes are [predictable based simply on zip code](https://www.nytimes.com/2020/05/19/learning/how-much-has-your-zip-code-determined-your-opportunities.html), at base, we at least need to create more equitable access to our infrastructure to all people.","luoe2wj"
"luoffbr","ankdain","2024-10-31 11:19:25 UTC","> but what I said is not false.

Except it is false.  Your first sentence:

""The difference in behaviour explains why those areas are high income or low income""

Those families are not poor because their children cause trouble.  The kids behaviour does NOT explain why their families are in that situation/location.  There are absolutely some % of those kids who are perfectly well behaved - do you think they are less poor?  If the naught kids suddenly started being 100% well behaved would their parents economic situation instantly change?  That they'd just not poor because the kids stopped messing around?  No.  The behaviour is probably a symptom of their situation, but is is not the reason behind that situation.  So no, the difference in the kids behaviour does not explain why they're in a low income situation (otherwise the rich parents with dipship kids would also be poor right?).  So your statement was false.

The flip side is true though - that statistically being poor leads to worse outcomes so the behaviour is partly explained by the economic situations.  But just because A leads to B does mean B also leads to A.","luodtgu"
"luofdf8","LylesDanceParty","2024-10-31 11:18:58 UTC","No, but being that reductive about complicated topics like this feeds into some people's prejudices, apathy, and malice.

The statement helps no one at best and may lead to more harm for the most needy among us at the worst.

Being downvoted is the least harmful thing about all of this.

If you find being downvoted upsetting enough to write about, imagine how some of those needy kids feel about their environment and not being serviced. Not all of them misbehave, just like not all of the kids in the richer school behave well. 

They should all be helped.","luodtgu"
"luoieic","njwineguy","2024-10-31 11:43:49 UTC","Presenting a simplistic, not enlightening, half-story should be downvoted.","luodtgu"
"lur6lus","GullibleAntelope","2024-10-31 20:35:15 UTC","> Poverty is a huge trap

Yes it temporarily trapped 120,000 Japanese Americans who were placed in concentration camps for 2-3 years in the early 1940s after having all their assets seized.  And after WWII, many  started again in Calif., Ore, and WA , where they were often prevented from buying homes or otherwise disenfranchised. We all know what their behavioral patterns were like for the next 30-40 years -- and today.  And their success outcomes.","luolio1"
"lut6ps3","GullibleAntelope","2024-11-01 04:21:27 UTC","True.  But a persistent obstacle to education is indifference to being educated and worse, patterns of disruptive behavior in school.  The stats are clear on much higher levels of unruly behavior from youth from low income, inner city communities. This behavior includes a lack of civility.  Good definition in this conservative article: [Public Order Makes City Life Possible](https://www.city-journal.org/html/public-order-makes-city-life-possible-15516.html)

 
>Civility...is not innate....We have to learn not to throw sand at other kids, not to blast music from our apartment or car...not to monopolize public spaces with our “expressive” behavior...not to bother or offend others unnecessarily. 

People who exhibit these behaviors are often prone to loud quarrels and cursing in public spaces and in businesses, disruptive behavior on public transport, and idling on street corners talking trash to passersby. When these young people do poorly in school,  progressives attribute these outcomes to bias and racism and complain about an alleged ""school to prison pipeline."" 

Conservative academic Thomas Sowell in his essay *Black Rednecks, White Liberals* aptly comments:

>White liberals in many roles---as intellectuals, politicians, teachers...etc.--have aided and abetted the perpetuation of a counterproductive and self-destructive lifestyle...non-judgmental intellectual trends have enabled it to escape moral condemnation...(p. 51)

In short, Behavior Matters.  Poor behavior by adults = poor parenting = kids doing poorly in school.","lut1eod"
"luojkyf","Hankskiibro","2024-10-31 11:52:52 UTC","They also hadn’t even thought of it before as OP said in another comment. They seem to have a lot more familiarity with the first school’s situation in general.","luohnap"
"luowwbv","somerandomguy1984","2024-10-31 13:20:40 UTC","That means statistics aren’t true.  Obviously.","luon4n8"
