"comment_id","user","time","message","parent_id"
"luounok","ExcitementOk1529","2024-10-31 13:06:55 UTC","My community had a free bookshelf overflowing with good books until a huge used book chain opened nearby that buys used books. I love the store, but now there is definitely at least one person that periodically drives by at night at takes all the books. There will always be people who take donated items for a purpose other than the intention, but at least someone will reuse it and maybe somebody really needed the money.","luohjrr"
"luoytk8","perpetualmotionmachi","2024-10-31 13:32:07 UTC","When I last moved, I put about 30 nice, newish books in one. They were gone by the time I came back from the store a block away. I'd like to hope it was someone that was into reading, but given the area I'm sure someone took them for resale. It wasn't even a thing I considered when I put them in","luohjrr"
"lupsly1","NomNomNews","2024-10-31 16:13:14 UTC","I have a Little Free Library in my front yard.

My library is heavily used by the neighborhood, lots of rotation of the books, and always almost completely full.

About once a month, I’ll come out to see that it has been completely cleared out overnight.","luohjrr"
"luohwwf","bunnylover726","2024-10-31 11:39:55 UTC","Fuck, I didn't even consider that.","luohjrr"
"luommyw","Good_parabola","2024-10-31 12:13:31 UTC","As a hood kid, I have never in my life seen anyone trying to sell books at their stolen ware sale.  Nah.  Ain’t nobody stealing the free books to fence them.  

Taking them all because they’re a crackhead hoarder, I can see that.  But to stock the fence sale, no.","luohjrr"
"lup1p38","Kodiak01","2024-10-31 13:48:45 UTC","> Multiple times per week someone will come by and take all the books at once. They'll then add them to their cart with a sign that says ""Book Fair"" and try to sell them along with other stolen items.

I'd be inclined to put stickers both inside and outside prominently stating that the books were donated to the free library.  This way, they'd be a bit less inclined to steal them as the sale value would be tanked.","luohjrr"
"luoiyqi","Salcha_00","2024-10-31 11:48:11 UTC","Then they should write Free Library on the covers.","luohjrr"
"lupex3s","alyxmj","2024-10-31 15:01:07 UTC","While selling is one reason, I have also seen well maintained little libraries in poorer neighborhoods be out all the time because it is the ONLY access to books they have. Richer neighborhoods donate more because they have more to start with and they need them less because they have access to books at home and well stocked libraries elsewhere. 

Books in lower income areas, especially around elementary schools, are like a sip of water in the desert.","luohjrr"
"luq2gxi","TenaceErbaccia","2024-10-31 17:04:49 UTC","I think this is a large part of it. To some degree it’s a trust thing. Wealthy neighborhoods will more often see these being treated as small community libraries. The borrowers will often return the books after they are done. This encourages lenders, because they feel like they are enriching the neighborhood. In poorer communities they’re treated as loot boxes, and books with any value get sold online. Seeing their donated books disappear into the void discourages lenders, because they realize their books are being taken to keep, or to be sold. The community is not being enriched, some thief is just taking the donations.","luohjrr"
"luqau9q","Confident-Mix1243","2024-10-31 17:47:58 UTC","Where are you selling a used paperback book for more than 50 cents?","luohjrr"
"luoka29","shadowrun456","2024-10-31 11:58:07 UTC",">To everyone who thinks the low income libraries are empty because their communities do not value reading, consider that people are probably stealing and selling those books. 

You're contradicting yourself though. If they're stealing and selling those books, then by definition it means that they don't value reading them.

To anyone who will try to misinterpret what I wrote again: all I'm saying is that education is the best solution to poverty, I'm not assigning blame to anyone.","luohjrr"
"lupf4ii","dexflux","2024-10-31 15:02:14 UTC","One major conclusion from this is that low income communities need more income first and more books second. I'll take high bets that once income improves across the board, stealing and selling books ceases.

If people could read themselves out of poverty, they would. Reading is wonderful, but it can't feed hungry mouths or pay rent. In short: it's socioeconomic reasons *yet again*.","luohjrr"
"lusd2f7","your_moms_a_clone","2024-11-01 00:54:52 UTC","Most of the books in those libraries aren't worth much though, unless they're textbooks. I can't imagine this being worth anyone's time.","luohjrr"
"lup7bb7","lucidzfl","2024-10-31 14:20:09 UTC","This was literally my first thought, what should people with spare books do, drive from their nice neighborhoods to low income neighborhoods to drop books into a box and try to scurry home?","luohjrr"
"lupvbaj","balkanobeasti","2024-10-31 16:27:28 UTC","They don't got a limit on the # of books you can take at once or it happens so frequently it don't matter? ","luohjrr"
"luqvc58","JackPembroke","2024-10-31 19:35:13 UTC","I live in a fairly well off area and we have the same issue. There's always someone looking to ruin a good thing, can't let it stop you from trying","luohjrr"
"lupz7wp","CCContent","2024-10-31 16:47:54 UTC","The fact that you surmise the library might be empty because people are stealing and reselling actually VALIDATES the idea that the community the free library is in does not value reading.","luohjrr"
"lup6aw9","Moldy_slug","2024-10-31 14:14:36 UTC","I’ve never seen someone trying to sell stolen books, and I don’t live in a rich neighborhood… your situation sounds pretty unusual.","luohjrr"
"luqbeln","CANDY_MAN_1776","2024-10-31 17:50:49 UTC",">  because their communities do not value reading, consider that people are probably stealing and selling those books.

Yes. This is exactly it. You said it yourself. As a community they don't value reading as highly as other communities, thus their free library fails.","luohjrr"
"luojjbl","iamjacksragingupvote","2024-10-31 11:52:32 UTC","Robin Book","luob4db"
"lup9g0e","Skullclownlol","2024-10-31 14:31:51 UTC","> There's a solution to this. 'Borrow' from the rich kids free library and return to the poor kids free library.

I've seen this tried a few times (but in situations with much less contrast than the OP describes). Unless the caretaking is sustained, they can become abandoned again pretty quickly. In one situation, we saw new books get snatched the same day, to end up on 2nd-hand websites for $underpriced not much later.

Unless people learn to care for themselves and their neighborhood, it's not guaranteed to help if you just add more valuable items.

Whether or not the ""better"" library is maintained afterwards depended on how much was moved. If the majority is moved away and the locals couldn't benefit, odds were they'd reduce their contributions/participation. If a minority is moved, or the better books were moved after the locals could enjoy their local library, participation stayed more active.","luob4db"
"lupp9uk","BigKarmaGuy69","2024-10-31 15:55:47 UTC","Seems unethical. What if you just donated your own books to the LFL of your choice instead of tampering with other people’s donations?","luob4db"
"lur9iuw","Island_Crystal","2024-10-31 20:51:03 UTC","you could also just buy books for cheap from used bookstores and give them to the low income free libraries instead of stealing from another community’s","luob4db"
"luof399","slowmaker","2024-10-31 11:16:33 UTC","This is a head-smack-OF-COURSE-why-didn't-I-see-that great answer!","luob4db"
"luowexp","Deleted","2024-10-31 13:17:44 UTC","[removed]","luob4db"
"luowyem","ghostboo77","2024-10-31 13:21:01 UTC","This is one of those things that unfortunately will never work in a ghetto. People will steal the books and/or vandalize the library box every time","luob4db"
"luogndr","grumpycrumpetcrumble","2024-10-31 11:29:39 UTC","That's socialism. /s","luob4db"
"luoy1wn","stickinitinaz","2024-10-31 13:27:36 UTC","Sure, then everyone can be dumb. Do you realize most of the children in poor areas can hardly even read when they graduate highschool? Focus on fixing our broken education system if you want to really help disadvantaged youth.","luob4db"
"luokcd4","DonQuigleone","2024-10-31 11:58:35 UTC","This... Is ingenious.","luob4db"
"luodlub","njwineguy","2024-10-31 11:03:37 UTC","Yep","luob4db"
"luow6qj","ExcitementOk1529","2024-10-31 13:16:21 UTC","Next thing, OP will be accused of “stealing” from the rich LFL to resell the books that may or may not actually be “reappropriated” for sale when she drops them off in the poor LFL.","luob4db"
"lupun3b","BobT21","2024-10-31 16:23:57 UTC","I'll bookmarx this suggestion.","luob4db"
"lup68vk","havsies","2024-10-31 14:14:18 UTC","Trickle down bookconomics","luob4db"
"lv2zi0l","0MysticMemories","2024-11-02 21:38:52 UTC","Hopefully at least a few of them actually end up in the hands of someone who really wanted them. 

I see videos constantly of people taking books from little free libraries and scanning the barcodes and taking them to resell and the caption will be some stupid thing like “support the hustle” or “reselling is a great way to make extra cash” and they brag about driving to higher income areas and taking all the books because they’re better quality and higher income areas always have books they can take.

Then in more religious areas I see people making videos where they go to little free libraries and take any book they don’t approve of and destroy them because they “don’t follow the word of god” or “it’s witchcraft/hearsay/satanism” or “makes children stray from god” or “children should only be reading the Bible” Then they put a bunch of religious excerpts and Bible verses if not literal bibles in there instead.","luphpa1"
"lupr7zg","ArtisanalMoonlight","2024-10-31 16:05:57 UTC","You can Google for book donations in your area, you'll likely get a list of thrift stores as well as other organizations that might take them. 

And TIL, that you can search for Little Free Libraries near you (so you might find some to fill): https://littlefreelibrary.org/map/","lupluio"
"luqfmhi","Willow-girl","2024-10-31 18:12:38 UTC","Kids do seem to love learning cursive! I'm not sure if it's because it makes writing easier or if they see it as a marker of being ""grown up.""","luq7mk7"
"lupik45","tekalon","2024-10-31 15:20:33 UTC","[One parent argued, on Facebook](https://www.axios.com/local/salt-lake-city/2024/10/04/book-ban-little-free-libraries-utah), that LFL's that distributes 'pornographic' (definition usually whatever someone wants it to be) material should be charged. If you have a more up to date account of an actual law trying to be pushed through, let me know. I'm tempted to get a LFL set up in my liberal neighborhood in Salt Lake, but there are 4? already near by and I'm a few blocks away from a branch of the city library. My sister in a different city is also working on getting one set up for kids books.","luoy4nk"
"luqc7a1","CANDY_MAN_1776","2024-10-31 17:54:52 UTC","> Bottom line is that in impoverished areas there is greater demand for free books than there is in wealthy areas. 

Quite the opposite.","lup0hzb"
"lupdck7","bunnylover726","2024-10-31 14:52:54 UTC","I'm fully aware that they're using them for porn and other stuff. I'm no fool. I just wanted to cut that argument off before anyone could even make it.","lup77p9"
"lupcrps","bunnylover726","2024-10-31 14:49:48 UTC","My mom didn't grow up urban poor, but she grew up rural poor. She was telling a story from her childhood where she was spitting with envy about a girl in her class growing up because the other girl's family could afford Ritz crackers and my mom's family only had saltines. Ketchup sandwiches, gravy bread, and Cabbage with cheap noodles were staple meals for them. My uncles had to sleep two to a bed all growing up because they didn't have enough beds for everyone. It boggles my mind that mom grew up, went to school on Pell Grants, then immediately started trying to yank the ladder up behind her.

It's not the middle ages anymore, so I don't think that kids should be held responsible for the situation that they are raised in. I do like getting my books from the sale place where I get them because it's a landfill diversion charity. If the books aren't sold, they get sent to the garbage dump. The price attached is very low, just enough to pay the cashier, keep the building lights on, etc. So it feels like doing two good deeds.","luozjln"
"luqk9ni","STFUisright","2024-10-31 18:36:54 UTC","Absolutely! And as for the people who donated the books in the first place, they’re not going to be upset if some of the books go to less privileged kids. If a small minority of them are upset about it? Oh well.","luozjln"
"lus44g4","Deleted","2024-10-31 23:57:26 UTC","[removed]","lup2frx"
"lus8u05","books-ModTeam","2024-11-01 00:28:03 UTC","Hello. Per [rule 1.2](https://www.reddit.com/r/Books/wiki/rules), posts cannot be inherently political. This is a book forum, not a political platform. Thank you.","lup2frx"
"luqypni","PaulTheMerc","2024-10-31 19:53:03 UTC","Didn't they have to bullet point his daily security stuff because he wouldn't read it otherwise?","lup2frx"
"luq3hab","mrwhitaker3","2024-10-31 17:10:03 UTC","What did he say? I'm lost.","lup3lf1"
"lup2494","entropynchaos","2024-10-31 13:51:08 UTC","Because kids who practice reading and have fun reading learn to read better. Are you suggesting we just give up until we have better institutional practices in place?

""Don't give the kids books. They can't read!"" 

Well, then they're really not going to be able to read.","luoxey7"
"lus43th","thewimsey","2024-10-31 23:57:19 UTC","9th grade reading level (lexile 1185) means the ability to read Gatsby and To Kill a Mockingbird. 

Those aren't people who can hardly read. 

>85% of children in the juvenile court system are functionally illiterate.

The US under-18 population is 73 million. 425,000 juveniles are justice involved. That's .5%.

So, yeah, 85% of .5% are functionally illiterate. 

>What's the point of putting a bunch of effort and pride into making books available for kids who can hardly read?

It's a very small percentage of the population.

>We need to fix the US Education system

I suppose we could start by teaching statistics. 

You are probably an educated person, but you seem to be completely unable to draw valid conclusions from the data you have.","luoxey7"
"luu9bgg","Gumshoe212","2024-11-01 11:22:31 UTC","You're preaching to the choir. You're also right that the problem isn't ""a cutesy books of books."" It's another way to try and help.","luoxey7"
"luoe15m","n3ws4cc","2024-10-31 11:07:21 UTC","Your phrasing might have made it sound like you were saying these people are poor because of some innate thing, and the 'behaviour' shows that.

I'd say it the other way around next time: the poverty explains the behaviour. But that's kinda OP's point already.","luob5oa"
"luog5gy","Deleted","2024-10-31 11:25:29 UTC",">The difference in behavior explains why those areas are high income or low income, and them being high income or low income explains the behavior.

Your thesis is antithetical in its current wording, although I do understand the point you're trying to make. It's like saying a chicken comes from an egg, therefore an egg comes from a chicken. It's a true statement, but does not put the point across you're trying to. 

Try saying: Poverty causes a vicious feedback loop where people feel disenfranchised, so they start misbehaving, which causes more disenfranchisement because people are less likely to allocate resources because they believe it is a lost cause.","luob5oa"
"luodkhr","njwineguy","2024-10-31 11:03:16 UTC","You should be downvoted because the “why” is deeper and more complex than that.","luob5oa"
"luog0zx","Dick_Souls_II","2024-10-31 11:24:27 UTC","I think you're being down voted because people on Reddit find it offensive whenever you suggest that people can be poor due to their own choices. To Reddit, every poor person is automatically a victim.","luob5oa"
"luofq56","beebop_bee","2024-10-31 11:21:58 UTC","You're downvoted for promoting a meritocratic paradigm of seeing the world rather than a systemic one where power is actively held and concentrated in the hands of an elite.","luob5oa"
"lur4ydr","GullibleAntelope","2024-10-31 20:26:20 UTC",">The difference in behavior explains why those areas are high income or low income

You should have written: ""Differences in behavior *help* explain...""   But even if you wrote that, you likely would have had pushback.  This comment from a  conservative academic (not too many of those outside STEM) is also unpopular on this sub, heavily weighted towards progressive views:  [The Behavioral Aspects of Poverty](https://www.brookings.edu/articles/the-behavioral-aspects-of-poverty/):

>Two contending views of what causes poverty—people’s own behavior or their adverse circumstances—will have some validity at least some of the time...(yet)...most of the academic community has coalesced around the view that bad behaviors are a consequence, rather than a cause, of poverty...","luob5oa"
"luqz3q7","bunnylover726","2024-10-31 19:55:08 UTC","Not northeast, but i bet that r/Cleveland could point you in the right direction!","luqm216"
"lur5wag","MaterialUpender","2024-10-31 20:31:25 UTC","Candy prices have outpaced inflation this year.

Raw cocoa prices have gone up by about 40 percent since 2020 and that drove chocolate candy prices up. 

Which had a secondary effect on hard candies and such without cocoa.","lur3htq"
"luoh05e","BigSpoonFullOfSnark","2024-10-31 11:32:35 UTC","Or maybe free books are more likely to get stolen/sold in communities where people are struggling with poverty.","luogbrb"
"luohc9f","BobTheNae_452","2024-10-31 11:35:21 UTC","I’d say it’s a matter of income. Some people in poverty are spending their mental energy trying to figure out how to provide for themselves/their families, not focusing on books in a free library or reading.","luogbrb"
"luoiwha","Nixeris","2024-10-31 11:47:43 UTC",">There are direct correlations between both reading level and income; and the amount of books read and income.

Pretty sure I read every day and still get paid crap.","luogbrb"
"luoj0yf","HelinaHandbasketIRL","2024-10-31 11:48:39 UTC","""I agree it’s sad… but this is pretty obviously an issue of what each community values, right?""

  
That's a pretty privileged take on the situation. 

It's very easy to have free libraries in more middle class and affluent areas, where both money and time are more abundant. Those libraries take quite a bit to setup and maintain, and rely on people donating books for free.

It's absolutely not fair to say that poorer communities don't value their kids, or education, or access to books. When you're an adult trying desperately to make ends meet and provide for your family, you prioritise spending any free time, mental space and cash on them, rather than on a free book stand.","luogbrb"
"lur3u64","party4diamondz","2024-10-31 20:20:17 UTC","And they could also choose to disperse the books they buy and donate to other locations?","luqfknr"
"lutoqm0","Eis_ber","2024-11-01 07:36:49 UTC","The supplies stop being ""your items"" once they're donated. And if your donations come with conditions, then you shouldn't donate at all.","lurntt8"
"luqf81x","Willow-girl","2024-10-31 18:10:31 UTC","And once the donors find out ...","luqcijy"
"luopxtl","gorgossiums","2024-10-31 12:36:37 UTC","Traveling takes resources and time.","luon9iw"
"luov41x","underwaterbruja","2024-10-31 13:09:46 UTC","Easy answer: They shouldn’t have to.","luon9iw"
"lut5hr3","books-ModTeam","2024-11-01 04:10:55 UTC","Per [Rule 2.1](https://www.reddit.com/r/Books/wiki/rules#wiki_personal_conduct): Please conduct yourself in a civil manner.

Civil behavior is a requirement for participation in this sub.  This is a warning but repeat behavior will be met with a ban.","lustthq"
"lupet1s","Onedayyouwillthankme","2024-10-31 15:00:31 UTC","I'm on the West Coast and there are four little libraries within walking distance of my house...","lupe1ht"
"luped4m","bunnylover726","2024-10-31 14:58:14 UTC","The first one I ever saw was at the public pool where I worked. It was great because kids would read the books during adult swim and then put them back. Plus, if a kid accidentally got water on a book, they were just cheap second hand paperbacks, so it wasn't a huge deal.","lupe1ht"
"luoy7bm","bango_lassie","2024-10-31 13:28:29 UTC","Nonsense. Your asinine and classist comment reflects your character quite well, however.","luosnl5"
"lupilrs","Polkadotlamp","2024-10-31 15:20:47 UTC","Ugh.  I don’t know where you live, but that would not be the case anywhere I’ve lived.","lup0zgy"
"luoyc0s","gripperjonez","2024-10-31 13:29:15 UTC","Beach reads certainly have an agenda and are there exclusively to promote belief in beaches. You have a point. I remember learning about the beach reformation wars in school, too!","luoqhpj"
"lup1flj","NeonYarnCatz","2024-10-31 13:47:14 UTC","I love this!  Provides food, provides activity for seniors who might otherwise sit at home alone, easy drop-off for people who want to contribute -- sounds like a win all around","luoxipn"
"lup6jxa","ariesangel0329","2024-10-31 14:15:55 UTC","That is a wonderful idea! 

I wonder if folks could leave coupons that they know they won’t or can’t use, too. I’d certainly do that if I didn’t have any food to donate. 

Oh, I just remembered. If you’re donating canned goods, do organizations prefer if you donate the kind that have the pull tab on top or does it not matter? I figure it might help the folks who don’t have can openers. (And for the people like me who struggle with those darn things).","luoxipn"
"lup6jko","caveatlector73","2024-10-31 14:15:52 UTC","Ours is in the library.","luoxipn"
"lusgtza","saltporksuit","2024-11-01 01:18:10 UTC","The one near me put the word out they were accepting backyard gardener’s largesses. There was a lovely note left from a user thanking a gardener for the best carrots they’d had in years. I’m going to plant a better garden next year knowing all those extra tomatoes can go somewhere.","luoxipn"
"lur52hz","Best_Baseball3429","2024-10-31 20:26:57 UTC","Yeah like what a weird line in the sand for op. Especially if they are actually 1000m apart, that’s the same neighborhood.","luqslog"
"lupziqb","Optimal-Ad-7074","2024-10-31 16:49:27 UTC","I'm not thinking about other people's opinions.   it's more my own personal sense of the thing.  ","lupc8r0"
"lusaa1x","Optimal-Ad-7074","2024-11-01 00:37:11 UTC","perfect for the people hosting the box.   ","lurnfmt"
"lur4hah","BasicReputations","2024-10-31 20:23:44 UTC","They've done it both ways.  Sequels to books read in class, culturally targeted materials, manga, banned books, choice from a robust selection, varied reading levels, local authors, movie-related - lots of bright, book loving people have brainstormed and experimented with this a lot.


Some of the students love their books.  Many do not.  I would say it is wasted on maybe half - I know some regift them to siblings and cousins as a way to provide a birthday or Christmas present so maybe a bit better than that.


I think it's sort of a feel-good ""we tried"" thing.","lur09v8"
"luvcewc","Lin771","2024-11-01 15:26:20 UTC","If they were read to more often, it may counteract that.","lutfo93"
"luwim5w","TheIllustratedLaw","2024-11-01 19:05:48 UTC","It’s not just a matter of enforcing norms on people that builds trust. The larger part of building trust is having robust systems of communal support and strong relationships.","luql1u2"
"lupmkqw","skitonk","2024-10-31 15:41:44 UTC","As a relatively well-off person who can afford books, this is exactly correct. My town has a beautiful downtown library. It's surrounded by the homeless and you have to check in your bag just to use the restroom. I take my kids to the much smaller local library branch or drive to another suburb. It's sad, but the solution of ""don't let the obviously homeless abuse the library"" is too politically difficult. So, patrons go elsewhere, the libraries are under-utilized, then eventually cut back because of budgets in favor of the ones people actually use (ya know, not as a bathroom). 

Or, we just buy books and pass them around friends, because who wants to have to worry about your kids getting accosted by the druggies while they hunt for books. 

I vote for the library levies anyway. Then complain on the internet, like a true liberal.","lupakk5"
"lur2jcb","DarraignTheSane","2024-10-31 20:13:21 UTC","> they even have a full time lgbt librarian on staff

Are there part time LGBT people?  /s","lupakk5"
"lupssqw","PhantomWings","2024-10-31 16:14:14 UTC","I'd believe that for Beavercreek","lupaz1f"
"luouvn7","loljetfuel","2024-10-31 13:08:18 UTC","It's better to write ""Little Free Library"" (there are even stamps if you donate books frequently) -- a lot of used book stores, which are the main way for LFL thieves to cash in -- will refuse to buy books labeled that way.

Just ""Free"" could be a book from a stoop sale or some other source, and used shops will happily buy those if they can be resold.","luoitxz"
"luolufi","JonnySnowflake","2024-10-31 12:08:14 UTC","They'll also scribble over the barcode so that resellers can't scan it to see what it's worth","luoitxz"
"luol99a","Fuzzy-Hunger","2024-10-31 12:04:42 UTC","I could see this adding stigma that prevents a child from touching a book like this for shame/bullying.","luoitxz"
