"comment_id","user","time","message","parent_id"
"lvc0d1t","rabidstoat","2024-11-04 11:49:06 UTC","Probably the book relocated to an alternate reality while you were looking for it. Then when you were no longer looking, it phased back into our reality.

My cats do this sometimes. I go looking for them in the house (they're inside cats only) and they are nowhere to be found. I'll look everywhere and nope, they're gone. Then a few hours they'll show up, acting all casual, like they hadn't just nipped off to an alternate reality for a few hours.","lv9m2h6"
"lvad5fq","Chicago-Lake-Witch","2024-11-04 02:34:47 UTC","Former circulation clerk. If you don’t have an experience that requires you to pay to replace a book at least once, you aren’t using your library enough. Library books are meant to be used and loved until they fall apart, or get left on an airplane, or fall in a pool. I saw a dvd that a four year old had microwaved which is how his parents discovered he knew how to use the microwave. Sometimes books left on airplanes get taken to the local library by airport staff who make sure the books gets home states away. 

Take your books on your adventures. And then tell us all about it. We love that shit.","lva79zv"
"lvadrtj","clumsyguy","2024-11-04 02:38:40 UTC","I've taken library books all over the world. I actually think it would be really cool if our library had a map and you could somehow indicate where different books have traveled to.","lva79zv"
"lvbf904","cloudcats","2024-11-04 07:58:26 UTC","I worked as a page and circulation assistant in a public library for over a decade.  The number of books that came back with sand in the dust jackets was quite high ;)","lva79zv"
"lvawcoh","beldaran1224","2024-11-04 04:50:05 UTC","Lol yep! Chances are, an adult taking a book on vacation will be less damaging than a kid stuffing it at the bottom of their bookbag for weeks at a time!","lv9p15v"
"lvaq2jq","Alaira314","2024-11-04 04:01:21 UTC","I've never encountered this outside of whatever the standard renewals policy is(ie, checkout period is 2 weeks and you can renew twice for up to a total of 6 weeks, regardless of whether you're in town or on vacation). I have no doubt that your library does it, but I'd check yourself on the assertion that *most* libraries do.","lv9zo5f"
"lv9yasl","ZoyaZhivago","2024-11-04 01:04:34 UTC","Oh no… not an academic ILL!! I’m a public reference librarian, and most of our books are easily (and relatively cheaply) replaced. But that doesn’t sound cheap. 😬","lv9wdw9"
"lvcogkk","mixolydienne","2024-11-04 14:31:05 UTC","Uhm, might have been nice to give others the chance to be moved by it as well.","lv9wdw9"
"lvaj55s","SCCLBR","2024-11-04 03:13:46 UTC","The same cost to replace as if I damaged my own book. Really 0 extra risk unless you are so poor that a book breaks you (in which case i bet the library waives the fine)","lv9o5ms"
"lvcyfg2","Comprehensive-Fun47","2024-11-04 15:24:36 UTC","😂 Exactly!

You get it.","lv9qb3r"
"lvb0e1e","BooBoo_Cat","2024-11-04 05:25:05 UTC","My cat once knocked red wine over and some got on my library book.  Thankfully minimal damage.  But I was horrified!","lvatjme"
"lvcz0yw","Comprehensive-Fun47","2024-11-04 15:27:41 UTC","Love that. It nice to have a book association with a specific trip.","lvahl2i"
"lvanir0","Comprehensive-Fun47","2024-11-04 03:43:25 UTC","I'm picturing a Rick Steves travel guide belted in a first class seat with a satin eye mask and a martini.","lvamuje"
"lv9on40","elektramortis","2024-11-04 00:08:45 UTC","Sometimes there is","lv9m5e6"
"lvj4k49","Comprehensive-Fun47","2024-11-05 15:01:15 UTC","Lovely!

I also have my eye on the Boox Palma!","lvglvx3"
"lv9ogxp","1fateisinexorable1","2024-11-04 00:07:46 UTC","Which book?","lv9jyri"
"lvan7g0","Comprehensive-Fun47","2024-11-04 03:41:18 UTC","If you check out the books through Libby, most have an option to read with Kindle.

Though I feel the same way. If I get an e-reader, it probably won't be made by Amazon.","lva8m8t"
"lvd17su","Comprehensive-Fun47","2024-11-04 15:39:08 UTC","That's a double whammy! To lose all of your stuff and then have to pay a find to boot! I'd be so annoyed.","lvcnabb"
"lvuqbhi","Tornado_Of_Benjamins","2024-11-07 05:38:05 UTC","I think you may appreciate an upgrade to your lexicon, it could help you make your points better. Philosophically, you're discussing morals, not ethics. Morals are guiding principles that apply on the individual level (e.g., religion, culture, etc.) whereas ethics are societally agreed upon standards often upheld by social or institutional contracts (e.g., laws).","lvbn9ns"
"lwcik6i","voice-of-reason-777","2024-11-10 02:00:47 UTC","jfc","lvcd3w7"
"lv9rux7","TOONstones","2024-11-04 00:26:52 UTC","I always laminate each page. Just to be safe.","lv9jvk0"
"lvaf66h","KatJen76","2024-11-04 02:47:34 UTC","I guess that's kind of what I meant. I don't think you're significantly more likely to lose or badly damage a book on vacation than at home. In fact, both of the times I did, it was at home.","lvaebwp"
"lvaw2zi","beldaran1224","2024-11-04 04:47:48 UTC","A $10 fine? That's such a weird number. Books are expensive, and most libraries will charge you the cost of the book if its damaged. And btw, libraries often have to pay more for books than others. They don't get secondhand books, they typically get hardbacks when available or even special library bindings (often books that aren't available in hardback at retail) and many will pay for the distributor to process the book, such as putting the protective shields in place.","lvaebwp"
"lvanrmr","Merle8888","2024-11-04 03:45:07 UTC","My partner was astonished to learn that I take library books with me on my stand up paddleboard (so I can take a break, lie down and read while on the lake). I was like… yeah, if I drop one in I can afford to replace it, my phone seems like the bigger concern here…?

(I use an attachable floatie for my phone, which I highly recommend! The books just stay in the dry bag unless I’m reading them.)","lvaebwp"
"lvddkq8","imdungrowinup","2024-11-04 16:42:31 UTC","I am a risk manager professionally and I bought the same book at the airport to continue reading. I would just feel guilty about losing something that is not mine. Did I tell you I have anxiety?","lvaebwp"
"lvbf62p","Around-town","2024-11-04 07:57:31 UTC","It resonated with me because growing up my mom would never let me take a library book on vacation because she didn't want me to lose it. I internalized that as an adult.","lvaebwp"
"lvb74dw","rlnrlnrln","2024-11-04 06:30:02 UTC","But what if they lose it?","lvaebwp"
"lvc6mjc","TurnoverObvious170","2024-11-04 12:39:07 UTC","My library makes us pay full retail replacement value for lost/damaged books. Your criticism of someone bring cautious with books she doesn’t own is “phenomenally weird” and certainly unneccessary.","lvaebwp"
"lvan3zw","Merle8888","2024-11-04 03:40:38 UTC","Haha this is great!

Sadly the only time I had to pay for a library book is the most boring story ever. My water bottle spilled all over it, and I wasn’t traveling at the time either. I wish I had heard your perspective because I was completely ashamed. ","lvad5fq"
"lvbhyxg","mabolle","2024-11-04 08:30:02 UTC","> I saw a dvd that a four year old had microwaved which is how his parents discovered he knew how to use the microwave.

Or, put another way, that he absolutely did not know how to use the microwave.","lvad5fq"
"lvfiovg","Pangolins_or_bust","2024-11-04 23:07:04 UTC","Some damaged books are worth the amusement! I remember a badly chewed copy of a puppy training book :)","lvad5fq"
"lvc2tld","PhilConnersWPBH-TV","2024-11-04 12:09:40 UTC","That's a pretty fun idea. I'm going to discuss it with my adult programming librarian today.","lvadrtj"
"lvasc16","SwanDane","2024-11-04 04:17:56 UTC","Whilst I agree with the premise that it’s fine and completely normal to take them - you don’t necessarily have to replace it if you owned it (personally, I absolutely would anyway) as opposed to the obligation when it belongs to a library.","lvaj55s"
"lvap3su","MozzieKiller","2024-11-04 03:54:23 UTC","And its carryon is safely stowed in the overhead bin. No checked bags for Steve’s Guidebook!","lvanir0"
"lv9xxvo","ZoyaZhivago","2024-11-04 01:02:25 UTC","Literally never have I come across such a rule, and I’ve been a public librarian for almost 20 years. Where did you hear that?","lv9on40"
"lv9sqtn","Malak_7","2024-11-04 00:31:58 UTC","« The library » by Bella Osborne","lv9ogxp"
"lvf9zjr","gabrieldevue","2024-11-04 22:19:47 UTC","That's very good to know, thank you! I just checked it out and looked for my library and I can use it for my library and it seems to work with kindle!

I am not entirely sure, if libby has the same catalogue as our local e-library (that system has a different name.) but they have a ton of choice that would be absolutely sufficient.

I am so grateful for our local libraries : )","lvan7g0"
"lvetpv4","YoKinaZu","2024-11-04 20:57:13 UTC","It was not my finest Holiday season 😅😅😭😭","lvd17su"
"lvafo6e","StoicComeLately","2024-11-04 02:50:45 UTC","I don't know what to tell you. I have young kids, we go to the beach. It's just a precaution.","lv9rux7"
"lvb03m4","BooBoo_Cat","2024-11-04 05:22:30 UTC","Twice, years apart, I had to replace two books because they were in my backpack and they got soaked due to heavy rain.  I was charged $30 and $40.  I am very careful with books, but these two downpour were heavy and everything got soaked.","lvaw2zi"
"lvca1hp","Redditarama","2024-11-04 13:03:18 UTC","Definitely. The library doesn't seem to get deals either. You pay absolute top retail price to replace items. They'll want $50 to replace a book you'll see in stores at $25.","lvaw2zi"
"lve2yb6","hellomateyy","2024-11-04 18:45:45 UTC","Here in Sweden the fine for a lost book paperback is ~$10 and a lost hardback ~$35.","lvaw2zi"
"lvcp712","scatteredlyte","2024-11-04 14:35:13 UTC","You do know you pay for libraries, right? Unless you don’t pay taxes. the funding comes from city and county taxes, state taxes, and special revenues. Your comment sounds like the library is burdened with buying books that you ultimately pay for. It’s a smoking deal.","lvaw2zi"
"lvbvjbc","McIgglyTuffMuffin","2024-11-04 11:03:50 UTC","> I use an attachable floatie for my phone

I never even thought of this. I just throw it in my dry box and hope and pray I don't kick it off my board. Now to look into these...","lvanrmr"
"lvb87h2","Chicago-Lake-Witch","2024-11-04 06:41:14 UTC","It’s such a normal part of being a book custodian, even temporary. 

Also you should read The Library Book by Susan Orlean, a non fiction book about an LA library that was set on fire. Most of the damage was actually the books being waterlogged from the fire hoses and they figured out a way to freeze them to try to save them. Fascinating book.","lvan3zw"
"lvbfinr","TOONstones","2024-11-04 08:01:31 UTC","Oh, I'm sorry! I thought you were making a joke. I was picturing someone reading through a plastic bag. 

My fault. I misread your response. But, I get it. I'm sure I still have some books with juice stains from when my kids were younger.","lvafo6e"
"lvb1038","beldaran1224","2024-11-04 05:30:42 UTC","Yep. $10 is very cheap. Its very normal for people to pay $30-40 for a retail adult fiction hardback, Nonfiction can be much more expensive, and reference or special collections will be the most expensive of all (though these are not particularly likely to be vacation reads, tbh).","lvb03m4"
"lvexr0z","Springroll_Doggifer","2024-11-04 21:17:14 UTC","Still worth it! Imagine having to buy each book you read a year. I’d be broke 😭","lvb03m4"
"lveuhgk","elvbierbaum","2024-11-04 21:00:57 UTC","In the US it's almost always the price of the book the library paid to receive it. Sometimes Libraries will try to set a larger fine on top but I haven't seen that happen in a while, at least locally.","lve2yb6"
"lvcwhpr","beldaran1224","2024-11-04 15:14:25 UTC","I'm over here talking about how libraries buy books from distributors and you think I don't know how they're funded? I am a public librarian!


Libraries have to buy books. And when you damage them, you're not going to pay $10, you're probably going to pay the cost of the book. That is the point of my comment. Because what I see happen is library customers come in and get upset at how much it costs to replace a book, and it's because they don't understand.","lvcp712"
"lvb9fi8","Merle8888","2024-11-04 06:53:59 UTC","I’ve read about the freezing thing for salvaging books with water damage! That’s just if you can’t start carefully drying out the book right away (perhaps because there are so many and can’t do them all at once), right?","lvb87h2"
"lvf23gg","BooBoo_Cat","2024-11-04 21:39:08 UTC","Agreed!  And if you borrow and read a book you didn't like, no money wasted!  If I really like a book, I may buy it later when I decide to reread it.","lvexr0z"
"lve4iag","hellomateyy","2024-11-04 18:53:18 UTC","The fine for damaging a book could be $0 and it could be $1,000. There’s no hard and fast rule dictating what it *should* be. The cost of the book from the library’s point of view will never be recouped (financially). How the library/municipality/state/country chooses to define the fine (heh) doesn’t have to have anything to do with the price of the book.

Where I live (Sweden) the price for damaging a paperback is $10 no matter if it’s a first edition or it’s still available in the shop across the street.

I think that’s a pretty reasonable stance, as I don’t have to take into account the value of the book (and whatever penalty I’d face if I were to damage it) when borrowing.","lvcwhpr"
"lvn9pgf","scatteredlyte","2024-11-06 04:04:37 UTC","I doubt it otherwise you wouldn’t be so naive about the system.","lvcwhpr"
"lvbbnw5","Chicago-Lake-Witch","2024-11-04 07:18:06 UTC","Yeah they had thousands they were trying to save and mold quickly becomes an issue. The fire was in 1986, it’s been awhile since I read the book but I want to say this was the largest test case of freezing the books. NASA was involved. It’s the single largest library fire in the US. It’s written like a love letter to public libraries.","lvb9fi8"
