"comment_id","user","time","message","parent_id"
"lvaesd2","sdwoodchuck","2024-11-04 02:45:06 UTC","I never have.

However, a few weeks back I found a copy of Jeff Vandermeer's *Dead Astronauts* at a local used bookstore, and it has stickers all over it from the Multnomah County Library in Portland. I figured it was sold off by them at some point, but as I read through it, I found a check-out receipt for the same book being used as a bookmark. So I think someone took it with them on vacation to Maui, and it somehow got left here.",""
"lvafc8t","Ennas_","2024-11-04 02:48:38 UTC","Of course. That's what they're for. Unless you go survivaling in the rain season, I don't see the problem here.",""
"lvafit0","dudestir127","2024-11-04 02:49:47 UTC","I have, yes. I live in Hawaii so it's a 5 hour flight just to California. A good book helps pass the time better on the long flight than anything on my phone or tablet.",""
"lvafunp","spyro-thedragon","2024-11-04 02:51:56 UTC","I've only ever had to replace one book from the library, and that was because my cat decided knocking over my full drink was a great idea.",""
"lvagds1","spazticcat","2024-11-04 02:55:24 UTC","If something happens to a library book while you have it, just be honest and I promise you no one working at the library will care. You say what fate befell the book, you pay for the book (or whatever your library's policy is for lost/damaged items), and then it's done! As long as you're not yelling at/arguing with the staff about it, they *do not care*. I promise you that even library staff have had to pay for items they ruined or lost!",""
"lvai9qs","ReadingOffTwitter","2024-11-04 03:07:54 UTC","I have done it, but I totally understand your concerns - I felt the same way. I read a great story: someone left a library book on the plane, went to the library to fess up and pay, and discovered someone had mailed the book back to the library. I vow I will do the same if I find one.",""
"lvakd34","sweadle","2024-11-04 03:22:01 UTC","Yes. I don't bring it to the pool or ocean.",""
"lvalcpm","lazylittlelady","2024-11-04 03:28:53 UTC","Yes and it was fine. I mean, don’t do it if you can’t afford to replace the book should the unknown occur.",""
"lvamvvi","Large_Advantage5829","2024-11-04 03:39:05 UTC","My library book was in an ereader so that doesn't count, but yeah. But when I was a kid borrowing from my school's library, the book never leaves my house.",""
"lvaosid","Sinakers","2024-11-04 03:52:12 UTC","I do it all the time.",""
"lvapkie","akps","2024-11-04 03:57:43 UTC","I always do this",""
"lvaqfi1","perc0lat0r","2024-11-04 04:03:56 UTC","Absolutely. Especially travel guides (years ago before international Internet was cheap).",""
"lvaqrar","Roupert4","2024-11-04 04:06:16 UTC","Yes of course",""
"lvaqxlh","HailTheCrimsonKing","2024-11-04 04:07:31 UTC","I thought everyone did that? Lol. Of course I’ve done it. Lots. It’s not even expensive if you lose or damage it.",""
"lvare5v","inthesandtrap","2024-11-04 04:10:53 UTC","I had a job where I went camping for 8 days then had 6 days off. I read SLC's Public Library's copy of War and Peace while working out in the sticks. I returned the book on time in perfect condition. 

OP - you'll be fine.",""
"lvasp6u","MangoPeyote","2024-11-04 04:20:45 UTC","Yes, the last time I travelled I had two library books with me.  A travel book on Vegas, ‘cause we went to Vegas, and a leisurely fiction book.  There was the danger of the fiction book being close-ish to the hotel pool when I was reading it, but I’m good with books, library ones or not.",""
"lvasq5a","darthjoey91","2024-11-04 04:20:57 UTC","Not as an adult, but I did that as a kid all the time.",""
"lvaujh8","Desperate-Bother-267","2024-11-04 04:35:11 UTC","Yes - took my kindle and downloaded my library books - had every senior lady buying a kindle or kobo as Canadian versus American  as they had no idea you could access the public library with one",""
"lvavyx6","IAmJacksSemiColon","2024-11-04 04:46:52 UTC","Sure. Worst case scenario, you replace the book.",""
"lvb08zt","BooBoo_Cat","2024-11-04 05:23:50 UTC","Don't worry, the Library Policeman won't get you.",""
"lvb1cjb","bumbletowne","2024-11-04 05:33:57 UTC","Every time

My library even has a 'vacation mode' where they set the return date after you return. 

I love my kindle but I usually take 2-3 library books",""
"lvb1mvl","Ok-Sink-614","2024-11-04 05:36:39 UTC","I've done it but lost a book twice. Just ust forgetting to put it in my bag as we're leaving the hotel room or left on a seat when travelling. Sure you just pay the fine to replace, but it kinda puts a downer now thinking I have to plan something after the holidays. And you now have to feel like irresponsible kid going to librarian and giving them unnecessary work. I just take one of my own books , no stress if I lose it, get water on it or its gets messed. Admittedly I haven't lost them but it does mean I don't have to keep in my mind that I have to keep a book on loan safe the entire time. Plus I sometimes don't even end up reading sl if I got it from the library I'd end up renting it again anyway.",""
"lvb3cbz","NoFluffyOnlyZuul","2024-11-04 05:52:43 UTC","All the time. I don't know why it would be different than taking it to read on the bus while commuting, etc. Just be careful with it like you would if you were home.",""
"lvb3pu9","ridley48","2024-11-04 05:56:19 UTC","Vacation, business trips, anywhere I go",""
"lvbahz7","CrypticMirages","2024-11-04 07:05:25 UTC","Reading was my addiction of choice for a long time, I brought several on a vacation with me, made the ride there and back so much better!",""
"lvbi1mx","theotherlever","2024-11-04 08:30:55 UTC","As a librarian I can tell you I don't care where you take them to. BUT. if your luggage gets stolen and you loose 5 books. That does not give you a discount. Or if you leave them at your summer residence. I do not care if it is far away and you forgot it. You still have to bring it back or you will be charged. Yes all of these things have happened.",""
"lvbi4so","marcorr","2024-11-04 08:31:57 UTC","I’ve definitely taken library books on vacation before. One time, I took a book to the beach, and it got a little sand in it, but it just added to the experience.",""
"lvbi76w","Potential-Listen-809","2024-11-04 08:32:45 UTC","All the time!",""
"lvbiv80","ChymeraXYZ","2024-11-04 08:40:47 UTC","Me and my mum literally had a separate suitcase for books when we went to vacations, all of them from the library!",""
"lvbja38","Available-Evening491","2024-11-04 08:45:42 UTC","I’ve taken some on holiday to Greece. It was fine. Just look after them.",""
"lvblpsy","Cup-O-Guava","2024-11-04 09:14:42 UTC","My friend and I took a cruise earlier this year. She brought 3!! Lol I brought my kindle",""
"lvbvdd0","McIgglyTuffMuffin","2024-11-04 11:02:10 UTC","I'm about to fly down to Key West with the final book in the Dark Tower series. 

A beach town vacation seems like a great place to read a 700 page beast.",""
"lvbwxwh","GrinerForAlt","2024-11-04 11:17:42 UTC","It is fine, I do it all the time. If I travel within my country I sometimes even borrow new books at the local library where I am and send them back from my library at home.",""
"lvc1vry","Springwaterfriend","2024-11-04 12:01:58 UTC","I used to do it. Now I just download ebooks from the library to take on vacation",""
"lvca84m","ashoka_akira","2024-11-04 13:04:32 UTC","The travel books in most libraries are usually more travelled than the average patron.",""
"lvce4kl","flowtajit","2024-11-04 13:29:52 UTC","Yep. It just doesn’t go out and about with me. It stays where I’m staying.",""
"lvcekl1","cheapskateaficionado","2024-11-04 13:32:40 UTC","Yes, but on my kindle! I can take as many as I want and I don't risk damaging the book or returning it late.",""
"lvckwzn","GypsyBookGeek","2024-11-04 14:11:02 UTC","Yes. Once. I was stressed the whole time that I would lose it or leave it behind or it would be damaged. I ended up not even unpacking it. 

I loved when I could check e-books from the library.",""
"lvcnabb","YoKinaZu","2024-11-04 14:24:33 UTC","Yes! And my luggage ended up in a different country never to be seen again. Paid a fine. It was fine.",""
"lvcnf4e","Kurandoinu","2024-11-04 14:25:18 UTC","Not on vacation, no. 

If I'm going away somewhere I'll try to time it with me NOT reading a library book or a physical book I own, and instead reading something on my kindle as it means it'll take up less space in my bag and I have as many books as I need with me. 

I've taken library books with me on work trips or trips to my parents if I'm mid way through, but it's rare.

I'm not sure why so many in the comments are equating not taking library books on holiday with them to equal not READING however. I'm sure plenty of the people who have said no to this still read while on their jollies.",""
"lvcu0yh","Beth_Harmons_Bulova","2024-11-04 15:01:24 UTC","I just felt my county’s copy of The Human Stain deserved a little tan.",""
"lvd549u","denM_chickN","2024-11-04 15:59:05 UTC","I did, left it on the ane, but remembered in time. It was a book of Ray Bradburys short stories so worth the walk back down the terminal",""
"lvd7nkf","dvoorhis","2024-11-04 16:12:14 UTC","I've done it in the past with no issues, however these days I think it's better to bring a Kindle. You could still lose that and it may even more costly to replace than a library book but with a Kindle, you can have more than one book with you without the bulk.",""
"lvd7o73","dvoorhis","2024-11-04 16:12:14 UTC","I've done it in the past with no issues, however these days I think it's better to bring a Kindle. You could still lose that and it may even more costly to replace than a library book but with a Kindle, you can have more than one book with you without the bulk.",""
"lvde7l7","N0w1mN0th1ng","2024-11-04 16:45:39 UTC","There are people who DON’T do this??! 🤯",""
"lvdgxbu","Meep42","2024-11-04 16:58:57 UTC","I’ve worked & volunteered at several libraries. Checking books back in over summer we tended to have the trash can at our feet to shake out the sand that would fall out of the books (I did not live near the beach, it was hours away). So, yes, people take library books to the beach/on vacation.",""
"lvdlqzp","Extension_Virus_835","2024-11-04 17:22:25 UTC","I have once and dropped it off of a balcony into a pool on accident, I was mortified and now the library books stay at home… but that’s just my clumsy self I’m sure 99% of people who do this don’t have my luck and are fine",""
"lvdy37j","Kouzelnik","2024-11-04 18:22:07 UTC","I have literally checked out books BECAUSE I was going on vacation, and new I would have some down time.",""
"lve3w0t","DesiBoo2","2024-11-04 18:50:19 UTC","Yes, but not to a swimming pool or the beach.",""
"lvebavg","Emotional-Deer-2618","2024-11-04 19:26:42 UTC","I do this all the time actually. I don‘t really care if it‘s a libarary book because in the end if something happens to the book, I‘m resposible and will pay.",""
"lvef81w","ManikMedik","2024-11-04 19:46:09 UTC","I work at a library and as long as you bring it back in more or less the same condition (please no sand), we don't care where you go with it.",""
"lveqn6s","Critical_Potential40","2024-11-04 20:42:15 UTC","Many times.",""
"lveth44","Miss_Type","2024-11-04 20:56:02 UTC","I once took 12 library books on holiday. They took up most of my luggage allowance. Don't regret it.",""
"lveuwj1","leper-khan","2024-11-04 21:03:03 UTC","All the time on my phone/tablet",""
"lvev2kn","00xjOCMD","2024-11-04 21:03:53 UTC","It was sort of a tradition as a kid growing up.  We always vacationed at the beach and back then, rentals didn't usually include boardgames and books like they do today.  So, my mom would take us kids and we'd all get a few books in case there was a rainy beach day.",""
"lvezag4","bbonez__","2024-11-04 21:25:00 UTC","I work at a library. We have patrons who bring books all the time on vacation. We had a lady bring a book on a trip once, and i guess she went on a boat because she said it fell in the water, and when she brought it back it was all moldy, and when she was told she had to pay for the damaged book, that was when she had a meltdown.",""
"lvfgqp3","Avilola","2024-11-04 22:56:25 UTC","Just take it with you. Worst case scenario you end up needing to replace a book for $15.",""
"lvfi3vv","tenacrewood","2024-11-04 23:03:52 UTC","Librarian here, I take my library books on vacation all the time, it's absolutely okay!",""
"lvfy72b","ren-yo","2024-11-05 00:34:07 UTC","I actually have been pondering the same question too. So glad to see many responded with positive encouragement.",""
"lvghje2","Hagridsbeard-","2024-11-05 02:26:19 UTC","Yes, my local library even extends the max. Lending time in summer for this.",""
"lvgjl8c","Asher_the_atheist","2024-11-05 02:38:30 UTC","Yes, and then I made the profoundly stupid decision to read it by the pool. It ended up getting soaked, so now I own a mediocre but annoyingly expensive water-damaged library book.",""
"lvhcje6","commonsearchterm","2024-11-05 05:56:21 UTC","i did maybe once, they were heavy. now i just put stuff on a kindle for travel.",""
"lvo42je","yellow_hairbrush","2024-11-06 07:29:23 UTC","Oh I’ve taken library books from NZ to the Uk. Didn’t think that would be weird! 😂",""
"lvpfmr1","cozycinnamonhouse","2024-11-06 13:28:43 UTC","I once brought four library books to Reno. I got through three of them, and they all made it home safely.",""
"lvqnaw9","hrabs2412","2024-11-06 16:51:56 UTC","I took a library book to Australia with me in March, and most recently, on a camping trip this weekend! :) I do it all the time!!",""
"lw50ivx","Few-Time4737","2024-11-08 20:28:01 UTC","I think I have yes",""
"lvbn9ns","wrenwynn","2024-11-04 09:33:04 UTC","No, I haven't and I wouldn't. I've read other people's posts about how they do it because the risk of losing or damaging the book isn't that high & they can afford the fine to replace the book if they do lose it.

For me, that line of argument misses the underlying point. This isn't a risk matrix issue where you weigh up the likelihood of an event occuring vs severity of the impact to you as the individual if the event occurs (ie you have to replace the book). 

For me, this is an ***ethics*** issue. If it's my book that I own, then it's completely fair for me to decide the low risk of damage to my property is worth the pleasure I'll get from not having to wait to finish or re-borrow the book once I'm back. But if it's a library book, it's unethical for me to decide I can take unnecessary risks with something that isn't my property. So I wouldn't feel comfortable taking a library book with me on holiday. Even if I was at a really juicy bit. I wouldn't want to put the book down & leave it safe at home or return it, but I would still do it because that's what my personal sense of ethics would dictate as the best choice. I don't think someone who makes the opposite choice is an unethical monster, we just have different values.",""
"lvbb0yx","thestereo300","2024-11-04 07:11:08 UTC","I'm confused.  I do this all the time?  

What is the big...ahem...whoop?",""
"lv9scb4","Dalton387","2024-11-04 00:29:39 UTC","Books are for reading. Worst case, you pay the library for the book. Chances are it’ll be fine.",""
"lv9k1ua","series_hybrid","2024-11-03 23:43:27 UTC","When I was traveling for work, I would buy a book or two at a used book store. The library also sometimes has donated books for $1. When I'm done I just leave them in the airport when I return.",""
"lv9lfhu","Nizamark","2024-11-03 23:51:06 UTC","of course. books go practically everywhere",""
"lv9mudd","alterVgo","2024-11-03 23:58:49 UTC","I had this same debate with myself earlier this year, but I ultimately opted not to bring a (physical) library book with me (I did end up reading an ebook I borrowed). It probably would've been fine, but I didn't want the added anxiety.",""
"lv9n8i8","urhiteshub","2024-11-04 00:00:55 UTC","I do it all the time, indeed, once I took it to another country. Though I generally have domestic holidays, so not much in the way of risks... But I did go trekking/camping once, with four others, and we weren't able to make it to the civilization one night, so we decided to camp in an abandoned building of sorts, since the terrain was rather uneven and dangerous to tread wothout light, and we weren't sure if the campsite we thought would go was near. So yeah, in this somewhat creepy place, we set up camp, and it was our first time completely in the wild, so we thought we'd stand guard. Against stray dogs, wolves, creatures of the night, what have you. Later everybody laughed at us for this back at home, but it was real scary out there. 


And as we had no electricty, nobody could risk killin time on their phones. Save that one friend addicted to instagram... Even he had to drop his phone, when his battery finally gave away. Anyway, only way we could pass time in our shifts was by reading this book one of the guys brought from his uni. library, about miyamoto musashi, and it was indeed an interesting book, passed between shifts. You'd wake up the next guy, and hand him the book. It was fun. 


So yeah, that would be one occasion I think a book taken from a library was at serious risk. A risk I personally wouldn't have taken. We had very crowded backpacks, and I dunno, anything could've happened. Was not a controlled environment, for sure.",""
"lv9nt6c","BooBoo_Cat","2024-11-04 00:04:03 UTC","All the time.  ",""
"lv9numj","Kcups","2024-11-04 00:04:17 UTC","Took one physical book and a selection of books on CD for us to choose from for our last road trip.",""
"lv9whmt","signaturesilly","2024-11-04 00:53:50 UTC","Yes. I live in Seattle and I checked out read Dreams of My Father in hardback and read it on vacation in Hawaii. I had no idea who the writer (Barack Obama) was. It was just a recommended read in the 'librarian's recommend' section of the local Seattle neighborhood library. The following year he ran for President and I supported his campaign.",""
"lvadv4c","IasDarnSkipBW","2024-11-04 02:39:15 UTC","Yes but i always am a bit paranoid about it.",""
"lvaoshz","thedeadp0ets","2024-11-04 03:52:12 UTC","This is why I bought a kobo. It’s so convenient",""
"lvapl7g","confabulatrix","2024-11-04 03:57:51 UTC","I don’t do this anymore. It often ends poorly.",""
"lvarsfm","jonnyfreedom77","2024-11-04 04:13:50 UTC","No, but library books certainly take me on a vacation. 

I’ll see myself out.",""
"lvat7qz","cherrybounce","2024-11-04 04:24:44 UTC","Who hasn’t? Weird that it would even be a question.",""
"lvb2oar","setrippin","2024-11-04 05:46:23 UTC","yes. and it was in a backpack that was stolen from me on a train.

and honestly, i didn't care at all about the book or paying for it...i only cared that my FAVORITE bookmark that can never be replaced was in it :(",""
"lvbbmvy","lachavela","2024-11-04 07:17:47 UTC","Yup, I did and I dropped it in a river. Yes, I had to pay to replace it.",""
"lvbw9yg","cleanthequeen","2024-11-04 11:11:12 UTC","Bringing a library book is fine but I'd never ever press a leaf or flower in one. That's kind of crazy to me.",""
"lvcbbtj","Reflectionboho8725","2024-11-04 13:11:54 UTC","No i would be afraid of accidentally damaging it :D",""
"lvcp577","mixolydienne","2024-11-04 14:34:56 UTC","When I was a kid, the practically the only time we *bought* books was to take on vacation, because we never took library books with us. I can't bring myself to do it to this day. Fortunately, we have e-books now.",""
"lvdddae","practiceprompts","2024-11-04 16:41:29 UTC","i did this during the eclipse and ended up leaving my book in a friends car like 8 hours away from home. i knew i was gonna see him a month later so i just kept renewing the book until i got it back lol

got it back the day after my final renewal allowed ended, so i had to pay a quarter in late fees!",""
"lv9ng6y","squishgrrl","2024-11-04 00:02:03 UTC","Yeah I left it on a train in France and had to pay the library 23 dollars.",""
"lvaw9g1","Author_A_McGrath","2024-11-04 04:49:19 UTC","You are playing a dangerous game.",""
"lvddd8q","imdungrowinup","2024-11-04 16:41:29 UTC","No I am not so daring. One time I bought the same book at the airport to continue reading.",""
"lv9wpym","BoringTrouble11","2024-11-04 00:55:13 UTC","Yes and it stresses my husband out lol ",""
"lvahbv8","Jazzlike_Ad_8236","2024-11-04 03:01:38 UTC","There’s a copy of Harry Potter and the Philosopher’s Stone residing in Massachusetts that has been to Costa Rica lol.

Library books would be like $6 to replace don’t worry abt it",""
"lv9p6om","Feeling-Parking-7866","2024-11-04 00:11:54 UTC","One of my favorite things about traveling is leaving good books in far away places, I usually write my name in it and what country I'm from in the front cover.

Sometimes I'll take a book specifically to leave somewhere. I stole a copy of Kidnapped from my home towns library, and wrote in the front cover that I'd like this books to see the world, Encouraging people to take it back to their come countries, and then leave it somewhere where it may go on an adventure. Never did pay that fine.

I've got a couple books that have gone on wicked adventures, They're scratched, worn, sun bleached and stained, And just like me every blemish and mark is a story whole other story in itself.",""
"lv9m1tm","Pipe-International","2024-11-03 23:54:33 UTC","Yes but I shouldn’t have, it got damaged in my backpack in transit.",""
"lva2dr4","welkover","2024-11-04 01:29:24 UTC","If the book is less than eighteen years old you can be jailed (justifiably) if you take it across State lines with certain intents.",""
"lvczqnw","DrummingThumper","2024-11-04 15:31:22 UTC","Several times, I’ve found library books in pristine condition, in Brodart covers, and with attached nametags on the spines, but not stamped “Deaccessed” or “Removed from Circulation,” often in thrift stores. I'll call a library to determine if a book is legitimately Deaccessioned, and if not, I tell store managers of that fact. Usually, a manager simply gives me the book, which I then offer to return to the library.",""
"lvcd3w7","Stingwing4oba","2024-11-04 13:23:22 UTC","Only once and it drove me nuts worrying about them, couldn't enjoy the vacation",""
"lv9jvk0","StoicComeLately","2024-11-03 23:42:30 UTC","Yes, but it's always sealed in a plastic bag. 😄",""
"lv9o2bz","Twm273ss","2024-11-04 00:05:28 UTC","Yeah all the time. I also like clogging the library toilet and smearing poo on the cubicle walls for the janitor to clean up. They have no way of proving it was me",""
"lvaebwp","AccursedFishwife","2024-11-04 02:42:11 UTC","Because it's not a bad idea. Most people will maybe lose one book over their entire lifetime, and pay a $10 fine. What a phenomenally weird post. OP needs to borrow a book on risk management.","lv9lhqm"
"lvbhw57","NotACaterpillar","2024-11-04 08:29:08 UTC","It depends entirely on the type of trip. If I'm driving somewhere for the weekend or taking a bullet train further south in my own country or Europe, I'd take the book with me. If it's a suitcase+hotel type trip, then bringing a book is fine.

But I wouldn't take a library book on a backpacking trip to Uzbekistan.","lv9lhqm"
"lvbi4s7","lichen_Linda","2024-11-04 08:31:57 UTC","My library even makes a list each year with 'best books to bring on vacation'","lv9lhqm"
"lvafz1w","interstatebus","2024-11-04 02:52:45 UTC","Literally every vacation I’ve been on in the last 15 years has included a library book, usually more than 1.","lv9lhqm"
"lvcamye","atlhart","2024-11-04 13:07:18 UTC","Same here.

I pretty much always go to the library before a trip and load up on books for my whole family. We went to the beach for a week this summer. I took over 50 books from the library for my family of 6 and we read every one of them.","lv9lhqm"
"lvf0ozv","Fair_University","2024-11-04 21:32:05 UTC","Me too. I've never even thought about it.","lv9lhqm"
"lvfkwj2","HappyMcNichols","2024-11-04 23:19:14 UTC","My job required 80% travel and I traveled for 30 years. I have never watched tv and I 
always carried multiple library books with me. I don’t recall ever losing one and it never crossed my mind that I would do so. When I travel for pleasure now, I bring my iPad and downloaded library books from Libby.","lv9lhqm"
"lv9zpp2","dxrey65","2024-11-04 01:13:07 UTC","I think I've had to pay for two books over about the last 40 years too. One was kind of lost (one of my kids lent it to a friend, who claimed to have returned it), and one was charged to us for water damage, though it was that way when we checked it out. Setting a good example for my kids, I hope, I didn't argue with either and just paid what the library said to pay. I told them that if we averaged everything out over the years that meant I was out maybe 1 cent per book I checked out, which is practically nothing. And the two I paid for were good books, which I was happy to have replaced for other people to read.

And I usually bring books on vacation, as there is always down-time and it's really nice to have something to read.","lv9m2h6"
"lva5ygv","thestral_z","2024-11-04 01:51:04 UTC","I’ve lost a library book and found it the same way. Must be some weird tear in the universe.","lv9m2h6"
