"comment_id","user","time","message","parent_id"
"lv9lhqm","KatJen76","2024-11-03 23:51:28 UTC","It never occurred to me this might be a bad idea. I do it all the time.",""
"lv9m2h6","KimBrrr1975","2024-11-03 23:54:39 UTC","In 40 years of using the public library, I think we have lost a total of 2 books. I simply offered to pay for them, one was like $9 and the other was $20-something. Library edition hardcover novels can be more, but it's not like you get a $500 fine for losing the book. You just pay for replacement. In one case, I paid for a book my son lost and like 5 years later found it on his bookshelf (which I not only checked numerous times, but completely emptied trying to find the book 😂)",""
"lva79zv","PhilConnersWPBH-TV","2024-11-04 01:59:03 UTC","As a library director, I 100% want our books to travel with our patrons.",""
"lv9p15v","iowanaquarist","2024-11-04 00:11:01 UTC","Hundreds. That's what they exist for -- to be taken and read.",""
"lv9zo5f","Boiledfootballeather","2024-11-04 01:12:51 UTC","Fun fact: Most libraries will extend your checkout time with items if you are going on vacation or are otherwise going to be away from home, so that you will avoid late fees and/or other library notifications.

Source: I am a librarian.",""
"lv9wm4r","queenannechick","2024-11-04 00:54:35 UTC","I take mine in the hotel hot tub. I live dangerously.",""
"lv9wdw9","oodja","2024-11-04 00:53:13 UTC","I'm an interlibrary loan librarian and one of my colleagues had a great story about a grad student who borrowed a book via ILL and took it on vacation, only to leave it on a mountaintop as a ""tribute"" because she had been so moved by it.",""
"lv9klbq","themomentaftero","2024-11-03 23:46:25 UTC","Keep it in your carry on. If the plane or ship goes down, there's a very good chance it isn't your problem anymore anyways.",""
"lvbxr5u","Kriging","2024-11-04 11:25:27 UTC","Of course? That's a totally normal thing to do. That's not a 'wild' thing  to do at all.",""
"lv9o5ms","206ert","2024-11-04 00:05:59 UTC","Worst-case scenario is you have to replace the book. $30?  If that worries you I can’t imagine the type of vacations you’re taking.  Take it and enjoy it.",""
"lv9jn69","throwthatbitchaccoun","2024-11-03 23:41:15 UTC","I’m sure a lot of people do, however if I was really worried about damaging the book, I’d keep it in my hotel room, having a room with a balcony would be a bonus.",""
"lvbnr2u","Ben-solo-11","2024-11-04 09:38:45 UTC","Have I ever gone on vacation without a library book?",""
"lv9wukp","orundarkes","2024-11-04 00:55:59 UTC","Yes and you’re really overthinking this.",""
"lv9uaps","ApplicationNo2523","2024-11-04 00:40:57 UTC","It’s never occurred to me to do that but I have taken audiobooks on CD from the library w me for roadtrips. How funny that somehow I am too anxious to take a library book with me but never thought twice about the audiobooks.",""
"lvae6wr","carlcapture","2024-11-04 02:41:18 UTC","That's Evel Knievel wild! A library book on Vacation!! 🤯😳😲... Living Life on the edge 🤣.",""
"lv9qb3r","canquilt","2024-11-04 00:18:12 UTC","I have but it feels illegal.",""
"lv9w1n0","Nehneh14","2024-11-04 00:51:11 UTC","All the time. I left one at the Grand Canyon at the lodge and they sent it back to me :)",""
"lvahrfa","imriebelow","2024-11-04 03:04:30 UTC","Another librarian chiming in - take your books wherever, lmao, we don’t care as long as you return them. 

HOWEVER! To all beachgoers: Please STOP letting the dust jacket get filled with SAND!! It is one of my biggest pet peeves to pull a book out of the returns bin and have to shake it over the trashcan to get all the sand out!And the dust jackets are folded really tightly around the cover so it took effort to get that sand in there!! I’ve had to withdraw books that had too much goddamn sand in them!!",""
"lvatjme","LowKeyRatchet","2024-11-04 04:27:17 UTC","Librarian here. I admit that I get annoyed when books are returned sandy because they then have to be re-covered. So, while I don’t care if you take them on vacation, I personally don’t love when they’re taken to the beach. Aside from this instance, as others have said, damage can occur anywhere, so it doesn’t matter if you take them away with you.",""
"lv9xpqa","ZoyaZhivago","2024-11-04 01:01:04 UTC","I’m a librarian… so… yeah, all the time. 😂

And here’s a trade secret: We really don’t care if you do, either. Just be honest if you damage it, and we’ll usually let it slide (unless it’s something really rare and/or expensive which is unlikely). You have no idea how many books are returned with sand in the covers over the summer! That one’s an easy fix, but water damage is not. So just tell us if that happens, and most libraries will waive the fees once.",""
"lva25f3","reindeermoon","2024-11-04 01:28:01 UTC","I used to, in the times before ebooks were a thing. If it was a long trip, I’d often bring thrift store paperbacks instead, so I could just leave them behind when I finished them and not have to bring them home.",""
"lva7k7x","Majestic-Homework720","2024-11-04 02:00:45 UTC","Yes! It was a John Irving book and I was more than halfway through it when I decided to use as an easel for my phone for a fantastic landscape photo with me in it. I turned on the self timer, got in place and voila! I was so happy with that way it turned out that I got back in my car with my phone and went on my way. Several hours later I realized I was missing the book. My favorite librarian got a kick out of the story but I had to pay $25 for the book, which was less than I expected. 

I don’t lose library books anymore.",""
"lvahl2i","GhostFour","2024-11-04 03:03:19 UTC","Vacation is about the only time I buy a book anymore.  All of my library cards get used on Libby/Hoopla so my rare, tactile book experience comes as part of my vacation.",""
"lvamuje","MozzieKiller","2024-11-04 03:38:50 UTC","You think all those Rick Steves books don’t travel to their destinations by fellow library patrons? Heck, if they had frequent flier accounts, they’d be upgraded all the time!",""
"lvbpd9y","rueschka","2024-11-04 09:57:22 UTC","When I was a child/teenager, I planned my trip to the library a day before we left for vacation and calculated how many books I could reasonably borrow and pack. I went to France with 10 library books and read through them all. My parents would have never financially recovered from *buying* all the books I wanted to read on vacation.",""
"lvbssjd","ToWriteAMystery","2024-11-04 10:35:06 UTC","Literally all the time. I’ve probably taken a hundred library books on vacation, maybe even more, during my life.",""
"lvbwdds","Rasutoerikusa","2024-11-04 11:12:06 UTC","Never even considered that being ""risky"", if I'm on a short trip so I have space for books they are 99% of the time from a library",""
"lvd3wjm","Vin-Metal","2024-11-04 15:52:57 UTC","I would never have thought twice about doing it.  Worst that can happen, you owe the library another copy.",""
"lve3p3a","Fun_Wait1183","2024-11-04 18:49:22 UTC","Oh — hahahaaaa! My eldest sister had really catastrophic asthma, and we lived in a high summer heat/high humidity city before the days of widespread air conditioning. My resourceful mother found an elderly couple with a summer house in Colorado that they never used, so they offered it to use for summers. Part of packing was to visit the local library and load up with three months of books. These took up half of the trunk space of my mom’s Chevy Impala. What a great memory! We read aloud in the evenings, had noon siesta with books, made “arts and crafts” with instructions from library books. It was awesome.",""
"lvf51gq","camplate","2024-11-04 21:54:01 UTC","Yes. The worst was to make sure they weren't due, to renew before the trip. Had that happen once.",""
"lvn89og","Background_Carpet841","2024-11-06 03:55:38 UTC","I brought three overdue library books on an international flight recently, so I think it;s fine",""
"lv9zivt","jawnbaejaeger","2024-11-04 01:11:58 UTC","Yes? I didn't even realize that this was a thing to be concerned about.",""
"lv9k8y3","BakeKnitCode","2024-11-03 23:44:31 UTC","Not really anymore, because I can check out library books electronically. Now I just bring my iPad. But I did in the past.",""
"lv9m5e6","LowBalance4404","2024-11-03 23:55:05 UTC","Yes.  There is no rule that says they have to remain in the county.",""
"lva2du2","love2go","2024-11-04 01:29:24 UTC","I only read library books so they are the only ones I ever take.",""
"lvb1v6i","emperor_nort","2024-11-04 05:38:48 UTC","My wife managed to fall asleep by the pool with her book covering her face. The heat melted the glue binding and when she woke up half the pages fell out of the book. When we got back she explained what happened to the librarian and offered to pay. All he asked was if we’d had a nice time. Take your library books on holiday it’s not that deep.",""
"lv9pqfg","Porcupine__Racetrack","2024-11-04 00:15:00 UTC","Yes! And I ended up reading it on the plane next to one of the librarians from my library!! 🤣 She asked me if it was a good one!",""
"lva3zxn","mollusksword","2024-11-04 01:39:09 UTC","I used to do it all the time with much success. Until the one time I lost a book. Now I don't do it anymore.",""
"lva6rje","andy_nony_mouse","2024-11-04 01:55:57 UTC","Yes and I left it on the plane. Oops.",""
"lva91sz","bunnyin_mars","2024-11-04 02:09:35 UTC","Recently, I took mine to a foreign nation and went on traveling with it in japan. 3 cities later the book is next to me while I type this all out.",""
"lva9ir7","curlykewing","2024-11-04 02:12:27 UTC","Once, and I left it on the plane. Never again. But my dippiness doesn't necessarily translate to anyone else's. To add to the fun of that, btw? I also left my iPad with the library book. Good times.",""
"lvaa0ey","noneya79","2024-11-04 02:15:25 UTC","I take them with me all the time!",""
"lvam5q9","CharmingAsset23","2024-11-04 03:34:10 UTC","I ONLY read books from the library so yes absolutely I have taken them on vacation",""
"lvavw1i","Jaxson-ros","2024-11-04 04:46:12 UTC","Yes, there's something special about taking a library book on vacation! It feels like you're bringing a bit of home with you, plus the discovery of reading something new in a new place adds a little extra magic.",""
"lvawiks","Awkward_Pangolin3254","2024-11-04 04:51:26 UTC","Yeah, plenty of times. Vacation is a great time to read.",""
"lvaxs8c","Pyesmybaby","2024-11-04 05:02:11 UTC","I took a couple guide books for England and London. They came in very handy and were safely returned when I got home.",""
"lvb2i33","Cereborn","2024-11-04 05:44:45 UTC","I'm sure I've taken library books on short trips, but I've never taken one on a plane.",""
"lvb3wy3","Hello-Central","2024-11-04 05:58:14 UTC","Many times!",""
"lvbwzad","sammybnz","2024-11-04 11:18:06 UTC","Many, many times.",""
"lvbyzrn","Moon_whisper","2024-11-04 11:36:58 UTC","All the time.",""
"lvc2mva","quinalou","2024-11-04 12:08:10 UTC","Without the mountain of library books borrowed directly before leaving for vacation, my sister and I would never have made it through three weeks of free time. Have done it for forever and would still.

If I ever lost or heavily damaged one, I would just pay for it I guess. And honestly, I'm just as likely to spill my coffee over my books at home as I am on vacation.",""
"lvc9qqb","Shanstergoodheart","2024-11-04 13:01:16 UTC","All the time. It was literally one of the reasons why I used to go to the library.",""
"lvca15k","EIIymoore","2024-11-04 13:03:14 UTC","That’s so cool! I totally get the worry about damaging it, but it sounds like you had a great experience! Bringing a library book on vacation is kind of like taking a piece of home with you. Plus, using it as a leaf press is a cute idea! I’d love to hear more about the book you took! 📚🍃",""
"lvcv12c","Calilou2020","2024-11-04 15:06:43 UTC","Yes, and there is a great story to share. I accidentally left the book in  the airplane storage pocket when landing. It was a puddle jumper into a small regional airport, and the counter staff also did the tidying of the planes between flights. I realized very quickly what I had done and went to talk with someone at the counter. I had to wait quite a while for someone to return to the counter, and when they did, I was told that the plane had already left for its next flight. Forward to my reporting the book lost at my small local library. They were very understanding and suggested I wait a while before paying for the book. 4 MONTHS later, I got a call from the library saying they received the book in the mail! Some kind soul evidently turned the book into their library (hopefully after reading it themselves), and their library sent it back to my local library. It was so heartwarming!",""
"lvda4mt","cherryultrasuedetups","2024-11-04 16:25:03 UTC","Yeah. I mean, take care of it, but if you lose it or something happens to it, just tell the library and maybe pay for the replacement fee. Every library I've used has appreciated honesty and people using the library responsibly.",""
"lve8jbp","MastodonOld1960","2024-11-04 19:13:05 UTC","I even tool it to the beach. Very bad idea.",""
"lvf27pk","mentalcuteness","2024-11-04 21:39:45 UTC","As a kid and teen, I used to do this all the time. Before we went on vacation we would always stop by the library and get books. Our library during summer time had a rule that you could borrow them longer than usual, so that was great. I would borrow the maximum amount of books I was allowed to take with me on vacation (my parents made a rule specifically for me), and then I would read the books I took, usually my mom's too, then sometimes my dad's or siblings as well.",""
"lvfu34c","leelalu476","2024-11-05 00:10:33 UTC","I do, always so scared, it's only a small fine but the guilt I'll feel",""
"lvg1xwi","deaseb","2024-11-05 00:55:46 UTC","Have King Lear with me on vacation right now!",""
"lvglvx3","Deleted","2024-11-05 02:52:02 UTC","I took a book with me when I went to South Korea and read in a cafe early in the morning. It was so nice. It was fall so I ended up putting an orange leaf in my book as a bookmark/souvenir. I recently bought a boox palma so I will more than likely take that with me instead on my future trips.",""
"lvh0ei7","SaizaKC","2024-11-05 04:22:34 UTC","I’ve always taken library books on vacation with me. When I was little I took a book with me everywhere, running errands with my mom, I’d sit in the car and read, waiting at a dr’s office, I’d read, waiting for a table on a busy Saturday night, I’d read.",""
"lva2nsi","TheGrumpySnail2","2024-11-04 01:31:04 UTC","You're going on vacation, not into combat. You need to lighten up.",""
"lv9kuwm","ComfortabletheSky","2024-11-03 23:47:54 UTC","Oh, definitely. I don't think I ever lost any, but if that does happen they'll ask you to pay for the replacement, which will likely be more than you would pay for buying it yourself but as long as you can do it you'll still be in good standing, they know that things happen sometimes, even if you don't go anywhere for that matter.",""
"lv9jyri","Malak_7","2024-11-03 23:42:59 UTC","I only read books that I get from the library so I always end up taking the one I’m currently reading with me on any travel. I recently took the same book on two different trip, it is a very slow read 😆 it went with me to Ireland and Calgary.",""
"lv9o3yr","ImLittleNana","2024-11-04 00:05:43 UTC","Twice I’ve taken books out of state to visit my parents.  Both times I left one. I think a part of that is the relaxed attitude of oh it’s my parents house so if I leave it no big deal.",""
"lv9ozj7","Killer-Jukebox-Hero","2024-11-04 00:10:45 UTC","I have, I dont like to do it though. I like to use it as motivation to get a library book finished before I know I'm leaving. Checked one out Tuesday, finished Thursday. Flew out Friday. 😂. Brought two other books with me that I own. ",""
"lvadek1","invisiblette","2024-11-04 02:36:22 UTC","Yes, and I left it in a motel room. The motel owner was kind enough to mail it back to my local library, but I felt terrible about this.

Granted, I was 9 years old at the time. But I learned a harsh lesson back then.",""
"lvamwrz","printerdsw1968","2024-11-04 03:39:15 UTC","All the time.",""
"lv9uhyt","las-vaguest","2024-11-04 00:42:07 UTC","I took an inter library loan on vacation with me, left it on the plane, called the airlines and both airports, failed to locate it, and paid a $150 fine… which is exactly what I told my boyfriend I would wind up doing, because I constantly lose and misplace library books, even when I never leave the ground.  🤷🏼‍♀️ 

ETA: flashback to collections going after me for an underground radio encyclopaedia I thought I lost and found in a moving box a decade later. 

What is wrong with me, my gosh.",""
"lv9owm7","k_shon","2024-11-04 00:10:16 UTC","I have a library book with me on a work trip right now!",""
"lv9polm","rharper38","2024-11-04 00:14:43 UTC","I do it all the time.",""
"lv9ppk0","Feeling_Vegetable_84","2024-11-04 00:14:51 UTC","Yep, every time I leave my house for more than a few hours I'm taking a book and 9 times out of 10 it's my current library book",""
"lv9pskj","EveryFngNameIsTaken","2024-11-04 00:15:20 UTC","I do it all the all the time.  I've even checked out books while on vacation.",""
"lv9r29l","madmoneymcgee","2024-11-04 00:22:20 UTC","If I drop a book I personally own in pool I’m going to pay to replace it anyway. 

I carry library books around my day to day life that puts it at just as much risk to damage.",""
"lv9r4lt","ReservoirGods","2024-11-04 00:22:42 UTC","I just took two with me all across Vietnam, was well worth it because the travel time to get there was long and gave me lots of time to finish them both. ",""
"lv9rg0u","EfficiencyWooden2116","2024-11-04 00:24:30 UTC","Always",""
"lv9rgmo","No_Objective5106","2024-11-04 00:24:36 UTC","Always did. In 30+ years, I have never lost one.  Now I have a kindle. It is easier to carry.",""
"lv9rtrz","ChoneFigginsStan","2024-11-04 00:26:41 UTC","I’ve been contemplating this this week. I’m going to Puerto Rico for a week next week and I’ve got a huge backlog of library books I need to get to.",""
"lv9se4h","baseball_mickey","2024-11-04 00:29:56 UTC","I use Libby, so kind of?",""
"lv9sgos","GhostofAugustWest","2024-11-04 00:30:20 UTC","Many times.",""
"lv9shd3","ChefDodge","2024-11-04 00:30:27 UTC","Yep, and usually a movie from the library as well in case the rental place has a DVD player.",""
"lv9t6jr","catjknow","2024-11-04 00:34:29 UTC","This is the 1st year I didn't take library books camping because Kindle😂my husband always says my book tote is the heaviest thing we carry, he was quite impressed!",""
"lv9th2g","MondoShlongo","2024-11-04 00:36:11 UTC","Every single time.",""
"lv9thri","DuerkTuerkWrite","2024-11-04 00:36:18 UTC","I literally always bring my library books! I just try and borrow paperbacks in case of emergency I just find they travel nicer lol.",""
"lv9u2co","Zikoris","2024-11-04 00:39:37 UTC","We don't bring them from home, but my boyfriend likes to check them out at other libraries when we travel within our province. The libraries in our province have an agreement with each other so you can check out a book in one place and them return it at another branch 1000km away and nobody cares.",""
"lv9ud7m","DoesntReallyExist","2024-11-04 00:41:20 UTC","My local library has a kiosk at the airport. So they obviously don't mind if people do it",""
"lv9uzif","pepmin","2024-11-04 00:44:58 UTC","I prefer to take a book or two that I own (in addition to my Kindle) and leave it in a Little Free Library/book exchange so that I have room to buy a book or two from a bookshop wherever I go.",""
"lv9v235","Ok-Equivalent8260","2024-11-04 00:45:23 UTC","All the time",""
"lv9vtzf","Kra56457489","2024-11-04 00:49:55 UTC","I took some books camping as a kid and left them too close to the side of the tent and they got water damage. I was upset but we just took them to the desk and paid the fee and then I got to keep them. Wasn’t a big deal.",""
"lv9xpgo","SevenBraixen","2024-11-04 01:01:02 UTC","I never thought that this was a bad idea… never even considered that I could lose it! Oops 😱",""
"lv9zlke","bridge_bb","2024-11-04 01:12:24 UTC","Don't think I've ever taken a physical hard copy library book with me, but many borrowed ebooks :)",""
"lv9zvib","deep_blue_au","2024-11-04 01:14:07 UTC","Yeah, 50/50 chance it’s library book instead of mine.",""
"lva0p3s","disastermaster255","2024-11-04 01:19:09 UTC","From US. I took one to China with me.",""
"lva0qs9","Wide-Umpire-348","2024-11-04 01:19:25 UTC","I brought Eragon with me one time. Left it on the airplane. I purchased a new one and gave it to the library",""
"lva0vra","QuiteFatty","2024-11-04 01:20:17 UTC","I've taken a library book out of the country.",""
"lva13s2","skankin22jax","2024-11-04 01:21:37 UTC","I took a library book to Israel two years ago",""
"lva1dt3","Innerouterself2","2024-11-04 01:23:18 UTC","I always take library books with me. Hardcover books tend to be fine while traveling. If not.. meh I could buy a new one.",""
"lva1dzq","asexual-Nectarine76","2024-11-04 01:23:20 UTC","Of course. I used to bring four or five of them. One time I had overweight luggage because of them. When covid hit, I bought a Kindle because the library closed for a couple months. Now I just load up my Kindle with about 12 books from the library.",""
"lva1npe","meme-com-poop","2024-11-04 01:24:59 UTC","Worst case scenario is you lose it and you're out $30",""
"lva29dx","CeladonBlaze1895","2024-11-04 01:28:40 UTC","Depends on where I'm going and for how long. I'm not so much worried about losing a library book, but it's got to be worth taking up the room in my baggage. A long weekend, probably (in fact, I'm sure I have.) Getting there in a car, maybe. A week or two, especially with travel that involves planes or trains, no. For those trips I bring railway books - my term for books bought cheaply (usually paperbacks bought at library book sales, used to be 50 cents or less but with inflation sometimes that's up to a dollar now!) and totally disposable. I maintain a whole box of them, so when I go somewhere I can just pick a few out to take. I'll read them while traveling, in the hotel hot tub, at the beach, wherever. When I'm done with one I will leave it somewhere for someone else to grab if they need a book. They are usually in decent condition when I finish unless they got splashed a lot.",""
"lva2kf7","EffableFornent","2024-11-04 01:30:30 UTC","Just please don't take them to the beach. It's a massive PITA getting sand out of books. ",""
"lva2py3","RagnaBrock","2024-11-04 01:31:26 UTC","Of course I have.",""
"lva36yd","Topdropje","2024-11-04 01:34:19 UTC","All the time, my library extends the time you can borrow books during the summer holidays so you can take it with you. They even mention you can do that. In the Netherlands we have books called ""Dwarsligger"" which are books that are really tiny for on the go. I always go borrow one or two of those when I go traveling so it doesn't take so much space.",""
"lva3ecf","Library_Spidey","2024-11-04 01:35:34 UTC","Yeah, why wouldn’t I?",""
"lva3ftp","lilythefrogphd","2024-11-04 01:35:49 UTC","I do it on nearly every trip. I think the only time I've ever gotten worried was reading the book in the pool/hot tub because of water damage",""
"lva3odh","BagleCat56789","2024-11-04 01:37:17 UTC","Yes, if I check out a book, they go everywhere with me. I will spend more time reading than I do playing in the ocean water",""
"lva4if0","charliefoxtrot9","2024-11-04 01:42:15 UTC","Always",""
"lva5phn","Sparrowbuck","2024-11-04 01:49:32 UTC","I’ve specifically gone to the library to get books to take on a vacation.",""
"lva648y","Dramatic_Suspect_3","2024-11-04 01:52:02 UTC","Yes! Many times.",""
"lva8m8t","gabrieldevue","2024-11-04 02:06:59 UTC","I got an ereader specifically to be more flexible with library books. From not having to drive to the library (living ruraly and parking close to the library is a pain) to taking the books with me everywhere and not needing 4 arms to hold up a very heavy book.
And the ereader is its own soft light source - so i can enjoy reading with kiddo in a dimly lit space.

love the e-library options of our local library : ) But i did have to get a reader that is NOT the kindle. I honestly like the kindle, but it doesn't allow a connection to libraries... of course <_<",""
"lva8o7s","Ok-Bowl-6366","2024-11-04 02:07:19 UTC","yep as an old person and a bookworm definitely as we didnt have other options. If you lose it youll have to pay for it of course but probably just to cover the cost of the book -- not too bad",""
"lva9znl","Lilmc_1313","2024-11-04 02:15:17 UTC","All the time. My only worry is that if I finish it, I have to haul it back. But other than that, it never crossed my mind that I shouldn’t.",""
"lvaa9rq","Chocolate_Haver","2024-11-04 02:17:00 UTC","I used to do that now my library books I take are just digital ",""
"lvab7sg","NeuHundred","2024-11-04 02:22:48 UTC","Yeah, I would be afraid of losing it as well.  I try to be very careful with things that aren't mine.",""
"lvacxoe","Little_Guarantee_693","2024-11-04 02:33:27 UTC","I’ve done it and never lost one. I’ve also returned library books that people have left at the restaurant I work at.",""
