"comment_id","user","time","message","parent_id"
"lxl8ayd","hxgmmgxh","2024-11-17 13:27:32 UTC","Wonderworks: Literary Invention and the Science of Stories by Angus Fletcher.

Made me realize why reading fiction is so essential for humanity.",""
"lxlonbg","rayningsun","2024-11-17 15:16:55 UTC","might not be so obscure, but i haven't heard anyone talk about it online. it's ""the light in hidden places"" by sharon cameron. it was my favourite book for years. it's a semi-biographical novel about the life of stefania podgorska, a polish teenager who hid 13 jews in her basement during ww2. honestly, what a woman to admire. i was literally awed reading about her. her courage, her determination, her *compassion*, it's one hell of an inspiration. and also the way sharon cameron has written it is so important to me. i, as a twelve-year-old (when i read the book for the first time) was able to feel and connect to the characters in such an intimate way despite the book being about such a heavy topic. not to mention the absolute fear it filled you with when stefania's just about to get caught by the nazis at various instances. stefania podgorska was an absolute warrior, and i have been inspired by her ever since i read that book. although she passed away, i feel like she was forever immortalized through this book.",""
"lxlcoko","Heavy_Direction1547","2024-11-17 13:59:15 UTC","Not obscure in the sense of many fans  many of whom have read the whole canon more than once; Patrick O'Brian's 'Aubrey/Maturin' 20 book series. He is an excellent writer, a word smith, witty... and the books, which are set in the Royal Navy during the Napoleonic Wars, are meticulously researched. A seriously under-rated author that transcends genre., each reading reveals new gems. As an aside, the movie 'Master and Commander' does a pretty good job catching the spirit of the books.",""
"lxldcwf","GrinerForAlt","2024-11-17 14:04:02 UTC","Too Like The Lightning by Ada Palmer taught me to understand how differently I read when I trust and do not trust the writer because I had both experiences with that book. The whole series is also so weird it moved my whole concept of weird a fair bit, which was helpful.",""
"lxmcw7m","Extrovert_89","2024-11-17 17:33:05 UTC","In the Heart of the Sea: Tale of the Whaleship Essex

Whaling was never a subject I knew much of and I had never read a nonfiction book with cannibalism before this one.

A little learning of the whaling trade, life on a ship back then and then an ultimate test of sacrifice, survival and human nature in the darkest situation you can be in.

Read it for class in college and bought it again once I returned it to the college bookstore. I still wonder how any of them survived that many days in the boat...

Def one I think more people should read, and made me more open to an occasional nonfiction if it was the right kind of story I want to learn about. Not sure about it being obscure though.",""
"lxln3ew","MiniaturePhilosopher","2024-11-17 15:07:34 UTC","At 14, I picked up *[The Zoo Story](http://www.lem.seed.pr.gov.br/arquivos/File/livrosliteraturaingles/zoostory.pdf)* by Edward Albee on a whim while browsing in the library.

That tiny one-act play changed my life. I’d never read anything like it. I enjoyed starter classics - Coleridge and Shakespeare and Twain - but this was my first exposure to, well, bleaker literature. It scratched an itch I didn’t even know was there. I spent the next four years tearing through post WW2 plays and novellas with a serious focus on the theater of the absurd. That early and repeated exposure to a specific brand of existentialism made for a cynical, jaded, angsty teen but I wouldn’t be who I am as a person today without that Y2K version of myself. Something about my love of those stories at a tender age took me from being a little girl desperately trying to bend herself to fit in to being a little girl who no longer felt the need to be anything but her odd self.",""
"lxl7wma","mlorinam","2024-11-17 13:24:31 UTC","Mine was Roots by Alex Haley. I read it when I was sixteen.  It was my first experience with reading an epic saga. Because of it i love reading generational sagas with brutal themes or complex characters.",""
"lxlct98","AcadiaFlyer","2024-11-17 14:00:10 UTC","Last of the Curlews. A fictionalized account of the last Eskimo Curlew (A bird that is presumed extinct today), looking for a mate. The narrative goes back and forth from the fiction narrative to jarring firsthand accounts of the mass annihilation of this species, then the too-late attempts to save it. A really progressive book for the era it came out in, and one of my favorite ecological reads of all time. ",""
"lxldo9v","ThiefofToms","2024-11-17 14:06:15 UTC","*Sometimes a Great Notion* by Ken Kesey did this for me. The ending is so masterful with all of the disparate pieces coming together. They were in a concert with each other that I didn't know was being played. 

It certainly plays second fiddle to *Cuckoo's Nest* though it is vastly superior, and I liked *Cuckoo's Nest*.",""
"lxljvpq","WeedFinderGeneral","2024-11-17 14:47:46 UTC","The Cut-Up Trilogy/The Nova Trilogy books by William S Burroughs (The Soft Machine, The Ticket That Exploded, Nova Express)

Experimental writing with huge sci-fi/philosophy ideas that I didn't expect people to be talking about in the 50s/60s, and it's gone on to have a ton of influence on modern stuff like Twin Peaks or Annihilation or really most things under the genre of ""Weird Fiction"". 

There's even a section of Naked Lunch (not directly part of the trilogy, but heavily related) that's basically an early version of John Carpenter's The Thing where a guy turns into a disgusting body horror blob monster and goes around absorbing people until a mob burns him to death with a flamethrower.",""
"lxl9bka","ArchStanton75","2024-11-17 13:34:53 UTC","Light from Uncommon Stars, by Ryka Aoki, involves a demon pact, a transgender child prodigy, and aliens running a donut shop. I expected it to fall apart, but it hit hard because the story came together into something absolutely beautiful. All of the parts fit. It made me much less uptight with my reading.",""
"lxm3m63","Waynersnitzel","2024-11-17 16:41:41 UTC","**A Swim in the Pond in the Rain** by *George Saunders*

Based on a class Saunders taught, the book reads along and examines seven short stories by Russian authors (Chekhov, Turgenev, Tolstoy, and Gogol). While the book is aimed at writers (it was an MFA writing class), it works well for anyone interested in  a better understanding of Russian literature.",""
"lxpe70s","S_Lee_Stacks","2024-11-18 03:58:49 UTC","I hated most things I was assigned to read.

Winesburg, Ohio by Sherwood Anderson was the exception junior year of high school.

I lived in a small town and, unlike Our Town, by Thornton  Wilder, this delved into the underlying dissatisfaction and loneliness in a wholesome community I wanted nothing more than to escape from. This was some guy in 1919 expressing what I already sensed myself to be true, and exploring it in a compelling fashion.

I love it to this day.",""
"lxlj2c1","Ishitataki","2024-11-17 14:42:33 UTC","The Island Of The Day Before, by Umberto Eco.

It's not as well regarded as his other books, but I think there's some really interesting topics covered in the book that deserve more consideration.",""
"lxlesb4","saint_ryan","2024-11-17 14:13:59 UTC","All the Kings Men - Robert Penn Warren",""
"lxlmpbu","runtheruckus","2024-11-17 15:05:13 UTC","Charles De Lint wasn't obscure when I read him, but I've seen his urban fantasy books slowly move away. I really enjoyed Trader, and his books were definitely an early inspiration for me to go check out more myths. He also handled First Nations myths well in his novels in a respectful way, AFAIK. One of the first books I read with a fake NA city that wasn't for sure 100% in the USA 

Matthew Woodring Stover's Heros Die and the Blade of Tyshalle, the first two books of his Acts of Caine series; one of the first books that made me care about an older character when I was a younger man. Doubly so the sequel, as it gave me an important POV of a man in a wheelchair that stayed with me.",""
"lxlobmj","dancognito","2024-11-17 15:14:59 UTC","I read Life in a Medieval Village by Frances and Joseph Gies  in college and thought it was really boring and couldn't stand it, but then I read it again earlier this year as a challenge to reread a book your opinions may have changed. I'm so glad I reread it. It was so fascinating and informative. 

I know Reddit and /r/Books can be very hot or cold on Pillars of the Earth and World Without End, and the other books in the Kingsbridge series, but I think Life in a Medieval Village really made the stories that much richer. The Gies studied a bunch of villages, but focused on one in particular in England, called Elton. We still have a bunch of court documents and town hall records of what this village was doing in the 1300s. There's really not much information on the people of Elton, but what little we do know, it just gives me a much better appreciation for all the side characters you get to meet in other books.",""
"lxm3i2v","AnotherNate","2024-11-17 16:41:04 UTC","The First Fifteen Lives of Harry August by Claire North (Catherine Webb). It isn't groundbreaking, but it helped drive home to me that not all authors are storytellers and the difference is so far beyond ""show don't tell.""
North's use of thematic perspective takes what could be an idle stoner thought into a compelling story with expansive scope and pervasive insight through the lens of the MC. The unique element of the story (no spoilers) is used to flesh out key details within the world and enhance the tragic nostalgia and wistful tone surrounding an unassuming and unseen hero.
I don't usually read within the genre, I received the book when a friend left it with me to regain suitcase space. Luckiest leftover I've ever consumed and I would (and have) recommend it to any avid reader.",""
"lxpknur","Miserable_Sea_1335","2024-11-18 04:45:11 UTC","Monstrilio - Gerardo Samano Cordova 

I read this book after seeing it mentioned in a random TikTok. I decided that 2024 was my year of reading other people’s 5 star books, so I saw the recommendation and it was my 2nd read of the year. 

Historically I read sci-fi and fantasy. This book had magical realism going for it, so I went for it.

This book ended up being such an interesting and heartbreaking portrayal of grief that it completely changed my reading trajectory, at least for this year so far. I was 6 months postpartum when I read this book, and it surrounds the story of a mother losing her son and grasping to anything she can. I was struggling with depression, and the grief grabbed me. 

The rest of this year, I have read fiction and nonfiction books dealing with grief, and it has actually helped me with my depression. The books I have read this year have been heavy, but I feel I have changed so much as a reader, and my mental health has improved for it.

Reading about grief has really helped me to be able to embrace my own, but it has also helped me to understand the grief of others more thoroughly. Many of the stories - both fiction and nonfiction - are raw and strange and uncomfortable. Very honest.",""
"lxlf8d8","New_Rain2129","2024-11-17 14:17:04 UTC","Is Thomas Pynchon's The Crying of Lot 49 obscure? It shaped my reading tastes, worldview and perception of what Pynchon called ""official reality"" profoundly. And Oedipa Maas is one of literature's greatest protagonists.",""
"lxlfo2b","Silly-RedRabbit","2024-11-17 14:20:02 UTC","I wouldn’t say obscure, but Breakfast of Champions by Kurt Vonnegut blew my mind. The way the author inserts himself in the story and interacts with the main character is just so unique. It changed the way I think about storytelling.",""
"lxll3hk","elocin__aicilef","2024-11-17 14:55:24 UTC","The books of Pellinor series by Alison Croggin.  It's a YA epic fantasy series that I picked up as an adult in my 30s.  These books ignited my live for fantasy which is now my favorite genre.",""
"lxnscfj","RJWolfe","2024-11-17 22:09:15 UTC","Fifth Business by Robertson Davies. Reading it felt like stepping into a favorite pair of shoes.",""
"lxola0u","OlympiaShannon","2024-11-18 00:56:08 UTC","Another vote for Patrick O'Brian's 'Aubrey/Maturin' 20 book series.

He greatly admired Jane Austen and wrote in the same style, somewhat. Restrained, subtle and deeply funny when you know how to process the tone. Nothing else seems to compare.",""
"lxmnz6w","__inthemarrow","2024-11-17 18:33:15 UTC","Stoner by John Williams, which I don’t think is considered obscure anymore. That book took me out of the weird fantasy smut hole I fell into and brought me back to the art of literature. ",""
"lxl9ryd","uglysuprith","2024-11-17 13:38:18 UTC","for me it was ""now and after : the ABC of AnCom"" by Alexander berkman. it changed my life. though I was not new to left wing philosophies & economics, I was new to AnCom & this book made me love the philosophy. politically, I became libertarian socialist(changed my mindset & perspective in political economy), read more books about it, mainly, ""​he conquest of bread"". though those books are like 100 years old & there are shiny new non fiction books out there, they still hold great wisdom that's true even today after a century since they were written.",""
"lxlemxk","MyLastAcctWasBetter","2024-11-17 14:12:57 UTC","I read God Shaped Hole when I was a sophomore in high school and it made me want to become a writer. I didn’t, obviously, but it definitely felt like the first real adult fiction book that I independently enjoyed.",""
"lxls7h6","Atzkicica","2024-11-17 15:37:49 UTC","Puckoon. Made me realise what I loved was what teachers had been correcting me on. Then went to more Milligan, Edward Lear, and Hilaire Belloc.",""
"lxonx7h","TK_404","2024-11-18 01:12:13 UTC","The Worst Journey in the World (1922) by Apsley Cherry-Garrard. It's a memoir from Scott's Terra Nova expedition. Stories of survival and humble day-to-day anecdotes, all set against an immense, uncaring plain of snowy blankness.",""
"lxp1w4h","Lumpyproletarian","2024-11-18 02:38:22 UTC","In Sacred Loneliness -the plural wives of Joseph Smith.  Killed stone dead any belief in  or respect I had for the man, the grinding misery of their lives, poor Helen Mar Kimball 14 years old handed over by her own father.",""
"lxpkd1w","Visible-Run-4538","2024-11-18 04:42:58 UTC","i don’t think it’s obscure but “the diving bell and the butterfly” by jean-dominique bauby changed my notion of what a memoir/biography looks like. up until that point, i was 16 and only read fantasy for leisure, but this book forced me to do self-reflection and opened me up to not only read non-fiction but also poetry. i read it in one afternoon then woke up early the next day to read it again. 
it tells the story of jean-dominique bauby’s life before and after a stroke that left him with LIS (locked-in syndrome) and he wrote the book by blinking his left eye as a nurse pointed at the alphabet. incredible work, not a single word was wasted.",""
"lxl8f7f","PeteForsake","2024-11-17 13:28:26 UTC","Good question!

One for me would be Dept of Speculation by Jenny Offill - the first ""fragmentary"" novel I read. Up to then I thought the more detail and plot, the better the novel. But it opened me up to the ability of a great writer to leave things up to the reader to decide.",""
"lxlneal","Ready-set-go765","2024-11-17 15:09:24 UTC","My friend gave me Jon Krakauer's *Into the Wild* a few years back, which changed how I viewed nature, society, humanity, survival, and so on. I'd always loved nature stories, but I'd not really read anything (in this vein) except fiction. Reading Alex's story really hit me.",""
"lxlm70e","Bombay1234567890","2024-11-17 15:02:10 UTC","The Tunnel by William Gass.",""
"lxl8c3g","astrolomeria","2024-11-17 13:27:46 UTC","Not obscure elsewhere but I don’t often hear about Yukio Mishima’s Sea of Fertility Tetralogy.

I read it when I was probably 18 and it deeply affected me. I still have a great love for Japanese literature; it brings me so much peace.",""
"lxl9w6o","AnonymousCoward261","2024-11-17 13:39:10 UTC","Recently: *Romance of the Three Kingdoms*. The sneaky heroes really made me rethink the Western value of authenticity. You have guys like Zhuge Liang, who is Machiavellian in his use of diplomacy and manipulation to preserve the kingdom he serves, but not narcissistic (he’s willing to defer to an incompetent superior and demotes himself after a failure) or psychopathic (he returns as a ghost to beg conquerors to go easy on his kingdom). Why do we value ‘being true to yourself’? Isn’t it more important to get stuff done? 

As an added bonus you suddenly start noticing references in random Asian media. ",""
"lxlzl6b","Requiemin","2024-11-17 16:19:36 UTC","A Japanese mystery/thriller (also classified as horror) called Shokuzai (Penance in English) by Kanae Minato. 

Four girls witness their friend’s death as a child and although it’s a simple read it’s from the lens of each girl and how they dealt with the trauma, some failed, some got stronger, and my favorite was the last girl’s, as it showed how small things she was told as a child stuck with her, and the small ways she felt inferior and lost made her grow up to be…interesting. 

Definitely amazing literature-wise as well, as it brings you into a different world and perspectives and each girl’s narrations are unreliable and based on their view.",""
"lxmfq70","New-Temperature-1742","2024-11-17 17:48:50 UTC","I am a bit convinced that I am the only person on the planet who has read this book but when I was 12 I read a book called *Firegold* by Dia Calhoun, it was probably the first novel I read that made me feel things besides an escapist sense of ""that was fun.""   It is a YA fantasy book but the story feels a lot low key and personal compared to other books in the genre - there isnt any epic quest or fight scenes, I dont even think the book has an antagonist IIRC, it really is just more of a coming of age story.  Sadly, I feel like this is the kind of book that Harry Potter more or less buried.  

*Firegold* also has a prequel called *White Midnight* which I have only read recently and it isnt great.  It is too weird (not in a good way) and mean spirited for what is supposed to be a YA book, but *Firegold* holds up very well imho",""
"lxmy474","dekdekwho","2024-11-17 19:25:59 UTC","I really love The Samurai’s Garden by Gail Tsukiyama and Half a Lifelong Romance by Eileen Chang because they made me love how fiction can have beautiful use of narrative styles and prose, and complex characters in a cross-cultural setting.",""
"lxniepe","MotNorr","2024-11-17 21:14:48 UTC","Not sure how obscure this is, but German Autumn by Stig Dagerman. Still the best book I ever read about war.",""
"lxnnuzm","LeeChaChur","2024-11-17 21:44:39 UTC","There's a book whose cover pops up on reddit every now and then:  
The Jewish Japanese Cookbook and How to Train Wolves

I actually read it, and it's a lot of fun, and surprisingly touching. Reading it, I learned that literature (generally and as a concept) doesn't have to be serious and deep and profound and meaningful, etc etc.  
It can just be fun and nonsense, and still pack a punch!",""
"lxnz9er","Naughtynuzzler","2024-11-17 22:48:07 UTC","Quiet Houses by Simon Kurt Unsworth. Read it years ago, but it really opened me up to reading collections of short stories/anthology which for some reason I had avoided in my teens and early twenties. A super great horror collection!!! Didn't, like, change my view of literature or anything lol but young me needed to learn the value and power of short stories.",""
"lxofi2u","HellianLunaris","2024-11-18 00:22:25 UTC","The Goblin Emperor

Changed my taste in fantasy from epic to cozy",""
"lxofufv","psirockin123","2024-11-18 00:24:24 UTC","I didn't read this early in life (I was \\~30) but Phantastes by George MacDonald. 

It's basically a fairy tale but for adults and was written nearly 100 years before The Lord Of The Rings. It's whimsical and weird but what I really liked about it was the writing style/prose. Tolkien definitely took influence here. 

I really enjoyed the descriptive writing as it allowed me to picture the environments and characters very well. The plot isn't crazy and I'm terrible about noticing symbolism and other hidden meanings like that but I still think about this book often. I should reread it soon.",""
"lxoomvv","dwarven_cavediver_Jr","2024-11-18 01:16:33 UTC","Roadside picknick and the 40k book prince of crows. Both of these are masterpieces",""
"lxpc1wg","gemmarenee","2024-11-18 03:44:02 UTC","what a good question! mine would be ""mother in the dark"" by Kayla Maiuri!  it was the book that got me into literary fiction",""
"lxpco05","theblindsdontwork","2024-11-18 03:48:14 UTC","I can’t even really remember what it’s about anymore since I read it 20+ years ago, but *The Culture of Make Believe* by Derrick Jensen really solidified my mindset of questioning accepted narratives of how the world was, is and should be.",""
"lxptbzi","ThrowRArusskiy","2024-11-18 05:56:27 UTC","I think Helen Oyeyemi's works kind of redefined my reading tastes quite a bit. Any summary of her works don't really do them justice, even genre-wise, you could classify her works as general or paranormal fiction, but that doesn't even cover half of it. Her works are exactly what a fever dream feel like, where it definitely has realistic elements to it but also some things are just completely absurd and random and unexplainable. I highly recommend her works, her prose style is rather interesting imo and I think she's one of the few authors I read where I can confidently pick up a book and not be concerned whether I'll like it or not because I know I will :) ",""
"lxqgg9m","kutsurogitai","2024-11-18 10:01:27 UTC","*Plainsong* by Kazushi Hosaka. It really made me realise that what I most enjoy from literature is the quotidian, rather than the dramatic.",""
"lxr145n","Seruati","2024-11-18 13:10:11 UTC","Riddley Walker by Russel Hoban.",""
"lxroe33","Radarrex","2024-11-18 15:33:35 UTC","This is a controversial opinion, as I have yet to meet one other person who enjoyed the book.

The Enigma of Arrival changed the speed at which I work through my books. It forced me to read for the subconscious, to read slowly and purposefully. 

	•	The book blends autobiography and fiction, offering a deeply introspective narrative about the immigrant experience, belonging, and the passage of time. Naipaul uses his own experiences in rural England as a lens to examine broader human themes, such as alienation and cultural identity.

	•	It resonates with readers who have experienced displacement or sought meaning in unfamiliar surroundings.

	•	The novel breaks traditional narrative structures, focusing on introspection and observation rather than a conventional plot. Its reflective tone and descriptive passages about the English countryside mirror the protagonist’s internal journey.

	•	This structure challenges readers to engage with the text on a deeper intellectual and emotional level, making it a landmark in literary modernism.

	•	Naipaul, as a writer from Trinidad with Indian ancestry, captures the complexities of post-colonial identity. The novel reflects on the lingering effects of colonialism, especially how it shapes personal and cultural identities.

	•	The protagonist’s struggles mirror those of many who live in the shadow of colonial histories, making the book both personal and political.

	•	It is a self-conscious work that provides insight into the mind of one of the 20th century’s most acclaimed writers.

	•	The Enigma of Arrival has been praised for its evocative prose, its philosophical depth, and its ability to capture the fragility and transience of human existence.

	•	The book helped secure Naipaul’s place as a Nobel Laureate in Literature (awarded in 2001) and cemented his legacy as a writer of global significance.",""
"lxueqiu","Impossible_Map7177","2024-11-19 00:04:06 UTC","I'm not sure it's obscure as it was just being discussed on another thread, but mine is Cloud Atlas. Similar to another comment about fragmentary novels, I've never read something where so much of the meaning is left up to the readers interpretation. It was such an interesting journey and it feels like everyone that reads it has a slightly different take which is beautiful. Definitely recommend!",""
"ly7alc6","AdesiusFinor","2024-11-21 04:23:31 UTC","“Black beauty” which was about a black horse and its journey from changing owners. Read it when I was 11 and never reread it, but I rarely came across people who knew about it. Not obscure by any means though",""
"lxq5xyc","GoodFurger","2024-11-18 08:03:24 UTC","I was just having a similar discussion with my partner last night! He was commenting how much my reading tastes have changed since we met (in middle school, to be fair) and how so much of my reading these days is sci fi. We were trying to pin down which book shifted my trajectory and I have to say it’s likely Alastair Reynolds’ Revelation Space series. The first book (Revelation Space) came out in 2000 but I didn’t read it until much later. He’s become an auto-buy author for me. 

The other book that really defined my reading taste is not super obscure but I don’t see it talked about as much as it should be - The Master and Margarita by Mikhail Bulgakov. Truly become a standard against which I measure things (and where I learned about translation preferences!)",""
