"comment_id","user","time","message","parent_id"
"lxn513q","mlorinam","2024-11-17 20:03:42 UTC","I had no idea he had a museum.  I'm adding it to my bucket list!","lxm1k47"
"lxlkp0r","AcadiaFlyer","2024-11-17 14:52:56 UTC","The ending fucked me up, it was absolutely heartbreaking. quick read too","lxlk9l8"
"lxmb8kh","ThiefofToms","2024-11-17 17:23:54 UTC","Very, very well said.","lxm4ouo"
"lxnlrji","ThiefofToms","2024-11-17 21:33:07 UTC","I've never been as stunned by a novel as I was by that novel. My personal opinion is that it is the closest thing we have to the Great American Novel.","lxn75er"
"lxnepus","saint_ryan","2024-11-17 20:55:30 UTC","Mine too - by a mile","lxm29vs"
"lxqp2wi","dancognito","2024-11-18 11:31:33 UTC","I haven't. Any good?","lxpd99w"
"lyfcn0o","Radarrex","2024-11-22 15:20:47 UTC","Fair warning, you can spend three pages on the same description of a hillside.","lydkzat"
"lxoyns4","salmonherring","2024-11-18 02:18:15 UTC","That was my second favorite of his","lxoeiuy"
"lxqs4u1","GirlWhoServes","2024-11-18 11:59:21 UTC","I totally get it. I also read The Stranger and I had to just sit back and reflect on it for a little bit. If O had read either at a younger age they probably would have just frustrated me 🤷‍♀️","lxpx6x2"
"lxs9z9w","Secure-Reporter-5647","2024-11-18 17:25:26 UTC","I hope you love it!","lxrp0u1"
"lydmv7a","Aware_Stage_539","2024-11-22 06:39:44 UTC","Royal Blood series by Aimee Carter. It's very... YA but it's really good and it's the first book I've ever done a back to back reread of.","lydl41c"
"lxs0sdc","vexillifer","2024-11-18 16:38:57 UTC","I am obsessed. I have recommended it to like 20 people. I thought it was compelling and beautiful and brilliant","lxrzz5p"
"lxlldt0","nothxloser","2024-11-17 14:57:12 UTC","Bought. Thank you for your service 🫡","lxlkp0r"
"lxrepbx","herbalhippie","2024-11-18 14:38:18 UTC","I think so!  It's about one full year in a medieval village told from the perspective of a wife and mother.  It's a sweet book.","lxqp2wi"
"lyfczmg","South_Honey2705","2024-11-22 15:22:41 UTC","Sounds a wee bit ponderous lol!","lyfcn0o"
"lxqwfpn","kimmeljs","2024-11-18 12:35:16 UTC","""Do you love your mother?""","lxqs4u1"
"lxlpf2j","AcadiaFlyer","2024-11-17 15:21:27 UTC","Hope you enjoy it!","lxlldt0"
"lyfd8q8","Radarrex","2024-11-22 15:24:04 UTC","Nailed it!","lyfczmg"
