"comment_id","user","time","message","parent_id"
"lxl9iw7","salmonherring","2024-11-17 13:36:26 UTC","Gravity’s Rainbow. I often think about as something with profound unity and also profound chaos, humor and tragedy, a broad human vision and a very person authorial vision. Another one is Georges Perec’s Life, A User’s Manual, for its structure and thematic unity while still representing realistic everyday life.",""
"lxmfltb","jumena3","2024-11-17 17:48:09 UTC","It isn't obscure, but Crime and Punishment made me appreciate Russian literature much more.",""
"lxlomtm","Solombum","2024-11-17 15:16:50 UTC","I hated reading as a kid, literally only had one series they could get me to read in elementary for any length of time (Warrior Cats lol). But in middle school I was introduced to the “Inheritance Cycle by Christopher Paolini” and my love of all things fiction, but especially fantasy was introduced. It is still one of my favorite re reads as an adult, and he’s still writing more so we’ll see how the world shapes up.
I recently gave Dragon Riders of Pern another shot as an adult (as I couldn’t get into it as a teen) and I loved the story and the world. The fact that it’s a Science-Fantasy was also a really cool way to read this type of story, with how it’s a culture that’s just the left overs of the once advanced settlers of the planet Pern, who have lost all but the most basic of technology (like they don’t have printing presses, they’ve just rediscovered a way to make a battery but it’s huge, and are making their own version of the telegraph). Loosing all of that history for thousands of years, just to rediscover it later when they discover the old settlements buried under ash from a volcano.",""
"lxoofdo","GirlWhoServes","2024-11-18 01:15:16 UTC","Although this might not be exactly what you asked, the book that completely shifted my reading taste was The Plague by Albert Camus. I read the text during the COVID-19 shutdown for a college class (the text had been traditionally used for that class, not just because of the pandemic). That book during that time completely rocked my world. I really grew to love and appreciate the classics and books written by philosophers and even shifting into nonfiction. I don’t believe I’ve read a “popular read” type of book since. The books that are simply good because everyone is reading them, are just not even a thought anymore.",""
"lxq195v","Miss-Marvelous-4815","2024-11-18 07:13:17 UTC","The Poisoner by I.V. Ophelia - Not my typical book subjects, I usually prefer more heroine and lighter based books. This is a dark Victorian era book, about a female serial killer who murders abusive men via poison, but finds herself being stalked by another paranormal serial killer. Really enjoyed it. ",""
"lxqg8wf","Appropriate-Safe7232","2024-11-18 09:59:09 UTC","Wilbur Smith       "" Monsoon"" ""A Sparrow Falls""  ""elephant song"" ""triumph of the son ""  "" River God""",""
"lxon1vq","Secure-Reporter-5647","2024-11-18 01:06:53 UTC","My entire relationship to reading shifted after I read The Vegetarian. When I started reading a lot more translated fiction I discovered (and now this feels very 'no duh' but at the time was a revelation for me) that storytelling, despite being universal, is different in different parts of the world. The atmosphere rendered in Japanese and Korean literature completely changed how I seek out and interact with what I read now. None of my teachers or book-loving friends ever brought up any foreign lit that didn't come from countries like... France. It took me over a decade to figure it out on my own, simply by chance bc I thought this new book with a fancy award sounded kinda weird",""
"lxmomfb","RagsTTiger","2024-11-17 18:36:33 UTC","The Man Who Loved Children by Christina Stead should be much better known than it is currently.",""
"lxns8mb","SamTheSpam73","2024-11-17 22:08:41 UTC","Not obscure but I highly recommend Sold. It’s a True story about 2 very young girls who were sold by their Father to men as wives and about their struggles to escape that life.",""
"lxnsdyk","VacationNo3003","2024-11-17 22:09:28 UTC","Far Tortuga by Peter Matthiessen 

He is not exactly obscure. But no one I talk to seems to have read this this book and it is incredible. 
It is described as experimental fiction. But it doesn’t read as though it is experimental. You just think you are reading a normal novel. But then when you reflect upon it…",""
"lxo0h8z","Star_Aries","2024-11-17 22:55:04 UTC","""Singularity"" by William Sleator. 

He's one of my favourite authors, and this particular book is everything I love in a book. It's science fiction, YA, siblings, psychology, just a smidge of romance...

This book is everything I love, and it's my all time favourite. I wish it had a fandom.",""
"lxo0yau","Other-Match-4857","2024-11-17 22:57:47 UTC","Probably not obscure, but The Dean’s December by Saul Bellow is over 40 years old now, and I don’t feel like he gets much attention now. I just finished this book, the first one of his I’ve read. I was floored by it, the way he starts threads of plot in a seemingly random way and revisits them at intervals and weaves them together. At the same time, he’s covering deep philosophical topics in a thoughtful way and tying them into the various plot points as well. This is a book that demands attention and thought from the reader, as well as internet access while reading to look up words, historical figures and philosophical concepts. Normally, I’m not big into philosophy, but this book drew me in and held me.",""
"lxp4imv","Key_Yellow_8847","2024-11-18 02:54:35 UTC","War with the Newts...OK it didn't really redefine my tastes but it did give me a damn why hadn't I heard of this before moment.",""
"lxp5vtf","thetruephysic","2024-11-18 03:03:20 UTC","Mating by Norman Rush. Daunting, epic, knowing. It ballooned my sense of what I could expect from a novel.",""
"lxp94jt","hyper_shock","2024-11-18 03:24:26 UTC","The Wind on Fire trilogy by William Nicholson. I was about 11 when I read it, and it was the first time I cried while reading. ",""
"lxp9ah5","soflo91","2024-11-18 03:25:31 UTC","The Summer after high school I somehow got my hands on a copy of Khrushchev Remembers which are the memoirs of Nikita Khrushchev that were snuck out of the Soviet Union in the 1970’s. It really awakened my love for history and biography. The first half about his early organizing in the Ukraine can be kind of wordy but the sections about his time under Stalin keep you on the edge of your seat.",""
"lxpx6pe","islandkuromi","2024-11-18 06:32:39 UTC","“The Gilda Stories” by Jewelle Gomez is fiction that reads like a historical biography. It gave opportunities for growth and reflection that felt like real life experiences! It totally redefined the sci-fi genre for me as an adult. The author used vampiric lore in a way that was expansive and the language she chose was a huge part of that. I came out the other side feeling like I had a better vocabulary to understand and describe myself and others. It really touched me and got me back into reading after a long dry period. It’s also dark, gothic, a little erotic, and very queer! Highly recommend. 🩷",""
"lxpyadj","twigsofsong","2024-11-18 06:43:23 UTC","The Heir of Night series by Helen Lowe is my favorite epic fantasy series of all time and I don’t understand why no one has ever heard of it. Especially given that it was first coming out when Game of Thrones was big on TV and it really scratches that same itch for high politics and complex world building, but IMO is more creative and wiser on every level",""
"lxq30kw","Erdosign","2024-11-18 07:31:47 UTC","I think it's only really obscure outside of Spanish-speaking countries: The Seven Madmen by Roberto Arlt. It made me conscious that a book could draw from disparate and even contradictory elements by using the sense of disjunction to reflect all the chaos of the real world.",""
"lxrwj9r","Orangebird","2024-11-18 16:16:54 UTC","*Vaseline Buddha* by Jung Young Moon. It's a surreal stream-of-consciousness ""story"" about the narrator going on a trip (and he doesn't like travel). After a while, I had to suspend my expectations and just take it in. It's been a while since I read it, and I'll probably never read it again, but every time I hear someone say a story has to have x, y, or z to be successful, I think of that book.",""
"lxsuj46","SuitableEpitaph","2024-11-18 19:08:21 UTC","A VN named Umineko no Naku Koro Ni (When the Seagulls Cry). It completely redefined my understanding of the mystery genre and the malleability of truth.",""
"lxttsc1","tsuki_ouji","2024-11-18 22:06:44 UTC","Garth Nix's ""Abhorsen"" series.

It shaped the way I look at necromancy in fantasy media.",""
"lxw94qs","Acceptable-Cow6446","2024-11-19 07:51:34 UTC","Nonfiction: tossup between “Pilgrim at Tinker Creek” by Annie Dillard and “A Box of Matches” by Nicholson Baker.

Fantasy: “The Second Apocalypse” by R. Scott Bakker.",""
"lxwqgs9","Sanguine_Rosey","2024-11-19 11:01:51 UTC","I was a child. I remember picking up a book (for the life of me, I can not remember it, and Google doesn't have a clue) it was about a child that found what was thought to be a stone but was actually an egg with a baby nessie  style creature in, from what I can remember it was a lovely story",""
"lxxdf7a","MagnetoManectric","2024-11-19 13:56:42 UTC","*The Minotaur Takes a Cigarette Break* by Steven Sherril. This is the book that got me back into reading regularly after a long hiatus from doing so. The style of the prose and the vivid picture it paints of being an outsider really spoke to me and made me realise the importance of literature as an outlet and way of understanding the world.",""
"lxxgr73","fkat5","2024-11-19 14:16:53 UTC","Gut Symmetries by Jeanette Winterson. People and physics and beautiful prose.",""
"lxywb8y","Aware_Stage_539","2024-11-19 18:40:50 UTC","Honestly I don't know what counts as obscure. I like a series by an author who previously wrote kind of wild and not very good books and her newest is like. REALLY GOOD but I see nobody talking about it ever.",""
"ly1ecjv","Ok-Cow2018","2024-11-20 02:46:56 UTC","Ice by Anna Kavan. Especially as a person whose first language isn't english. I can't really tell why, but for me it felt just different than most Books.",""
"ly74154","SecretCitizen40","2024-11-21 03:39:46 UTC","Jomny Sun

Everyone's a Aliebn When Ur a Aliebn Too: A Book


No that's not a typo. This book can be read in an hour or two. I don't know about redefining my understanding of literature but kind of reminds me (I've read it multiple times) to open my heart to the world and be less afraid. I know a lot of people are put off by the grammar and spelling in the book but I thought it was both fitting for the narrative and slows the reader a bit to help the message sink in. As far as redefining my reading tastes it's kind of opened me up to giving more styles and topics a chance, and I've had some good experiences that I maybe wouldn't have had otherwise",""
"lybi4vp","SkedaddleMode","2024-11-21 22:18:06 UTC","Suttree by Cormac McCarthy",""
"lygiz04","Sailsherpa","2024-11-22 18:59:26 UTC","Stand on Zanzibar prepared me for the last 20 years.",""
"lyh1qne","Cleobulle","2024-11-22 20:38:40 UTC","Wild sargasso sea 
To a young poet's letter",""
"lxlqbl0","FunkyDunky2","2024-11-17 15:26:49 UTC","Locos by Felipe Alfau.",""
"lxns2dz","H_nography","2024-11-17 22:07:43 UTC","Sophie's Choice by William Styron.

Wonderfully crafted story with characters with more layers than I got lifetime to explore. I don't think anyone understands Stingo is supposed to be a satirical character enough to get the real meaning behind the plot and the false outrage from Jewish activists about superficialities of the plot has driven the greater public away from a wonderfully crafted novel.",""
"lxokmtz","Suspicious-Peace9233","2024-11-18 00:52:15 UTC","Outofshapeworthlessloser by Gracie Gold",""
"lxopcno","deadinderry","2024-11-18 01:20:56 UTC","Glamorama by Bret Easton Ellis. Ellis is by no means obscure, but I think the utter slog of celebrity names in the first sixty pages turn a lot of people off from this one. 

It is genuinely my favorite book though, and really turned me on to Ellis—it was my first by him!",""
"lxp5nhl","Resident_Bike8720","2024-11-18 03:01:51 UTC","Redwall",""
"lxph2px","leftsidewrite","2024-11-18 04:19:18 UTC","Trout Fishing in America by Richard Brautigan. Started and stopped a few times, in the end another prespective",""
"lxpsx07","French1220","2024-11-18 05:52:40 UTC","Screwtape Letters by CS Lewis",""
"lxlmx2o","Snoo-10511","2024-11-17 15:06:30 UTC","ok its Frankenstein by mary shelley. frankenstein is obviously very famous, but because of its popular tv icons, i havent seen that much people read frankenstein as much as i have seen people read emily brontë or dracula or dorian gray and this is simply a world mistake. frankenstein is my favorite book and theres so much to talk about (i know still is not a obscure read but idc just go and read it)",""
"lxlg9z4","Substantial_Knee578","2024-11-17 14:24:09 UTC","The marriage of opposites by Alice Hoffman",""
"lxlsq7q","Real-Ad-8521","2024-11-17 15:40:48 UTC","I think just the ""poem"" from Ivan in Brother's Karamzov is somewhat life-changing",""
"lxltg94","CarpeDiemMaybe","2024-11-17 15:44:56 UTC","Moon over Manifest by Clare Vanderpool",""
"lxok5eh","BloodyPaleMoonlight","2024-11-18 00:49:22 UTC","""Gestapo Mars"" by Victor Gischler",""
"lxost6e","ComfortableShrimps","2024-11-18 01:42:10 UTC","For my it was The Papalagi from Erich Scheurmann",""
"lxpgtun","cambriansplooge","2024-11-18 04:17:32 UTC","Darkmans Nicola Barker",""
"lxpxj24","kimmeljs","2024-11-18 06:35:59 UTC","""The Blind Assassin"" by Margaret Atwood. The writing, the structure, the intertwining plot lines. John Irving's writing also has done some twists and turns but Atwood beats him by a mile. Both live in Toronto...",""
"lxpz3o3","19Ziebarth","2024-11-18 06:51:23 UTC","Tony Tulathimutte’s “Private Citizens”.",""
"lxqf9ew","VictorWardBodyDouble","2024-11-18 09:48:12 UTC","It might not be very obscure but American Psycho got me back into reading. I just didn't know that someone could write such an evil character, the level of violence in it was nothing id ever read before it had me hooked, and lastly it was somehow also laugh out loud funny the whole time, which was amazing bc hardly any book had ever made me LOL. I've been on a reading kick since I read it last summer and I've read thirty something books since.",""
"lxpke3a","nameExpire14_04_2021","2024-11-18 04:43:10 UTC","The menu at a closed down restaurant  i used to go to, it was a fusion of australian and thai, the vegemite noodles were to 'die' for.",""
"lxpmzss","112oceanave","2024-11-18 05:02:44 UTC","Starship troopers 😎",""
"lxnanl2","vexillifer","2024-11-17 20:34:02 UTC","It sounds like you might also like “a swim in a pond in the rain” which blew my mind!","lxl8ayd"
"lxlrlpg","ef-why-not","2024-11-17 15:34:20 UTC","Sounds like I've found my next read.","lxl8ayd"
"lxpd5yn","Total-Buffalo-4334","2024-11-18 03:51:41 UTC","This book blew my mind. I'm so glad to hear someone else talking about it ","lxl8ayd"
"lxmea1p","Smailien","2024-11-17 17:40:47 UTC","I keep a catalog of great quotes from literature and so many of them are from this series.  From the first novel:


'My dear creature, I have done with all debate. But you know as well as I, patriotism is a word; and one that generally comes to mean either my country, right or wrong, which is infamous, or my country is always right, which is imbecile."" - Stephen Maturin","lxlcoko"
"lxom38c","TK_404","2024-11-18 01:01:02 UTC","The books that taught me (a 12 year old Norwegian at the time) proper English and way too much about the Royal Navy in the 19th century. I spent the next two years traversing the far side of a world of frigates, gunboats, ship maneuvers and Lord Nelson, and I talked the ears off anyone kind enough to pretend to listen. The series will always hold a special place in my heart. Beautifully written.","lxlcoko"
"lxrruah","TheFishSauce","2024-11-18 15:52:04 UTC","He's amazing. Probably the greatest writer of historical fiction ever.","lxlcoko"
"lxpgx28","cambriansplooge","2024-11-18 04:18:11 UTC","Damn it I was thinking of starting these and no I’ve received a sign!","lxlcoko"
"lxpkw66","zhongcha","2024-11-18 04:46:53 UTC","I've read the first one fairly recently and it was a great great read. I got through the first few pages, left it and the overwhelming new universe alone a month or so and when I picked it back up I couldn't put it down until it was finished. The relationships are extremely well crafted.","lxlcoko"
"lxolafh","Historical-Kitchen76","2024-11-18 00:56:12 UTC","I LOVED this book. I don't know anyone else who has read it. I remember becoming obsessed with whaling and tall ships after reading it. I had no idea how tough it was to be a whaler.","lxmcw7m"
"lxrkoab","BlueberryFlashy4617","2024-11-18 15:13:01 UTC","I took an entire course specifically about *Moby Dick* as an additional elective while pursuing my bachelors in english. 

There were some interesting 'supplementary' texts like the experimental *Lucchesi and the Whale* by Frank Lentricchia or *Call me Ischmael* by Charles Olson from which we only read a few sections, but the only true narrative fiction texts, and the only other works we read in their entirey otherwise, were Poe's *Arthur Gordon Pym* and *The Whaleship Essex*.

It's a fantastic example of a popular genre our professor deemed 'sea adventure tales,' if memory serves, the likes of which both Melville and Poe were imitating and manipulating.

Honestly, I love Melville's *Dick* and all of the attendant and technically correct word play, but *Essex* and *Pym* were a genuinely enjoyable surprise and worth the time.","lxmcw7m"
"lxsacxx","Nigel_Mckrachen","2024-11-18 17:27:21 UTC","Would it be crass for me to recommend the 2015 movie of the same title?  I'd been studying Moby-Dick and one scholar mentioned the story of the Essex and how it must have inspired Melville's novel.  I really loved this movie.  It's about as literary as a movie can get these days.","lxmcw7m"
"lxppvr6","mushinnoshit","2024-11-18 05:26:15 UTC","Ooh, similar for me except it was The Caretaker by Harold Pinter. I'd never sat down to read a play before and it just blew my mind. I instantly locked on to the characters and their private worlds, the strangely menacing atmosphere and the intent to unsettle the audience through dialogue. I went on to read The Birthday Party, then the rest of Pinter's work and a lot more theatre of the absurd in general (including Zoo Story). 

It had a big effect on shaping my tastes too, I still love stories and movies that capture that hard-to-define sense that things are both normal and wrong.","lxln3ew"
"lxm1k47","Waynersnitzel","2024-11-17 16:30:24 UTC","If you are ever in the middle of nowhere Henning, TN, you should visit the author’s home. It is a great little museum and the curators are wonderful. 

https://alexhaley.com/alex-haley-museum/","lxl7wma"
"lxmrjkp","Pvt-Snafu","2024-11-17 18:51:42 UTC","That's definitely a powerful choice. I think books with that kind of scope can not only shape your tastes but also make you look at your own roots in a new way and understand how history impacts individual lives.","lxl7wma"
"lxlk9l8","nothxloser","2024-11-17 14:50:13 UTC","Is this sad? It sounds like it'll ruin me emotionally. I'm here for it.","lxlct98"
"lyc6neb","Mary_Olivers_geese","2024-11-22 00:40:18 UTC","A killer blend of ecology, anthropology, archeology, and adventure writing: *Atlas of a Lost World* by Craig Childs

It’s about the arrival of humans on the North and South American continents. I really don’t know how to describe this book. It’s a non-fiction examination of early Americans and their cultures, but explored *parallel* to Craig Childs’ personal narratives of his travels and life.

Let me just offer this pitch: I truly laughed and wept. I can’t imagine a more masterfully personal take on the lives of those 14,000+ years gone. If you like nature writing, adventure writing, anthropological or sociological works like Sapiens, or just genuine contemplation, there’s something in here for you.

If you like eco books, and want a work of true magnitude, Aldo Leopold’s *A Sand County Almanac* is stunning. It’s like the East of Eden of ecology. It’s got scope and definition. Leopold was a lifetime ahead of the public in his perception of the natural world. It’s also inseparable from the man’s life.","lxlct98"
"lxm4ouo","Stupid-Sexy-Alt","2024-11-17 16:47:34 UTC","Yes, yes, yes. Such a complicated novel. The writing style is so unique, several voices sharing a single page or paragraph. The dampness that creeps out of the book and soaks you through. The ineluctability of the river. The many faces—good and bad— of the “masculine.” The teetering balance of the house. The love and hate. The noble and the petty. The greatness of America and the horror of America. It’s all there.","lxldo9v"
"lxn75er","Less_Matter_3962","2024-11-17 20:15:11 UTC","Saw the title of this thread and immediately thought of this. Such an accomplishment of a book, like nothing else I've read ","lxldo9v"
"lxleamo","magsterchief","2024-11-17 14:10:36 UTC","this sounds amazing!","lxl9bka"
"lxoftdl","Will12182015","2024-11-18 00:24:14 UTC","This is probably the first time since I read it that somebody else mentioned it. I loved that book, and I'd say that it helped me to be more sure of my love for the found family genre!","lxl9bka"
"lxpc75r","theblindsdontwork","2024-11-18 03:45:02 UTC","One of my absolute favorite books I’ve read all year. It’s such an absurd book but in all the right ways, and such a touching tale of trans identity. 🥲","lxl9bka"
"lxxdh6g","MagnetoManectric","2024-11-19 13:57:03 UTC","That sounds wicked. I'll be checking it out.","lxl9bka"
"lxt3my1","WonderChiefs","2024-11-18 19:54:10 UTC","this is going to be my next read, I just yesterday had the audiobook for Brain dead megaphone playing while on a drive with the girlfriend. AND i happened to have a huge romance with Tolstoy and Gogol so reading this is on my to do list for sure. (I even Made a carving that said Nothing Save The Sky on my Ukulele) Saunders is one of my all time Favorites!!!","lxm3m63"
"lxqrmai","Heretoholdmyhand","2024-11-18 11:54:46 UTC","I've had this book for almost 10 years but I haven't been able to read it. It's just beyond me, but I look forward to the day I can.","lxlj2c1"
"lxm29vs","Waynersnitzel","2024-11-17 16:34:20 UTC","I highly recommend Warren’s poetry, too. Very lyrical and feature a lot of natural imagery. My favorite poet!","lxlesb4"
"lxpd99w","herbalhippie","2024-11-18 03:52:18 UTC","> I read Life in a Medieval Village by Frances and Joseph Gies

This sounds intriguing!  Have you read Down the Common by Anne Baer?","lxlobmj"
"lxpxmbq","twigsofsong","2024-11-18 06:36:52 UTC","I love this book. Claire North has done a few of these “concept” sci fi books and I’ve enjoyed most of them, but Harry August and Notes From the Burning Age were my favorites","lxm3i2v"
"lxqal4c","Muser_name","2024-11-18 08:55:15 UTC","Wow! I looked up Monstrilio because it is this book for me also, and I’m so pleasantly surprised to see someone else saying it! Thank you for sharing that, and I wish you good luck and smooth sailing on your journey out of depression ❤️","lxpknur"
"lxn9roj","Disastrous-Wing699","2024-11-17 20:29:11 UTC","I love all his books, but Hocus Pocus was one that strongly influenced the book I ended up lucky enough to publish.","lxlfo2b"
"lydkzat","South_Honey2705","2024-11-22 06:21:51 UTC","It sounds excellent 👌","lxroe33"
"lxoeiuy","Necessary_Monsters","2024-11-18 00:16:56 UTC","Currently reading Mason & Dixon.","lxl9iw7"
"lxpx6x2","kimmeljs","2024-11-18 06:32:42 UTC","For me, I read ""The Plague"" when I was too young. Later, I read ""The Stranger"" and it just transformed me.","lxoofdo"
"lxrp0u1","Radarrex","2024-11-18 15:37:01 UTC","The Vegetarian just arrived in the mail! I can’t wait to dive in.","lxon1vq"
"lxr84xi","imoinda","2024-11-18 13:57:16 UTC","I loved The vegetarian and I agree, it really does highlight how different a story can be in a different culture. And the people I know who don’t like it often bring up arguments that show that they didn’t get the cultural context.","lxon1vq"
"lydl41c","South_Honey2705","2024-11-22 06:23:05 UTC","What is the book and author?","lxywb8y"
"lxp5p2u","Resident_Bike8720","2024-11-18 03:02:08 UTC","It makes me appreciate the more lower tone of fantasy","lxp5nhl"
"lxr8d0m","imoinda","2024-11-18 13:58:42 UTC","Yeah Frankenstein is so much more than it’s portrayed as on screen. Great book.","lxlmx2o"
"lxrzz5p","mhkrusto","2024-11-18 16:34:48 UTC","Just finished this one. A love letter to readers and writers and just about anyone who wants to pull back the curtain on what makes a great story great","lxnanl2"
"lxp7y8d","Extrovert_89","2024-11-18 03:16:44 UTC","I sometimes wonder why my professor chose it and the beginning being so slow because it was about prepping the boats and then I was SHOCKED at all that happened. What still gets me is the piece of twine/rope the sailor worked on the entire time just to track the days.","lxolafh"
"lxrrh43","Extrovert_89","2024-11-18 15:50:08 UTC","Philbrick has written plenty since he's a history writer but I enjoy history and learning about historical events. so it was probably my history class we read it for. I've never read Moby Dick before- I'm also working on reading more classics.","lxrkoab"
"lxsdaiv","Extrovert_89","2024-11-18 17:42:01 UTC","Not at all, you're good :)","lxsacxx"
